Incident ID,Offence Code,CR Number,Dispatch Date / Time,Start_Date_Time,End_Date_Time,NIBRS Code,Victims,Crime Name1,Crime Name2,Crime Name3,Police District Name,Block Address,City,State,Zip Code,Agency,Place,Sector,Beat,PRA,Address Number,Street Prefix,Street Name,Street Suffix,Street Type,Latitude,Longitude,Police District Number,Location
201248466,2203,190034048,07/18/2019 01:31:01 AM,2019-07-18 01:22:00,07/18/2019 01:23:00 AM,220,1,Crime Against Property,Burglary/Breaking and Entering,BURGLARY - FORCED ENTRY-NONRESIDENTIAL,ROCKVILLE,14900 BLK  SHADY GROVE RD,ROCKVILLE,MD,20850.0,RCPD,Retail - Appliances/Electronics,B,1B1,241,14900.0,,SHADY GROVE,,RD,39.09939,-77.1924,1D,"(39.0994, -77.1924)"
201384806,2501,220031004,07/19/2022 10:15:45 AM,2022-07-18 20:30:00,,250,1,Crime Against Property,Counterfeiting/Forgery,FORGERY OF CHECKS,MONTGOMERY VILLAGE,500 BLK  CHESTERTOWN ST,GAITHERSBURG,MD,20878.0,MCPD,Other/Unknown,P,6P2,450,500.0,,CHESTERTOWN,,ST,39.12324,-77.247,6D,"(39.1232, -77.247)"
201322902,1316,210009178,03/11/2021 03:47:32 PM,2021-03-11 15:47:00,,13C,1,Crime Against Person,Intimidation,ASSAULT - INTIMIDATION (INCLUDES STALKING),WHEATON,10800 BLK  GEORGIA AVE,SILVER SPRING,MD,20902.0,MCPD,Residence - Apartment/Condo,L,4L2,323,10800.0,,GEORGIA,,AVE,39.03193,-77.0483,4D,"(39.0319, -77.0483)"
201431145,2399,230028749,06/15/2023 09:19:34 AM,2023-06-11 10:36:00,,23H,1,Crime Against Property,All other Larceny,LARCENY (DESCRIBE OFFENSE),GERMANTOWN,200 BLK  REDPOLL AL,CLARKSBURG,MD,20871.0,MCPD,Other/Unknown,N,5N3,466,200.0,,REDPOLL,,AL,39.21921,-77.2957,5D,"(39.2192, -77.2957)"
201230360,9103,190010612,03/07/2019 09:45:06 AM,2019-03-07 09:45:00,03/07/2019 12:00:00 AM,720,1,Crime Against Society,Animal Cruelty,ANIMAL CRUELTY,WHEATON,11200 BLK  GEORGIA AVE,SILVER SPRING,MD,20902.0,MCPD,Residence - Apartment/Condo,L,4L2,324,11200.0,,GEORGIA,,AVE,39.03867,-77.0508,4D,"(39.0387, -77.0508)"
201348583,2902,210040361,10/09/2021 01:41:47 PM,2021-10-08 23:45:00,10/09/2021 11:45:00 AM,290,1,Crime Against Property,Destruction/Damage/Vandalism of Property,DAMAGE PROPERTY - PRIVATE,SILVER SPRING,4300 BLK  REGALWOOD TER,BURTONSVILLE,MD,20866.0,MCPD,Street - Residential,I,3I2,381,4300.0,,REGALWOOD,,TER,39.09892,-76.9208,3D,"(39.0989, -76.9208)"
201340249,5212,210029457,07/29/2021 05:02:40 PM,2021-07-29 15:56:00,,520,1,Crime Against Society,Weapon Law Violations,WEAPON - POSSESSION,GERMANTOWN,19400 BLK  DOVER CLIFFS CIR,GERMANTOWN,MD,20874.0,MCPD,Retail - Other,N,5N1,702,19400.0,,DOVER CLIFFS,,CIR,39.17717,-77.2795,5D,"(39.1772, -77.2795)"
201433484,2902,230031098,06/29/2023 02:16:38 PM,2023-06-21 00:00:00,06/29/2023 02:16:00 PM,290,1,Crime Against Property,Destruction/Damage/Vandalism of Property,DAMAGE PROPERTY - PRIVATE,SILVER SPRING,500 BLK  GRANVILLE DR,SILVER SPRING,MD,20901.0,MCPD,Residence - Single Family,G,3G2,104,500.0,,GRANVILLE,,DR,39.0144,-77.0187,3D,"(39.0144, -77.0187)"
201251218,2602,190036161,07/29/2019 03:55:48 PM,2019-07-29 11:00:00,,26A,1,Crime Against Property,False Pretenses/Swindle/Confidence Game,FRAUD - SWINDLE,MONTGOMERY VILLAGE,18600 BLK  MUNCASTER RD,DERWOOD,MD,20855.0,MCPD,Other/Unknown,R,6R3,716,18600.0,,MUNCASTER,,RD,39.16062,-77.1247,6D,"(39.1606, -77.1247)"
201416855,2902,230011704,03/10/2023 07:06:27 AM,2023-03-09 18:30:00,03/10/2023 05:30:00 AM,290,1,Crime Against Property,Destruction/Damage/Vandalism of Property,DAMAGE PROPERTY - PRIVATE,BETHESDA,5500 BLK  BRITE DR,BETHESDA,MD,20817.0,MCPD,Street - Residential,E,2E2,024,5500.0,,BRITE,,DR,38.98049,-77.1116,2D,"(38.9805, -77.1116)"
201439358,2902,230049144,08/12/2023 05:29:49 PM,2023-08-12 14:30:00,,290,1,Crime Against Property,Destruction/Damage/Vandalism of Property,DAMAGE PROPERTY - PRIVATE,BETHESDA,11100 BLK  ROCK RD,ROCKVILLE,,20852.0,MCPD,Residence - Single Family,D,2D4,309,11100.0,,ROCK,,RD,39.03642,-77.0881,2D,"(39.0364, -77.0881)"
201339588,2304,210029064,07/27/2021 10:04:57 AM,2019-07-27 00:00:00,07/27/2021 12:00:00 AM,23G,1,Crime Against Property,Theft of Motor Vehicle Parts or Accessories,LARCENY - AUTO PARTS,BETHESDA,3600 BLK  UNIVERSITY BLV W,KENSINGTON,MD,20895.0,MCPD,Parking Lot - Commercial,D,2D3,315,3600.0,,UNIVERSITY,W,BLV,39.03381,-77.0724,2D,"(39.0338, -77.0724)"
201263766,1399,190053189,11/04/2019 11:06:18 PM,2019-11-04 22:30:00,11/04/2019 11:00:00 PM,13B,1,Crime Against Person,Simple Assault,ASSAULT - 2ND DEGREE,WHEATON,1100 BLK  UNIVERSITY BLV W,SILVER SPRING,MD,20902.0,MCPD,Parking Garage - Residential,L,4L1,360,1100.0,,UNIVERSITY,W,BLV,39.03585,-77.0268,4D,"(39.0359, -77.0268)"
201359530,2999,220000636,01/06/2022 10:30:57 AM,2021-12-22 08:00:00,01/05/2022 11:45:00 AM,290,1,Crime Against Property,Destruction/Damage/Vandalism of Property,DAMAGE PROPERTY (DESCRIBE OFFENSE),MONTGOMERY VILLAGE,1200 BLK  MAIN ST,GAITHERSBURG,MD,20878.0,MCPD,School - Elementary/Secondary,P,6P2,450,1200.0,,MAIN,,ST,39.11631,-77.2323,6D,"(39.1163, -77.2323)"
201347297,1399,210038695,09/29/2021 08:39:03 PM,2021-09-29 18:00:00,09/29/2021 08:30:00 PM,13B,1,Crime Against Person,Simple Assault,ASSAULT - 2ND DEGREE,GERMANTOWN,9600 BLK  MAIN ST,DAMASCUS,MD,20872.0,MCPD,Residence - Apartment/Condo,M,5M2,479,9600.0,,MAIN,,ST,39.28668,-77.1982,5D,"(39.2867, -77.1982)"
201438311,1399,230048013,08/05/2023 09:10:31 PM,2023-08-05 21:10:00,,13B,1,Crime Against Person,Simple Assault,ASSAULT - 2ND DEGREE,WHEATON,13100 BLK  FERNEDGE RD,SILVER SPRING,MD,20906.0,MCPD,Residence - Yard,K,4K1,350,13100.0,,FERNEDGE,,RD,39.06996,-77.0592,4D,"(39.07, -77.0592)"
201344860,5404,210033935,08/30/2021 07:08:41 PM,2021-08-30 00:00:00,08/30/2021 12:00:00 AM,90D,1,Crime Against Society,Driving Under the Influence,DRIVING UNDER THE INFLUENCE LIQUOR,ROCKVILLE,,ROCKVILLE,MD,20850.0,MCPD,Street - In vehicle,A,1A3,279,,,HUNGERFORD,,DR,39.08792,-77.1504,1D,"(39.0879, -77.1504)"
201324219,2305,210010593,03/21/2021 09:16:15 AM,2021-03-20 23:00:00,03/21/2021 08:45:00 AM,23F,1,Crime Against Property,Theft From Motor Vehicle,LARCENY - FROM AUTO,BETHESDA,5800 BLK  GREENTREE RD,BETHESDA,MD,20817.0,MCPD,Residence - Driveway,E,2E2,056,5800.0,,GREENTREE,,RD,39.00095,-77.1157,2D,"(39.001, -77.1157)"
201389793,2399,220036886,08/26/2022 11:16:57 AM,2022-08-26 12:00:00,08/26/2022 12:00:00 AM,23H,1,Crime Against Property,All other Larceny,LARCENY (DESCRIBE OFFENSE),ROCKVILLE,14800 BLK  SOUTHLAWN LA,ROCKVILLE,MD,20850.0,RCPD,Restaurant,A,1A2,287,14800.0,,SOUTHLAWN,,LA,39.09774,-77.1365,1D,"(39.0977, -77.1365)"
201245566,2202,190030555,06/26/2019 06:55:29 PM,2019-06-26 19:00:00,,220,1,Crime Against Property,Burglary/Breaking and Entering,BURGLARY - FORCED ENTRY-RESIDENTIAL,WHEATON,2900 BLK  PARKER AVE,SILVER SPRING,MD,20902.0,MCPD,Residence - Single Family,L,4L1,328,2900.0,,PARKER,,AVE,39.04875,-77.0593,4D,"(39.0487, -77.0593)"
201407476,2308,230000590,01/04/2023 05:19:10 PM,2022-12-27 13:30:00,01/04/2023 05:00:00 PM,23D,1,Crime Against Property,Theft from Building,LARCENY - FROM BLDG,WHEATON,3200 BLK  WHISPERING PINES DR,SILVER SPRING,MD,20906.0,MCPD,Residence - Apartment/Condo,K,4K1,348,3200.0,,WHISPERING PINES,,DR,39.08831,-77.0652,4D,"(39.0883, -77.0652)"
201376407,2610,220020858,05/16/2022 04:01:52 PM,2022-04-18 00:00:00,,26F,1,Crime Against Property,Identity Theft,FRAUD - IDENTITY THEFT,ROCKVILLE,1  BLK  DEBORAH CT,POTOMAC,MD,20854.0,MCPD,Other/Unknown,B,1B1,223,1.0,,DEBORAH,,CT,39.04411,-77.1648,1D,"(39.0441, -77.1648)"
201226357,1399,190006613,02/11/2019 01:43:15 AM,2019-02-11 01:45:00,,13B,1,Crime Against Person,Simple Assault,ASSAULT - 2ND DEGREE,TAKOMA PARK,8600 BLK  FLOWER AVE,TAKOMA PARK,MD,20912.0,TPPD,Bar/Night Club,T,8T2,803,8600.0,,FLOWER,,AVE,38.99645,-77.0031,TPPD,"(38.9965, -77.0031)"
201347442,2404,210038889,09/30/2021 09:51:44 PM,2021-09-30 21:25:00,09/30/2021 09:35:00 PM,240,1,Crime Against Property,Motor Vehicle Theft,AUTO THEFT - VEHICLE THEFT,BETHESDA,,BETHESDA,MD,20814.0,MCPD,Street - Commercial,D,2D2,033,,,ELM,,ST,38.98234,-77.0926,2D,"(38.9823, -77.0926)"
201280431,5404,200010683,03/04/2020 01:39:49 AM,2020-03-04 01:49:00,,90D,1,Crime Against Society,Driving Under the Influence,DRIVING UNDER THE INFLUENCE LIQUOR,GERMANTOWN,21000 BLK  RIDGE RD,GERMANTOWN,MD,20876.0,MCPD,Street - In vehicle,M,5M3,474,21000.0,,RIDGE,,RD,39.19781,-77.2631,5D,"(39.1978, -77.2631)"
201401033,1213,220050780,11/17/2022 06:30:18 AM,2022-11-16 19:00:00,,120,1,Crime Against Property,Robbery,ROBBERY - GUN,SILVER SPRING,8200 BLK  FENTON ST,SILVER SPRING,MD,20910.0,MCPD,Parking Garage - County,G,3G1,093,8200.0,,FENTON,,ST,38.99169,-77.024,3D,"(38.9917, -77.024)"
201239238,3562,190022529,05/13/2019 12:43:46 PM,2019-05-13 08:00:00,05/13/2019 01:00:00 PM,35A,1,Crime Against Society,Drug/Narcotic Violations,DRUGS - MARIJUANA - POSSESS,WHEATON,4600 BLK W FRANKFORT DR,ROCKVILLE,MD,20853.0,MCPD,School/College - DO NOT USE,K,4K2,528,4600.0,W,FRANKFORT,,DR,39.08461,-77.0898,4D,"(39.0846, -77.0898)"
201294914,2305,200027652,07/16/2020 03:28:17 PM,2020-07-14 10:00:00,07/16/2020 01:00:00 PM,23F,1,Crime Against Property,Theft From Motor Vehicle,LARCENY - FROM AUTO,MONTGOMERY VILLAGE,9900 BLK  SHELBURNE TER,GAITHERSBURG,MD,20878.0,MCPD,Parking Lot - Residential,P,6P1,752,9900.0,,SHELBURNE,,TER,39.1164,-77.2023,6D,"(39.1164, -77.2023)"
201381582,2399,220027081,06/23/2022 12:19:41 PM,2022-06-23 12:19:00,,23H,1,Crime Against Property,All other Larceny,LARCENY (DESCRIBE OFFENSE),BETHESDA,10400 BLK  ROCKVILLE PIK,ROCKVILLE,MD,20852.0,MCPD,Street - In vehicle,D,2D4,190,10400.0,,ROCKVILLE,,PIK,39.02748,-77.1037,2D,"(39.0275, -77.1037)"
201223509,5404,190002973,01/19/2019 12:16:17 AM,2019-01-19 00:23:00,01/19/2019 12:24:00 AM,90D,1,Crime Against Society,Driving Under the Influence,DRIVING UNDER THE INFLUENCE LIQUOR,WHEATON,,SILVER SPRING,MD,20902.0,MCPD,Street - In vehicle,L,4L2,324,,,GEORGIA,,AVE,39.11237,-77.0755,4D,"(39.1124, -77.0755)"
201270738,2705,190061780,12/23/2019 01:51:28 PM,2019-12-23 13:51:00,12/23/2019 02:18:00 PM,270,1,Crime Against Property,Embezzlement,EMBEZZLE - POSTAL,GERMANTOWN,20000 BLK  AIRCRAFT DR,GERMANTOWN,MD,20874.0,MCPD,Residence - Single Family,N,5N1,702,20000.0,,AIRCRAFT,,DR,39.18396,-77.2617,5D,"(39.184, -77.2617)"
201439999,2404,230050045,08/18/2023 07:15:38 AM,2023-08-17 21:00:00,08/18/2023 07:00:00 AM,240,1,Crime Against Property,Motor Vehicle Theft,AUTO THEFT - VEHICLE THEFT,WHEATON,14100 BLK  GRAND PRE RD,SILVER SPRING,,20906.0,MCPD,Parking Lot - Residential,K,4K1,534,14100.0,,GRAND PRE,,RD,39.08683,-77.0738,4D,"(39.0868, -77.0738)"
201368277,3615,220011075,03/15/2022 07:54:29 AM,2021-10-25 00:01:00,11/01/2021 11:59:00 PM,90C,1,Crime Against Society,Disorderly Conduct,INDECENT EXPOSURE TO ADULT,ROCKVILLE,14600 BLK  KEENELAND CIR,GAITHERSBURG,MD,20878.0,MCPD,Residence -Townhouse/Duplex,B,1B2,457,14600.0,,KEENELAND,,CIR,39.09501,-77.2538,1D,"(39.095, -77.2538)"
201287442,1313,200018869,05/09/2020 02:04:56 PM,2020-05-09 14:04:00,05/09/2020 02:30:00 PM,13B,2,Crime Against Person,Simple Assault,ASSAULT - SIMPLE,SILVER SPRING,500 BLK  THAYER AVE,SILVER SPRING,MD,20910.0,MCPD,Residence - Apartment/Condo,G,3G1,114,500.0,,THAYER,,AVE,38.99384,-77.0115,3D,"(38.9938, -77.0115)"
201328711,2501,210015657,04/27/2021 11:47:51 AM,2021-03-16 00:00:00,04/27/2021 12:00:00 PM,250,1,Crime Against Property,Counterfeiting/Forgery,FORGERY OF CHECKS,MONTGOMERY VILLAGE,700 BLK  RUSSELL AVE,GAITHERSBURG,MD,20877.0,GPD,Retail - Mall,R,6R1,548,700.0,,RUSSELL,,AVE,39.15063,-77.2039,6D,"(39.1506, -77.2039)"
201406831,2404,220057871,12/30/2022 01:59:08 PM,2022-12-29 13:59:00,12/30/2022 09:00:00 AM,240,1,Crime Against Property,Motor Vehicle Theft,AUTO THEFT - VEHICLE THEFT,ROCKVILLE,200 BLK  CONGRESSIONAL LA,ROCKVILLE,MD,20852.0,RCPD,Parking Lot - Residential,A,1A1,267,200.0,,CONGRESSIONAL,,LA,39.06226,-77.129,1D,"(39.0623, -77.129)"
201434666,2304,230033066,07/11/2023 04:32:46 PM,2023-07-07 14:00:00,07/10/2023 01:00:00 PM,23G,1,Crime Against Property,Theft of Motor Vehicle Parts or Accessories,LARCENY - AUTO PARTS,ROCKVILLE,5400 BLK  RANDOLPH RD,ROCKVILLE,MD,20852.0,MCPD,Auto Repair,A,1A2,303,5400.0,,RANDOLPH,,RD,39.0535,-77.1067,1D,"(39.0535, -77.1067)"
201265700,1399,190055514,11/17/2019 07:27:46 PM,2019-11-17 19:25:00,,13B,1,Crime Against Person,Simple Assault,ASSAULT - 2ND DEGREE,WHEATON,,SILVER SPRING,MD,20902.0,MCPD,Street - Residential,L,4L1,328,,,CLARIDGE,,RD,39.05203,-77.0656,4D,"(39.052, -77.0656)"
201412577,2499,230006662,02/09/2023 03:25:38 PM,2023-02-09 15:25:00,,240,1,Crime Against Property,Motor Vehicle Theft,STOLEN VEHICLE (DESCRIBE OFFENSE),GERMANTOWN,18800 BLK  SPARKLING WATER DR,GERMANTOWN,MD,20874.0,MCPD,Parking Lot - Residential,N,5N2,594,18800.0,,SPARKLING WATER,,DR,39.16296,-77.2766,5D,"(39.163, -77.2766)"
201315501,5404,210000226,01/03/2021 01:28:35 AM,2021-01-03 01:28:00,,90D,1,Crime Against Society,Driving Under the Influence,DRIVING UNDER THE INFLUENCE LIQUOR,WHEATON,,ROCKVILLE,MD,20853.0,MCPD,Street - In vehicle,K,4K2,339,,,VEIRS MILL,,RD,39.053,-77.077,4D,"(39.053, -77.077)"
201438955,2308,230048768,08/10/2023 03:50:58 PM,2023-08-10 15:50:00,,23D,1,Crime Against Property,Theft from Building,LARCENY - FROM BLDG,WHEATON,14400 BLK  BAUER DR,ROCKVILLE,MD,20853.0,MCPD,Recreation Center,K,4K2,344,14400.0,,BAUER,,DR,39.09091,-77.1001,4D,"(39.0909, -77.1001)"
201276325,5311,200005696,02/03/2020 06:55:18 PM,2020-02-03 18:55:00,,90C,1,Crime Against Society,Disorderly Conduct,PUBLIC PEACE - DISORDERLY CONDUCT,WHEATON,13600 BLK  GEORGIA AVE,SILVER SPRING,MD,20906.0,MCPD,Parking Lot - Commercial,K,4K1,348,13600.0,,GEORGIA,,AVE,39.07828,-77.0718,4D,"(39.0783, -77.0718)"
201284511,2902,200015514,04/09/2020 11:59:41 AM,2020-04-09 11:20:00,04/09/2020 11:59:00 AM,290,1,Crime Against Property,Destruction/Damage/Vandalism of Property,DAMAGE PROPERTY - PRIVATE,WHEATON,1  BLK  NORMANDY SQUARE CT,SILVER SPRING,MD,20906.0,MCPD,Residence - Apartment/Condo,K,4K1,531,1.0,,NORMANDY SQUARE,,CT,39.10201,-77.0518,4D,"(39.102, -77.0518)"
201358563,2303,210052979,12/28/2021 07:28:23 PM,2021-12-28 19:28:00,,23C,1,Crime Against Property,Shoplifting,LARCENY - SHOPLIFTING,GERMANTOWN,20900 BLK  FREDERICK RD,GERMANTOWN,MD,20876.0,MCPD,Retail - Department/Discount Store,M,5M1,701,20900.0,,FREDERICK,,RD,39.19829,-77.2448,5D,"(39.1983, -77.2448)"
201378222,2303,220022719,05/27/2022 06:00:12 PM,2022-05-27 18:00:00,,23C,1,Crime Against Property,Shoplifting,LARCENY - SHOPLIFTING,GERMANTOWN,20900 BLK  FREDERICK RD,GERMANTOWN,MD,20876.0,MCPD,Retail - Department/Discount Store,M,5M1,701,20900.0,,FREDERICK,,RD,39.19829,-77.2448,5D,"(39.1983, -77.2448)"
201404564,2303,220055052,12/13/2022 12:02:20 AM,2022-12-13 00:02:00,12/13/2022 01:10:00 AM,23C,1,Crime Against Property,Shoplifting,LARCENY - SHOPLIFTING,SILVER SPRING,1200 BLK E WEST HWY,SILVER SPRING,MD,20910.0,MCPD,Retail - Drug Store/Pharmacy,G,3G1,089,1200.0,E,WEST,,HWY,39.12378,-77.2033,3D,"(39.1238, -77.2033)"
201344377,2303,210034855,09/05/2021 03:46:55 PM,2021-09-05 15:15:00,09/05/2021 03:18:00 PM,23C,1,Crime Against Property,Shoplifting,LARCENY - SHOPLIFTING,MONTGOMERY VILLAGE,9100 BLK  ROTHBURY DR,MONTGOMERY VILLAGE,MD,20886.0,MCPD,Retail - Drug Store/Pharmacy,R,6R2,504,9100.0,,ROTHBURY,,DR,39.18526,-77.1874,6D,"(39.1853, -77.1874)"
201376217,2299,220020649,05/15/2022 02:47:33 AM,2022-05-15 02:47:00,,220,1,Crime Against Property,Burglary/Breaking and Entering,BURGLARY (DESCRIBE OFFENSE),MONTGOMERY VILLAGE,19300 BLK  KEYMAR WAY,MONTGOMERY VILLAGE,MD,20886.0,MCPD,Residence -Townhouse/Duplex,R,6R2,544,19300.0,,KEYMAR,,WAY,39.17313,-77.197,6D,"(39.1731, -77.197)"
201422867,2602,230018719,04/19/2023 02:29:13 PM,2023-04-18 17:19:00,04/19/2023 12:12:00 PM,26A,1,Crime Against Property,False Pretenses/Swindle/Confidence Game,FRAUD - SWINDLE,ROCKVILLE,1100 BLK  GRANDIN AVE,ROCKVILLE,MD,20851.0,RCPD,Residence - Single Family,A,1A2,292,1100.0,,GRANDIN,,AVE,39.07948,-77.1307,1D,"(39.0795, -77.1307)"
201405560,1399,220056038,12/18/2022 09:36:27 AM,2022-12-18 09:36:00,,13B,1,Crime Against Person,Simple Assault,ASSAULT - 2ND DEGREE,ROCKVILLE,9800 BLK  ALLENFORD CIR,ROCKVILLE,MD,20850.0,MCPD,Residence - Apartment/Condo,B,1B1,237,9800.0,,ALLENFORD,,CIR,39.0873,-77.2096,1D,"(39.0873, -77.2096)"
201385349,2204,220031680,07/23/2022 03:23:06 AM,2022-07-22 23:30:00,07/23/2022 02:00:00 AM,220,1,Crime Against Property,Burglary/Breaking and Entering,BURGLARY - NO FORCED ENTRY-RESIDENTIAL,ROCKVILLE,1  BLK  UPPER ROCK CIR,ROCKVILLE,MD,20850.0,RCPD,Residence - Apartment/Condo,A,1A3,439,1.0,,UPPER ROCK,,CIR,39.1132,-77.185,1D,"(39.1132, -77.185)"
201435590,2308,230033092,07/11/2023 07:23:20 PM,2023-07-11 19:23:00,,23D,1,Crime Against Property,Theft from Building,LARCENY - FROM BLDG,WHEATON,11400 BLK  AMHERST AVE,SILVER SPRING,MD,20902.0,MCPD,Restaurant,L,4L2,356,11400.0,,AMHERST,,AVE,39.04128,-77.0482,4D,"(39.0413, -77.0482)"
201272943,2610,200001499,01/09/2020 03:14:38 PM,2020-01-09 00:00:00,01/09/2020 12:00:00 AM,26F,1,Crime Against Property,Identity Theft,FRAUD - IDENTITY THEFT,WHEATON,15100 BLK  INTERLACHEN DR,SILVER SPRING,MD,20906.0,MCPD,Residence - Apartment/Condo,K,4K1,346,15100.0,,INTERLACHEN,,DR,39.10575,-77.0694,4D,"(39.1058, -77.0694)"
201303236,2304,200037491,09/24/2020 09:31:30 AM,2020-09-20 22:00:00,09/21/2020 12:00:00 PM,23G,1,Crime Against Property,Theft of Motor Vehicle Parts or Accessories,LARCENY - AUTO PARTS,ROCKVILLE,15500 BLK  FREDERICK RD,DERWOOD,MD,20855.0,MCPD,Auto Repair,A,1A4,280,15500.0,,FREDERICK,,RD,39.11,-77.1604,1D,"(39.11, -77.1604)"
201367873,1399,220010597,03/11/2022 06:46:25 PM,2022-03-11 18:46:00,,13B,1,Crime Against Person,Simple Assault,ASSAULT - 2ND DEGREE,WHEATON,11100 BLK  VEIRS MILL RD,SILVER SPRING,MD,20902.0,MCPD,Retail - Mall,L,4L2,321,11100.0,,VEIRS MILL,,RD,39.03758,-77.0519,4D,"(39.0376, -77.0519)"
201289100,2203,200020820,05/25/2020 09:51:10 PM,2020-05-25 21:51:00,,220,1,Crime Against Property,Burglary/Breaking and Entering,BURGLARY - FORCED ENTRY-NONRESIDENTIAL,WHEATON,12300 BLK  GEORGIA AVE,SILVER SPRING,MD,20906.0,MCPD,Restaurant,J,4J1,536,12300.0,,GEORGIA,,AVE,39.05819,-77.05,4D,"(39.0582, -77.05)"
201334528,2399,210022710,06/14/2021 01:15:43 PM,2021-06-08 15:36:00,06/08/2021 03:45:00 PM,23H,1,Crime Against Property,All other Larceny,LARCENY (DESCRIBE OFFENSE),MONTGOMERY VILLAGE,100 BLK  TIMBERBROOK LA,GAITHERSBURG,MD,20878.0,GPD,Residence - Apartment/Condo,P,6P1,552,100.0,,TIMBERBROOK,,LA,39.11763,-77.2168,6D,"(39.1176, -77.2168)"
201245506,2404,190030267,06/25/2019 08:01:34 AM,2019-06-25 03:00:00,06/25/2019 08:01:00 AM,240,1,Crime Against Property,Motor Vehicle Theft,AUTO THEFT - VEHICLE THEFT,WHEATON,4100 BLK  ALFALFA TER,OLNEY,MD,20832.0,MCPD,Residence - Driveway,J,4J2,539,4100.0,,ALFALFA,,TER,39.13925,-77.0829,4D,"(39.1392, -77.0829)"
201316332,2399,210001701,01/14/2021 10:50:57 AM,2021-01-14 11:27:00,,23H,1,Crime Against Property,All other Larceny,LARCENY (DESCRIBE OFFENSE),SILVER SPRING,2100 BLK  INDUSTRIAL PKW,SILVER SPRING,MD,20904.0,MCPD,Government Building,I,3I1,146,2100.0,,INDUSTRIAL,,PKW,39.05583,-76.9709,3D,"(39.0558, -76.9709)"
201411748,5202,230005575,02/03/2023 08:56:53 AM,2023-02-03 11:15:00,02/03/2023 12:00:00 PM,520,1,Crime Against Society,Weapon Law Violations,WEAPON - CONCEALED,WHEATON,900 BLK  UNIVERSITY BLV,SILVER SPRING,MD,20901.0,MCPD,School - Elementary/Secondary,L,4L2,158,900.0,,UNIVERSITY,,BLV,38.99418,-76.9925,4D,"(38.9942, -76.9925)"
201268216,4199,190058661,,2019-12-05 16:22:00,,90G,1,Crime Against Society,Liquor Law Violations,LIQUOR (DESCRIBE OFFENSE),WHEATON,2500 BLK  UNIVERSITY BLV W,SILVER SPRING,MD,20902.0,MCPD,Retail - Other,L,4L2,325,2500.0,,UNIVERSITY,W,BLV,39.04148,-77.0518,4D,"(39.0415, -77.0518)"
201430043,2308,230027390,06/07/2023 03:42:26 PM,2023-06-07 15:42:00,,23D,1,Crime Against Property,Theft from Building,LARCENY - FROM BLDG,WHEATON,1  BLK  PIMLICO CT,SILVER SPRING,MD,20906.0,MCPD,Residence - Single Family,K,4K1,346,1.0,,PIMLICO,,CT,39.10531,-77.0742,4D,"(39.1053, -77.0742)"
201435191,2305,230032780,07/10/2023 09:35:56 AM,2023-07-09 19:00:00,07/10/2023 07:30:00 AM,23F,1,Crime Against Property,Theft From Motor Vehicle,LARCENY - FROM AUTO,SILVER SPRING,10600 BLK S DUNMOOR DR,SILVER SPRING,MD,20901.0,MCPD,Parking Lot - Residential,H,3H2,154,10600.0,S,DUNMOOR,,DR,39.02566,-77.0074,3D,"(39.0257, -77.0074)"
201275585,2699,200004747,01/29/2020 09:57:58 AM,2020-01-28 11:51:00,01/28/2020 02:00:00 PM,26A,1,Crime Against Property,False Pretenses/Swindle/Confidence Game,FRAUD (DESCRIBE OFFENSE),ROCKVILLE,2000 BLK  ROCKLAND AVE,ROCKVILLE,MD,20851.0,RCPD,Residence - Single Family,A,1A2,298,2000.0,,ROCKLAND,,AVE,39.07013,-77.1227,1D,"(39.0701, -77.1227)"
201231295,2308,190012384,03/17/2019 08:37:52 PM,2019-03-17 07:00:00,03/17/2019 08:34:00 PM,23D,1,Crime Against Property,Theft from Building,LARCENY - FROM BLDG,WHEATON,18100 BLK  PRINCE PHILIP DR,OLNEY,MD,20832.0,MCPD,Hospital/Emergency Care Center,J,4J2,401,18100.0,,PRINCE PHILIP,,DR,39.15425,-77.0569,4D,"(39.1542, -77.0569)"
201244042,2303,190028633,06/15/2019 01:42:02 PM,2019-06-15 13:42:00,,23C,1,Crime Against Property,Shoplifting,LARCENY - SHOPLIFTING,SILVER SPRING,1200 BLK E WEST HWY,SILVER SPRING,MD,20910.0,MCPD,Retail - Drug Store/Pharmacy,G,3G1,089,1200.0,E,WEST,,HWY,39.12378,-77.2033,3D,"(39.1238, -77.2033)"
201417269,2901,230010811,03/05/2023 02:04:06 AM,2023-03-05 01:00:00,03/05/2023 01:30:00 AM,290,1,Crime Against Property,Destruction/Damage/Vandalism of Property,DAMAGE PROPERTY - BUSINESS,MONTGOMERY VILLAGE,9800 BLK  WASHINGTONIAN BLV,GAITHERSBURG,MD,20878.0,MCPD,Parking Garage - Commercial,P,6P1,549,9800.0,,WASHINGTONIAN,,BLV,39.11415,-77.197,6D,"(39.1142, -77.197)"
201255617,2605,190042778,09/06/2019 05:24:34 PM,2019-09-06 00:00:00,,26B,1,Crime Against Property,Credit Card/Automatic Teller Machine Fraud,FRAUD - ILLEGAL USE CREDIT CARDS,GERMANTOWN,19700 BLK  GERMANTOWN RD,GERMANTOWN,MD,20874.0,MCPD,Bank/S&L/Credit Union,N,5N1,702,19700.0,,GERMANTOWN,,RD,39.17881,-77.2673,5D,"(39.1788, -77.2673)"
201406905,1314,220057986,12/31/2022 07:45:35 AM,2022-12-31 07:45:00,,13A,1,Crime Against Person,Aggravated Assault,ASSAULT - AGGRAVATED - GUN,WHEATON,2700 BLK  URBANA DR,SILVER SPRING,MD,20906.0,MCPD,Residence - Single Family,K,4K2,335,2700.0,,URBANA,,DR,39.06107,-77.0562,4D,"(39.0611, -77.0562)"
201282984,2308,200013733,03/23/2020 01:14:51 PM,2020-03-21 08:30:00,,23D,1,Crime Against Property,Theft from Building,LARCENY - FROM BLDG,MONTGOMERY VILLAGE,900 BLK  CLOPPER RD,GAITHERSBURG,MD,20878.0,GPD,Commercial - Office Building,P,6P2,555,900.0,,CLOPPER,,RD,39.14601,-77.2282,6D,"(39.146, -77.2282)"
201229760,5404,190010533,03/06/2019 08:47:42 PM,2019-03-06 20:47:00,,90D,1,Crime Against Society,Driving Under the Influence,DRIVING UNDER THE INFLUENCE LIQUOR,GERMANTOWN,23400 BLK  WOODFIELD RD,GAITHERSBURG,MD,20882.0,MCPD,Street - In vehicle,M,5M2,627,23400.0,,WOODFIELD,,RD,39.24038,-77.1827,5D,"(39.2404, -77.1827)"
201259602,3562,190047739,10/04/2019 11:24:42 PM,2019-10-04 23:24:00,,35A,1,Crime Against Society,Drug/Narcotic Violations,DRUGS - MARIJUANA - POSSESS,SILVER SPRING,,SILVER SPRING,MD,20910.0,MCPD,Street - In vehicle,G,3G1,093,,,SLIGO,,AVE,38.9903,-77.0183,3D,"(38.9903, -77.0183)"
201261696,2399,190050488,10/21/2019 12:58:30 PM,2019-10-19 16:00:00,10/21/2019 08:00:00 AM,23H,1,Crime Against Property,All other Larceny,LARCENY (DESCRIBE OFFENSE),BETHESDA,9500 BLK  LINDALE DR,BETHESDA,MD,20817.0,MCPD,Construction Site,E,2E2,070,9500.0,,LINDALE,,DR,39.01091,-77.1205,2D,"(39.0109, -77.1205)"
201315870,2305,210001192,01/10/2021 09:48:02 AM,2021-01-09 10:30:00,01/10/2021 09:45:00 AM,23F,1,Crime Against Property,Theft From Motor Vehicle,LARCENY - FROM AUTO,TAKOMA PARK,6800 BLK  PRINCE GEORGES AVE,TAKOMA PARK,MD,20912.0,TPPD,Residence - Driveway,T,8T3,808,6800.0,,PRINCE GEORGES,,AVE,38.97318,-76.9981,TPPD,"(38.9732, -76.9981)"
201241105,3562,190024849,05/25/2019 01:32:42 AM,2019-05-25 01:32:00,05/25/2019 02:00:00 AM,35A,1,Crime Against Society,Drug/Narcotic Violations,DRUGS - MARIJUANA - POSSESS,SILVER SPRING,900 BLK  SILVER SPRING AVE,SILVER SPRING,MD,20910.0,MCPD,Street - Commercial,G,3G1,093,900.0,,SILVER SPRING,,AVE,38.99169,-77.024,3D,"(38.9917, -77.024)"
201316539,5404,210001926,01/16/2021 12:37:53 AM,2021-01-16 00:38:00,,90D,1,Crime Against Society,Driving Under the Influence,DRIVING UNDER THE INFLUENCE LIQUOR,MONTGOMERY VILLAGE,,GAITHERSBURG,MD,20879.0,MCPD,Street - In vehicle,R,6R2,545,,,PROFESSIONAL,,DR,39.15927,-77.2265,6D,"(39.1593, -77.2265)"
201422057,3802,230017673,04/13/2023 03:36:18 PM,2023-04-12 16:30:00,04/12/2023 11:00:00 PM,90F,1,Crime Against Society,"Family Offenses, NonViolent",FAMILY OFFENSE - CRUELTY TOWARD CHILD,BETHESDA,6300 BLK  GREENTREE RD,BETHESDA,MD,20817.0,MCPD,Shelter-Mission/Homeless,E,2E2,068,6300.0,,GREENTREE,,RD,39.00172,-77.1278,2D,"(39.0017, -77.1278)"
201340588,5403,210030308,08/04/2021 07:25:52 PM,2021-08-04 19:25:00,,90D,1,Crime Against Society,Driving Under the Influence,DRIVING UNDER THE INFLUENCE DRUGS,MONTGOMERY VILLAGE,10200 BLK  GREAT SENECA HWY,GAITHERSBURG,MD,20878.0,MCPD,Street - In vehicle,P,6P1,552,10200.0,,GREAT SENECA,,HWY,39.11021,-77.2173,6D,"(39.1102, -77.2173)"
201436129,2902,230034816,07/21/2023 08:50:17 PM,2023-07-21 03:00:00,07/21/2023 08:47:00 PM,290,1,Crime Against Property,Destruction/Damage/Vandalism of Property,DAMAGE PROPERTY - PRIVATE,TAKOMA PARK,1200 BLK  KIRKLYNN AVE,TAKOMA PARK,MD,20912.0,TPPD,Street - Residential,T,8T3,806,1200.0,,KIRKLYNN,,AVE,38.98727,-76.9908,TPPD,"(38.9873, -76.9908)"
201427084,1399,230023796,05/18/2023 02:19:30 AM,2023-05-18 02:19:00,,13B,1,Crime Against Person,Simple Assault,ASSAULT - 2ND DEGREE,GERMANTOWN,20800 BLK  GAELIC CT,GERMANTOWN,MD,20874.0,MCPD,Residence -Townhouse/Duplex,N,5N1,465,20800.0,,GAELIC,,CT,39.1971,-77.27,5D,"(39.1971, -77.27)"
201382005,4104,220027592,06/27/2022 09:48:46 AM,2022-06-27 09:00:00,06/27/2022 09:45:00 AM,90G,1,Crime Against Society,Liquor Law Violations,LIQUOR - POSSESS,ROCKVILLE,200 BLK  MEADOW HALL DR,ROCKVILLE,MD,20851.0,RCPD,Library,A,1A2,293,200.0,,MEADOW HALL,,DR,39.07435,-77.1137,1D,"(39.0744, -77.1137)"
201422109,3522,230017735,04/13/2023 10:52:51 PM,2023-04-13 22:30:00,04/13/2023 11:00:00 PM,35A,1,Crime Against Society,Drug/Narcotic Violations,DRUGS - OPIUM OR DERIVATIVE - POSSESS,WHEATON,11200 BLK  TRIANGLE LA,SILVER SPRING,MD,20902.0,MCPD,Street - Commercial,L,4L2,324,11200.0,,TRIANGLE,,LA,39.03853,-77.0515,4D,"(39.0385, -77.0515)"
201292402,2605,200024735,06/24/2020 06:07:45 PM,2020-06-24 14:30:00,,26B,1,Crime Against Property,Credit Card/Automatic Teller Machine Fraud,FRAUD - ILLEGAL USE CREDIT CARDS,GERMANTOWN,10400 BLK  DAMASCUS PARK LA,DAMASCUS,MD,20872.0,MCPD,Other/Unknown,M,5M2,481,10400.0,,DAMASCUS PARK,,LA,39.27294,-77.2136,5D,"(39.2729, -77.2136)"
201246183,2305,190031299,07/01/2019 11:14:01 AM,2019-06-30 21:30:00,07/01/2019 08:00:00 AM,23F,1,Crime Against Property,Theft From Motor Vehicle,LARCENY - FROM AUTO,MONTGOMERY VILLAGE,18600 BLK  AZALEA DR,DERWOOD,MD,20855.0,MCPD,Residence - Driveway,R,6R3,724,18600.0,,AZALEA,,DR,39.1609,-77.1173,6D,"(39.1609, -77.1173)"
201233376,2610,190015218,04/02/2019 11:18:32 AM,2019-04-02 11:18:00,,26F,1,Crime Against Property,Identity Theft,FRAUD - IDENTITY THEFT,ROCKVILLE,1  BLK W MONTGOMERY AVE,ROCKVILLE,MD,20850.0,RCPD,Residence - Single Family,A,1A3,255,1.0,W,MONTGOMERY,,AVE,38.97429,-77.0089,1D,"(38.9743, -77.0089)"
201351000,2203,210043437,10/28/2021 03:00:54 AM,2021-10-28 03:00:00,,220,1,Crime Against Property,Burglary/Breaking and Entering,BURGLARY - FORCED ENTRY-NONRESIDENTIAL,MONTGOMERY VILLAGE,600 BLK S FREDERICK AVE,GAITHERSBURG,MD,20877.0,MCPD,Gas Station,P,6P3,432,600.0,S,FREDERICK,,AVE,39.15009,-77.209,6D,"(39.1501, -77.209)"
201361074,2610,220002185,01/18/2022 03:21:31 PM,2022-01-04 13:00:00,01/04/2022 01:00:00 PM,26F,1,Crime Against Property,Identity Theft,FRAUD - IDENTITY THEFT,WHEATON,2400 BLK  BLUERIDGE AVE,SILVER SPRING,MD,20902.0,MCPD,Other/Unknown,L,4L1,358,2400.0,,BLUERIDGE,,AVE,39.043,-77.0499,4D,"(39.043, -77.0499)"
201340445,1103,210030151,08/03/2021 05:02:33 PM,2021-07-31 20:00:00,,11A,1,Crime Against Person,Forcible Rape,RAPE - STRONG-ARM,SILVER SPRING,4200 BLK  TAZEWELL TER,BURTONSVILLE,MD,20866.0,MCPD,Residence - Single Family,I,3I2,381,4200.0,,TAZEWELL,,TER,39.10374,-76.9241,3D,"(39.1037, -76.9241)"
201236452,2399,190019062,04/23/2019 05:13:53 PM,2019-04-23 09:00:00,04/23/2019 04:00:00 PM,23H,1,Crime Against Property,All other Larceny,LARCENY (DESCRIBE OFFENSE),ROCKVILLE,700 BLK  MONROE ST,ROCKVILLE,MD,20850.0,RCPD,Parking Lot - Residential,A,1A1,258,700.0,,MONROE,,ST,39.07537,-77.153,1D,"(39.0754, -77.153)"
201401037,2303,220050781,11/17/2022 06:59:49 AM,2022-11-17 06:59:00,,23C,1,Crime Against Property,Shoplifting,LARCENY - SHOPLIFTING,BETHESDA,5000 BLK  BRADLEY BLV,CHEVY CHASE,MD,20815.0,MCPD,Grocery/Supermarket,D,2D2,016,5000.0,,BRADLEY,,BLV,38.978,-77.0987,2D,"(38.978, -77.0987)"
201275665,4008,200004732,01/28/2020 11:34:05 PM,2020-01-29 19:47:00,,40C,1,Crime Against Person,Purchasing Prostitution,COMM SEX OFF - PURCHASE PROSTITUTE - ADULT,ROCKVILLE,16000 BLK  SHADY GROVE RD,ROCKVILLE,MD,20850.0,MCPD,Hotel/Motel/Etc.,A,1A3,439,16000.0,,SHADY GROVE,,RD,39.11887,-77.1826,1D,"(39.1189, -77.1826)"
201231432,2316,190012828,03/20/2019 10:11:21 AM,2019-03-18 10:11:00,03/20/2019 10:00:00 AM,23H,1,Crime Against Property,All other Larceny,LARCENY - POSTAL,SILVER SPRING,1600 BLK  CARRIAGE HOUSE TER,SILVER SPRING,MD,20904.0,MCPD,Residence - Other,I,3I1,145,1600.0,,CARRIAGE HOUSE,,TER,39.04919,-76.9795,3D,"(39.0492, -76.9795)"
201321821,2610,210008073,03/03/2021 05:37:39 PM,2021-03-03 00:00:00,,26F,1,Crime Against Property,Identity Theft,FRAUD - IDENTITY THEFT,SILVER SPRING,9400 BLK  WIRE AVE,SILVER SPRING,MD,20901.0,MCPD,Other/Unknown,G,3G2,120,9400.0,,WIRE,,AVE,39.00989,-77.0104,3D,"(39.0099, -77.0104)"
201310586,2305,200046405,11/24/2020 12:20:19 PM,2020-11-24 13:23:00,,23F,1,Crime Against Property,Theft From Motor Vehicle,LARCENY - FROM AUTO,ROCKVILLE,2200 BLK  RESEARCH BLV,ROCKVILLE,MD,20850.0,MCPD,Parking Lot - Commercial,B,1B1,241,2200.0,,RESEARCH,,BLV,39.10014,-77.1819,1D,"(39.1001, -77.1819)"
201377632,3562,220022231,05/24/2022 08:01:29 PM,2022-05-24 19:50:00,,35A,1,Crime Against Society,Drug/Narcotic Violations,DRUGS - MARIJUANA - POSSESS,,,SILVER SPRING,,20910.0,MCPD,Street - In vehicle,w,own,Unknown,,,,,,0.0,0.0,Unknown,"(0.0, 0.0)"
201345450,4104,210036284,09/14/2021 08:45:40 PM,2021-09-14 20:45:00,,90G,1,Crime Against Society,Liquor Law Violations,LIQUOR - POSSESS,WHEATON,12300 BLK  GEORGIA AVE,SILVER SPRING,MD,20906.0,MCPD,Street - Bus Stop,J,4J1,536,12300.0,,GEORGIA,,AVE,39.05819,-77.05,4D,"(39.0582, -77.05)"
201446188,1399,230057723,09/30/2023 03:46:41 PM,2023-09-30 15:46:00,,13B,3,Crime Against Person,Simple Assault,ASSAULT - 2ND DEGREE,WHEATON,4000 BLK  OLNEY LAYTONSVILLE RD,OLNEY,MD,20832.0,MCPD,Residence - Yard,J,4J2,400,4000.0,,OLNEY LAYTONSVILLE,,RD,39.16059,-77.0791,4D,"(39.1606, -77.0791)"
201445864,2399,230057293,09/28/2023 01:03:31 PM,2023-09-19 13:03:00,09/28/2023 12:00:00 AM,23H,1,Crime Against Property,All other Larceny,LARCENY (DESCRIBE OFFENSE),BETHESDA,6600 BLK  ROCKLEDGE DR,BETHESDA,MD,20817.0,MCPD,Retail - Other,E,2E3,197,6600.0,,ROCKLEDGE,,DR,39.02708,-77.1323,2D,"(39.0271, -77.1323)"
201337377,2399,210026215,07/08/2021 10:23:25 AM,2021-07-08 05:00:00,,23H,1,Crime Against Property,All other Larceny,LARCENY (DESCRIBE OFFENSE),GERMANTOWN,18100 BLK  KITCHEN HOUSE CT,GERMANTOWN,MD,20874.0,MCPD,Parking Lot - Residential,N,5N2,448,18100.0,,KITCHEN HOUSE,,CT,39.15212,-77.2661,5D,"(39.1521, -77.2661)"
201260509,1399,190048972,10/11/2019 10:56:20 PM,2019-10-11 22:56:00,,13B,3,Crime Against Person,Simple Assault,ASSAULT - 2ND DEGREE,GERMANTOWN,12900 BLK  BARLEYCORN TER,GERMANTOWN,MD,20874.0,MCPD,Residence - Single Family,N,5N2,448,12900.0,,BARLEYCORN,,TER,39.14916,-77.2694,5D,"(39.1492, -77.2694)"
201324226,5311,210010597,03/21/2021 09:40:29 AM,2021-03-21 09:39:00,,90C,1,Crime Against Society,Disorderly Conduct,PUBLIC PEACE - DISORDERLY CONDUCT,SILVER SPRING,8700 BLK  GEORGIA AVE,SILVER SPRING,MD,20910.0,MCPD,Residence - Apartment/Condo,G,3G1,095,8700.0,,GEORGIA,,AVE,38.99752,-77.0297,3D,"(38.9975, -77.0297)"
201316721,2202,210002072,01/17/2021 12:19:47 PM,2021-01-17 12:19:00,,220,1,Crime Against Property,Burglary/Breaking and Entering,BURGLARY - FORCED ENTRY-RESIDENTIAL,SILVER SPRING,1000 BLK  QUEBEC TER,SILVER SPRING,MD,20903.0,MCPD,Residence - Apartment/Condo,H,3H1,132,1000.0,,QUEBEC,,TER,38.99907,-76.9893,3D,"(38.9991, -76.9893)"
201280966,2305,200011470,03/08/2020 05:45:58 PM,2020-03-08 17:45:00,,23F,1,Crime Against Property,Theft From Motor Vehicle,LARCENY - FROM AUTO,GERMANTOWN,20700 BLK  SUMMER SWEET TER,GERMANTOWN,MD,20876.0,MCPD,Street - Residential,M,5M1,701,20700.0,,SUMMER SWEET,,TER,39.195,-77.2469,5D,"(39.195, -77.2469)"
201226795,2902,190007097,02/13/2019 05:46:46 PM,2019-02-13 14:00:00,02/13/2019 05:30:00 PM,290,1,Crime Against Property,Destruction/Damage/Vandalism of Property,DAMAGE PROPERTY - PRIVATE,WHEATON,2700 BLK  UNIVERSITY BLV W,SILVER SPRING,MD,20902.0,MCPD,Parking Lot - Commercial,L,4L2,321,2700.0,,UNIVERSITY,W,BLV,39.04002,-77.0554,4D,"(39.04, -77.0554)"
201237544,2404,190020406,05/01/2019 11:47:40 AM,2019-04-30 23:00:00,05/01/2019 07:00:00 AM,240,1,Crime Against Property,Motor Vehicle Theft,AUTO THEFT - VEHICLE THEFT,BETHESDA,6900 BLK  CLARENDON RD,BETHESDA,MD,20814.0,MCPD,Parking Lot - Residential,D,2D2,031,6900.0,,CLARENDON,,RD,38.97926,-77.1012,2D,"(38.9793, -77.1012)"
201303534,2305,200037880,09/26/2020 03:10:18 PM,2020-09-25 22:00:00,09/26/2020 12:00:00 PM,23F,1,Crime Against Property,Theft From Motor Vehicle,LARCENY - FROM AUTO,SILVER SPRING,1400 BLK  LEISTER DR,SILVER SPRING,MD,20904.0,MCPD,Residence - Driveway,I,3I1,149,1400.0,,LEISTER,,DR,39.06646,-76.9849,3D,"(39.0665, -76.9849)"
201274120,2610,200002850,01/17/2020 01:07:44 PM,2020-01-15 16:00:00,01/15/2020 05:00:00 PM,26F,1,Crime Against Property,Identity Theft,FRAUD - IDENTITY THEFT,BETHESDA,11000 BLK  GLUECK LA,KENSINGTON,MD,20895.0,MCPD,Other/Unknown,D,2D3,314,11000.0,,GLUECK,,LA,39.03686,-77.0694,2D,"(39.0369, -77.0694)"
201230000,5404,190011047,03/09/2019 11:13:50 PM,2019-03-09 23:13:00,03/10/2019 12:45:00 AM,90D,1,Crime Against Society,Driving Under the Influence,DRIVING UNDER THE INFLUENCE LIQUOR,SILVER SPRING,,SILVER SPRING,MD,20904.0,MCPD,Street - In vehicle,I,3I1,148,,,COLUMBIA,,PIK,38.97665,-77.0065,3D,"(38.9766, -77.0065)"
201280500,2404,200010907,03/05/2020 09:15:44 AM,2020-03-04 18:00:00,03/05/2020 08:00:00 AM,240,1,Crime Against Property,Motor Vehicle Theft,AUTO THEFT - VEHICLE THEFT,GERMANTOWN,12500 BLK  GREAT PARK CIR,GERMANTOWN,MD,20876.0,MCPD,Parking Lot - Residential,M,5M3,474,12500.0,,GREAT PARK,,CIR,39.20238,-77.2572,5D,"(39.2024, -77.2572)"
201335666,1399,210024140,06/24/2021 01:26:34 AM,2021-06-24 01:25:00,,13B,1,Crime Against Person,Simple Assault,ASSAULT - 2ND DEGREE,GERMANTOWN,19700 BLK  CRYSTAL ROCK DR,GERMANTOWN,MD,20874.0,MCPD,Residence - Apartment/Condo,N,5N1,595,19700.0,,CRYSTAL ROCK,,DR,39.17902,-77.2616,5D,"(39.179, -77.2616)"
201449370,2399,230061428,10/19/2023 12:37:11 PM,2023-10-10 00:00:00,,23H,1,Crime Against Property,All other Larceny,LARCENY (DESCRIBE OFFENSE),MONTGOMERY VILLAGE,8600 BLK  DAKOTA DR,GAITHERSBURG,MD,20877.0,MCPD,Commercial - Office Building,P,6P3,437,8600.0,,DAKOTA,,DR,39.12715,-77.1753,6D,"(39.1272, -77.1753)"
201335492,2203,210023899,06/22/2021 03:30:58 PM,2021-06-21 16:00:00,06/22/2021 09:00:00 AM,220,1,Crime Against Property,Burglary/Breaking and Entering,BURGLARY - FORCED ENTRY-NONRESIDENTIAL,MONTGOMERY VILLAGE,16800 BLK  OAKMONT AVE,GAITHERSBURG,MD,20877.0,MCPD,Commercial - Office Building,P,6P3,437,16800.0,,OAKMONT,,AVE,39.13164,-77.175,6D,"(39.1316, -77.175)"
201435112,2303,230033612,07/14/2023 05:29:29 PM,2023-07-14 17:10:00,,23C,1,Crime Against Property,Shoplifting,LARCENY - SHOPLIFTING,GERMANTOWN,20900 BLK  FREDERICK RD,GERMANTOWN,MD,20876.0,MCPD,Retail - Department/Discount Store,M,5M1,701,20900.0,,FREDERICK,,RD,39.19829,-77.2448,5D,"(39.1983, -77.2448)"
201333970,2203,210021956,06/09/2021 01:56:18 PM,2021-06-09 13:56:00,,220,1,Crime Against Property,Burglary/Breaking and Entering,BURGLARY - FORCED ENTRY-NONRESIDENTIAL,TAKOMA PARK,7000 BLK  CARROLL AVE,TAKOMA PARK,MD,20912.0,TPPD,Restaurant,T,8T1,801,7000.0,,CARROLL,,AVE,38.97464,-77.0121,TPPD,"(38.9746, -77.0121)"
201424508,2404,230020681,04/30/2023 11:31:25 PM,2023-04-21 12:00:00,04/30/2023 10:15:00 PM,240,1,Crime Against Property,Motor Vehicle Theft,AUTO THEFT - VEHICLE THEFT,ROCKVILLE,100 BLK  ROLLINS AVE,ROCKVILLE,MD,20852.0,MCPD,Parking Lot - Residential,A,1A1,269,100.0,,ROLLINS,,AVE,39.05883,-77.1213,1D,"(39.0588, -77.1213)"
201265693,5707,190055231,11/16/2019 12:11:14 AM,2019-11-16 00:09:00,11/16/2019 12:10:00 AM,90J,1,Crime Against Society,Trespass of Real Property,TRESPASSING,SILVER SPRING,8600 BLK  COLESVILLE RD,SILVER SPRING,MD,20910.0,MCPD,Theater,G,3G1,108,8600.0,,COLESVILLE,,RD,38.99602,-77.0281,3D,"(38.996, -77.0281)"
201233982,2610,190015853,04/05/2019 02:26:50 PM,2019-04-04 23:59:00,,26F,1,Crime Against Property,Identity Theft,FRAUD - IDENTITY THEFT,BETHESDA,2300 BLK E WEST HWY,SILVER SPRING,MD,20910.0,MCPD,Other/Unknown,D,2D1,085,2300.0,E,WEST,,HWY,0.0,0.0,2D,"(0.0, 0.0)"
201420528,2303,230015873,04/03/2023 09:17:45 AM,2023-04-03 09:00:00,04/03/2023 09:16:00 AM,23C,1,Crime Against Property,Shoplifting,LARCENY - SHOPLIFTING,GERMANTOWN,21000 BLK  FREDERICK RD,GERMANTOWN,MD,20876.0,MCPD,Convenience Store,M,5M1,701,21000.0,,FREDERICK,,RD,39.20331,-77.2457,5D,"(39.2033, -77.2457)"
201222277,2399,190000621,01/04/2019 01:37:05 PM,2019-01-04 13:37:00,,23H,1,Crime Against Property,All other Larceny,LARCENY (DESCRIBE OFFENSE),ROCKVILLE,2400 BLK  WOOTTON PKW,ROCKVILLE,MD,20850.0,MCPD,Street - Bus Stop,B,1B1,238,2400.0,,WOOTTON,,PKW,39.08372,-77.187,1D,"(39.0837, -77.187)"
201346435,2903,210037625,09/23/2021 12:50:40 PM,2021-09-23 12:59:00,,290,1,Crime Against Property,Destruction/Damage/Vandalism of Property,DAMAGE PROPERTY - PUBLIC,TAKOMA PARK,7600 BLK  FLOWER AVE,TAKOMA PARK,MD,20912.0,TPPD,Street - Residential,T,8T2,805,7600.0,,FLOWER,,AVE,38.98478,-76.9985,TPPD,"(38.9848, -76.9985)"
201236990,3611,190019658,04/26/2019 08:36:43 PM,2019-04-26 20:33:00,,90H,1,Crime Against Society,Peeping Tom,SEX OFFENSE - PEEPING TOM,,,GAITHERSBURG,MD,20877.0,GPD,Residence - Apartment/Condo,w,own,Unknown,,,,,,0.0,0.0,Unknown,"(0.0, 0.0)"
201309729,2601,200045395,11/17/2020 03:28:37 PM,2020-11-13 16:19:00,,26A,1,Crime Against Property,False Pretenses/Swindle/Confidence Game,FRAUD - CONFIDENCE GAME,MONTGOMERY VILLAGE,12100 BLK  PAWNEE DR,GAITHERSBURG,MD,20878.0,MCPD,Residence - Single Family,P,6P2,591,12100.0,,PAWNEE,,DR,39.12294,-77.2491,6D,"(39.1229, -77.2491)"
201366511,2902,220008958,03/02/2022 06:09:40 AM,2022-03-01 17:00:00,03/02/2022 06:00:00 AM,290,1,Crime Against Property,Destruction/Damage/Vandalism of Property,DAMAGE PROPERTY - PRIVATE,WHEATON,12600 BLK  GEORGIA AVE,SILVER SPRING,MD,20906.0,MCPD,Parking Lot - Residential,K,4K1,351,12600.0,,GEORGIA,,AVE,39.06303,-77.0547,4D,"(39.063, -77.0547)"
201231858,2303,190013270,03/22/2019 04:35:29 PM,2019-03-22 16:35:00,,23C,1,Crime Against Property,Shoplifting,LARCENY - SHOPLIFTING,SILVER SPRING,900 BLK  ELLSWORTH DR,SILVER SPRING,MD,20910.0,MCPD,Retail - Department/Discount Store,G,3G1,109,900.0,,ELLSWORTH,,DR,38.99686,-77.0254,3D,"(38.9969, -77.0254)"
201419539,2902,230014821,03/27/2023 05:10:08 PM,2023-03-26 17:10:00,03/27/2023 04:00:00 AM,290,1,Crime Against Property,Destruction/Damage/Vandalism of Property,DAMAGE PROPERTY - PRIVATE,ROCKVILLE,15500 BLK  OWENS GLEN TER,GAITHERSBURG,MD,20878.0,MCPD,Parking Garage - Residential,B,1B2,556,15500.0,,OWENS GLEN,,TER,39.11073,-77.2424,1D,"(39.1107, -77.2424)"
201352002,2399,210044719,11/04/2021 05:54:53 PM,2021-10-25 12:47:00,10/25/2021 12:50:00 PM,23H,1,Crime Against Property,All other Larceny,LARCENY (DESCRIBE OFFENSE),SILVER SPRING,1200 BLK  BLAIR MILL RD,SILVER SPRING,MD,20910.0,MCPD,Other/Unknown,G,3G1,669,1200.0,,BLAIR MILL,,RD,38.98994,-77.0289,3D,"(38.9899, -77.0289)"
201410879,2205,230004655,01/28/2023 07:30:26 PM,2023-01-28 19:30:00,,220,1,Crime Against Property,Burglary/Breaking and Entering,BURGLARY - NO FORCED ENTRY-NONRESIDENTIAL,GERMANTOWN,26800 BLK  LONG CORNER RD,MT AIRY,MD,21771.0,MCPD,Residence - Single Family,M,5M2,613,26800.0,,LONG CORNER,,RD,39.29586,-77.1637,5D,"(39.2959, -77.1637)"
201350158,2305,210042313,10/21/2021 12:14:37 PM,2021-10-20 13:25:00,10/21/2021 09:00:00 AM,23F,1,Crime Against Property,Theft From Motor Vehicle,LARCENY - FROM AUTO,ROCKVILLE,13600 BLK  STRAW BALE LA,GAITHERSBURG,MD,20878.0,MCPD,Residence - Driveway,B,1B2,560,13600.0,,STRAW BALE,,LA,39.0962,-77.2812,1D,"(39.0962, -77.2812)"
201399364,2204,220048759,11/05/2022 04:13:50 AM,2022-11-05 04:13:00,,220,1,Crime Against Property,Burglary/Breaking and Entering,BURGLARY - NO FORCED ENTRY-RESIDENTIAL,GERMANTOWN,11500 BLK  ABERSTRAW WAY,GERMANTOWN,MD,20876.0,MCPD,Residence -Townhouse/Duplex,M,5M1,471,11500.0,,ABERSTRAW,,WAY,39.18951,-77.2398,5D,"(39.1895, -77.2398)"
201271556,2303,190062752,12/30/2019 02:40:15 PM,2019-12-30 14:28:00,,23C,1,Crime Against Property,Shoplifting,LARCENY - SHOPLIFTING,GERMANTOWN,20900 BLK  FREDERICK RD,GERMANTOWN,MD,20876.0,MCPD,Retail - Department/Discount Store,M,5M1,701,20900.0,,FREDERICK,,RD,39.19829,-77.2448,5D,"(39.1983, -77.2448)"
201314047,1399,200050507,12/23/2020 02:32:49 PM,2020-12-22 18:00:00,12/22/2020 07:00:00 PM,13B,1,Crime Against Person,Simple Assault,ASSAULT - 2ND DEGREE,WHEATON,2300 BLK  JONES LA,SILVER SPRING,MD,20902.0,MCPD,Street - In vehicle,L,4L1,674,2300.0,,JONES,,LA,39.05366,-77.0492,4D,"(39.0537, -77.0492)"
201408409,2699,230001659,01/11/2023 08:41:00 AM,2022-12-09 00:00:00,01/04/2023 12:00:00 AM,26A,1,Crime Against Property,False Pretenses/Swindle/Confidence Game,FRAUD (DESCRIBE OFFENSE),ROCKVILLE,12000 BLK  AMBLESIDE DR,POTOMAC,MD,20854.0,MCPD,Bank - ATM,B,1B2,234,12000.0,,AMBLESIDE,,DR,39.05217,-77.2006,1D,"(39.0522, -77.2006)"
201300467,2502,200034196,09/01/2020 01:12:21 PM,2020-07-13 00:01:00,07/14/2020 11:59:00 PM,250,1,Crime Against Property,Counterfeiting/Forgery,FORGERY OF OTHER,BETHESDA,4800 BLK  RUGBY AVE,BETHESDA,MD,20814.0,MCPD,Bank/S&L/Credit Union,D,2D2,049,4800.0,,RUGBY,,AVE,38.99133,-77.0967,2D,"(38.9913, -77.0967)"
201348943,2610,210040829,10/12/2021 03:04:43 PM,2021-10-09 00:00:00,,26F,1,Crime Against Property,Identity Theft,FRAUD - IDENTITY THEFT,SILVER SPRING,12900 BLK  TWO FARM DR,SILVER SPRING,MD,20904.0,MCPD,Other/Unknown,I,3I1,150,12900.0,,TWO FARM,,DR,39.06733,-77.007,3D,"(39.0673, -77.007)"
201263928,2305,190053277,11/05/2019 01:40:27 PM,2019-11-03 18:00:00,11/05/2019 12:00:00 PM,23F,1,Crime Against Property,Theft From Motor Vehicle,LARCENY - FROM AUTO,SILVER SPRING,1200 BLK E WEST HWY,SILVER SPRING,MD,20910.0,MCPD,Parking Garage - Residential,G,3G1,089,1200.0,E,WEST,,HWY,39.12378,-77.2033,3D,"(39.1238, -77.2033)"
201392283,2305,220040051,09/14/2022 08:27:47 PM,2022-09-14 13:30:00,09/14/2022 08:00:00 PM,23F,1,Crime Against Property,Theft From Motor Vehicle,LARCENY - FROM AUTO,WHEATON,11100 BLK  VEIRS MILL RD,SILVER SPRING,MD,20902.0,MCPD,Parking Lot - Commercial,L,4L2,321,11100.0,,VEIRS MILL,,RD,39.03758,-77.0519,4D,"(39.0376, -77.0519)"
201420073,2303,230015379,03/30/2023 04:31:10 PM,2023-03-30 16:31:00,,23C,1,Crime Against Property,Shoplifting,LARCENY - SHOPLIFTING,MONTGOMERY VILLAGE,1  BLK  GRAND CORNER AVE,GAITHERSBURG,MD,20878.0,GPD,Retail - Sporting Goods,P,6P1,549,1.0,,GRAND CORNER,,AVE,39.11801,-77.2004,6D,"(39.118, -77.2004)"
201438119,2902,230047783,08/04/2023 11:39:52 AM,2023-08-04 11:39:00,,290,1,Crime Against Property,Destruction/Damage/Vandalism of Property,DAMAGE PROPERTY - PRIVATE,MONTGOMERY VILLAGE,18700 BLK  WALKERS CHOICE RD,MONTGOMERY VILLAGE,MD,20886.0,MCPD,Parking Lot - Residential,R,6R1,766,18700.0,,WALKERS CHOICE,,RD,39.16202,-77.2047,6D,"(39.162, -77.2047)"
201257062,5404,190044250,09/15/2019 10:51:47 PM,2019-09-15 22:51:00,,90D,1,Crime Against Society,Driving Under the Influence,DRIVING UNDER THE INFLUENCE LIQUOR,GERMANTOWN,,GERMANTOWN,MD,20876.0,MCPD,Street - Other,M,5M3,600,,,RIDGE,,RD,39.30489,-77.1976,5D,"(39.3049, -77.1976)"
201251294,2399,190037509,08/05/2019 06:27:18 PM,2019-08-05 18:27:00,,23H,1,Crime Against Property,All other Larceny,LARCENY (DESCRIBE OFFENSE),GERMANTOWN,12200 BLK  DANCREST DR,CLARKSBURG,MD,20871.0,MCPD,Residence - Single Family,M,5M3,601,12200.0,,DANCREST,,DR,39.24884,-77.2535,5D,"(39.2488, -77.2535)"
201381881,1399,220027456,06/26/2022 12:34:51 AM,2022-06-26 01:00:00,06/26/2022 01:21:00 AM,13B,1,Crime Against Person,Simple Assault,ASSAULT - 2ND DEGREE,MONTGOMERY VILLAGE,9900 BLK  MEDICAL CENTER DR,ROCKVILLE,MD,20850.0,RCPD,Hospital/Emergency Care Center,P,6P1,721,9900.0,,MEDICAL CENTER,,DR,39.09661,-77.1993,6D,"(39.0966, -77.1993)"
201388366,2305,220035286,08/16/2022 10:12:57 AM,2022-08-15 19:00:00,08/16/2022 08:00:00 AM,23F,1,Crime Against Property,Theft From Motor Vehicle,LARCENY - FROM AUTO,BETHESDA,11800 BLK  GRAND PARK AVE,ROCKVILLE,MD,20852.0,MCPD,Parking Garage - Residential,D,2D4,188,11800.0,,GRAND PARK,,AVE,39.049,-77.1169,2D,"(39.049, -77.1169)"
201393217,2304,220041191,09/21/2022 07:53:51 PM,2022-09-16 03:00:00,09/21/2022 06:30:00 PM,23G,1,Crime Against Property,Theft of Motor Vehicle Parts or Accessories,LARCENY - AUTO PARTS,MONTGOMERY VILLAGE,20200 BLK  GRAZING WAY,MONTGOMERY VILLAGE,MD,20886.0,MCPD,Street - Residential,R,6R2,504,20200.0,,GRAZING,,WAY,39.18821,-77.1936,6D,"(39.1882, -77.1936)"
201374477,3562,220018554,05/01/2022 11:34:10 PM,2022-05-02 00:15:00,,35A,1,Crime Against Society,Drug/Narcotic Violations,DRUGS - MARIJUANA - POSSESS,GERMANTOWN,,GERMANTOWN,MD,20874.0,MCPD,Street - In vehicle,N,5N1,702,,,LOCBURY,,DR,39.18587,-77.2658,5D,"(39.1859, -77.2658)"
201271748,2605,190062088,12/25/2019 08:48:45 PM,2019-12-25 20:48:00,,26B,1,Crime Against Property,Credit Card/Automatic Teller Machine Fraud,FRAUD - ILLEGAL USE CREDIT CARDS,SILVER SPRING,3300 BLK  TEAGARDEN CIR,SILVER SPRING,MD,20904.0,MCPD,Residence - Apartment/Condo,I,3I2,380,3300.0,,TEAGARDEN,,CIR,39.08197,-76.9439,3D,"(39.082, -76.9439)"
201390269,1399,220037569,08/30/2022 04:14:35 PM,2022-08-30 13:20:00,,13B,1,Crime Against Person,Simple Assault,ASSAULT - 2ND DEGREE,SILVER SPRING,13600 BLK  ROBEY RD,SILVER SPRING,MD,20904.0,MCPD,School - Elementary/Secondary,I,3I2,380,13600.0,,ROBEY,,RD,39.07943,-76.9452,3D,"(39.0794, -76.9452)"
201362604,2305,220004402,02/01/2022 05:34:52 PM,2022-01-30 00:00:00,02/01/2022 03:00:00 PM,23F,1,Crime Against Property,Theft From Motor Vehicle,LARCENY - FROM AUTO,MONTGOMERY VILLAGE,9800 BLK  WASHINGTONIAN BLV,GAITHERSBURG,MD,20878.0,MCPD,Parking Lot - Commercial,P,6P1,549,9800.0,,WASHINGTONIAN,,BLV,39.11415,-77.197,6D,"(39.1142, -77.197)"
201417016,3601,230011857,03/10/2023 06:51:31 PM,2023-03-10 22:37:00,,11D,2,Crime Against Person,Forcible Fondling,SEX OFFENSE - AGAINST CHILD-FONDLING,WHEATON,12800 BLK  GEORGIA AVE,SILVER SPRING,MD,20906.0,MCPD,Residence - Single Family,K,4K1,351,12800.0,,GEORGIA,,AVE,39.0653,-77.0576,4D,"(39.0653, -77.0576)"
201385317,2399,220031611,07/22/2022 05:42:53 PM,2022-07-22 20:56:00,,23H,1,Crime Against Property,All other Larceny,LARCENY (DESCRIBE OFFENSE),BETHESDA,8400 BLK  CHEVY CHASE LAKE TER,CHEVY CHASE,,20815.0,MCPD,Residence - Apartment/Condo,D,2D1,038,8400.0,,CHEVY CHASE LAKE,,TER,38.99419,-77.0752,2D,"(38.9942, -77.0752)"
201301158,2305,200035065,09/07/2020 05:23:29 PM,2020-09-06 20:00:00,09/07/2020 02:00:00 PM,23F,1,Crime Against Property,Theft From Motor Vehicle,LARCENY - FROM AUTO,BETHESDA,9700 BLK  HILLRIDGE DR,KENSINGTON,MD,20895.0,MCPD,Residence - Driveway,D,2D3,178,9700.0,,HILLRIDGE,,DR,39.01539,-77.0687,2D,"(39.0154, -77.0687)"
201287591,2305,200019124,05/11/2020 08:42:53 PM,2020-05-09 02:00:00,05/09/2020 12:00:00 PM,23F,1,Crime Against Property,Theft From Motor Vehicle,LARCENY - FROM AUTO,WHEATON,2600 BLK  TABIONA CIR,SILVER SPRING,MD,20906.0,MCPD,Street - In vehicle,K,4K1,531,2600.0,,TABIONA,,CIR,39.10158,-77.0534,4D,"(39.1016, -77.0534)"
201332410,3550,210020145,05/28/2021 01:12:57 AM,2021-05-28 01:12:00,,35B,1,Crime Against Society,Drug Equipment Violations,DRUGS - NARCOTIC EQUIP - POSSESS,MONTGOMERY VILLAGE,18200 BLK  LOST KNIFE CIR,MONTGOMERY VILLAGE,MD,20886.0,GPD,Street - In vehicle,R,6R1,505,18200.0,,LOST KNIFE,,CIR,39.15711,-77.2033,6D,"(39.1571, -77.2033)"
201252302,2303,190038617,08/13/2019 12:11:13 PM,2019-08-11 17:44:00,08/11/2019 05:46:00 PM,23C,1,Crime Against Property,Shoplifting,LARCENY - SHOPLIFTING,BETHESDA,7100 BLK  DEMOCRACY BLV,BETHESDA,MD,20817.0,MCPD,Retail - Beauty/Barber Shop,E,2E3,204,7100.0,,DEMOCRACY,,BLV,39.02207,-77.1473,2D,"(39.0221, -77.1473)"
201354271,1201,210047586,11/23/2021 11:17:19 AM,2021-11-23 11:17:00,,120,1,Crime Against Property,Robbery,ROBBERY - BUSINESS-GUN,BETHESDA,5200 BLK  RANDOLPH RD,ROCKVILLE,MD,20852.0,MCPD,Restaurant,D,2D4,523,5200.0,,RANDOLPH,,RD,39.05361,-77.103,2D,"(39.0536, -77.103)"
201425370,2303,230021755,05/06/2023 09:03:13 PM,2023-05-06 20:45:00,,23C,1,Crime Against Property,Shoplifting,LARCENY - SHOPLIFTING,GERMANTOWN,12100 BLK  SNOWDEN FARM PKW,CLARKSBURG,MD,20871.0,MCPD,Convenience Store,M,5M3,476,12100.0,,SNOWDEN FARM,,PKW,39.22898,-77.2514,5D,"(39.229, -77.2514)"
201350567,2902,210042876,10/25/2021 03:38:53 AM,2021-10-25 03:38:00,,290,1,Crime Against Property,Destruction/Damage/Vandalism of Property,DAMAGE PROPERTY - PRIVATE,SILVER SPRING,8200 BLK  GEORGIA AVE,SILVER SPRING,MD,20910.0,MCPD,Parking Lot - Commercial,G,3G1,094,8200.0,,GEORGIA,,AVE,38.99163,-77.0266,3D,"(38.9916, -77.0266)"
201414326,2305,230008684,02/21/2023 06:37:30 AM,2023-02-21 05:40:00,02/21/2023 05:42:00 AM,23F,1,Crime Against Property,Theft From Motor Vehicle,LARCENY - FROM AUTO,WHEATON,13700 BLK  FLINT ROCK RD,ROCKVILLE,MD,20853.0,MCPD,Residence - Driveway,K,4K2,340,13700.0,,FLINT ROCK,,RD,39.08065,-77.0971,4D,"(39.0806, -77.0971)"
201234383,2902,190016371,04/08/2019 07:13:29 PM,2019-04-08 13:00:00,04/08/2019 05:00:00 PM,290,1,Crime Against Property,Destruction/Damage/Vandalism of Property,DAMAGE PROPERTY - PRIVATE,GERMANTOWN,23500 BLK  WOODFIELD RD,GAITHERSBURG,MD,20882.0,MCPD,Residence - Yard,M,5M2,627,23500.0,,WOODFIELD,,RD,39.24203,-77.1834,5D,"(39.242, -77.1834)"
201259257,2202,190047396,10/03/2019 09:35:14 AM,2019-10-03 12:00:00,10/03/2019 08:39:00 AM,220,1,Crime Against Property,Burglary/Breaking and Entering,BURGLARY - FORCED ENTRY-RESIDENTIAL,BETHESDA,5700 BLK  LUXEMBURG ST,ROCKVILLE,MD,20852.0,MCPD,Residence - Apartment/Condo,D,2D4,190,5700.0,,LUXEMBURG,,ST,39.02965,-77.1157,2D,"(39.0296, -77.1157)"
201447194,2601,230058932,10/06/2023 01:38:26 PM,2023-10-05 17:00:00,10/05/2023 05:30:00 PM,26A,1,Crime Against Property,False Pretenses/Swindle/Confidence Game,FRAUD - CONFIDENCE GAME,ROCKVILLE,200 BLK  CRABB AVE,ROCKVILLE,MD,20850.0,RCPD,Other/Unknown,A,1A3,283,200.0,,CRABB,,AVE,0.0,0.0,1D,"(0.0, 0.0)"
201364711,1114,220006978,02/17/2022 01:06:22 PM,2021-09-01 00:01:00,02/10/2022 11:59:00 PM,11B,1,Crime Against Person,Forcible Sodomy,SEX ASSAULT - SODOMY-GIRL-STRONG-ARM,GERMANTOWN,13700 BLK  LITTLE SENECA PKW,CLARKSBURG,MD,20871.0,MCPD,Residence - Single Family,N,5N3,466,13700.0,,LITTLE SENECA,,PKW,39.21657,-77.283,5D,"(39.2166, -77.283)"
201321032,2610,210007209,02/25/2021 10:01:21 AM,2021-02-24 11:20:00,,26F,1,Crime Against Property,Identity Theft,FRAUD - IDENTITY THEFT,MONTGOMERY VILLAGE,9300 BLK  WEATHERVANE PL,MONTGOMERY VILLAGE,MD,20886.0,MCPD,Other/Unknown,R,6R2,504,9300.0,,WEATHERVANE,,PL,39.18235,-77.1913,6D,"(39.1824, -77.1913)"
201393071,2305,220041053,09/21/2022 03:53:35 AM,2022-09-20 20:00:00,09/21/2022 03:00:00 AM,23F,1,Crime Against Property,Theft From Motor Vehicle,LARCENY - FROM AUTO,SILVER SPRING,8600 BLK  MANCHESTER RD,SILVER SPRING,MD,20901.0,MCPD,Parking Lot - Residential,H,3H1,126,8600.0,,MANCHESTER,,RD,38.99837,-77.0069,3D,"(38.9984, -77.0069)"
201409081,1399,220039783,09/13/2022 01:42:52 PM,2022-09-13 13:30:00,09/14/2022 12:00:00 PM,13B,1,Crime Against Person,Simple Assault,ASSAULT - 2ND DEGREE,SILVER SPRING,200 BLK  VALLEY BROOK DR,SILVER SPRING,MD,20904.0,MCPD,School - Elementary/Secondary,I,3I1,150,200.0,,VALLEY BROOK,,DR,39.05932,-77.0064,3D,"(39.0593, -77.0064)"
201263758,2399,190053179,11/04/2019 10:00:03 PM,2019-11-04 22:00:00,11/04/2019 10:00:00 PM,23H,1,Crime Against Property,All other Larceny,LARCENY (DESCRIBE OFFENSE),ROCKVILLE,1700 BLK  CHAPMAN AVE,ROCKVILLE,MD,20852.0,RCPD,Street - Bus Stop,A,1A1,272,1700.0,,CHAPMAN,,AVE,39.06198,-77.1217,1D,"(39.062, -77.1217)"
201406594,2902,220057572,12/28/2022 04:34:44 PM,2022-12-27 16:00:00,12/28/2022 02:30:00 PM,290,1,Crime Against Property,Destruction/Damage/Vandalism of Property,DAMAGE PROPERTY - PRIVATE,BETHESDA,10600 BLK  WEYMOUTH ST,BETHESDA,MD,20814.0,MCPD,Parking Lot - Residential,D,2D4,185,10600.0,,WEYMOUTH,,ST,39.02854,-77.0963,2D,"(39.0285, -77.0963)"
201344800,2399,210035477,09/09/2021 04:01:13 PM,2021-09-09 16:01:00,,23H,1,Crime Against Property,All other Larceny,LARCENY (DESCRIBE OFFENSE),BETHESDA,11300 BLK  WOODGLEN DR,ROCKVILLE,MD,20852.0,MCPD,Street - Bus Stop,D,2D4,189,11300.0,,WOODGLEN,,DR,39.0418,-77.1132,2D,"(39.0418, -77.1132)"
201367971,2303,220010555,03/11/2022 03:57:00 PM,2022-03-11 15:50:00,,23C,1,Crime Against Property,Shoplifting,LARCENY - SHOPLIFTING,GERMANTOWN,20900 BLK  FREDERICK RD,GERMANTOWN,MD,20876.0,MCPD,Retail - Department/Discount Store,M,5M1,701,20900.0,,FREDERICK,,RD,39.19829,-77.2448,5D,"(39.1983, -77.2448)"
201333545,2399,210021437,06/06/2021 12:09:11 AM,2021-06-06 00:49:00,,23H,1,Crime Against Property,All other Larceny,LARCENY (DESCRIBE OFFENSE),MONTGOMERY VILLAGE,100 BLK E DIAMOND AVE,GAITHERSBURG,MD,20877.0,GPD,Bar/Night Club,P,6P3,431,100.0,E,DIAMOND,,AVE,39.14184,-77.1964,6D,"(39.1418, -77.1964)"
201386845,2303,220033152,08/02/2022 12:59:32 PM,2022-07-19 13:10:00,07/19/2022 01:15:00 PM,23C,1,Crime Against Property,Shoplifting,LARCENY - SHOPLIFTING,MONTGOMERY VILLAGE,1  BLK  MARKET ST,GAITHERSBURG,MD,20878.0,GPD,Retail - Hardware,P,6P2,450,1.0,,MARKET,,ST,39.12411,-77.235,6D,"(39.1241, -77.235)"
201231729,2305,190013194,03/22/2019 11:42:36 AM,2019-03-21 19:00:00,03/22/2019 09:00:00 AM,23F,1,Crime Against Property,Theft From Motor Vehicle,LARCENY - FROM AUTO,BETHESDA,6700 BLK  EAST AVE,CHEVY CHASE,MD,20815.0,MCPD,Street - Residential,D,2D2,014,6700.0,,EAST,,AVE,38.97714,-77.0866,2D,"(38.9771, -77.0866)"
201311368,2602,200046868,11/27/2020 06:27:06 PM,2020-12-01 23:04:00,,26A,1,Crime Against Property,False Pretenses/Swindle/Confidence Game,FRAUD - SWINDLE,GERMANTOWN,8000 BLK  HILTON RD,GAITHERSBURG,MD,20882.0,MCPD,Residence - Single Family,M,5M2,617,8000.0,,HILTON,,RD,39.2555,-77.1655,5D,"(39.2555, -77.1655)"
201326975,2902,210013520,04/11/2021 02:14:01 PM,2021-04-10 13:00:00,04/11/2021 01:40:00 PM,290,1,Crime Against Property,Destruction/Damage/Vandalism of Property,DAMAGE PROPERTY - PRIVATE,MONTGOMERY VILLAGE,20000 BLK  LUMARYN PL,MONTGOMERY VILLAGE,MD,20886.0,MCPD,Residence -Townhouse/Duplex,R,6R2,504,20000.0,,LUMARYN,,PL,39.18481,-77.1932,6D,"(39.1848, -77.1932)"
201409413,1313,220056957,,2022-12-22 16:29:00,,13B,1,Crime Against Person,Simple Assault,ASSAULT - SIMPLE,BETHESDA,6400 BLK  ELMWOOD RD,CHEVY CHASE,,20815.0,MCPD,Residence - Single Family,E,2E1,023,6400.0,,ELMWOOD,,RD,38.9729,-77.105,2D,"(38.9729, -77.105)"
201380198,3562,220025420,06/13/2022 03:54:46 PM,2022-06-13 15:55:00,,35A,1,Crime Against Society,Drug/Narcotic Violations,DRUGS - MARIJUANA - POSSESS,WHEATON,11700 BLK  GEORGIA AVE,SILVER SPRING,MD,20902.0,MCPD,Parking Lot - Rec Center,L,4L1,364,11700.0,,GEORGIA,,AVE,39.04713,-77.052,4D,"(39.0471, -77.052)"
201366273,2399,220008702,02/28/2022 06:09:43 PM,2022-02-28 03:00:00,,23H,1,Crime Against Property,All other Larceny,LARCENY (DESCRIBE OFFENSE),SILVER SPRING,8200 BLK  GEORGIA AVE,SILVER SPRING,MD,20910.0,MCPD,Street - Commercial,G,3G1,093,8200.0,,GEORGIA,,AVE,38.99163,-77.0266,3D,"(38.9916, -77.0266)"
201287962,2404,200019506,05/15/2020 05:12:54 AM,2020-05-11 23:30:00,05/14/2020 11:00:00 PM,240,1,Crime Against Property,Motor Vehicle Theft,AUTO THEFT - VEHICLE THEFT,SILVER SPRING,1600 BLK  APRIL LA,SILVER SPRING,MD,20904.0,MCPD,Street - Residential,I,3I1,145,1600.0,,APRIL,,LA,39.04591,-76.9792,3D,"(39.0459, -76.9792)"
201387054,2399,220033712,08/05/2022 08:51:28 PM,2022-07-27 14:58:00,,23H,1,Crime Against Property,All other Larceny,LARCENY (DESCRIBE OFFENSE),SILVER SPRING,8800 BLK  COLESVILLE RD,SILVER SPRING,MD,20910.0,MCPD,Residence - Apartment/Condo,G,3G2,118,8800.0,,COLESVILLE,,RD,38.999,-77.0261,3D,"(38.999, -77.0261)"
201338876,2305,210028197,07/21/2021 11:25:10 AM,2021-07-20 20:00:00,07/21/2021 11:00:00 AM,23F,1,Crime Against Property,Theft From Motor Vehicle,LARCENY - FROM AUTO,GERMANTOWN,11400 BLK  APPLEGRATH WAY,GERMANTOWN,MD,20876.0,MCPD,Street - Residential,M,5M1,471,11400.0,,APPLEGRATH,,WAY,39.18895,-77.2377,5D,"(39.1889, -77.2377)"
201308563,2305,200043959,11/07/2020 01:46:37 PM,2020-11-06 20:00:00,11/07/2020 01:00:00 PM,23F,1,Crime Against Property,Theft From Motor Vehicle,LARCENY - FROM AUTO,ROCKVILLE,600 BLK  DENHAM RD,ROCKVILLE,MD,20851.0,RCPD,Street - Residential,A,1A2,288,600.0,,DENHAM,,RD,39.08439,-77.1345,1D,"(39.0844, -77.1345)"
201232537,1399,190014251,03/27/2019 09:28:30 PM,2019-03-27 17:10:00,,13B,1,Crime Against Person,Simple Assault,ASSAULT - 2ND DEGREE,ROCKVILLE,1  BLK  MARYLAND AVE,ROCKVILLE,MD,20850.0,MCPD,Library,A,1A3,277,1.0,,MARYLAND,,AVE,39.14486,-77.2027,1D,"(39.1449, -77.2027)"
201230786,1399,190012142,03/16/2019 07:20:32 AM,2019-03-16 06:30:00,,13B,1,Crime Against Person,Simple Assault,ASSAULT - 2ND DEGREE,MONTGOMERY VILLAGE,18300 BLK  LOST KNIFE CIR,MONTGOMERY VILLAGE,,20886.0,MCPD,Residence - Apartment/Condo,R,6R1,505,18300.0,,LOST KNIFE,,CIR,39.15801,-77.202,6D,"(39.158, -77.202)"
201407676,2305,230000818,01/05/2023 09:17:49 PM,2023-01-05 19:00:00,01/05/2023 09:00:00 PM,23F,1,Crime Against Property,Theft From Motor Vehicle,LARCENY - FROM AUTO,WHEATON,11300 BLK  GRANDVIEW AVE,SILVER SPRING,MD,20902.0,MCPD,Street - Commercial,L,4L2,324,11300.0,,GRANDVIEW,,AVE,39.04009,-77.0526,4D,"(39.0401, -77.0526)"
201335215,2203,210023611,06/20/2021 01:39:50 PM,2021-06-20 03:58:00,,220,1,Crime Against Property,Burglary/Breaking and Entering,BURGLARY - FORCED ENTRY-NONRESIDENTIAL,MONTGOMERY VILLAGE,300 BLK  MAIN ST,GAITHERSBURG,MD,20878.0,MCPD,Commercial - Office Building,P,6P2,450,300.0,,MAIN,,ST,39.12206,-77.2386,6D,"(39.1221, -77.2386)"
201287577,5311,200019117,05/11/2020 07:56:44 PM,2020-05-11 19:57:00,05/11/2020 08:00:00 PM,90C,1,Crime Against Society,Disorderly Conduct,PUBLIC PEACE - DISORDERLY CONDUCT,WHEATON,,SILVER SPRING,MD,20906.0,MCPD,Street - Other,K,4K1,350,,,LAYHILL,,RD,39.0637,-77.0498,4D,"(39.0637, -77.0498)"
201397668,2303,220046720,10/24/2022 08:31:43 PM,2022-10-24 20:31:00,,23C,1,Crime Against Property,Shoplifting,LARCENY - SHOPLIFTING,WHEATON,18000 BLK  GEORGIA AVE,OLNEY,MD,20832.0,MCPD,Gas Station,J,4J2,399,18000.0,,GEORGIA,,AVE,39.15129,-77.0668,4D,"(39.1513, -77.0668)"
201354463,1399,210047856,11/24/2021 07:13:46 PM,2021-11-24 18:50:00,11/24/2021 07:13:00 PM,13B,1,Crime Against Person,Simple Assault,ASSAULT - 2ND DEGREE,MONTGOMERY VILLAGE,1  BLK  SCHOOL DR,GAITHERSBURG,MD,20878.0,GPD,Residence - Apartment/Condo,P,6P1,442,1.0,,SCHOOL,,DR,39.11771,-77.2165,6D,"(39.1177, -77.2165)"
201410005,3504,230003625,01/22/2023 09:31:40 PM,2023-01-22 21:37:00,,35A,1,Crime Against Society,Drug/Narcotic Violations,DRUGS - HALLUCINOGEN - POSSESS,GERMANTOWN,1  BLK  ROSEBAY CT,GERMANTOWN,MD,20874.0,MCPD,Street - In vehicle,N,5N1,465,1.0,,ROSEBAY,,CT,39.19909,-77.2713,5D,"(39.1991, -77.2713)"
201318018,2902,210003656,01/29/2021 07:40:55 AM,2021-01-28 21:00:00,01/29/2021 12:00:00 AM,290,1,Crime Against Property,Destruction/Damage/Vandalism of Property,DAMAGE PROPERTY - PRIVATE,SILVER SPRING,8700 BLK  ARLISS ST,SILVER SPRING,MD,20901.0,MCPD,Parking Lot - Residential,H,3H1,127,8700.0,,ARLISS,,ST,38.99857,-77.0011,3D,"(38.9986, -77.0011)"
201391267,2305,220038834,09/07/2022 12:12:32 PM,2022-09-06 20:30:00,09/07/2022 12:00:00 PM,23F,1,Crime Against Property,Theft From Motor Vehicle,LARCENY - FROM AUTO,SILVER SPRING,100 BLK  UNIVERSITY BLV,SILVER SPRING,MD,20901.0,MCPD,Street - In vehicle,H,3H2,157,100.0,,UNIVERSITY,,BLV,39.02006,-77.0136,3D,"(39.0201, -77.0136)"
201222327,4104,190001301,01/08/2019 06:24:27 PM,2019-01-08 18:24:00,,90G,1,Crime Against Society,Liquor Law Violations,LIQUOR - POSSESS,ROCKVILLE,,ROCKVILLE,MD,20850.0,MCPD,Street - In vehicle,A,1A4,281,,,SOUTHLAWN,,LA,39.10394,-77.1343,1D,"(39.1039, -77.1343)"
201343099,2305,210033398,08/26/2021 10:27:29 PM,2021-08-26 19:00:00,08/26/2021 08:30:00 PM,23F,1,Crime Against Property,Theft From Motor Vehicle,LARCENY - FROM AUTO,SILVER SPRING,8500 BLK  CAMERON ST,SILVER SPRING,MD,20910.0,MCPD,Parking Garage - County,G,3G1,095,8500.0,,CAMERON,,ST,38.99637,-77.0311,3D,"(38.9964, -77.0311)"
201346682,1399,210037946,09/25/2021 11:10:48 AM,2021-09-25 11:10:00,,13B,1,Crime Against Person,Simple Assault,ASSAULT - 2ND DEGREE,SILVER SPRING,8600 BLK  2ND AVE,SILVER SPRING,MD,20910.0,MCPD,Residence - Apartment/Condo,G,3G1,095,8600.0,,2ND,,AVE,38.99666,-77.0332,3D,"(38.9967, -77.0332)"
201267977,2699,190058373,12/04/2019 10:13:52 AM,2019-12-04 10:13:00,,26A,1,Crime Against Property,False Pretenses/Swindle/Confidence Game,FRAUD (DESCRIBE OFFENSE),GERMANTOWN,21000 BLK  SCOTTSBURY DR,GERMANTOWN,MD,20876.0,MCPD,Other/Unknown,M,5M1,472,21000.0,,SCOTTSBURY,,DR,39.20205,-77.2411,5D,"(39.2021, -77.2411)"
201389663,3522,220036843,08/26/2022 02:00:36 AM,2022-08-26 02:00:00,,35A,1,Crime Against Society,Drug/Narcotic Violations,DRUGS - OPIUM OR DERIVATIVE - POSSESS,MONTGOMERY VILLAGE,500 BLK  QUINCE ORCHARD RD,GAITHERSBURG,MD,20878.0,GPD,Gas Station,P,6P2,445,500.0,,QUINCE ORCHARD,,RD,39.14541,-77.2199,6D,"(39.1454, -77.2199)"
201390065,2305,220037171,08/28/2022 08:34:39 AM,2022-08-27 20:00:00,08/28/2022 08:00:00 AM,23F,1,Crime Against Property,Theft From Motor Vehicle,LARCENY - FROM AUTO,SILVER SPRING,8400 BLK  10TH AVE,SILVER SPRING,MD,20903.0,MCPD,Street - Residential,H,3H1,132,8400.0,,10TH,,AVE,38.99376,-76.9911,3D,"(38.9938, -76.9911)"
201366340,2304,220008616,02/28/2022 11:05:23 AM,2022-02-10 12:00:00,02/28/2022 08:00:00 AM,23G,1,Crime Against Property,Theft of Motor Vehicle Parts or Accessories,LARCENY - AUTO PARTS,ROCKVILLE,7300 BLK  CALHOUN PL,DERWOOD,MD,20855.0,MCPD,Parking Lot - Commercial,A,1A4,281,7300.0,,CALHOUN,,PL,39.10793,-77.148,1D,"(39.1079, -77.148)"
201391520,4099,220039118,09/08/2022 10:44:35 PM,2022-09-08 22:44:00,,40B,1,Crime Against Society,Assisting or Promoting Prostitution,COMM SEX OFF (DESCRIBE OFFENSE),SILVER SPRING,300 BLK  WILLIAMSBURG DR,SILVER SPRING,MD,20901.0,MCPD,Residence - Single Family,H,3H2,153,300.0,,WILLIAMSBURG,,DR,39.01962,-77.0031,3D,"(39.0196, -77.0031)"
201299242,3532,200032764,08/22/2020 02:52:43 AM,2020-08-22 02:47:00,,35A,1,Crime Against Society,Drug/Narcotic Violations,DRUGS - COCAINE - POSSESS,MONTGOMERY VILLAGE,400 BLK N SUMMIT AVE,GAITHERSBURG,MD,20877.0,GPD,Residence - Apartment/Condo,P,6P3,419,400.0,N,SUMMIT,,AVE,39.14823,-77.1931,6D,"(39.1482, -77.1931)"
201367613,3542,220010235,03/09/2022 09:04:38 PM,2022-03-09 21:00:00,03/09/2022 11:45:00 PM,35A,1,Crime Against Society,Drug/Narcotic Violations,DRUGS - SYNTHETIC NARCOTIC - POSSESS,GERMANTOWN,21000 BLK  HENDERSON CORNER RD,GERMANTOWN,MD,20876.0,MCPD,Street - In vehicle,M,5M3,473,21000.0,,HENDERSON CORNER,,RD,39.20236,-77.2455,5D,"(39.2024, -77.2455)"
201249269,1399,190035027,07/23/2019 05:02:47 PM,2019-07-23 17:02:00,,13B,2,Crime Against Person,Simple Assault,ASSAULT - 2ND DEGREE,SILVER SPRING,8500 BLK  GEORGIA AVE,SILVER SPRING,MD,20910.0,MCPD,Parking Lot - Commercial,G,3G1,109,8500.0,,GEORGIA,,AVE,38.99454,-77.0268,3D,"(38.9945, -77.0268)"
201282731,2305,200013520,03/21/2020 01:20:55 PM,2020-03-20 18:00:00,03/21/2020 12:00:00 PM,23F,1,Crime Against Property,Theft From Motor Vehicle,LARCENY - FROM AUTO,GERMANTOWN,,GERMANTOWN,MD,20874.0,MCPD,Parking Lot - Residential,N,5N1,465,,,LARENTIA,,DR,39.18147,-77.2782,5D,"(39.1815, -77.2782)"
201440096,2099,230050170,08/18/2023 07:02:17 PM,2023-08-18 19:02:00,,200,1,Crime Against Property,Arson,ARSON (DESCRIBE OFFENSE),SILVER SPRING,800 BLK  WAYNE AVE,SILVER SPRING,MD,20910.0,MCPD,Convenience Store,G,3G1,671,800.0,,WAYNE,,AVE,38.99717,-77.0218,3D,"(38.9972, -77.0218)"
201407974,5311,230001041,01/07/2023 10:14:01 AM,2023-01-07 10:14:00,,90C,1,Crime Against Society,Disorderly Conduct,PUBLIC PEACE - DISORDERLY CONDUCT,SILVER SPRING,8600 BLK  GEORGIA AVE,SILVER SPRING,MD,20910.0,MCPD,Gas Station,G,3G1,095,8600.0,,GEORGIA,,AVE,38.99602,-77.0281,3D,"(38.996, -77.0281)"
201320844,2305,210006982,02/23/2021 04:30:19 PM,2021-02-22 20:30:00,02/22/2021 04:00:00 PM,23F,1,Crime Against Property,Theft From Motor Vehicle,LARCENY - FROM AUTO,BETHESDA,1  BLK  SHAGBARK CT,ROCKVILLE,MD,20852.0,MCPD,Parking Lot - Residential,E,2E3,200,1.0,,SHAGBARK,,CT,39.05145,-77.1298,2D,"(39.0515, -77.1298)"
201384086,2304,220030082,07/13/2022 01:19:39 PM,2022-07-12 21:00:00,07/13/2022 10:30:00 AM,23G,1,Crime Against Property,Theft of Motor Vehicle Parts or Accessories,LARCENY - AUTO PARTS,WHEATON,800 BLK  HORTON DR,SILVER SPRING,MD,20902.0,MCPD,Street - Residential,L,4L1,535,800.0,,HORTON,,DR,39.04478,-77.0242,4D,"(39.0448, -77.0242)"
201392157,2305,220039900,09/14/2022 07:38:50 AM,2022-09-13 20:30:00,09/14/2022 07:15:00 AM,23F,1,Crime Against Property,Theft From Motor Vehicle,LARCENY - FROM AUTO,ROCKVILLE,100 BLK  ELMCROFT SQ,ROCKVILLE,MD,20850.0,RCPD,Residence - Driveway,A,1A3,439,100.0,,ELMCROFT,,SQ,39.11451,-77.1692,1D,"(39.1145, -77.1692)"
201382392,5707,220028058,06/29/2022 11:08:29 PM,2022-06-29 23:08:00,,90J,1,Crime Against Society,Trespass of Real Property,TRESPASSING,BETHESDA,9300 BLK  WADSWORTH DR,BETHESDA,MD,20817.0,MCPD,School - Elementary/Secondary,E,2E2,068,9300.0,,WADSWORTH,,DR,39.00844,-77.1275,2D,"(39.0084, -77.1275)"
201320401,2399,210006473,02/19/2021 01:38:02 PM,2021-02-18 07:30:00,02/18/2021 04:30:00 PM,23H,1,Crime Against Property,All other Larceny,LARCENY (DESCRIBE OFFENSE),WHEATON,2000 BLK  RANDOLPH RD,SILVER SPRING,MD,20902.0,MCPD,Residence - Apartment/Condo,J,4J1,368,2000.0,,RANDOLPH,,RD,39.06247,-77.0419,4D,"(39.0625, -77.0419)"
201371442,2601,220014676,04/06/2022 03:43:39 PM,2022-04-06 12:39:00,04/06/2022 03:43:00 PM,26A,1,Crime Against Property,False Pretenses/Swindle/Confidence Game,FRAUD - CONFIDENCE GAME,SILVER SPRING,100 BLK  UNIVERSITY BLV W,SILVER SPRING,MD,20901.0,MCPD,Other/Unknown,H,3H2,160,100.0,,UNIVERSITY,W,BLV,39.02006,-77.0136,3D,"(39.0201, -77.0136)"
201269532,2902,190060245,12/14/2019 06:35:33 AM,2019-12-14 06:35:00,12/14/2019 07:00:00 AM,290,1,Crime Against Property,Destruction/Damage/Vandalism of Property,DAMAGE PROPERTY - PRIVATE,WHEATON,400 BLK  HANNES ST,SILVER SPRING,MD,20901.0,MCPD,Street - Residential,L,4L2,158,400.0,,HANNES,,ST,39.03179,-77.0203,4D,"(39.0318, -77.0203)"
201249988,2305,190035937,07/28/2019 10:56:22 AM,2019-07-26 21:00:00,07/27/2019 12:00:00 PM,23F,1,Crime Against Property,Theft From Motor Vehicle,LARCENY - FROM AUTO,MONTGOMERY VILLAGE,500 BLK  BROWN ST,WASHINGTON GROVE,MD,20880.0,MCPD,Residence - Driveway,P,6P3,418,500.0,,BROWN,,ST,39.1356,-77.1738,6D,"(39.1356, -77.1738)"
201237081,2903,190018966,04/23/2019 09:31:46 AM,2019-04-19 21:00:00,04/22/2019 08:47:00 AM,290,1,Crime Against Property,Destruction/Damage/Vandalism of Property,DAMAGE PROPERTY - PUBLIC,SILVER SPRING,1  BLK  UNIVERSITY BLV E,SILVER SPRING,MD,20901.0,MCPD,School/College - DO NOT USE,H,3H2,156,1.0,,UNIVERSITY,E,BLV,39.02037,-77.0127,3D,"(39.0204, -77.0127)"
201388792,2303,220035815,08/19/2022 11:47:41 AM,2022-08-18 21:16:00,08/18/2022 09:21:00 PM,23C,1,Crime Against Property,Shoplifting,LARCENY - SHOPLIFTING,BETHESDA,3700 BLK  UNIVERSITY BLV,KENSINGTON,MD,20895.0,MCPD,Retail - Drug Store/Pharmacy,D,2D3,314,3700.0,,UNIVERSITY,,BLV,39.03314,-77.0732,2D,"(39.0331, -77.0732)"
201268598,2401,190059074,12/07/2019 04:57:15 PM,2019-12-06 00:00:00,12/07/2019 12:00:00 AM,240,1,Crime Against Property,Motor Vehicle Theft,AUTO THEFT - THEFT AND SALE VEHICLE,SILVER SPRING,3600 BLK  TURBRIDGE DR,BURTONSVILLE,MD,20866.0,MCPD,Parking Lot - Other,I,3I2,380,3600.0,,TURBRIDGE,,DR,39.09351,-76.9361,3D,"(39.0935, -76.9361)"
201250625,2308,190036725,08/01/2019 03:40:13 PM,2019-08-01 13:00:00,08/01/2019 02:24:00 PM,23D,1,Crime Against Property,Theft from Building,LARCENY - FROM BLDG,ROCKVILLE,700 BLK  HUNGERFORD DR,ROCKVILLE,MD,20850.0,RCPD,Doctor/Dentist/Vet Office,A,1A3,278,700.0,,HUNGERFORD,,DR,39.09308,-77.1534,1D,"(39.0931, -77.1534)"
201239115,3562,190022417,05/12/2019 06:35:28 PM,2019-05-12 20:54:00,,35A,1,Crime Against Society,Drug/Narcotic Violations,DRUGS - MARIJUANA - POSSESS,MONTGOMERY VILLAGE,200 BLK  ODEND HAL AVE,GAITHERSBURG,MD,20877.0,MCPD,Street - In vehicle,R,6R1,548,200.0,,ODEND HAL,,AVE,39.15237,-77.1983,6D,"(39.1524, -77.1983)"
201255354,2308,190042358,09/04/2019 02:34:53 PM,2019-09-03 19:33:00,09/03/2019 10:00:00 PM,23D,1,Crime Against Property,Theft from Building,LARCENY - FROM BLDG,BETHESDA,1700 BLK E WEST HWY,SILVER SPRING,MD,20910.0,MCPD,Residence - Other,D,2D1,517,1700.0,E,WEST,,HWY,0.0,0.0,2D,"(0.0, 0.0)"
201222208,2305,190001270,01/08/2019 03:24:44 PM,2019-01-08 15:24:00,,23F,1,Crime Against Property,Theft From Motor Vehicle,LARCENY - FROM AUTO,SILVER SPRING,200 BLK  CRESTMOOR CIR,SILVER SPRING,MD,20901.0,MCPD,Street - Residential,H,3H2,154,200.0,,CRESTMOOR,,CIR,39.02322,-77.0064,3D,"(39.0232, -77.0064)"
201256790,2999,190044282,09/16/2019 09:04:16 AM,2019-09-14 20:00:00,09/16/2019 08:30:00 AM,290,1,Crime Against Property,Destruction/Damage/Vandalism of Property,DAMAGE PROPERTY (DESCRIBE OFFENSE),ROCKVILLE,1500 BLK  ROCKVILLE PIK,ROCKVILLE,MD,20852.0,RCPD,Retail - Other,A,1A1,273,1500.0,,ROCKVILLE,,PIK,39.0651,-77.1266,1D,"(39.0651, -77.1266)"
201447346,2999,230059137,,2023-09-29 15:00:00,09/29/2023 03:00:00 PM,290,1,Crime Against Property,Destruction/Damage/Vandalism of Property,DAMAGE PROPERTY (DESCRIBE OFFENSE),SILVER SPRING,1000 BLK  MILESTONE DR,SILVER SPRING,,20904.0,MCPD,Parking Lot - County,I,3I1,148,1000.0,,MILESTONE,,DR,39.0456,-76.9919,3D,"(39.0456, -76.9919)"
201236130,2506,190018576,04/20/2019 08:32:28 PM,2019-04-20 20:32:00,,250,1,Crime Against Property,Counterfeiting/Forgery,FORGERY - POSSESS FORGED,WHEATON,11100 BLK  VEIRS MILL RD,SILVER SPRING,MD,20902.0,MCPD,Street - Commercial,L,4L2,324,11100.0,,VEIRS MILL,,RD,39.03758,-77.0519,4D,"(39.0376, -77.0519)"
201247160,5404,190031829,07/04/2019 03:25:26 AM,2019-07-04 03:25:00,,90D,1,Crime Against Society,Driving Under the Influence,DRIVING UNDER THE INFLUENCE LIQUOR,SILVER SPRING,,SILVER SPRING,MD,20903.0,MCPD,Street - In vehicle,H,3H2,136,,,OAKVIEW,,DR,39.01562,-76.9816,3D,"(39.0156, -76.9816)"
201300279,5202,200033964,08/30/2020 10:25:11 PM,2020-08-30 22:25:00,,520,1,Crime Against Society,Weapon Law Violations,WEAPON - CONCEALED,SILVER SPRING,600 BLK  RAY DR,SILVER SPRING,MD,20910.0,MCPD,Residence - Single Family,G,3G1,112,600.0,,RAY,,DR,38.98549,-77.0142,3D,"(38.9855, -77.0142)"
201438628,2305,230048348,08/08/2023 09:03:06 AM,2023-08-08 04:51:00,08/08/2023 12:00:00 AM,23F,1,Crime Against Property,Theft From Motor Vehicle,LARCENY - FROM AUTO,TAKOMA PARK,6700 BLK  POPLAR AVE,TAKOMA PARK,MD,20912.0,TPPD,Street - Residential,T,8T1,802,6700.0,,POPLAR,,AVE,38.97178,-77.0022,TPPD,"(38.9718, -77.0022)"
201419108,1399,230014272,03/24/2023 01:18:35 PM,2023-03-24 13:18:00,,13B,1,Crime Against Person,Simple Assault,ASSAULT - 2ND DEGREE,SILVER SPRING,8600 BLK  COLESVILLE RD,SILVER SPRING,MD,20910.0,MCPD,Retail - Jewelry,G,3G1,109,8600.0,,COLESVILLE,,RD,38.99602,-77.0281,3D,"(38.996, -77.0281)"
201315778,1399,210001077,01/09/2021 12:11:50 PM,2021-01-09 12:11:00,,13B,1,Crime Against Person,Simple Assault,ASSAULT - 2ND DEGREE,MONTGOMERY VILLAGE,9900 BLK  GABLE RIDGE TER,ROCKVILLE,MD,20850.0,MCPD,Residence - Apartment/Condo,P,6P1,751,9900.0,,GABLE RIDGE,,TER,39.10835,-77.2051,6D,"(39.1084, -77.2051)"
201309856,2605,200045535,11/18/2020 01:09:01 PM,2020-11-14 00:00:00,,26B,1,Crime Against Property,Credit Card/Automatic Teller Machine Fraud,FRAUD - ILLEGAL USE CREDIT CARDS,WHEATON,2300 BLK  PARKER AVE,SILVER SPRING,MD,20902.0,MCPD,Other/Unknown,L,4L1,364,2300.0,,PARKER,,AVE,39.04955,-77.0482,4D,"(39.0496, -77.0482)"
201279328,5403,200008595,02/20/2020 09:23:33 PM,2020-02-20 21:23:00,,90D,1,Crime Against Society,Driving Under the Influence,DRIVING UNDER THE INFLUENCE DRUGS,SILVER SPRING,,SILVER SPRING,MD,20910.0,MCPD,Street - Commercial,G,3G1,109,,,GEORGIA,,AVE,39.11237,-77.0755,3D,"(39.1124, -77.0755)"
201284819,2305,200015895,04/13/2020 05:37:11 PM,2020-04-13 01:00:00,04/13/2020 09:30:00 AM,23F,1,Crime Against Property,Theft From Motor Vehicle,LARCENY - FROM AUTO,SILVER SPRING,11400 BLK  JULY DR,SILVER SPRING,MD,20904.0,MCPD,Parking Lot - Residential,I,3I1,145,11400.0,,JULY,,DR,39.0415,-76.9817,3D,"(39.0415, -76.9817)"
201306558,2305,200041396,10/20/2020 02:21:36 PM,2020-10-18 19:00:00,10/19/2020 09:30:00 AM,23F,1,Crime Against Property,Theft From Motor Vehicle,LARCENY - FROM AUTO,BETHESDA,4800 BLK  ESSEX AVE,CHEVY CHASE,MD,20815.0,MCPD,Residence - Driveway,E,2E1,017,4800.0,,ESSEX,,AVE,38.96697,-77.0962,2D,"(38.967, -77.0962)"
201248221,2399,190033551,07/15/2019 09:24:30 AM,2019-07-12 08:00:00,07/14/2019 07:00:00 PM,23H,1,Crime Against Property,All other Larceny,LARCENY (DESCRIBE OFFENSE),GERMANTOWN,18000 BLK  COTTAGE GARDEN DR,GERMANTOWN,MD,20874.0,MCPD,Residence - Yard,N,5N2,448,18000.0,,COTTAGE GARDEN,,DR,39.15255,-77.2745,5D,"(39.1525, -77.2745)"
201416153,5404,230010804,03/05/2023 12:12:26 AM,2023-03-05 00:12:00,,90D,1,Crime Against Society,Driving Under the Influence,DRIVING UNDER THE INFLUENCE LIQUOR,MONTGOMERY VILLAGE,,GAITHERSBURG,MD,20877.0,GPD,Street - In vehicle,P,6P3,432,,S,FREDERICK,,AVE,39.05909,-77.1162,6D,"(39.0591, -77.1162)"
201295184,5399,200028015,07/19/2020 12:10:43 PM,2020-07-19 00:19:00,07/19/2020 12:45:00 AM,90C,1,Crime Against Society,Disorderly Conduct,PUBLIC PEACE (DESCRIBE OFFENSE),BETHESDA,5600 BLK  WOOD WAY,BETHESDA,MD,20816.0,MCPD,Residence - Single Family,E,2E1,003,5600.0,,WOOD,,WAY,38.95609,-77.1118,2D,"(38.9561, -77.1118)"
201261649,2902,190050435,10/21/2019 07:39:11 AM,2019-10-21 07:37:00,,290,1,Crime Against Property,Destruction/Damage/Vandalism of Property,DAMAGE PROPERTY - PRIVATE,SILVER SPRING,9200 BLK  SLIGO CREEK PKW,SILVER SPRING,MD,20901.0,MCPD,Residence - Driveway,G,3G2,123,9200.0,,SLIGO CREEK,,PKW,38.97973,-76.9952,3D,"(38.9797, -76.9952)"
201226796,2404,190006948,02/13/2019 05:20:36 AM,2019-02-13 05:20:00,,240,1,Crime Against Property,Motor Vehicle Theft,AUTO THEFT - VEHICLE THEFT,WHEATON,3300 BLK  MC MAHON RD,SILVER SPRING,MD,20902.0,MCPD,Parking Lot - Residential,L,4L2,170,3300.0,,MC MAHON,,RD,39.03438,-77.042,4D,"(39.0344, -77.042)"
201339843,2305,210029410,07/29/2021 12:32:29 PM,2021-07-23 12:32:00,07/24/2021 12:00:00 AM,23F,1,Crime Against Property,Theft From Motor Vehicle,LARCENY - FROM AUTO,SILVER SPRING,,SILVER SPRING,MD,20910.0,MCPD,Parking Garage - Residential,G,3G1,094,,,BONIFANT,,ST,38.9946,-77.0237,3D,"(38.9946, -77.0237)"
201405296,2902,220055982,12/17/2022 08:36:15 PM,2022-12-17 20:36:00,,290,1,Crime Against Property,Destruction/Damage/Vandalism of Property,DAMAGE PROPERTY - PRIVATE,MONTGOMERY VILLAGE,,GAITHERSBURG,MD,20879.0,MCPD,Parking Lot - Commercial,R,6R3,421,,,SNOUFFER SCHOOL,,RD,39.17164,-77.1783,6D,"(39.1716, -77.1783)"
201329708,3522,210016801,05/04/2021 11:06:42 PM,2021-05-04 21:23:00,,35A,1,Crime Against Society,Drug/Narcotic Violations,DRUGS - OPIUM OR DERIVATIVE - POSSESS,MONTGOMERY VILLAGE,,GAITHERSBURG,MD,20879.0,MCPD,Street - In vehicle,R,6R1,503,,,BLUE SMOKE,,CT,39.17873,-77.1831,6D,"(39.1787, -77.1831)"
201315246,2404,210000455,01/04/2021 08:15:39 PM,2021-01-04 19:55:00,,240,1,Crime Against Property,Motor Vehicle Theft,AUTO THEFT - VEHICLE THEFT,BETHESDA,6700 BLK  BRADLEY BLV,BETHESDA,MD,20817.0,MCPD,Residence - Driveway,E,2E2,067,6700.0,,BRADLEY,,BLV,39.00322,-77.1349,2D,"(39.0032, -77.1349)"
201360434,2399,220001800,01/14/2022 11:28:45 PM,2022-01-14 23:28:00,,23H,1,Crime Against Property,All other Larceny,LARCENY (DESCRIBE OFFENSE),SILVER SPRING,1500 BLK  HAMPSHIRE WEST CT,SILVER SPRING,MD,20903.0,MCPD,Residence - Apartment/Condo,H,3H2,137,1500.0,,HAMPSHIRE WEST,,CT,39.00841,-76.9807,3D,"(39.0084, -76.9807)"
201256274,5404,190043619,09/11/2019 09:52:32 PM,2019-09-11 21:52:00,,90D,1,Crime Against Society,Driving Under the Influence,DRIVING UNDER THE INFLUENCE LIQUOR,BETHESDA,6000 BLK  GROSVENOR LA,BETHESDA,MD,20814.0,MCPD,Street - Commercial,D,2D4,191,6000.0,,GROSVENOR,,LA,39.02249,-77.1196,2D,"(39.0225, -77.1196)"
201425717,1399,230022167,05/09/2023 10:35:52 AM,2023-05-09 10:35:00,,13B,1,Crime Against Person,Simple Assault,ASSAULT - 2ND DEGREE,WHEATON,2200 BLK  RANDOLPH RD,SILVER SPRING,MD,20902.0,MCPD,Grocery/Supermarket,J,4J1,536,2200.0,,RANDOLPH,,RD,39.05907,-77.0477,4D,"(39.0591, -77.0477)"
201312567,2303,200048809,12/11/2020 12:08:06 PM,2020-12-11 12:08:00,,23C,1,Crime Against Property,Shoplifting,LARCENY - SHOPLIFTING,MONTGOMERY VILLAGE,15700 BLK  SHADY GROVE RD,GAITHERSBURG,MD,20877.0,MCPD,Retail - Department/Discount Store,P,6P3,756,15700.0,,SHADY GROVE,,RD,39.11327,-77.1865,6D,"(39.1133, -77.1865)"
201372827,2606,220016448,04/18/2022 03:00:26 PM,2022-04-18 09:00:00,04/18/2022 03:00:00 PM,90A,2,Crime Against Property,Bad Checks,BAD CHECK  INSUFFICIENT FUNDS,GERMANTOWN,9400 BLK  MARSH POINT CT,GAITHERSBURG,MD,20882.0,MCPD,Other/Unknown,M,5M2,620,9400.0,,MARSH POINT,,CT,39.24817,-77.1952,5D,"(39.2482, -77.1952)"
201438313,2305,230047667,08/03/2023 02:36:23 PM,2023-08-02 18:00:00,08/03/2023 12:00:00 PM,23F,1,Crime Against Property,Theft From Motor Vehicle,LARCENY - FROM AUTO,MONTGOMERY VILLAGE,9400 BLK  FERN HOLLOW WAY,MONTGOMERY VILLAGE,MD,20886.0,MCPD,Street - Residential,R,6R2,504,9400.0,,FERN HOLLOW,,WAY,39.18168,-77.1932,6D,"(39.1817, -77.1932)"
201282246,2203,200012840,03/16/2020 09:50:28 AM,2020-03-13 17:00:00,03/16/2020 08:00:00 AM,220,1,Crime Against Property,Burglary/Breaking and Entering,BURGLARY - FORCED ENTRY-NONRESIDENTIAL,SILVER SPRING,9100 BLK  BROOKVILLE RD,SILVER SPRING,MD,20910.0,MCPD,Hospital/Emergency Care Center,G,3G2,083,9100.0,,BROOKVILLE,,RD,39.00453,-77.0509,3D,"(39.0045, -77.0509)"
201308071,1313,200043366,11/03/2020 10:36:44 AM,2020-11-03 10:36:00,11/03/2020 10:36:00 AM,13B,1,Crime Against Person,Simple Assault,ASSAULT - SIMPLE,BETHESDA,12000 BLK  NEBEL ST,ROCKVILLE,MD,20852.0,MCPD,Retail - Other,D,2D4,187,12000.0,,NEBEL,,ST,39.05038,-77.1088,2D,"(39.0504, -77.1088)"
201292262,2399,200024566,06/23/2020 04:59:26 PM,2020-03-12 12:00:00,04/22/2020 01:00:00 PM,23H,1,Crime Against Property,All other Larceny,LARCENY (DESCRIBE OFFENSE),MONTGOMERY VILLAGE,7400 BLK  ROSEWOOD MANOR LA,GAITHERSBURG,MD,20882.0,MCPD,Other/Unknown,R,6R2,714,7400.0,,ROSEWOOD MANOR,,LA,39.18977,-77.1517,6D,"(39.1898, -77.1517)"
201331948,2304,210019625,05/24/2021 03:54:58 PM,2021-04-01 07:00:00,05/24/2021 09:30:00 AM,23G,1,Crime Against Property,Theft of Motor Vehicle Parts or Accessories,LARCENY - AUTO PARTS,GERMANTOWN,19800 BLK  MAYCREST WAY,GERMANTOWN,MD,20876.0,MCPD,Residence - Driveway,M,5M1,470,19800.0,,MAYCREST,,WAY,39.18007,-77.2296,5D,"(39.1801, -77.2296)"
201275958,1399,200005199,01/31/2020 05:56:43 PM,2020-01-31 17:00:00,,13B,1,Crime Against Person,Simple Assault,ASSAULT - 2ND DEGREE,MONTGOMERY VILLAGE,18300 BLK  LOST KNIFE CIR,MONTGOMERY VILLAGE,MD,20886.0,MCPD,Parking Lot - Residential,R,6R1,505,18300.0,,LOST KNIFE,,CIR,39.15801,-77.202,6D,"(39.158, -77.202)"
201313087,2610,200049493,12/16/2020 10:52:37 AM,2020-12-16 10:30:00,,26F,1,Crime Against Property,Identity Theft,FRAUD - IDENTITY THEFT,MONTGOMERY VILLAGE,5800 BLK  WILD FLOWER CT,DERWOOD,MD,20855.0,MCPD,Residence - Single Family,R,6R3,716,5800.0,,WILD FLOWER,,CT,39.17726,-77.1181,6D,"(39.1773, -77.1181)"
201397756,2305,220046627,10/24/2022 12:58:55 PM,2022-10-22 08:30:00,10/22/2022 11:30:00 PM,23F,1,Crime Against Property,Theft From Motor Vehicle,LARCENY - FROM AUTO,MONTGOMERY VILLAGE,200 BLK  SPECTRUM AVE,GAITHERSBURG,MD,20879.0,MCPD,Parking Garage - Residential,P,6P2,425,200.0,,SPECTRUM,,AVE,39.16059,-77.2231,6D,"(39.1606, -77.2231)"
201233445,5404,190014698,03/30/2019 02:34:23 AM,2019-03-30 02:34:00,,90D,1,Crime Against Society,Driving Under the Influence,DRIVING UNDER THE INFLUENCE LIQUOR,BETHESDA,,BETHESDA,MD,20814.0,MCPD,Street - In vehicle,D,2D2,049,,,AUBURN,,AVE,38.97633,-76.9948,2D,"(38.9763, -76.9948)"
201285065,2305,200016188,04/16/2020 02:48:12 PM,2020-04-15 20:00:00,04/16/2020 02:00:00 PM,23F,1,Crime Against Property,Theft From Motor Vehicle,LARCENY - FROM AUTO,SILVER SPRING,400 BLK  UNIVERSITY BLV E,SILVER SPRING,MD,20901.0,MCPD,Residence - Driveway,G,3G2,125,400.0,,UNIVERSITY,E,BLV,39.00978,-76.9998,3D,"(39.0098, -76.9998)"
201340483,2303,210028043,07/20/2021 01:48:57 PM,2021-07-20 13:48:00,,23C,1,Crime Against Property,Shoplifting,LARCENY - SHOPLIFTING,SILVER SPRING,8500 BLK  FENTON ST,SILVER SPRING,MD,20910.0,MCPD,Retail - Other,G,3G1,671,8500.0,,FENTON,,ST,38.9954,-77.0244,3D,"(38.9954, -77.0244)"
201342910,2299,210033189,08/25/2021 02:53:03 PM,2021-08-25 14:53:00,,220,1,Crime Against Property,Burglary/Breaking and Entering,BURGLARY (DESCRIBE OFFENSE),SILVER SPRING,1  BLK  EASTMOOR DR,SILVER SPRING,MD,20901.0,MCPD,Residence - Single Family,H,3H2,154,1.0,,EASTMOOR,,DR,39.02564,-77.0102,3D,"(39.0256, -77.0102)"
201410313,2399,230003760,01/23/2023 03:29:01 PM,2023-01-23 15:29:00,,23H,1,Crime Against Property,All other Larceny,LARCENY (DESCRIBE OFFENSE),BETHESDA,8200 BLK  MAPLE RIDGE RD,BETHESDA,MD,20814.0,MCPD,Residence - Single Family,E,2E2,054,8200.0,,MAPLE RIDGE,,RD,38.99199,-77.1062,2D,"(38.992, -77.1062)"
201282140,5707,200012781,03/15/2020 07:34:45 PM,2020-03-15 19:34:00,,90J,1,Crime Against Society,Trespass of Real Property,TRESPASSING,WHEATON,12300 BLK  GEORGIA AVE,SILVER SPRING,MD,20906.0,MCPD,Restaurant,J,4J1,536,12300.0,,GEORGIA,,AVE,39.05819,-77.05,4D,"(39.0582, -77.05)"
201256322,3550,190043676,09/12/2019 10:44:57 AM,2019-09-12 10:44:00,09/12/2019 11:00:00 AM,35B,1,Crime Against Society,Drug Equipment Violations,DRUGS - NARCOTIC EQUIP - POSSESS,ROCKVILLE,100 BLK E MONTGOMERY AVE,ROCKVILLE,MD,20850.0,RCPD,Street - Commercial,A,1A3,276,100.0,E,MONTGOMERY,,AVE,39.08417,-77.1548,1D,"(39.0842, -77.1548)"
201344958,2308,210035761,09/11/2021 01:09:42 PM,2021-09-11 13:40:00,,23D,1,Crime Against Property,Theft from Building,LARCENY - FROM BLDG,SILVER SPRING,8200 BLK  GEORGIA AVE,SILVER SPRING,MD,20910.0,MCPD,Residence - Apartment/Condo,G,3G1,094,8200.0,,GEORGIA,,AVE,38.99163,-77.0266,3D,"(38.9916, -77.0266)"
201380270,2308,220025535,06/14/2022 09:30:41 AM,2022-06-12 11:00:00,06/12/2022 12:00:00 PM,23D,1,Crime Against Property,Theft from Building,LARCENY - FROM BLDG,MONTGOMERY VILLAGE,7400 BLK  MUNCASTER MILL RD,GAITHERSBURG,MD,20877.0,MCPD,Church/Synagogue/Temple,R,6R3,542,7400.0,,MUNCASTER MILL,,RD,39.15114,-77.1497,6D,"(39.1511, -77.1497)"
201308956,2399,200044445,11/10/2020 06:25:47 PM,2020-11-10 18:25:00,,23H,1,Crime Against Property,All other Larceny,LARCENY (DESCRIBE OFFENSE),SILVER SPRING,800 BLK  WAYNE AVE,SILVER SPRING,MD,20910.0,MCPD,Parking Lot - Other,G,3G1,671,800.0,,WAYNE,,AVE,38.99717,-77.0218,3D,"(38.9972, -77.0218)"
201329593,5404,210015911,04/28/2021 10:45:21 PM,2021-04-28 22:45:00,,90D,1,Crime Against Society,Driving Under the Influence,DRIVING UNDER THE INFLUENCE LIQUOR,MONTGOMERY VILLAGE,,ROCKVILLE,MD,20850.0,MCPD,Street - In vehicle,P,6P1,721,,,SHADY GROVE,,RD,39.14114,-77.1518,6D,"(39.1411, -77.1518)"
201322877,2303,210009130,03/11/2021 10:41:58 AM,2021-03-11 10:41:00,,23C,1,Crime Against Property,Shoplifting,LARCENY - SHOPLIFTING,GERMANTOWN,20900 BLK  FREDERICK RD,GERMANTOWN,MD,20876.0,MCPD,Retail - Department/Discount Store,M,5M1,701,20900.0,,FREDERICK,,RD,39.19829,-77.2448,5D,"(39.1983, -77.2448)"
201346032,5212,210036038,09/13/2021 02:34:55 PM,2021-09-13 06:15:00,,520,1,Crime Against Society,Weapon Law Violations,WEAPON - POSSESSION,GERMANTOWN,25000 BLK  ANGELA CT,DAMASCUS,MD,20872.0,MCPD,Residence -Townhouse/Duplex,M,5M2,481,25000.0,,ANGELA,,CT,39.26725,-77.2077,5D,"(39.2672, -77.2077)"
201342934,5403,210031559,08/14/2021 12:59:29 AM,2021-08-14 00:59:00,,90D,1,Crime Against Society,Driving Under the Influence,DRIVING UNDER THE INFLUENCE DRUGS,GERMANTOWN,,GERMANTOWN,MD,20874.0,MCPD,Street - In vehicle,N,5N1,595,,,MIDDLEBROOK,,RD,39.17603,-77.2458,5D,"(39.176, -77.2458)"
201429612,2605,230026953,06/05/2023 11:40:28 AM,2023-06-03 07:00:00,,26B,1,Crime Against Property,Credit Card/Automatic Teller Machine Fraud,FRAUD - ILLEGAL USE CREDIT CARDS,GERMANTOWN,20000 BLK  FREDERICK RD,GERMANTOWN,MD,20876.0,MCPD,Residence - Other,M,5M1,468,20000.0,,FREDERICK,,RD,39.18341,-77.2388,5D,"(39.1834, -77.2388)"
201450903,2304,230063336,10/30/2023 09:27:40 AM,2023-10-29 22:00:00,10/30/2023 07:50:00 AM,23G,1,Crime Against Property,Theft of Motor Vehicle Parts or Accessories,LARCENY - AUTO PARTS,WHEATON,2100 BLK  GREENERY LA,SILVER SPRING,MD,20906.0,MCPD,Parking Lot - Residential,J,4J1,368,2100.0,,GREENERY,,LA,39.06026,-77.0457,4D,"(39.0603, -77.0457)"
201380444,2308,220025726,06/15/2022 10:09:44 AM,2022-06-05 08:00:00,06/13/2022 10:00:00 AM,23D,1,Crime Against Property,Theft from Building,LARCENY - FROM BLDG,ROCKVILLE,14900 BLK  SHADY GROVE RD,ROCKVILLE,MD,20850.0,MCPD,Hotel/Motel/Etc.,B,1B1,241,14900.0,,SHADY GROVE,,RD,39.09939,-77.1924,1D,"(39.0994, -77.1924)"
201388711,2303,220035712,08/18/2022 07:35:23 PM,2022-08-18 19:35:00,,23C,1,Crime Against Property,Shoplifting,LARCENY - SHOPLIFTING,SILVER SPRING,11200 BLK  NEW HAMPSHIRE AVE,SILVER SPRING,MD,20904.0,MCPD,Retail - Drug Store/Pharmacy,I,3I1,518,11200.0,,NEW HAMPSHIRE,,AVE,39.03978,-76.9906,3D,"(39.0398, -76.9906)"
201285122,2305,200016248,04/17/2020 02:52:05 AM,2020-04-17 02:52:00,,23F,1,Crime Against Property,Theft From Motor Vehicle,LARCENY - FROM AUTO,MONTGOMERY VILLAGE,700 BLK  RUSSELL AVE,GAITHERSBURG,MD,20877.0,MCPD,Parking Lot - Commercial,R,6R1,548,700.0,,RUSSELL,,AVE,39.15063,-77.2039,6D,"(39.1506, -77.2039)"
201274723,3550,200003710,01/22/2020 11:51:34 PM,2020-01-22 23:51:00,,35B,1,Crime Against Society,Drug Equipment Violations,DRUGS - NARCOTIC EQUIP - POSSESS,WHEATON,2600 BLK  NEWTON ST,SILVER SPRING,MD,20902.0,MCPD,Residence - Single Family,L,4L1,330,2600.0,,NEWTON,,ST,39.05673,-77.0529,4D,"(39.0567, -77.0529)"
201224296,3550,190003575,01/23/2019 03:47:57 PM,2019-01-23 15:47:00,01/23/2019 12:00:00 AM,35B,1,Crime Against Society,Drug Equipment Violations,DRUGS - NARCOTIC EQUIP - POSSESS,SILVER SPRING,11300 BLK  LOCKWOOD DR,SILVER SPRING,MD,20904.0,MCPD,Street - Commercial,I,3I1,145,11300.0,,LOCKWOOD,,DR,39.03978,-76.9906,3D,"(39.0398, -76.9906)"
201326204,2303,210012597,04/04/2021 08:50:47 PM,2021-04-04 20:59:00,,23C,1,Crime Against Property,Shoplifting,LARCENY - SHOPLIFTING,GERMANTOWN,20900 BLK  FREDERICK RD,GERMANTOWN,MD,20876.0,MCPD,Retail - Department/Discount Store,M,5M1,701,20900.0,,FREDERICK,,RD,39.19829,-77.2448,5D,"(39.1983, -77.2448)"
201443568,2902,230054349,09/12/2023 01:51:07 AM,2023-09-12 00:00:00,,290,1,Crime Against Property,Destruction/Damage/Vandalism of Property,DAMAGE PROPERTY - PRIVATE,MONTGOMERY VILLAGE,9500 BLK  TREYFORD TER,MONTGOMERY VILLAGE,,20886.0,MCPD,Residence - Driveway,R,6R1,505,9500.0,,TREYFORD,,TER,39.15454,-77.1954,6D,"(39.1545, -77.1954)"
201398998,2303,220046887,10/25/2022 05:18:38 PM,2022-10-20 20:37:00,10/20/2022 08:54:00 PM,23C,1,Crime Against Property,Shoplifting,LARCENY - SHOPLIFTING,BETHESDA,6800 BLK  WISCONSIN AVE,CHEVY CHASE,MD,20815.0,MCPD,Retail - Department/Discount Store,D,2D2,014,6800.0,,WISCONSIN,,AVE,38.97782,-77.091,2D,"(38.9778, -77.091)"
201429066,3564,230026092,05/31/2023 12:27:18 PM,2023-05-31 00:00:00,,35A,1,Crime Against Society,Drug/Narcotic Violations,DRUGS - MARIJUANA (DESCRIBE OFFENSE),ROCKVILLE,15800 BLK  QUINCE ORCHARD RD,GAITHERSBURG,MD,20878.0,MCPD,School/College - DO NOT USE,B,1B2,457,15800.0,,QUINCE ORCHARD,,RD,39.11449,-77.2529,1D,"(39.1145, -77.2529)"
201341552,2303,210031456,08/13/2021 10:35:30 AM,2021-08-13 10:00:00,08/13/2021 10:30:00 AM,23C,1,Crime Against Property,Shoplifting,LARCENY - SHOPLIFTING,WHEATON,12300 BLK  GEORGIA AVE,SILVER SPRING,MD,20906.0,MCPD,Retail - Other,J,4J1,536,12300.0,,GEORGIA,,AVE,39.05819,-77.05,4D,"(39.0582, -77.05)"
201312134,2203,200048209,12/07/2020 12:57:09 PM,2020-12-07 12:57:00,,220,1,Crime Against Property,Burglary/Breaking and Entering,BURGLARY - FORCED ENTRY-NONRESIDENTIAL,MONTGOMERY VILLAGE,200 BLK N FREDERICK AVE,GAITHERSBURG,MD,20877.0,GPD,Gas Station,P,6P2,428,200.0,N,FREDERICK,,AVE,39.09454,-77.1506,6D,"(39.0945, -77.1506)"
201391022,1303,220038523,09/05/2022 06:51:55 PM,2022-09-05 18:51:00,09/05/2022 12:00:00 AM,13A,1,Crime Against Person,Aggravated Assault,ASSAULT - AGGRAVATED - FAMILY-STRONG-ARM,MONTGOMERY VILLAGE,18300 BLK  STREAMSIDE DR,GAITHERSBURG,MD,20879.0,MCPD,Residence - Apartment/Condo,R,6R3,420,18300.0,,STREAMSIDE,,DR,39.15484,-77.1691,6D,"(39.1548, -77.1691)"
201420167,1399,230015457,03/31/2023 08:38:00 AM,2023-03-31 07:38:00,03/31/2023 08:38:00 AM,13B,1,Crime Against Person,Simple Assault,ASSAULT - 2ND DEGREE,BETHESDA,5100 BLK  PARKLAWN TER,ROCKVILLE,MD,20852.0,MCPD,Street - In vehicle,D,2D4,523,5100.0,,PARKLAWN,,TER,39.04993,-77.1017,2D,"(39.0499, -77.1017)"
201223425,4199,190002837,01/18/2019 11:42:52 AM,2019-01-18 11:45:00,01/18/2019 11:50:00 AM,90G,1,Crime Against Society,Liquor Law Violations,LIQUOR (DESCRIBE OFFENSE),SILVER SPRING,8100 BLK  GEORGIA AVE,SILVER SPRING,MD,20910.0,MCPD,Street - Commercial,G,3G1,094,8100.0,,GEORGIA,,AVE,38.99064,-77.0266,3D,"(38.9906, -77.0266)"
201431769,2305,230029430,06/19/2023 02:43:43 PM,2023-06-18 22:00:00,06/19/2023 12:00:00 PM,23F,1,Crime Against Property,Theft From Motor Vehicle,LARCENY - FROM AUTO,SILVER SPRING,500 BLK  ELDRID DR,SILVER SPRING,MD,20904.0,MCPD,Street - Residential,I,3I1,519,500.0,,ELDRID,,DR,39.06567,-77.0003,3D,"(39.0657, -77.0003)"
201342372,2308,210032550,08/20/2021 11:23:43 PM,2021-08-13 19:45:00,08/13/2021 08:15:00 PM,23D,1,Crime Against Property,Theft from Building,LARCENY - FROM BLDG,GERMANTOWN,20900 BLK  FREDERICK RD,GERMANTOWN,MD,20876.0,MCPD,Retail - Department/Discount Store,M,5M1,701,20900.0,,FREDERICK,,RD,39.19829,-77.2448,5D,"(39.1983, -77.2448)"
201222021,1313,190001050,01/07/2019 12:03:45 PM,2019-01-07 11:55:00,,13B,1,Crime Against Person,Simple Assault,ASSAULT - SIMPLE,GERMANTOWN,11500 BLK  ABERSTRAW WAY,GERMANTOWN,MD,20876.0,MCPD,Parking Lot - Residential,M,5M1,471,11500.0,,ABERSTRAW,,WAY,39.18951,-77.2398,5D,"(39.1895, -77.2398)"
201223259,2304,190002641,01/17/2019 09:21:10 AM,2019-01-15 00:00:00,01/17/2019 09:00:00 AM,23G,1,Crime Against Property,Theft of Motor Vehicle Parts or Accessories,LARCENY - AUTO PARTS,GERMANTOWN,21000 BLK  FREDERICK RD,GERMANTOWN,MD,20876.0,MCPD,Parking Lot - Commercial,M,5M1,701,21000.0,,FREDERICK,,RD,39.20331,-77.2457,5D,"(39.2033, -77.2457)"
201448740,2305,230059300,10/08/2023 01:56:47 PM,2023-10-07 21:00:00,10/08/2023 11:00:00 AM,23F,1,Crime Against Property,Theft From Motor Vehicle,LARCENY - FROM AUTO,SILVER SPRING,10100 BLK  QUINBY ST,SILVER SPRING,MD,20901.0,MCPD,Other/Unknown,H,3H2,162,10100.0,,QUINBY,,ST,0.0,0.0,3D,"(0.0, 0.0)"
201258442,5311,190045210,,2019-09-21 00:50:00,09/21/2019 12:55:00 AM,90C,1,Crime Against Society,Disorderly Conduct,PUBLIC PEACE - DISORDERLY CONDUCT,WHEATON,2400 BLK  ENNALLS AVE,SILVER SPRING,MD,20902.0,MCPD,Street - Alley,L,4L2,324,2400.0,,ENNALLS,,AVE,39.04096,-77.0515,4D,"(39.041, -77.0515)"
201413309,3550,230007597,02/14/2023 08:20:26 PM,2023-02-14 20:10:00,,35B,1,Crime Against Society,Drug Equipment Violations,DRUGS - NARCOTIC EQUIP - POSSESS,WHEATON,1900 BLK  WINEXBURG CT,SILVER SPRING,MD,20906.0,MCPD,Parking Lot - Residential,J,4J1,368,1900.0,,WINEXBURG,,CT,39.06261,-77.042,4D,"(39.0626, -77.042)"
201420870,3532,230016183,04/04/2023 11:21:13 PM,2023-04-04 23:10:00,04/05/2023 01:30:00 AM,35A,1,Crime Against Society,Drug/Narcotic Violations,DRUGS - COCAINE - POSSESS,WHEATON,3800 BLK  INTERNATIONAL DR,SILVER SPRING,MD,20906.0,MCPD,Street - In vehicle,K,4K1,346,3800.0,,INTERNATIONAL,,DR,39.10371,-77.0758,4D,"(39.1037, -77.0758)"
201296339,2305,200029349,07/28/2020 06:02:22 PM,2020-07-27 20:30:00,07/28/2020 08:30:00 AM,23F,1,Crime Against Property,Theft From Motor Vehicle,LARCENY - FROM AUTO,SILVER SPRING,900 BLK W NOLCREST DR,SILVER SPRING,MD,20903.0,MCPD,Residence - Driveway,H,3H2,144,900.0,W,NOLCREST,,DR,39.02885,-76.9907,3D,"(39.0288, -76.9907)"
201244508,2699,190029083,06/18/2019 10:38:11 AM,2019-06-03 10:38:00,06/13/2019 12:00:00 PM,26A,1,Crime Against Property,False Pretenses/Swindle/Confidence Game,FRAUD (DESCRIBE OFFENSE),BETHESDA,6900 BLK  ARLINGTON RD,BETHESDA,MD,20814.0,MCPD,Commercial - Office Building,D,2D2,031,6900.0,,ARLINGTON,,RD,38.978,-77.0987,2D,"(38.978, -77.0987)"
201276687,3530,200006098,02/06/2020 05:27:22 AM,2020-02-06 04:00:00,02/06/2020 08:00:00 AM,35A,1,Crime Against Society,Drug/Narcotic Violations,DRUGS - COCAINE - SELL,MONTGOMERY VILLAGE,700 BLK  QUINCE ORCHARD BLV,GAITHERSBURG,MD,20878.0,MCPD,Residence - Apartment/Condo,P,6P2,554,700.0,,QUINCE ORCHARD,,BLV,39.14181,-77.2244,6D,"(39.1418, -77.2244)"
201356206,3562,210049971,12/09/2021 08:13:29 AM,2021-12-09 08:13:00,,35A,1,Crime Against Society,Drug/Narcotic Violations,DRUGS - MARIJUANA - POSSESS,GERMANTOWN,25900 BLK  RIDGE RD,DAMASCUS,MD,20872.0,MCPD,School - Elementary/Secondary,M,5M2,615,25900.0,,RIDGE,,RD,39.28396,-77.2106,5D,"(39.284, -77.2106)"
201305763,5299,200040553,10/14/2020 06:59:05 PM,2020-10-14 18:59:00,,520,1,Crime Against Society,Weapon Law Violations,WEAPON OFFENSE (DESCRIBE OFFENSE),GERMANTOWN,11700 BLK  LITTLE SENECA PKW,CLARKSBURG,MD,20871.0,MCPD,School/College - DO NOT USE,M,5M3,600,11700.0,,LITTLE SENECA,,PKW,39.23154,-77.2431,5D,"(39.2315, -77.2431)"
201228267,2305,190008903,02/25/2019 06:55:33 AM,2019-02-24 22:00:00,02/25/2019 06:00:00 AM,23F,1,Crime Against Property,Theft From Motor Vehicle,LARCENY - FROM AUTO,GERMANTOWN,19500 BLK  FREDERICK RD,GERMANTOWN,MD,20876.0,MCPD,Residence - Driveway,M,5M1,470,19500.0,,FREDERICK,,RD,39.17546,-77.2381,5D,"(39.1755, -77.2381)"
201389357,1315,220036476,08/23/2022 08:57:24 PM,2022-08-23 20:57:00,08/23/2022 09:00:00 PM,13A,1,Crime Against Person,Aggravated Assault,ASSAULT - AGGRAVATED - OTHER,SILVER SPRING,,SILVER SPRING,MD,20904.0,MCPD,Street - Residential,I,3I1,518,,,LOCKWOOD,,DR,39.04143,-76.9833,3D,"(39.0414, -76.9833)"
201237034,1399,190019643,04/26/2019 07:08:33 PM,2019-04-26 19:08:00,,13B,1,Crime Against Person,Simple Assault,ASSAULT - 2ND DEGREE,WHEATON,18100 BLK  ROLLING MEADOW WAY,OLNEY,MD,20832.0,MCPD,Residence -Townhouse/Duplex,J,4J2,399,18100.0,,ROLLING MEADOW,,WAY,39.15426,-77.071,4D,"(39.1543, -77.071)"
201329041,2999,210016052,04/29/2021 10:28:38 PM,2021-04-29 22:27:00,,290,1,Crime Against Property,Destruction/Damage/Vandalism of Property,DAMAGE PROPERTY (DESCRIBE OFFENSE),GERMANTOWN,11900 BLK  MIDDLEBROOK RD,GERMANTOWN,MD,20876.0,MCPD,Street - In vehicle,M,5M1,469,11900.0,,MIDDLEBROOK,,RD,39.17594,-77.2459,5D,"(39.1759, -77.2459)"
201413318,2304,230006997,02/11/2023 03:12:34 PM,2023-02-04 00:00:00,02/11/2023 11:00:00 AM,23G,1,Crime Against Property,Theft of Motor Vehicle Parts or Accessories,LARCENY - AUTO PARTS,MONTGOMERY VILLAGE,19800 BLK  FILBERT DR,GAITHERSBURG,MD,20879.0,MCPD,Street - Residential,R,6R3,421,19800.0,,FILBERT,,DR,39.18094,-77.1557,6D,"(39.1809, -77.1557)"
201248763,5404,190034249,07/19/2019 01:37:17 AM,2019-07-19 01:37:00,07/19/2019 02:00:00 AM,90D,1,Crime Against Society,Driving Under the Influence,DRIVING UNDER THE INFLUENCE LIQUOR,ROCKVILLE,1  BLK  PRESERVE PKW,ROCKVILLE,MD,20852.0,RCPD,Parking Lot - Other,A,1A1,264,1.0,,PRESERVE,,PKW,39.06693,-77.1503,1D,"(39.0669, -77.1503)"
201320542,1399,210006623,02/20/2021 05:30:18 PM,2021-02-20 17:30:00,,13B,1,Crime Against Person,Simple Assault,ASSAULT - 2ND DEGREE,SILVER SPRING,900 BLK  THAYER AVE,SILVER SPRING,MD,20910.0,MCPD,Grocery/Supermarket,G,3G1,670,900.0,,THAYER,,AVE,38.99304,-77.024,3D,"(38.993, -77.024)"
201303986,2999,200038399,09/30/2020 02:29:24 AM,2020-09-30 02:29:00,,290,1,Crime Against Property,Destruction/Damage/Vandalism of Property,DAMAGE PROPERTY (DESCRIBE OFFENSE),WHEATON,3200 BLK  WEEPING WILLOW CT,SILVER SPRING,MD,20906.0,MCPD,Residence - Apartment/Condo,K,4K1,348,3200.0,,WEEPING WILLOW,,CT,39.08999,-77.0691,4D,"(39.09, -77.0691)"
201384741,2901,220030865,07/18/2022 02:54:16 PM,2022-07-17 21:00:00,07/18/2022 07:30:00 AM,290,1,Crime Against Property,Destruction/Damage/Vandalism of Property,DAMAGE PROPERTY - BUSINESS,WHEATON,17700 BLK  PRINCE PHILIP DR,OLNEY,MD,20832.0,MCPD,Pool,J,4J2,642,17700.0,,PRINCE PHILIP,,DR,39.14217,-77.0611,4D,"(39.1422, -77.0611)"
201392312,2305,220040087,09/15/2022 08:12:08 AM,2022-09-14 18:00:00,09/15/2022 08:00:00 AM,23F,1,Crime Against Property,Theft From Motor Vehicle,LARCENY - FROM AUTO,SILVER SPRING,11000 BLK  LOCKWOOD DR,SILVER SPRING,MD,20901.0,MCPD,Residence - Driveway,I,3I1,518,11000.0,,LOCKWOOD,,DR,39.03543,-76.9971,3D,"(39.0354, -76.9971)"
201279473,2399,200009424,02/25/2020 07:14:43 PM,2020-02-25 19:14:00,,23H,1,Crime Against Property,All other Larceny,LARCENY (DESCRIBE OFFENSE),GERMANTOWN,20400 BLK  BLOOMINGVILLE CT,GERMANTOWN,MD,20876.0,MCPD,Other/Unknown,M,5M1,471,20400.0,,BLOOMINGVILLE,,CT,39.19029,-77.2324,5D,"(39.1903, -77.2324)"
201236155,2399,190018703,04/21/2019 05:51:58 PM,2019-04-21 17:13:00,04/21/2019 05:36:00 PM,23H,1,Crime Against Property,All other Larceny,LARCENY (DESCRIBE OFFENSE),SILVER SPRING,8500 BLK  GEORGIA AVE,SILVER SPRING,MD,20910.0,MCPD,Restaurant,G,3G1,109,8500.0,,GEORGIA,,AVE,38.99454,-77.0268,3D,"(38.9945, -77.0268)"
201432435,2404,230030373,06/25/2023 11:53:57 AM,2023-06-18 10:00:00,06/24/2023 10:00:00 PM,240,1,Crime Against Property,Motor Vehicle Theft,AUTO THEFT - VEHICLE THEFT,ROCKVILLE,12300 BLK  PARKLAWN DR,ROCKVILLE,MD,20852.0,MCPD,Residence - Other,A,1A2,303,12300.0,,PARKLAWN,,DR,39.05895,-77.1108,1D,"(39.059, -77.1108)"
201338896,1399,210028224,07/21/2021 02:05:32 PM,2021-07-21 14:05:00,,13B,2,Crime Against Person,Simple Assault,ASSAULT - 2ND DEGREE,MONTGOMERY VILLAGE,19300 BLK  MONTGOMERY VILLAGE AVE,MONTGOMERY VILLAGE,MD,20886.0,MCPD,Street - Commercial,R,6R2,546,19300.0,,MONTGOMERY VILLAGE,,AVE,39.17262,-77.2036,6D,"(39.1726, -77.2036)"
201234105,2303,190016147,04/07/2019 01:46:32 PM,2019-04-07 13:40:00,04/07/2019 01:42:00 PM,23C,1,Crime Against Property,Shoplifting,LARCENY - SHOPLIFTING,WHEATON,2300 BLK  UNIVERSITY BLV W,SILVER SPRING,MD,20902.0,MCPD,Convenience Store,L,4L2,355,2300.0,,UNIVERSITY,W,BLV,39.04147,-77.0492,4D,"(39.0415, -77.0492)"
201284704,1399,200015739,04/11/2020 10:11:31 PM,2020-04-11 22:07:00,04/11/2020 10:08:00 PM,13B,1,Crime Against Person,Simple Assault,ASSAULT - 2ND DEGREE,SILVER SPRING,600 BLK  NORTHAMPTON DR,SILVER SPRING,MD,20903.0,MCPD,Residence -Townhouse/Duplex,H,3H2,137,600.0,,NORTHAMPTON,,DR,39.00777,-76.9866,3D,"(39.0078, -76.9866)"
201323151,2308,210009513,03/13/2021 08:43:20 PM,2021-02-11 09:00:00,02/15/2021 03:00:00 PM,23D,1,Crime Against Property,Theft from Building,LARCENY - FROM BLDG,SILVER SPRING,12300 BLK  TREETOP DR,SILVER SPRING,MD,20904.0,MCPD,Residence - Other,I,3I1,147,12300.0,,TREETOP,,DR,39.05764,-76.9706,3D,"(39.0576, -76.9706)"
201361200,1304,220002679,01/21/2022 01:04:28 PM,2022-01-21 13:04:00,,13A,1,Crime Against Person,Aggravated Assault,ASSAULT - AGGRAVATED - NON-FAMILY-GUN,MONTGOMERY VILLAGE,5900 BLK  MUNCASTER MILL RD,DERWOOD,MD,20855.0,MCPD,School - Elementary/Secondary,R,6R3,397,5900.0,,MUNCASTER MILL,,RD,39.12941,-77.1183,6D,"(39.1294, -77.1183)"
201275209,2902,200004338,01/26/2020 07:50:55 PM,2020-01-26 19:50:00,,290,1,Crime Against Property,Destruction/Damage/Vandalism of Property,DAMAGE PROPERTY - PRIVATE,SILVER SPRING,10300 BLK  GEORGIA AVE,SILVER SPRING,MD,20902.0,MCPD,Residence - Single Family,G,3G2,174,10300.0,,GEORGIA,,AVE,39.0236,-77.0455,3D,"(39.0236, -77.0455)"
201371439,3562,220014845,04/07/2022 05:20:06 PM,2022-04-07 17:22:00,,35A,1,Crime Against Society,Drug/Narcotic Violations,DRUGS - MARIJUANA - POSSESS,SILVER SPRING,27500 BLK  OL495 PGCO TO X28 HWY,SILVER SPRING,MD,20903.0,MCPD,Street - In vehicle,H,3H2,135,27500.0,,OL495 PGCO TO X28,,HWY,39.01902,-76.9758,3D,"(39.019, -76.9758)"
201277550,3560,200007109,02/12/2020 12:54:42 PM,2020-02-12 13:00:00,,35A,1,Crime Against Society,Drug/Narcotic Violations,DRUGS - MARIJUANA - SELL,SILVER SPRING,2800 BLK  SCHUBERT DR,SILVER SPRING,MD,20904.0,MCPD,Residence - Single Family,I,3I2,378,2800.0,,SCHUBERT,,DR,39.07315,-76.9441,3D,"(39.0731, -76.9441)"
201383153,2601,220028955,07/06/2022 11:31:41 AM,2022-07-06 12:12:00,,26A,1,Crime Against Property,False Pretenses/Swindle/Confidence Game,FRAUD - CONFIDENCE GAME,MONTGOMERY VILLAGE,9000 BLK  CHESLEY KNOLL CT,GAITHERSBURG,MD,20879.0,MCPD,Cyberspace,R,6R1,503,9000.0,,CHESLEY KNOLL,,CT,39.18134,-77.1839,6D,"(39.1813, -77.1839)"
201257380,1399,190045015,,2019-09-20 02:19:00,,13B,2,Crime Against Person,Simple Assault,ASSAULT - 2ND DEGREE,WHEATON,11300 BLK  GEORGIA AVE,SILVER SPRING,MD,20902.0,MCPD,Bar/Night Club,L,4L2,324,11300.0,,GEORGIA,,AVE,39.04011,-77.0513,4D,"(39.0401, -77.0513)"
201228299,3562,190008941,02/25/2019 10:20:17 AM,2019-02-25 10:20:00,02/25/2019 11:00:00 AM,35A,1,Crime Against Society,Drug/Narcotic Violations,DRUGS - MARIJUANA - POSSESS,GERMANTOWN,18800 BLK  WARING STATION RD,GERMANTOWN,MD,20874.0,MCPD,School/College - DO NOT USE,N,5N1,447,18800.0,,WARING STATION,,RD,39.16467,-77.2473,5D,"(39.1647, -77.2473)"
201298896,2404,200032360,08/19/2020 08:22:23 AM,2020-08-18 20:00:00,08/19/2020 07:30:00 AM,240,1,Crime Against Property,Motor Vehicle Theft,AUTO THEFT - VEHICLE THEFT,WHEATON,14300 BLK  GEORGIA AVE,SILVER SPRING,MD,20906.0,MCPD,Parking Lot - Residential,K,4K1,534,14300.0,,GEORGIA,,AVE,39.09053,-77.0799,4D,"(39.0905, -77.0799)"
201382898,2202,220028647,07/04/2022 07:41:01 AM,2022-07-03 21:00:00,07/04/2022 07:00:00 AM,220,1,Crime Against Property,Burglary/Breaking and Entering,BURGLARY - FORCED ENTRY-RESIDENTIAL,SILVER SPRING,15200 BLK  OLD COLUMBIA PIK,BURTONSVILLE,MD,20866.0,MCPD,Residence - Shed,I,3I2,384,15200.0,,OLD COLUMBIA,,PIK,39.10533,-76.9382,3D,"(39.1053, -76.9382)"
201245270,2305,190030194,06/24/2019 06:40:42 PM,2019-06-20 20:11:00,06/24/2019 06:29:00 PM,23F,1,Crime Against Property,Theft From Motor Vehicle,LARCENY - FROM AUTO,GERMANTOWN,12900 BLK  CHURCHILL RIDGE CIR,GERMANTOWN,MD,20874.0,MCPD,Street - In vehicle,N,5N1,702,12900.0,,CHURCHILL RIDGE,,CIR,39.18726,-77.2664,5D,"(39.1873, -77.2664)"
201422679,2303,230018353,04/17/2023 06:00:51 PM,2023-04-17 18:00:00,,23C,1,Crime Against Property,Shoplifting,LARCENY - SHOPLIFTING,GERMANTOWN,20900 BLK  FREDERICK RD,GERMANTOWN,MD,20876.0,MCPD,Grocery/Supermarket,M,5M1,701,20900.0,,FREDERICK,,RD,39.19829,-77.2448,5D,"(39.1983, -77.2448)"
201367903,2305,220010570,03/11/2022 05:11:54 PM,2021-05-28 08:00:00,05/29/2021 05:00:00 PM,23F,1,Crime Against Property,Theft From Motor Vehicle,LARCENY - FROM AUTO,MONTGOMERY VILLAGE,500 BLK  QUINCE ORCHARD RD,GAITHERSBURG,MD,20878.0,MCPD,Auto Dealership,P,6P2,445,500.0,,QUINCE ORCHARD,,RD,39.14541,-77.2199,6D,"(39.1454, -77.2199)"
201401511,1115,220051338,11/20/2022 12:15:05 PM,2022-11-19 18:00:00,,11B,1,Crime Against Person,Forcible Sodomy,SEX ASSAULT - SODOMY-WOMAN-STRONG-ARM,BETHESDA,5200 BLK  POOKS HILL RD,BETHESDA,MD,20814.0,MCPD,Residence - Single Family,E,2E2,071,5200.0,,POOKS HILL,,RD,39.01434,-77.1061,2D,"(39.0143, -77.1061)"
201435370,2202,230033919,07/16/2023 08:31:05 PM,2023-07-16 20:31:00,,220,1,Crime Against Property,Burglary/Breaking and Entering,BURGLARY - FORCED ENTRY-RESIDENTIAL,ROCKVILLE,700 BLK  ROBERT RD,ROCKVILLE,MD,20850.0,RCPD,Residence - Single Family,A,1A3,286,700.0,,ROBERT,,RD,39.08533,-77.1379,1D,"(39.0853, -77.1379)"
201292142,2699,200024458,06/22/2020 06:22:06 PM,2020-06-22 18:22:00,,26A,1,Crime Against Property,False Pretenses/Swindle/Confidence Game,FRAUD (DESCRIBE OFFENSE),BETHESDA,8500 BLK  SCARBORO CT,POTOMAC,MD,20854.0,MCPD,Residence - Single Family,E,2E4,220,8500.0,,SCARBORO,,CT,39.02774,-77.1707,2D,"(39.0277, -77.1707)"
201327852,2902,210014615,04/19/2021 04:41:08 PM,2021-04-17 00:00:00,,290,1,Crime Against Property,Destruction/Damage/Vandalism of Property,DAMAGE PROPERTY - PRIVATE,GERMANTOWN,12600 BLK  GREY EAGLE CT,GERMANTOWN,MD,20874.0,MCPD,Parking Lot - Residential,N,5N1,447,12600.0,,GREY EAGLE,,CT,39.16706,-77.2635,5D,"(39.1671, -77.2635)"
201286748,2305,200018112,05/03/2020 10:08:52 PM,2020-05-02 14:00:00,05/02/2020 02:00:00 PM,23F,1,Crime Against Property,Theft From Motor Vehicle,LARCENY - FROM AUTO,ROCKVILLE,700 BLK  ANDERSON AVE,ROCKVILLE,MD,20850.0,RCPD,Residence - Driveway,A,1A3,248,700.0,,ANDERSON,,AVE,39.08685,-77.1673,1D,"(39.0868, -77.1673)"
201223400,2404,190002819,01/18/2019 09:41:21 AM,2019-01-16 10:00:00,01/17/2019 08:30:00 PM,240,1,Crime Against Property,Motor Vehicle Theft,AUTO THEFT - VEHICLE THEFT,SILVER SPRING,12500 BLK  PROSPERITY DR,SILVER SPRING,MD,20904.0,MCPD,Parking Lot - Other,I,3I1,146,12500.0,,PROSPERITY,,DR,39.06059,-76.9633,3D,"(39.0606, -76.9633)"
201249029,3562,190034734,07/21/2019 11:13:21 PM,2019-07-21 23:13:00,07/22/2019 12:00:00 AM,35A,1,Crime Against Society,Drug/Narcotic Violations,DRUGS - MARIJUANA - POSSESS,SILVER SPRING,,SILVER SPRING,MD,20901.0,MCPD,Street - In vehicle,H,3H1,127,,,PINEY BRANCH,,RD,39.00069,-76.9894,3D,"(39.0007, -76.9894)"
201317392,5404,210002947,01/23/2021 11:40:11 PM,2021-01-23 23:40:00,,90D,1,Crime Against Society,Driving Under the Influence,DRIVING UNDER THE INFLUENCE LIQUOR,ROCKVILLE,,ROCKVILLE,MD,20852.0,MCPD,Street - In vehicle,A,1A1,264,,,MONTROSE,,RD,39.05268,-77.1247,1D,"(39.0527, -77.1247)"
201374955,2305,220019144,05/05/2022 03:45:02 PM,2022-05-04 00:01:00,05/05/2022 03:45:00 PM,23F,1,Crime Against Property,Theft From Motor Vehicle,LARCENY - FROM AUTO,WHEATON,14800 BLK  VILLAGE GATE DR,SILVER SPRING,MD,20906.0,MCPD,Street - Residential,K,4K1,347,14800.0,,VILLAGE GATE,,DR,39.0966,-77.0461,4D,"(39.0966, -77.0461)"
201424930,2304,230021048,05/02/2023 09:21:16 PM,2023-05-01 14:00:00,05/02/2023 09:00:00 PM,23G,1,Crime Against Property,Theft of Motor Vehicle Parts or Accessories,LARCENY - AUTO PARTS,SILVER SPRING,8200 BLK  16TH ST,SILVER SPRING,MD,20910.0,MCPD,Parking Garage - Residential,G,3G1,089,8200.0,,16TH,,ST,38.99219,-77.0364,3D,"(38.9922, -77.0364)"
201278564,3562,200008383,02/19/2020 08:58:44 PM,2020-02-19 21:00:00,,35A,1,Crime Against Society,Drug/Narcotic Violations,DRUGS - MARIJUANA - POSSESS,MONTGOMERY VILLAGE,,GAITHERSBURG,MD,20879.0,MCPD,Street - In vehicle,R,6R2,504,,,GOSHEN,,RD,39.16324,-77.1921,6D,"(39.1632, -77.1921)"
201258184,2902,190045796,09/24/2019 04:00:18 PM,2019-09-24 16:00:00,,290,1,Crime Against Property,Destruction/Damage/Vandalism of Property,DAMAGE PROPERTY - PRIVATE,SILVER SPRING,,SILVER SPRING,MD,20904.0,MCPD,Street - Bus Stop,I,3I2,380,,,CASTLE,,BLV,39.08397,-76.941,3D,"(39.084, -76.941)"
201257017,2610,190044594,09/17/2019 06:16:32 PM,2019-09-16 15:00:00,,26F,1,Crime Against Property,Identity Theft,FRAUD - IDENTITY THEFT,ROCKVILLE,13300 BLK  BEALL CREEK CT,POTOMAC,MD,20854.0,MCPD,Other/Unknown,B,1B2,454,13300.0,,BEALL CREEK,,CT,39.05823,-77.271,1D,"(39.0582, -77.271)"
201391192,2305,220037086,08/27/2022 04:16:53 PM,2021-08-26 20:00:00,08/27/2021 08:30:00 AM,23F,1,Crime Against Property,Theft From Motor Vehicle,LARCENY - FROM AUTO,WHEATON,11700 BLK  NAIRN RD,SILVER SPRING,MD,20902.0,MCPD,Residence - Driveway,L,4L1,364,11700.0,,NAIRN,,RD,39.04724,-77.0425,4D,"(39.0472, -77.0425)"
201348507,2304,210040245,10/08/2021 05:32:50 PM,2021-10-08 11:00:00,,23G,1,Crime Against Property,Theft of Motor Vehicle Parts or Accessories,LARCENY - AUTO PARTS,BETHESDA,5500 BLK  MARINELLI RD,ROCKVILLE,MD,20852.0,MCPD,Parking Garage - Metro,D,2D4,187,5500.0,,MARINELLI,,RD,39.04731,-77.1121,2D,"(39.0473, -77.1121)"
201366656,1399,220009055,03/02/2022 04:02:41 PM,2022-03-02 16:02:00,,13B,1,Crime Against Person,Simple Assault,ASSAULT - 2ND DEGREE,WHEATON,13600 BLK  GEORGIA AVE,SILVER SPRING,MD,20906.0,MCPD,Street - Alley,K,4K1,348,13600.0,,GEORGIA,,AVE,39.07828,-77.0718,4D,"(39.0783, -77.0718)"
201382719,2304,220028434,07/02/2022 03:25:54 PM,2022-06-25 10:00:00,07/01/2022 12:00:00 PM,23G,1,Crime Against Property,Theft of Motor Vehicle Parts or Accessories,LARCENY - AUTO PARTS,WHEATON,700 BLK  KERWIN RD,SILVER SPRING,MD,20901.0,MCPD,Residence - Driveway,L,4L2,163,700.0,,KERWIN,,RD,39.02768,-77.0215,4D,"(39.0277, -77.0215)"
201379653,2308,220024723,06/09/2022 08:55:18 AM,2022-06-08 22:00:00,06/09/2022 08:55:00 AM,23D,1,Crime Against Property,Theft from Building,LARCENY - FROM BLDG,MONTGOMERY VILLAGE,700 BLK  CLOPPER RD,GAITHERSBURG,MD,20878.0,MCPD,Residence - Apartment/Condo,P,6P2,555,700.0,,CLOPPER,,RD,39.14368,-77.2237,6D,"(39.1437, -77.2237)"
201286530,5404,200017735,04/30/2020 08:19:29 PM,2020-04-30 20:19:00,,90D,1,Crime Against Society,Driving Under the Influence,DRIVING UNDER THE INFLUENCE LIQUOR,WHEATON,13000 BLK  VANDALIA DR,ROCKVILLE,MD,20853.0,MCPD,Street - In vehicle,K,4K2,338,13000.0,,VANDALIA,,DR,39.069,-77.085,4D,"(39.069, -77.085)"
201415413,2601,230010028,02/28/2023 04:37:32 PM,2023-02-19 12:00:00,02/25/2023 12:00:00 AM,26A,1,Crime Against Property,False Pretenses/Swindle/Confidence Game,FRAUD - CONFIDENCE GAME,GERMANTOWN,12400 BLK  QUAIL WOODS DR,GERMANTOWN,MD,20874.0,MCPD,Residence -Townhouse/Duplex,N,5N1,447,12400.0,,QUAIL WOODS,,DR,39.17371,-77.2545,5D,"(39.1737, -77.2545)"
201224207,2303,190003789,01/24/2019 03:25:00 PM,2019-01-24 14:03:00,01/24/2019 02:16:00 PM,23C,1,Crime Against Property,Shoplifting,LARCENY - SHOPLIFTING,WHEATON,11100 BLK  VEIRS MILL RD,SILVER SPRING,MD,20902.0,MCPD,Retail - Mall,L,4L2,321,11100.0,,VEIRS MILL,,RD,39.03758,-77.0519,4D,"(39.0376, -77.0519)"
201292603,5404,200024994,06/26/2020 11:40:22 PM,2020-06-26 23:40:00,06/26/2020 11:40:00 PM,90D,1,Crime Against Society,Driving Under the Influence,DRIVING UNDER THE INFLUENCE LIQUOR,SILVER SPRING,2900 BLK  MARLOW RD,SILVER SPRING,MD,20904.0,MCPD,Residence - Garage,I,3I1,377,2900.0,,MARLOW,,RD,39.0691,-76.9537,3D,"(39.0691, -76.9537)"
201348087,2305,210039721,10/05/2021 09:31:25 PM,2021-10-05 20:45:00,10/05/2021 08:50:00 PM,23F,1,Crime Against Property,Theft From Motor Vehicle,LARCENY - FROM AUTO,SILVER SPRING,8600 BLK  GEORGIA AVE,SILVER SPRING,MD,20910.0,MCPD,Street - Residential,G,3G1,108,8600.0,,GEORGIA,,AVE,38.99602,-77.0281,3D,"(38.996, -77.0281)"
201376904,2303,220021390,05/19/2022 05:29:46 PM,2022-05-19 16:40:00,,23C,1,Crime Against Property,Shoplifting,LARCENY - SHOPLIFTING,BETHESDA,7100 BLK  DEMOCRACY BLV,BETHESDA,MD,20817.0,MCPD,Retail - Mall,E,2E3,204,7100.0,,DEMOCRACY,,BLV,39.02207,-77.1473,2D,"(39.0221, -77.1473)"
201257008,2399,190044351,09/16/2019 03:02:05 PM,2019-09-04 07:00:00,09/16/2019 03:00:00 PM,23H,1,Crime Against Property,All other Larceny,LARCENY (DESCRIBE OFFENSE),TAKOMA PARK,6500 BLK  4TH AVE,TAKOMA PARK,MD,20912.0,TPPD,Residence - Single Family,T,8T1,802,6500.0,,4TH,,AVE,38.97009,-77.0025,TPPD,"(38.9701, -77.0025)"
201333541,2305,210021503,06/06/2021 04:25:14 PM,2021-06-06 14:00:00,06/06/2021 04:30:00 PM,23F,1,Crime Against Property,Theft From Motor Vehicle,LARCENY - FROM AUTO,BETHESDA,7100 BLK  WESTLAKE TER,BETHESDA,MD,20817.0,MCPD,Parking Lot - Commercial,E,2E3,520,7100.0,,WESTLAKE,,TER,39.02649,-77.1439,2D,"(39.0265, -77.1439)"
201357303,2303,210051372,12/17/2021 12:06:10 PM,2021-12-17 12:00:00,12/17/2021 12:06:00 PM,23C,1,Crime Against Property,Shoplifting,LARCENY - SHOPLIFTING,WHEATON,11100 BLK  VEIRS MILL RD,SILVER SPRING,MD,20902.0,MCPD,Retail - Other,L,4L2,321,11100.0,,VEIRS MILL,,RD,39.03758,-77.0519,4D,"(39.0376, -77.0519)"
201373660,5212,220017067,04/22/2022 09:07:05 AM,2022-04-22 09:02:00,04/22/2022 10:30:00 AM,520,1,Crime Against Society,Weapon Law Violations,WEAPON - POSSESSION,SILVER SPRING,200 BLK  VALLEY BROOK DR,SILVER SPRING,MD,20904.0,MCPD,School - Elementary/Secondary,I,3I1,150,200.0,,VALLEY BROOK,,DR,39.05932,-77.0064,3D,"(39.0593, -77.0064)"
201364220,2304,220006413,02/14/2022 12:36:55 PM,2022-01-29 13:00:00,01/29/2022 01:30:00 PM,23G,1,Crime Against Property,Theft of Motor Vehicle Parts or Accessories,LARCENY - AUTO PARTS,WHEATON,13500 BLK  CONNECTICUT AVE,SILVER SPRING,MD,20906.0,MCPD,Parking Lot - Commercial,K,4K2,337,13500.0,,CONNECTICUT,,AVE,39.07633,-77.0806,4D,"(39.0763, -77.0806)"
201337126,1114,210025903,07/06/2021 10:49:05 AM,2021-07-06 10:49:00,,11B,1,Crime Against Person,Forcible Sodomy,SEX ASSAULT - SODOMY-GIRL-STRONG-ARM,SILVER SPRING,1100 BLK  WAYNE AVE,SILVER SPRING,MD,20910.0,MCPD,Residence - Apartment/Condo,G,3G1,094,1100.0,,WAYNE,,AVE,38.99454,-77.028,3D,"(38.9945, -77.028)"
201278410,3562,200008339,02/19/2020 05:47:03 PM,2020-02-19 17:47:00,,35A,1,Crime Against Society,Drug/Narcotic Violations,DRUGS - MARIJUANA - POSSESS,SILVER SPRING,1700 BLK  APRIL LA,SILVER SPRING,MD,20904.0,MCPD,Street - In vehicle,I,3I1,145,1700.0,,APRIL,,LA,39.04653,-76.9772,3D,"(39.0465, -76.9772)"
201320374,2308,210006447,02/19/2021 10:31:11 AM,2021-02-17 03:00:00,02/19/2021 10:27:00 AM,23D,1,Crime Against Property,Theft from Building,LARCENY - FROM BLDG,MONTGOMERY VILLAGE,18700 BLK N FREDERICK AVE,GAITHERSBURG,MD,20879.0,GPD,Residence - Apartment/Condo,R,6R2,545,18700.0,N,FREDERICK,,AVE,39.1626,-77.2252,6D,"(39.1626, -77.2252)"
201326593,2902,210013105,04/08/2021 11:43:35 AM,2021-03-31 13:00:00,03/31/2021 03:00:00 PM,290,1,Crime Against Property,Destruction/Damage/Vandalism of Property,DAMAGE PROPERTY - PRIVATE,MONTGOMERY VILLAGE,100 BLK  ELLINGTON BLV,GAITHERSBURG,MD,20878.0,MCPD,Street - Commercial,P,6P1,441,100.0,,ELLINGTON,,BLV,39.1158,-77.2038,6D,"(39.1158, -77.2038)"
201425378,3582,230021406,05/04/2023 05:44:23 PM,2023-05-04 17:44:00,,35A,1,Crime Against Society,Drug/Narcotic Violations,DRUGS - BARBITURATE - POSSESS,MONTGOMERY VILLAGE,400 BLK  QUINCE ORCHARD RD,GAITHERSBURG,MD,20878.0,GPD,Hotel/Motel/Etc.,P,6P2,445,400.0,,QUINCE ORCHARD,,RD,39.14797,-77.2181,6D,"(39.148, -77.2181)"
201225013,2404,190004832,01/31/2019 07:10:59 AM,2019-01-30 20:00:00,01/31/2019 05:50:00 AM,240,1,Crime Against Property,Motor Vehicle Theft,AUTO THEFT - VEHICLE THEFT,WHEATON,11500 BLK  NAIRN RD,SILVER SPRING,MD,20902.0,MCPD,Street - Alley,L,4L1,359,11500.0,,NAIRN,,RD,39.04515,-77.0429,4D,"(39.0452, -77.0429)"
201241518,2202,190025395,05/28/2019 04:38:32 PM,2019-05-28 16:38:00,,220,1,Crime Against Property,Burglary/Breaking and Entering,BURGLARY - FORCED ENTRY-RESIDENTIAL,WHEATON,3200 BLK  WEEPING WILLOW CT,SILVER SPRING,MD,20906.0,MCPD,Residence - Apartment/Condo,K,4K1,348,3200.0,,WEEPING WILLOW,,CT,39.08999,-77.0691,4D,"(39.09, -77.0691)"
201419755,2610,230015058,03/28/2023 08:31:21 PM,2023-03-28 12:00:00,03/28/2023 12:00:00 PM,26F,1,Crime Against Property,Identity Theft,IDENTITY THEFT,MONTGOMERY VILLAGE,20000 BLK  AMESBURG WAY,MONTGOMERY VILLAGE,MD,20886.0,MCPD,Other/Unknown,R,6R3,719,20000.0,,AMESBURG,,WAY,39.18472,-77.182,6D,"(39.1847, -77.182)"
201275357,1399,200004485,01/27/2020 03:47:24 PM,2020-01-27 15:47:00,,13B,1,Crime Against Person,Simple Assault,ASSAULT - 2ND DEGREE,SILVER SPRING,8800 BLK  GARLAND AVE,SILVER SPRING,MD,20901.0,MCPD,Library,H,3H1,127,8800.0,,GARLAND,,AVE,39.00052,-77.0015,3D,"(39.0005, -77.0015)"
201278518,2999,200007610,02/14/2020 08:23:56 PM,2020-02-20 19:45:00,,290,1,Crime Against Property,Destruction/Damage/Vandalism of Property,DAMAGE PROPERTY (DESCRIBE OFFENSE),SILVER SPRING,900 BLK  BONIFANT ST,SILVER SPRING,MD,20910.0,MCPD,Parking Lot - Residential,G,3G1,670,900.0,,BONIFANT,,ST,38.99442,-77.0241,3D,"(38.9944, -77.0241)"
201364275,2303,220005333,,2021-12-10 18:36:00,02/07/2022 12:00:00 AM,23C,1,Crime Against Property,Shoplifting,LARCENY - SHOPLIFTING,SILVER SPRING,12000 BLK  CHERRY HILL RD,SILVER SPRING,MD,20904.0,MCPD,Retail - Department/Discount Store,I,3I1,146,12000.0,,CHERRY HILL,,RD,39.05259,-76.9531,3D,"(39.0526, -76.9531)"
201436097,2610,230034777,07/21/2023 04:27:37 PM,2023-07-21 09:00:00,07/21/2023 09:00:00 AM,26F,1,Crime Against Property,Identity Theft,IDENTITY THEFT,BETHESDA,3500 BLK  WOODBINE ST,CHEVY CHASE,MD,20815.0,MCPD,Other/Unknown,D,2D1,011,3500.0,,WOODBINE,,ST,38.98506,-77.0692,2D,"(38.9851, -77.0692)"
201268569,2903,190059148,,2019-12-08 08:24:00,12/08/2019 08:24:00 AM,290,1,Crime Against Property,Destruction/Damage/Vandalism of Property,DAMAGE PROPERTY - PUBLIC,ROCKVILLE,13200 BLK  ATLANTIC AVE,ROCKVILLE,MD,20851.0,RCPD,Street - Other,A,1A2,299,13200.0,,ATLANTIC,,AVE,39.07353,-77.1157,1D,"(39.0735, -77.1157)"
201359159,2404,220000194,01/02/2022 04:51:21 PM,2022-01-02 16:51:00,,240,1,Crime Against Property,Motor Vehicle Theft,AUTO THEFT - VEHICLE THEFT,WHEATON,,OLNEY,MD,20832.0,MCPD,Residence - Driveway,J,4J2,681,,,OLNEY SANDY SPRING,,RD,39.14985,-77.0583,4D,"(39.1499, -77.0583)"
201255079,3550,190041556,08/30/2019 03:13:20 PM,2019-08-30 15:14:00,,35B,1,Crime Against Society,Drug Equipment Violations,DRUGS - NARCOTIC EQUIP - POSSESS,GERMANTOWN,,GERMANTOWN,MD,20876.0,MCPD,Street - In vehicle,M,5M1,468,,,MIDDLEBROOK,,RD,39.17603,-77.2458,5D,"(39.176, -77.2458)"
201288290,2309,200019820,05/17/2020 06:43:20 PM,2020-05-17 18:30:00,,23H,1,Crime Against Property,All other Larceny,LARCENY - FROM YARDS,MONTGOMERY VILLAGE,8300 BLK  FAIRHAVEN DR,GAITHERSBURG,MD,20877.0,MCPD,Residence - Yard,P,6P3,551,8300.0,,FAIRHAVEN,,DR,39.14447,-77.171,6D,"(39.1445, -77.171)"
201276489,2999,200005873,02/04/2020 08:13:03 PM,2020-02-04 20:13:00,,290,1,Crime Against Property,Destruction/Damage/Vandalism of Property,DAMAGE PROPERTY (DESCRIBE OFFENSE),ROCKVILLE,15900 BLK  INDIAN HILLS TER,DERWOOD,MD,20855.0,MCPD,Residence -Townhouse/Duplex,A,1A4,281,15900.0,,INDIAN HILLS,,TER,39.11715,-77.1533,1D,"(39.1172, -77.1533)"
201340538,2610,210029440,07/29/2021 02:33:17 PM,2021-07-29 00:00:00,,26F,1,Crime Against Property,Identity Theft,FRAUD - IDENTITY THEFT,BETHESDA,7000 BLK  ARLINGTON RD,BETHESDA,MD,20814.0,MCPD,Auto Dealership,D,2D2,031,7000.0,,ARLINGTON,,RD,38.97918,-77.0987,2D,"(38.9792, -77.0987)"
201410898,2305,230004707,01/29/2023 06:36:04 AM,2023-01-28 20:15:00,01/29/2023 06:15:00 AM,23F,1,Crime Against Property,Theft From Motor Vehicle,LARCENY - FROM AUTO,GERMANTOWN,20200 BLK  GOLDENROD LA,GERMANTOWN,MD,20876.0,MCPD,Parking Lot - Commercial,M,5M1,468,20200.0,,GOLDENROD,,LA,39.18414,-77.2456,5D,"(39.1841, -77.2456)"
201397097,5404,220045437,10/16/2022 11:53:18 PM,2022-10-16 23:53:00,,90D,1,Crime Against Society,Driving Under the Influence,DRIVING UNDER THE INFLUENCE LIQUOR,GERMANTOWN,,GERMANTOWN,MD,20876.0,MCPD,Street - In vehicle,M,5M3,474,,,RIDGE,,RD,39.30489,-77.1976,5D,"(39.3049, -77.1976)"
201338050,2901,210027095,07/14/2021 04:11:26 AM,2021-07-14 04:08:00,07/14/2021 04:08:00 AM,290,1,Crime Against Property,Destruction/Damage/Vandalism of Property,DAMAGE PROPERTY - BUSINESS,ROCKVILLE,15200 BLK  SHADY GROVE RD,ROCKVILLE,MD,20850.0,RCPD,Retail - Drug Store/Pharmacy,B,1B1,241,15200.0,,SHADY GROVE,,RD,39.10347,-77.1907,1D,"(39.1035, -77.1907)"
201241818,4104,190024800,05/24/2019 08:54:02 PM,2019-05-24 21:00:00,05/24/2019 09:00:00 PM,90G,1,Crime Against Society,Liquor Law Violations,LIQUOR - POSSESS,SILVER SPRING,8000 BLK  13TH ST,SILVER SPRING,MD,20910.0,MCPD,Street - Commercial,G,3G1,090,8000.0,,13TH,,ST,38.98692,-77.0296,3D,"(38.9869, -77.0296)"
201339468,2610,210028925,07/26/2021 12:56:18 PM,2021-07-26 12:35:00,,26F,1,Crime Against Property,Identity Theft,FRAUD - IDENTITY THEFT,ROCKVILLE,1  BLK  COURTHOUSE SQ,ROCKVILLE,MD,20850.0,MCPD,Other/Unknown,A,1A3,276,1.0,,COURTHOUSE,,SQ,39.08418,-77.1529,1D,"(39.0842, -77.1529)"
201313020,2303,200049307,12/14/2020 09:37:20 PM,2020-12-14 21:37:00,,23C,1,Crime Against Property,Shoplifting,LARCENY - SHOPLIFTING,WHEATON,11100 BLK  VEIRS MILL RD,SILVER SPRING,MD,20902.0,MCPD,Retail - Department/Discount Store,L,4L2,321,11100.0,,VEIRS MILL,,RD,39.03758,-77.0519,4D,"(39.0376, -77.0519)"
201383316,2303,220029117,07/07/2022 11:36:56 AM,2022-07-07 11:40:00,,23C,1,Crime Against Property,Shoplifting,LARCENY - SHOPLIFTING,TAKOMA PARK,1300 BLK  UNIVERSITY BLV,TAKOMA PARK,MD,20912.0,TPPD,Retail - Drug Store/Pharmacy,T,8T3,807,1300.0,,UNIVERSITY,,BLV,39.03657,-77.0309,TPPD,"(39.0366, -77.0309)"
201301744,2399,200035768,09/12/2020 01:32:27 PM,2020-09-12 11:14:00,09/12/2020 11:40:00 AM,23H,1,Crime Against Property,All other Larceny,LARCENY (DESCRIBE OFFENSE),GERMANTOWN,20300 BLK  FOXWOOD TER,GERMANTOWN,MD,20876.0,MCPD,Residence - Other,M,5M1,471,20300.0,,FOXWOOD,,TER,39.19336,-77.2354,5D,"(39.1934, -77.2354)"
201319020,2902,210004819,02/06/2021 11:29:40 PM,2020-10-01 00:00:00,02/06/2021 11:29:00 PM,290,1,Crime Against Property,Destruction/Damage/Vandalism of Property,DAMAGE PROPERTY - PRIVATE,SILVER SPRING,11200 BLK  OAK LEAF DR,SILVER SPRING,MD,20901.0,MCPD,Residence - Apartment/Condo,H,3H2,144,11200.0,,OAK LEAF,,DR,39.03844,-76.9949,3D,"(39.0384, -76.9949)"
201264433,2303,190054028,11/09/2019 12:53:19 PM,2019-11-09 12:30:00,11/09/2019 12:50:00 PM,23C,1,Crime Against Property,Shoplifting,LARCENY - SHOPLIFTING,WHEATON,11100 BLK  VEIRS MILL RD,SILVER SPRING,MD,20902.0,MCPD,Retail - Sporting Goods,L,4L2,321,11100.0,,VEIRS MILL,,RD,39.03758,-77.0519,4D,"(39.0376, -77.0519)"
201277358,1399,200007012,02/11/2020 07:47:24 PM,2020-02-11 19:47:00,02/11/2020 07:47:00 PM,13B,1,Crime Against Person,Simple Assault,ASSAULT - 2ND DEGREE,WHEATON,18000 BLK  GEORGIA AVE,OLNEY,MD,20832.0,MCPD,Restaurant,J,4J2,399,18000.0,,GEORGIA,,AVE,39.15129,-77.0668,4D,"(39.1513, -77.0668)"
201415257,2901,230009835,02/27/2023 05:49:00 PM,2023-02-27 17:49:00,,290,1,Crime Against Property,Destruction/Damage/Vandalism of Property,DAMAGE PROPERTY - BUSINESS,BETHESDA,9300 BLK  WADSWORTH DR,BETHESDA,MD,20817.0,MCPD,School - Elementary/Secondary,E,2E2,068,9300.0,,WADSWORTH,,DR,39.00844,-77.1275,2D,"(39.0084, -77.1275)"
201335059,1399,210023398,06/18/2021 06:17:31 PM,2021-06-18 18:17:00,,13B,1,Crime Against Person,Simple Assault,ASSAULT - 2ND DEGREE,WHEATON,1100 BLK  UNIVERSITY BLV W,SILVER SPRING,MD,20902.0,MCPD,Pool,L,4L1,360,1100.0,,UNIVERSITY,W,BLV,39.03585,-77.0268,4D,"(39.0359, -77.0268)"
201260981,3562,190049569,,2019-10-15 12:50:00,10/16/2019 08:00:00 AM,35A,1,Crime Against Society,Drug/Narcotic Violations,DRUGS - MARIJUANA - POSSESS,ROCKVILLE,2100 BLK  BALTIMORE RD,ROCKVILLE,MD,20851.0,MCPD,School/College - DO NOT USE,A,1A2,290,2100.0,,BALTIMORE,,RD,39.08472,-77.1183,1D,"(39.0847, -77.1183)"
201319824,2308,210005783,02/14/2021 02:58:20 AM,2021-02-14 02:58:00,,23D,1,Crime Against Property,Theft from Building,LARCENY - FROM BLDG,GERMANTOWN,18000 BLK  CHALET DR,GERMANTOWN,MD,20874.0,MCPD,Residence - Apartment/Condo,N,5N2,448,18000.0,,CHALET,,DR,39.15523,-77.2729,5D,"(39.1552, -77.2729)"
201259668,2305,190047400,10/03/2019 10:34:38 AM,2019-10-02 21:00:00,10/03/2019 07:30:00 AM,23F,1,Crime Against Property,Theft From Motor Vehicle,LARCENY - FROM AUTO,SILVER SPRING,8000 BLK  KENNETT ST,SILVER SPRING,MD,20910.0,MCPD,Parking Garage - Commercial,G,3G1,090,8000.0,,KENNETT,,ST,38.98728,-77.0277,3D,"(38.9873, -77.0277)"
201384825,2399,220030976,07/19/2022 06:52:26 AM,2022-07-19 06:51:00,07/19/2022 06:51:00 AM,23H,1,Crime Against Property,All other Larceny,LARCENY (DESCRIBE OFFENSE),TAKOMA PARK,600 BLK  ETHAN ALLEN AVE,TAKOMA PARK,MD,20912.0,TPPD,Street - Other,T,8T3,808,600.0,,ETHAN ALLEN,,AVE,38.97618,-76.9968,TPPD,"(38.9762, -76.9968)"
201395849,2309,220044104,10/09/2022 09:56:27 AM,2022-10-11 17:17:00,,23H,1,Crime Against Property,All other Larceny,LARCENY - FROM YARDS,WHEATON,16900 BLK  NORWOOD RD,SANDY SPRING,MD,20860.0,MCPD,School - Elementary/Secondary,J,4J1,390,16900.0,,NORWOOD,,RD,39.13355,-77.0307,4D,"(39.1336, -77.0307)"
201239779,5311,190023253,05/17/2019 02:53:17 AM,2019-05-17 03:16:00,,90C,1,Crime Against Society,Disorderly Conduct,PUBLIC PEACE - DISORDERLY CONDUCT,WHEATON,2400 BLK  ENNALLS AVE,SILVER SPRING,MD,20902.0,MCPD,Street - Commercial,L,4L2,324,2400.0,,ENNALLS,,AVE,39.04096,-77.0515,4D,"(39.041, -77.0515)"
201270901,2316,190061981,12/24/2019 04:55:46 PM,2019-08-02 12:00:00,12/12/2019 01:30:00 PM,23H,1,Crime Against Property,All other Larceny,LARCENY - POSTAL,BETHESDA,10900 BLK  CONNECTICUT AVE,KENSINGTON,MD,20895.0,MCPD,Residence - Apartment/Condo,D,2D3,312,10900.0,,CONNECTICUT,,AVE,39.0347,-77.0751,2D,"(39.0347, -77.0751)"
201319381,2902,210004812,02/06/2021 11:13:43 PM,2021-02-06 23:13:00,,290,1,Crime Against Property,Destruction/Damage/Vandalism of Property,DAMAGE PROPERTY - PRIVATE,SILVER SPRING,1100 BLK  BONIFANT ST,SILVER SPRING,MD,20910.0,MCPD,Parking Garage - County,G,3G1,094,1100.0,,BONIFANT,,ST,38.99339,-77.0279,3D,"(38.9934, -77.0279)"
201335132,1399,210023424,06/18/2021 09:16:45 PM,2021-06-18 21:16:00,06/18/2021 08:30:00 PM,13B,2,Crime Against Person,Simple Assault,ASSAULT - 2ND DEGREE,ROCKVILLE,200 BLK  FREDERICK AVE,ROCKVILLE,MD,20850.0,RCPD,Residence - Single Family,A,1A3,743,200.0,,FREDERICK,,AVE,39.09454,-77.1506,1D,"(39.0945, -77.1506)"
201440826,2901,230051007,08/24/2023 07:40:10 AM,2023-08-23 22:30:00,08/24/2023 07:15:00 AM,290,1,Crime Against Property,Destruction/Damage/Vandalism of Property,DAMAGE PROPERTY - BUSINESS,SILVER SPRING,14900 BLK  SADDLE CREEK DR,BURTONSVILLE,MD,20866.0,MCPD,Street - Residential,I,3I2,381,14900.0,,SADDLE CREEK,,DR,39.1003,-76.918,3D,"(39.1003, -76.918)"
201246595,5404,190031802,07/03/2019 10:33:09 PM,2019-07-03 22:27:00,,90D,1,Crime Against Society,Driving Under the Influence,DRIVING UNDER THE INFLUENCE LIQUOR,ROCKVILLE,,ROCKVILLE,MD,20852.0,MCPD,Street - In vehicle,A,1A2,306,,,RANDOLPH,,RD,39.07542,-77.0039,1D,"(39.0754, -77.0039)"
201363276,3562,220005140,02/06/2022 12:04:43 PM,2022-02-06 12:04:00,02/06/2022 07:00:00 PM,35A,1,Crime Against Society,Drug/Narcotic Violations,DRUGS - MARIJUANA - POSSESS,SILVER SPRING,600 BLK  UNIVERSITY BLV E,SILVER SPRING,MD,20901.0,MCPD,Street - In vehicle,H,3H1,128,600.0,,UNIVERSITY,E,BLV,39.00254,-76.9957,3D,"(39.0025, -76.9957)"
201229476,3562,190010363,03/05/2019 10:40:44 PM,2019-03-05 22:40:00,,35A,1,Crime Against Society,Drug/Narcotic Violations,DRUGS - MARIJUANA - POSSESS,SILVER SPRING,3000 BLK  FAIRLAND RD,SILVER SPRING,MD,20904.0,MCPD,Street - In vehicle,I,3I1,377,3000.0,,FAIRLAND,,RD,39.06764,-76.9499,3D,"(39.0676, -76.9499)"
201337255,1103,210026050,07/07/2021 11:15:30 AM,2021-07-05 03:00:00,07/06/2021 04:00:00 AM,11A,1,Crime Against Person,Forcible Rape,RAPE - STRONG-ARM,MONTGOMERY VILLAGE,700 BLK  CLOPPER RD,GAITHERSBURG,MD,20878.0,GPD,Residence - Apartment/Condo,P,6P2,555,700.0,,CLOPPER,,RD,39.14368,-77.2237,6D,"(39.1437, -77.2237)"
201235056,1399,190017271,04/13/2019 02:42:13 PM,2019-04-13 14:42:00,,13B,2,Crime Against Person,Simple Assault,ASSAULT - 2ND DEGREE,GERMANTOWN,19900 BLK  SWEETGUM CIR,GERMANTOWN,MD,20874.0,MCPD,Residence - Apartment/Condo,N,5N1,465,19900.0,,SWEETGUM,,CIR,39.18314,-77.276,5D,"(39.1831, -77.276)"
201317152,5404,210002542,01/20/2021 08:18:09 PM,2021-01-20 20:18:00,01/20/2021 08:18:00 PM,90D,1,Crime Against Society,Driving Under the Influence,DRIVING UNDER THE INFLUENCE LIQUOR,SILVER SPRING,11600 BLK  LOCKWOOD DR,SILVER SPRING,MD,20904.0,MCPD,Street - Residential,I,3I1,145,11600.0,,LOCKWOOD,,DR,39.04129,-76.9851,3D,"(39.0413, -76.9851)"
201241506,2610,190025446,05/28/2019 08:42:08 PM,2019-04-02 15:00:00,,26F,1,Crime Against Property,Identity Theft,FRAUD - IDENTITY THEFT,BETHESDA,7200 BLK  CHESTNUT ST,CHEVY CHASE,MD,20815.0,MCPD,Other/Unknown,D,2D1,009,7200.0,,CHESTNUT,,ST,38.98117,-77.07,2D,"(38.9812, -77.07)"
201407463,2399,230000365,01/03/2023 04:36:22 PM,2022-11-12 00:00:00,,23H,1,Crime Against Property,All other Larceny,LARCENY (DESCRIBE OFFENSE),WHEATON,2800 BLK  BEL PRE RD,SILVER SPRING,,20906.0,MCPD,Residence - Single Family,K,4K1,532,2800.0,,BEL PRE,,RD,39.09038,-77.0564,4D,"(39.0904, -77.0564)"
201234171,5404,190016216,04/07/2019 11:50:19 PM,2019-04-07 23:50:00,04/08/2019 01:50:00 AM,90D,1,Crime Against Society,Driving Under the Influence,DRIVING UNDER THE INFLUENCE LIQUOR,SILVER SPRING,,SILVER SPRING,MD,20993.0,MCPD,Street - In vehicle,H,3H2,142,,,NEW HAMPSHIRE,,AVE,38.97994,-76.9899,3D,"(38.9799, -76.9899)"
201241227,2202,190025138,05/27/2019 02:32:24 AM,2019-05-27 00:00:00,05/27/2019 12:00:00 AM,220,1,Crime Against Property,Burglary/Breaking and Entering,BURGLARY - FORCED ENTRY-RESIDENTIAL,BETHESDA,9400 BLK  BYEFORDE RD,KENSINGTON,MD,20895.0,MCPD,Residence - Single Family,D,2D3,184,9400.0,,BYEFORDE,,RD,39.0095,-77.0824,2D,"(39.0095, -77.0824)"
201415274,3699,230009875,02/27/2023 09:55:40 PM,2023-02-27 21:55:00,,11D,1,Crime Against Person,Forcible Fondling,SEX OFFENSE - FONDLING,BETHESDA,8700 BLK  BROOKVILLE RD,SILVER SPRING,MD,20910.0,MCPD,Government Building,D,2D3,079,8700.0,,BROOKVILLE,,RD,38.9986,-77.0561,2D,"(38.9986, -77.0561)"
201444732,3532,230054736,,2023-09-13 22:00:00,,35A,1,Crime Against Society,Drug/Narcotic Violations,DRUGS - COCAINE - POSSESS,MONTGOMERY VILLAGE,,GAITHERSBURG,,20879.0,GPD,Street - In vehicle,R,6R2,545,,N,FREDERICK,,AVE,39.09474,-77.1492,6D,"(39.0947, -77.1492)"
201410120,2399,230003775,01/23/2023 05:47:42 PM,2023-01-21 19:07:00,01/23/2023 02:47:00 PM,23H,1,Crime Against Property,All other Larceny,LARCENY (DESCRIBE OFFENSE),TAKOMA PARK,400 BLK  CIRCLE AVE,TAKOMA PARK,MD,20912.0,TPPD,Residence - Single Family,T,8T3,808,400.0,,CIRCLE,,AVE,38.97314,-77.0005,TPPD,"(38.9731, -77.0005)"
201353284,2404,210046072,11/13/2021 04:26:48 PM,2021-11-13 16:26:00,,240,1,Crime Against Property,Motor Vehicle Theft,AUTO THEFT - VEHICLE THEFT,SILVER SPRING,8700 BLK  GEORGIA AVE,SILVER SPRING,MD,20910.0,MCPD,Street - Commercial,G,3G1,095,8700.0,,GEORGIA,,AVE,38.99752,-77.0297,3D,"(38.9975, -77.0297)"
201302202,1313,200036308,09/16/2020 01:25:21 PM,2020-09-16 13:25:00,,13B,1,Crime Against Person,Simple Assault,ASSAULT - SIMPLE,GERMANTOWN,12800 BLK  PINNACLE DR,GERMANTOWN,MD,20874.0,MCPD,Residence - Apartment/Condo,N,5N1,702,12800.0,,PINNACLE,,DR,39.18063,-77.2635,5D,"(39.1806, -77.2635)"
201253433,2610,190040219,08/22/2019 04:28:37 PM,2019-08-19 21:30:00,,26F,1,Crime Against Property,Identity Theft,FRAUD - IDENTITY THEFT,MONTGOMERY VILLAGE,8200 BLK  CAMBOURNE CT,GAITHERSBURG,MD,20877.0,MCPD,Residence - Single Family,P,6P3,551,8200.0,,CAMBOURNE,,CT,39.14284,-77.1666,6D,"(39.1428, -77.1666)"
201390528,5404,220037142,08/27/2022 11:44:52 PM,2022-08-27 23:49:00,08/27/2022 11:49:00 PM,90D,1,Crime Against Society,Driving Under the Influence,DRIVING UNDER THE INFLUENCE LIQUOR,MONTGOMERY VILLAGE,18200 BLK  MONTGOMERY VILLAGE AVE,MONTGOMERY VILLAGE,MD,20886.0,MCPD,Street - In vehicle,R,6R1,548,18200.0,,MONTGOMERY VILLAGE,,AVE,39.15635,-77.2066,6D,"(39.1564, -77.2066)"
201231119,3562,190011982,03/15/2019 01:12:58 PM,2019-03-15 19:36:00,,35A,1,Crime Against Society,Drug/Narcotic Violations,DRUGS - MARIJUANA - POSSESS,BETHESDA,,BETHESDA,MD,20817.0,MCPD,Street - In vehicle,E,2E2,664,,,WESTLAKE,,TER,39.0268,-77.1461,2D,"(39.0268, -77.1461)"
201242530,2305,190026715,06/04/2019 05:37:42 PM,2019-06-03 21:00:00,06/04/2019 05:30:00 AM,23F,1,Crime Against Property,Theft From Motor Vehicle,LARCENY - FROM AUTO,MONTGOMERY VILLAGE,17600 BLK  LARCHMONT TER,GAITHERSBURG,MD,20877.0,MCPD,Parking Lot - Residential,P,6P3,767,17600.0,,LARCHMONT,,TER,39.14646,-77.1737,6D,"(39.1465, -77.1737)"
201232631,2303,190014350,03/28/2019 12:32:14 PM,2019-03-28 12:32:00,03/28/2019 01:00:00 PM,23C,1,Crime Against Property,Shoplifting,LARCENY - SHOPLIFTING,ROCKVILLE,800 BLK  ROCKVILLE PIK,ROCKVILLE,MD,20852.0,RCPD,Grocery/Supermarket,A,1A1,263,800.0,,ROCKVILLE,,PIK,39.07757,-77.14,1D,"(39.0776, -77.14)"
201338207,2304,210027286,07/15/2021 08:53:09 AM,2021-07-13 21:00:00,07/14/2021 03:00:00 PM,23G,1,Crime Against Property,Theft of Motor Vehicle Parts or Accessories,LARCENY - AUTO PARTS,BETHESDA,5600 BLK  FOREST PL,BETHESDA,MD,20814.0,MCPD,Street - Residential,E,2E2,071,5600.0,,FOREST,,PL,39.01274,-77.1134,2D,"(39.0127, -77.1134)"
201304476,2305,200038900,10/03/2020 05:40:06 AM,2020-10-03 05:40:00,,23F,1,Crime Against Property,Theft From Motor Vehicle,LARCENY - FROM AUTO,WHEATON,13000 BLK  FLACK ST,SILVER SPRING,MD,20906.0,MCPD,Residence - Driveway,K,4K2,336,13000.0,,FLACK,,ST,39.06891,-77.0631,4D,"(39.0689, -77.0631)"
201266307,2303,190056284,11/21/2019 02:08:05 PM,2019-11-21 14:08:00,11/21/2019 04:30:00 PM,23C,1,Crime Against Property,Shoplifting,LARCENY - SHOPLIFTING,SILVER SPRING,8600 BLK  COLESVILLE RD,SILVER SPRING,MD,20910.0,MCPD,Retail - Department/Discount Store,G,3G1,109,8600.0,,COLESVILLE,,RD,38.99602,-77.0281,3D,"(38.996, -77.0281)"
201317118,2505,210002492,01/20/2021 02:06:07 PM,2021-01-20 14:06:00,,250,1,Crime Against Property,Counterfeiting/Forgery,COUNTERFEITING - PASS COUNTERFEITED,SILVER SPRING,15600 BLK  OLD COLUMBIA PIK,BURTONSVILLE,MD,20866.0,MCPD,Bank/S&L/Credit Union,I,3I2,383,15600.0,,OLD COLUMBIA,,PIK,39.11131,-76.932,3D,"(39.1113, -76.932)"
201232829,2303,190014457,03/28/2019 08:39:18 PM,2019-03-28 20:30:00,,23C,1,Crime Against Property,Shoplifting,LARCENY - SHOPLIFTING,SILVER SPRING,8200 BLK  GEORGIA AVE,SILVER SPRING,MD,20910.0,MCPD,Convenience Store,G,3G1,094,8200.0,,GEORGIA,,AVE,38.99163,-77.0266,3D,"(38.9916, -77.0266)"
201378064,1399,220022806,05/28/2022 08:47:17 AM,2022-05-28 08:47:00,,13B,1,Crime Against Person,Simple Assault,ASSAULT - 2ND DEGREE,MONTGOMERY VILLAGE,10100 BLK  WASHINGTONIAN BLV,GAITHERSBURG,MD,20878.0,MCPD,Parking Lot - Other,P,6P1,549,10100.0,,WASHINGTONIAN,,BLV,39.11914,-77.206,6D,"(39.1191, -77.206)"
201273949,2305,200002766,01/16/2020 09:39:56 PM,2020-01-15 15:00:00,01/16/2020 09:10:00 AM,23F,1,Crime Against Property,Theft From Motor Vehicle,LARCENY - FROM AUTO,WHEATON,14000 BLK  BREEZE HILL LA,SILVER SPRING,MD,20906.0,MCPD,Residence - Driveway,K,4K1,348,14000.0,,BREEZE HILL,,LA,39.08345,-77.0636,4D,"(39.0834, -77.0636)"
201271761,5707,200000012,01/01/2020 12:48:33 AM,2020-01-01 00:48:00,,90J,1,Crime Against Society,Trespass of Real Property,TRESPASSING,ROCKVILLE,1  BLK  TAFT CT,ROCKVILLE,MD,20850.0,RCPD,Government Building,A,1A2,287,1.0,,TAFT,,CT,39.09423,-77.1325,1D,"(39.0942, -77.1325)"
201376285,1399,220020730,05/15/2022 06:57:55 PM,2022-05-15 18:57:00,,13B,1,Crime Against Person,Simple Assault,ASSAULT - 2ND DEGREE,MONTGOMERY VILLAGE,700 BLK  QUINCE ORCHARD BLV,GAITHERSBURG,MD,20878.0,GPD,Residence - Apartment/Condo,P,6P2,554,700.0,,QUINCE ORCHARD,,BLV,39.14181,-77.2244,6D,"(39.1418, -77.2244)"
201281933,1313,200012654,03/14/2020 08:09:47 PM,2020-03-14 20:09:00,,13B,2,Crime Against Person,Simple Assault,ASSAULT - SIMPLE,SILVER SPRING,400 BLK  LEGATO TER,SILVER SPRING,MD,20901.0,MCPD,Residence -Townhouse/Duplex,H,3H2,152,400.0,,LEGATO,,TER,39.04006,-76.9985,3D,"(39.0401, -76.9985)"
201297159,2501,200030296,08/04/2020 06:52:43 PM,2019-11-22 07:00:00,,250,1,Crime Against Property,Counterfeiting/Forgery,FORGERY OF CHECKS,WHEATON,18000 BLK  CASHELL RD,OLNEY,MD,20832.0,MCPD,Other/Unknown,J,4J2,539,18000.0,,CASHELL,,RD,39.15144,-77.0931,4D,"(39.1514, -77.0931)"
201274158,2399,200003032,01/18/2020 06:21:14 PM,2020-01-18 17:54:00,,23H,1,Crime Against Property,All other Larceny,LARCENY (DESCRIBE OFFENSE),SILVER SPRING,8600 BLK  COLESVILLE RD,SILVER SPRING,MD,20910.0,MCPD,Restaurant,G,3G1,109,8600.0,,COLESVILLE,,RD,38.99602,-77.0281,3D,"(38.996, -77.0281)"
201323411,1399,210009459,03/13/2021 12:33:32 PM,2021-03-06 12:15:00,03/06/2021 12:30:00 PM,13B,1,Crime Against Person,Simple Assault,ASSAULT - 2ND DEGREE,WHEATON,12200 BLK  VEIRS MILL RD,SILVER SPRING,MD,20906.0,MCPD,Retail - Drug Store/Pharmacy,K,4K2,525,12200.0,,VEIRS MILL,,RD,39.05614,-77.0826,4D,"(39.0561, -77.0826)"
201275566,2308,200004340,01/26/2020 08:31:04 PM,2019-12-13 00:01:00,01/26/2020 06:00:00 PM,23D,1,Crime Against Property,Theft from Building,LARCENY - FROM BLDG,WHEATON,10800 BLK  BUCKNELL DR,SILVER SPRING,MD,20902.0,MCPD,Residence - Other,L,4L2,170,10800.0,,BUCKNELL,,DR,39.03267,-77.0454,4D,"(39.0327, -77.0454)"
201361391,2308,220002930,01/23/2022 10:25:21 AM,2022-01-12 09:00:00,01/12/2022 02:30:00 PM,23D,1,Crime Against Property,Theft from Building,LARCENY - FROM BLDG,MONTGOMERY VILLAGE,9900 BLK  MEDICAL CENTER DR,ROCKVILLE,MD,20850.0,MCPD,Hospital/Emergency Care Center,P,6P1,721,9900.0,,MEDICAL CENTER,,DR,39.09661,-77.1993,6D,"(39.0966, -77.1993)"
201423083,2901,230018973,04/20/2023 11:52:23 PM,2023-04-20 23:30:00,04/21/2023 11:52:00 PM,290,1,Crime Against Property,Destruction/Damage/Vandalism of Property,DAMAGE PROPERTY - BUSINESS,TAKOMA PARK,6900 BLK  NEW HAMPSHIRE AVE,TAKOMA PARK,MD,20912.0,TPPD,Gas Station,T,8T3,808,6900.0,,NEW HAMPSHIRE,,AVE,38.9756,-76.9939,TPPD,"(38.9756, -76.9939)"
201222768,5311,190002007,01/13/2019 09:21:49 AM,2019-01-13 09:21:00,,90C,1,Crime Against Society,Disorderly Conduct,PUBLIC PEACE - DISORDERLY CONDUCT,ROCKVILLE,600 BLK  BLANDFORD ST,ROCKVILLE,MD,20850.0,RCPD,Street - Residential,A,1A1,260,600.0,,BLANDFORD,,ST,39.07754,-77.1508,1D,"(39.0775, -77.1508)"
201329665,2610,210016837,05/05/2021 10:54:02 AM,2021-04-15 00:00:00,,26F,1,Crime Against Property,Identity Theft,FRAUD - IDENTITY THEFT,GERMANTOWN,24300 BLK  STRINGTOWN RD,CLARKSBURG,MD,20871.0,MCPD,Other/Unknown,M,5M3,608,24300.0,,STRINGTOWN,,RD,39.25494,-77.2518,5D,"(39.2549, -77.2518)"
201268706,5311,190059300,12/09/2019 12:12:52 PM,2019-12-09 12:12:00,,90C,1,Crime Against Society,Disorderly Conduct,PUBLIC PEACE - DISORDERLY CONDUCT,WHEATON,3900 BLK  ASPEN HILL RD,SILVER SPRING,MD,20906.0,MCPD,Retail - Department/Discount Store,K,4K2,526,3900.0,,ASPEN HILL,,RD,39.08038,-77.0772,4D,"(39.0804, -77.0772)"
201291646,2202,200023726,06/17/2020 09:21:17 AM,2020-06-17 09:21:00,,220,1,Crime Against Property,Burglary/Breaking and Entering,BURGLARY - FORCED ENTRY-RESIDENTIAL,SILVER SPRING,10200 BLK  DOUGLAS AVE,SILVER SPRING,MD,20902.0,MCPD,Residence - Yard,G,3G2,174,10200.0,,DOUGLAS,,AVE,39.02218,-77.0462,3D,"(39.0222, -77.0462)"
201364030,2204,220006215,02/12/2022 04:34:20 PM,2022-02-08 16:34:00,02/12/2022 04:34:00 PM,220,1,Crime Against Property,Burglary/Breaking and Entering,BURGLARY - NO FORCED ENTRY-RESIDENTIAL,WHEATON,12800 BLK  FLACK ST,SILVER SPRING,MD,20906.0,MCPD,Residence - Shed,K,4K2,335,12800.0,,FLACK,,ST,39.06448,-77.0587,4D,"(39.0645, -77.0587)"
201400443,2999,220050006,11/12/2022 01:28:03 PM,2022-11-12 13:28:00,,290,1,Crime Against Property,Destruction/Damage/Vandalism of Property,DAMAGE PROPERTY (DESCRIBE OFFENSE),TAKOMA PARK,7200 BLK  SPRUCE AVE,TAKOMA PARK,MD,20912.0,TPPD,Residence - Driveway,T,8T1,801,7200.0,,SPRUCE,,AVE,38.97579,-77.0109,TPPD,"(38.9758, -77.0109)"
201271073,2609,190062065,12/25/2019 04:29:32 PM,2019-12-24 22:00:00,12/25/2019 11:00:00 AM,26A,1,Crime Against Property,False Pretenses/Swindle/Confidence Game,FRAUD AND ABUSE - COMPUTER,BETHESDA,7600 BLK  DENTON RD,BETHESDA,MD,20814.0,MCPD,Other/Unknown,D,2D2,051,7600.0,,DENTON,,RD,38.98727,-77.102,2D,"(38.9873, -77.102)"
201384422,2305,220030535,07/16/2022 08:15:19 AM,2022-07-16 08:15:00,,23F,1,Crime Against Property,Theft From Motor Vehicle,LARCENY - FROM AUTO,GERMANTOWN,19600 BLK  GUNNERS BRANCH RD,GERMANTOWN,MD,20876.0,MCPD,Parking Lot - Commercial,M,5M1,468,19600.0,,GUNNERS BRANCH,,RD,39.17767,-77.2417,5D,"(39.1777, -77.2417)"
201376043,5404,220019212,05/06/2022 12:26:57 AM,2022-05-06 00:11:00,,90D,1,Crime Against Society,Driving Under the Influence,DRIVING UNDER THE INFLUENCE LIQUOR,MONTGOMERY VILLAGE,,GAITHERSBURG,MD,20877.0,MCPD,Street - In vehicle,P,6P3,432,,S,FREDERICK,,AVE,39.05909,-77.1162,6D,"(39.0591, -77.1162)"
201314882,9003,210000032,01/01/2021 04:49:55 AM,2021-01-01 04:49:00,,11C,1,Crime Against Person,Sexual Assault With An Object,SEX ASSAULT - WITH AN OBJECT,MONTGOMERY VILLAGE,1  BLK  STATE CT,GAITHERSBURG,MD,20877.0,GPD,Residence -Townhouse/Duplex,P,6P3,419,1.0,,STATE,,CT,39.14279,-77.1803,6D,"(39.1428, -77.1803)"
201443915,2305,230054685,09/13/2023 05:13:41 PM,2023-09-13 10:30:00,09/13/2023 03:30:00 PM,23F,1,Crime Against Property,Theft From Motor Vehicle,LARCENY - FROM AUTO,BETHESDA,7700 BLK  WOODMONT AVE,BETHESDA,MD,20814.0,MCPD,Parking Garage - County,D,2D2,048,7700.0,,WOODMONT,,AVE,38.98631,-77.0967,2D,"(38.9863, -77.0967)"
201261806,2610,190049981,10/18/2019 11:39:24 AM,2019-10-18 11:39:00,,26F,1,Crime Against Property,Identity Theft,FRAUD - IDENTITY THEFT,BETHESDA,8300 BLK  BURDETTE RD,BETHESDA,MD,20817.0,MCPD,Residence - Nursing Home,E,2E2,060,8300.0,,BURDETTE,,RD,38.99092,-77.1521,2D,"(38.9909, -77.1521)"
201313346,2399,200049769,12/18/2020 01:53:57 PM,2020-12-15 12:20:00,12/15/2020 12:41:00 PM,23H,1,Crime Against Property,All other Larceny,LARCENY (DESCRIBE OFFENSE),WHEATON,2700 BLK  SNOWBIRD TER,SILVER SPRING,MD,20906.0,MCPD,Residence - Other,K,4K1,347,2700.0,,SNOWBIRD,,TER,39.10632,-77.0552,4D,"(39.1063, -77.0552)"
201393577,2308,220041628,09/24/2022 12:42:55 PM,2022-09-24 12:15:00,,23D,1,Crime Against Property,Theft from Building,LARCENY - FROM BLDG,SILVER SPRING,3600 BLK  MAC TAVISH PL,BURTONSVILLE,MD,20866.0,MCPD,Residence -Townhouse/Duplex,I,3I2,381,3600.0,,MAC TAVISH,,PL,39.0948,-76.9316,3D,"(39.0948, -76.9316)"
201256778,2902,190044201,09/15/2019 02:28:35 PM,2019-09-15 14:28:00,,290,1,Crime Against Property,Destruction/Damage/Vandalism of Property,DAMAGE PROPERTY - PRIVATE,WHEATON,11000 BLK  VEIRS MILL RD,SILVER SPRING,MD,20902.0,MCPD,Parking Garage - Metro,L,4L2,321,11000.0,,VEIRS MILL,,RD,39.03609,-77.05,4D,"(39.0361, -77.05)"
201401548,1216,220051352,11/20/2022 03:29:49 PM,2022-11-20 15:29:00,,120,1,Crime Against Property,Robbery,ROBBERY - STRONG ARM,SILVER SPRING,8500 BLK  GEORGIA AVE,SILVER SPRING,MD,20910.0,MCPD,Restaurant,G,3G1,109,8500.0,,GEORGIA,,AVE,38.99454,-77.0268,3D,"(38.9945, -77.0268)"
201246662,2305,190031880,07/04/2019 04:05:26 PM,2019-07-04 12:00:00,07/04/2019 02:05:00 PM,23F,1,Crime Against Property,Theft From Motor Vehicle,LARCENY - FROM AUTO,ROCKVILLE,1800 BLK  ROCKVILLE PIK,ROCKVILLE,MD,20852.0,RCPD,Street - In vehicle,A,1A1,272,1800.0,,ROCKVILLE,,PIK,39.06028,-77.1226,1D,"(39.0603, -77.1226)"
201306378,1399,200041298,10/19/2020 07:31:50 PM,2020-10-19 19:31:00,,13B,1,Crime Against Person,Simple Assault,ASSAULT - 2ND DEGREE,SILVER SPRING,8000 BLK  13TH ST,SILVER SPRING,MD,20910.0,MCPD,Residence - Apartment/Condo,G,3G1,090,8000.0,,13TH,,ST,38.98692,-77.0296,3D,"(38.9869, -77.0296)"
201382971,2308,220028659,07/04/2022 09:30:23 AM,2022-07-03 15:30:00,07/03/2022 04:30:00 PM,23D,1,Crime Against Property,Theft from Building,LARCENY - FROM BLDG,SILVER SPRING,11400 BLK  JULY DR,SILVER SPRING,MD,20904.0,MCPD,Residence - Apartment/Condo,I,3I1,145,11400.0,,JULY,,DR,39.0415,-76.9817,3D,"(39.0415, -76.9817)"
201262124,2303,190050907,10/23/2019 11:04:37 AM,2019-10-23 11:04:00,,23C,1,Crime Against Property,Shoplifting,LARCENY - SHOPLIFTING,WHEATON,11100 BLK  VEIRS MILL RD,SILVER SPRING,MD,20902.0,MCPD,Other/Unknown,L,4L2,321,11100.0,,VEIRS MILL,,RD,39.03758,-77.0519,4D,"(39.0376, -77.0519)"
201265936,2601,190055191,11/15/2019 07:13:34 PM,2019-11-15 19:13:00,,26A,1,Crime Against Property,False Pretenses/Swindle/Confidence Game,FRAUD - CONFIDENCE GAME,GERMANTOWN,19600 BLK  GUNNERS BRANCH RD,GERMANTOWN,MD,20876.0,MCPD,Residence - Apartment/Condo,M,5M1,469,19600.0,,GUNNERS BRANCH,,RD,39.17767,-77.2417,5D,"(39.1777, -77.2417)"
201367093,2203,220009657,03/06/2022 11:22:28 AM,2022-03-06 11:00:00,03/06/2022 11:05:00 AM,220,1,Crime Against Property,Burglary/Breaking and Entering,BURGLARY - FORCED ENTRY-NONRESIDENTIAL,SILVER SPRING,8700 BLK  FLOWER AVE,SILVER SPRING,MD,20901.0,MCPD,Liquor Store - County,H,3H1,126,8700.0,,FLOWER,,AVE,38.99823,-77.0036,3D,"(38.9982, -77.0036)"
201415093,2399,230009663,02/26/2023 06:59:49 PM,2023-02-25 17:00:00,02/26/2023 12:00:00 PM,23H,1,Crime Against Property,All other Larceny,LARCENY (DESCRIBE OFFENSE),BETHESDA,9500 BLK  CULVER ST,KENSINGTON,MD,20895.0,MCPD,Residence - Single Family,D,2D3,184,9500.0,,CULVER,,ST,39.00976,-77.0841,2D,"(39.0098, -77.0841)"
201348082,2303,210039702,10/05/2021 05:57:58 PM,2021-10-05 18:23:00,,23C,1,Crime Against Property,Shoplifting,LARCENY - SHOPLIFTING,BETHESDA,7100 BLK  DEMOCRACY BLV,BETHESDA,MD,20817.0,MCPD,Retail - Mall,E,2E3,204,7100.0,,DEMOCRACY,,BLV,39.02207,-77.1473,2D,"(39.0221, -77.1473)"
201244919,5707,190029750,06/21/2019 08:27:25 PM,2019-06-21 20:27:00,,90J,1,Crime Against Society,Trespass of Real Property,TRESPASSING,BETHESDA,10800 BLK  STANMORE DR,POTOMAC,MD,20854.0,MCPD,Residence - Single Family,E,2E4,216,10800.0,,STANMORE,,DR,39.01441,-77.2235,2D,"(39.0144, -77.2235)"
201385690,2999,220032085,07/25/2022 08:40:56 PM,2022-07-25 20:40:00,07/25/2022 08:50:00 PM,290,1,Crime Against Property,Destruction/Damage/Vandalism of Property,DAMAGE PROPERTY (DESCRIBE OFFENSE),MONTGOMERY VILLAGE,1  BLK  PROFESSIONAL DR,GAITHERSBURG,MD,20879.0,GPD,Convenience Store,P,6P2,425,1.0,,PROFESSIONAL,,DR,39.16363,-77.2263,6D,"(39.1636, -77.2263)"
201342247,3562,210032215,08/18/2021 10:38:49 PM,2021-08-18 22:41:00,,35A,1,Crime Against Society,Drug/Narcotic Violations,DRUGS - MARIJUANA - POSSESS,MONTGOMERY VILLAGE,100 BLK  OLDE TOWNE AVE,GAITHERSBURG,MD,20877.0,GPD,Residence - Garage,P,6P3,431,100.0,,OLDE TOWNE,,AVE,39.14075,-77.1953,6D,"(39.1407, -77.1953)"
201412788,1399,230006877,02/10/2023 05:51:16 PM,2023-02-10 17:51:00,,13B,2,Crime Against Person,Simple Assault,ASSAULT - 2ND DEGREE,SILVER SPRING,,SILVER SPRING,MD,20901.0,MCPD,Street - Other,H,3H2,160,,,LANARK,,WAY,39.02201,-77.0254,3D,"(39.022, -77.0254)"
201300318,2305,200034019,08/31/2020 12:54:40 PM,2020-08-28 14:00:00,08/29/2020 12:00:00 PM,23F,1,Crime Against Property,Theft From Motor Vehicle,LARCENY - FROM AUTO,WHEATON,11800 BLK  DEWEY RD,SILVER SPRING,MD,20906.0,MCPD,Street - Residential,L,4L1,310,11800.0,,DEWEY,,RD,39.04845,-77.0885,4D,"(39.0485, -77.0885)"
201238160,1399,190021216,05/05/2019 11:23:42 PM,2019-05-05 23:23:00,,13B,1,Crime Against Person,Simple Assault,ASSAULT - 2ND DEGREE,GERMANTOWN,19900 BLK  AIRCRAFT DR,GERMANTOWN,MD,20874.0,MCPD,Gas Station,N,5N1,702,19900.0,,AIRCRAFT,,DR,39.18204,-77.2602,5D,"(39.182, -77.2602)"
201285589,2605,200016761,04/22/2020 10:17:23 AM,2020-02-14 08:00:00,,26B,1,Crime Against Property,Credit Card/Automatic Teller Machine Fraud,FRAUD - ILLEGAL USE CREDIT CARDS,BETHESDA,11000 BLK  LUXMANOR RD,ROCKVILLE,MD,20852.0,MCPD,Other/Unknown,E,2E3,199,11000.0,,LUXMANOR,,RD,39.03482,-77.1258,2D,"(39.0348, -77.1258)"
201285999,2399,200017254,04/26/2020 12:13:16 PM,2020-04-19 15:00:00,04/21/2020 03:00:00 PM,23H,1,Crime Against Property,All other Larceny,LARCENY (DESCRIBE OFFENSE),BETHESDA,9900 BLK  HILLRIDGE DR,KENSINGTON,MD,20895.0,MCPD,Residence - Other,D,2D3,697,9900.0,,HILLRIDGE,,DR,39.01939,-77.0678,2D,"(39.0194, -77.0678)"
201257782,3562,190045538,09/23/2019 09:40:15 AM,2019-09-23 09:40:00,,35A,1,Crime Against Society,Drug/Narcotic Violations,DRUGS - MARIJUANA - POSSESS,GERMANTOWN,12700 BLK  GORMAN CIR,BOYDS,MD,20841.0,MCPD,Residence - Garage,M,5M3,708,12700.0,,GORMAN,,CIR,39.21418,-77.2639,5D,"(39.2142, -77.2639)"
201389484,2699,220036634,08/24/2022 05:35:50 PM,2022-08-24 17:35:00,,26A,1,Crime Against Property,False Pretenses/Swindle/Confidence Game,FRAUD (DESCRIBE OFFENSE),BETHESDA,4600 BLK N PARK AVE,CHEVY CHASE,MD,20815.0,MCPD,Retail - Other,E,2E1,516,4600.0,N,PARK,,AVE,38.96349,-77.0909,2D,"(38.9635, -77.0909)"
201444092,2308,230055141,09/15/2023 08:27:49 PM,2023-09-15 19:52:00,09/15/2023 10:00:00 PM,23D,1,Crime Against Property,Theft from Building,LARCENY - FROM BLDG,ROCKVILLE,5700 BLK  FISHERS LA,ROCKVILLE,MD,20852.0,RCPD,Retail - Salon/Spa,A,1A2,300,5700.0,,FISHERS,,LA,39.06269,-77.1173,1D,"(39.0627, -77.1173)"
201327675,2305,210014437,04/18/2021 11:28:29 AM,2021-04-17 23:30:00,04/18/2021 11:25:00 AM,23F,1,Crime Against Property,Theft From Motor Vehicle,LARCENY - FROM AUTO,WHEATON,14300 BLK  BRAD DR,ROCKVILLE,MD,20853.0,MCPD,Residence - Driveway,K,4K2,343,14300.0,,BRAD,,DR,39.08835,-77.0932,4D,"(39.0883, -77.0932)"
201345860,2305,210036942,09/19/2021 09:12:02 AM,2021-09-18 23:15:00,09/19/2021 09:10:00 AM,23F,1,Crime Against Property,Theft From Motor Vehicle,LARCENY - FROM AUTO,SILVER SPRING,1900 BLK  LYTTONSVILLE RD,SILVER SPRING,MD,20910.0,MCPD,Parking Lot - Residential,G,3G2,083,1900.0,,LYTTONSVILLE,,RD,39.00185,-77.0401,3D,"(39.0018, -77.0401)"
201449901,2902,230061975,10/22/2023 02:33:06 PM,2023-10-21 10:00:00,10/22/2023 01:00:00 PM,290,1,Crime Against Property,Destruction/Damage/Vandalism of Property,DAMAGE PROPERTY - PRIVATE,GERMANTOWN,,GERMANTOWN,MD,20874.0,MCPD,Parking Lot - School,N,5N2,596,,,DAWSON FARM,,RD,39.17091,-77.2763,5D,"(39.1709, -77.2763)"
201388723,2699,220035672,08/18/2022 03:46:37 PM,2022-08-17 07:00:00,08/17/2022 12:52:00 PM,26A,1,Crime Against Property,False Pretenses/Swindle/Confidence Game,FRAUD (DESCRIBE OFFENSE),SILVER SPRING,1600 BLK  CARRIAGE HOUSE TER,SILVER SPRING,,20904.0,MCPD,Residence -Townhouse/Duplex,I,3I1,145,1600.0,,CARRIAGE HOUSE,,TER,39.04919,-76.9795,3D,"(39.0492, -76.9795)"
201227666,2902,190007958,02/19/2019 09:17:59 AM,2019-02-19 09:17:00,,290,1,Crime Against Property,Destruction/Damage/Vandalism of Property,DAMAGE PROPERTY - PRIVATE,WHEATON,14200 BLK  GEORGIA AVE,SILVER SPRING,MD,20906.0,MCPD,Residence - Apartment/Condo,K,4K1,534,14200.0,,GEORGIA,,AVE,39.08857,-77.0798,4D,"(39.0886, -77.0798)"
201294747,2610,200027446,07/15/2020 10:53:14 AM,2019-09-04 00:00:00,,26F,1,Crime Against Property,Identity Theft,FRAUD - IDENTITY THEFT,BETHESDA,8900 BLK  ONEIDA LA,BETHESDA,MD,20817.0,MCPD,Residence - Single Family,E,2E2,070,8900.0,,ONEIDA,,LA,39.00061,-77.1147,2D,"(39.0006, -77.1147)"
201386096,2404,220032544,07/29/2022 02:54:08 AM,2022-07-28 19:00:00,07/29/2022 02:20:00 AM,240,1,Crime Against Property,Motor Vehicle Theft,AUTO THEFT - VEHICLE THEFT,SILVER SPRING,8500 BLK  BARRON ST,TAKOMA PARK,MD,20912.0,MCPD,Street - Residential,H,3H1,130,8500.0,,BARRON,,ST,38.99483,-76.9981,3D,"(38.9948, -76.9981)"
201423967,1399,230020033,04/26/2023 06:24:56 PM,2023-04-26 09:00:00,04/26/2023 01:40:00 PM,13B,1,Crime Against Person,Simple Assault,ASSAULT - 2ND DEGREE,BETHESDA,6200 BLK  TILDEN LA,ROCKVILLE,MD,20852.0,MCPD,School - Elementary/Secondary,E,2E3,200,6200.0,,TILDEN,,LA,39.04408,-77.1269,2D,"(39.0441, -77.1269)"
201226596,2308,190006720,02/11/2019 05:34:25 PM,2019-02-11 12:00:00,02/11/2019 01:30:00 PM,23D,1,Crime Against Property,Theft from Building,LARCENY - FROM BLDG,MONTGOMERY VILLAGE,300 BLK  COPLEY PL,GAITHERSBURG,MD,20878.0,MCPD,Recreation Center,P,6P1,441,300.0,,COPLEY,,PL,39.11511,-77.2066,6D,"(39.1151, -77.2066)"
201386122,3700,220022100,05/24/2022 10:14:24 AM,2022-05-06 11:16:00,,370,1,Crime Against Society,Pornography/Obscene Material,OBSCENE MATERIAL,ROCKVILLE,200 BLK  CONGRESSIONAL LA,ROCKVILLE,MD,20852.0,MCPD,Residence - Apartment/Condo,A,1A1,267,200.0,,CONGRESSIONAL,,LA,39.06226,-77.129,1D,"(39.0623, -77.129)"
201371907,1399,220015260,04/10/2022 07:50:48 PM,2022-04-10 19:51:00,,13B,1,Crime Against Person,Simple Assault,ASSAULT - 2ND DEGREE,SILVER SPRING,9400 BLK  GEORGIA AVE,SILVER SPRING,MD,20910.0,MCPD,Bar/Night Club,G,3G2,101,9400.0,,GEORGIA,,AVE,39.00864,-77.0402,3D,"(39.0086, -77.0402)"
201447745,2303,230059484,10/09/2023 02:45:22 PM,2023-10-09 14:45:00,,23C,1,Crime Against Property,Shoplifting,LARCENY - SHOPLIFTING,ROCKVILLE,5700 BLK  BOU AVE,ROCKVILLE,MD,20852.0,MCPD,Retail - Department/Discount Store,A,1A2,735,5700.0,,BOU,,AVE,0.0,0.0,1D,"(0.0, 0.0)"
201269579,2305,190059871,12/12/2019 11:50:37 AM,2019-11-12 12:00:00,12/10/2019 08:00:00 AM,23F,1,Crime Against Property,Theft From Motor Vehicle,LARCENY - FROM AUTO,BETHESDA,10200 BLK  FLEMING AVE,BETHESDA,MD,20814.0,MCPD,Residence - Driveway,D,2D4,191,10200.0,,FLEMING,,AVE,39.02266,-77.1116,2D,"(39.0227, -77.1116)"
201266583,2610,190056657,11/23/2019 04:04:52 PM,2019-11-20 15:00:00,,26F,1,Crime Against Property,Identity Theft,FRAUD - IDENTITY THEFT,BETHESDA,6700 BLK  OLD STAGE RD,ROCKVILLE,MD,20852.0,MCPD,Other/Unknown,E,2E3,201,6700.0,,OLD STAGE,,RD,39.04728,-77.1384,2D,"(39.0473, -77.1384)"
201338117,2404,210027178,07/14/2021 03:01:52 PM,2021-07-14 14:42:00,,240,1,Crime Against Property,Motor Vehicle Theft,AUTO THEFT - VEHICLE THEFT,SILVER SPRING,1100 BLK E WEST HWY,SILVER SPRING,MD,20910.0,MCPD,Street - Residential,G,3G1,668,1100.0,E,WEST,,HWY,39.12437,-77.2032,3D,"(39.1244, -77.2032)"
201391649,2902,220039232,09/09/2022 04:42:53 PM,2022-09-08 17:00:00,09/09/2022 06:00:00 AM,290,1,Crime Against Property,Destruction/Damage/Vandalism of Property,DAMAGE PROPERTY - PRIVATE,MONTGOMERY VILLAGE,800 BLK  QUINCE ORCHARD BLV,GAITHERSBURG,MD,20878.0,MCPD,Street - Residential,P,6P2,554,800.0,,QUINCE ORCHARD,,BLV,39.14077,-77.2285,6D,"(39.1408, -77.2285)"
201293208,2305,200024880,06/26/2020 07:48:30 AM,2020-06-25 18:00:00,06/26/2020 07:00:00 AM,23F,1,Crime Against Property,Theft From Motor Vehicle,LARCENY - FROM AUTO,SILVER SPRING,11200 BLK  OAK LEAF DR,SILVER SPRING,MD,20901.0,MCPD,Parking Lot - Residential,H,3H2,144,11200.0,,OAK LEAF,,DR,39.03844,-76.9949,3D,"(39.0384, -76.9949)"
201327407,3562,210014119,04/15/2021 05:31:06 PM,2021-04-15 17:31:00,,35A,1,Crime Against Society,Drug/Narcotic Violations,DRUGS - MARIJUANA - POSSESS,WHEATON,,SILVER SPRING,MD,20902.0,MCPD,Street - In vehicle,L,4L1,332,,,CONNECTICUT,,AVE,39.08832,-77.0727,4D,"(39.0883, -77.0727)"
201431269,2901,230028899,06/15/2023 10:03:25 PM,2023-06-15 22:03:00,,290,1,Crime Against Property,Destruction/Damage/Vandalism of Property,DAMAGE PROPERTY - BUSINESS,MONTGOMERY VILLAGE,18300 BLK  CONTOUR RD,GAITHERSBURG,MD,20877.0,MCPD,Commercial - Office Building,R,6R1,505,18300.0,,CONTOUR,,RD,39.15531,-77.2004,6D,"(39.1553, -77.2004)"
201268575,2399,190059030,,2019-10-19 07:00:00,10/19/2019 11:00:00 PM,23H,1,Crime Against Property,All other Larceny,LARCENY (DESCRIBE OFFENSE),WHEATON,2300 BLK  RANDOLPH RD,SILVER SPRING,MD,20902.0,MCPD,Retail - Appliances/Electronics,L,4L1,366,2300.0,,RANDOLPH,,RD,39.05861,-77.0485,4D,"(39.0586, -77.0485)"
201226811,2303,190007111,02/13/2019 07:12:53 PM,2019-02-13 19:12:00,,23C,1,Crime Against Property,Shoplifting,LARCENY - SHOPLIFTING,SILVER SPRING,8500 BLK  FENTON ST,SILVER SPRING,MD,20910.0,MCPD,Retail - Appliances/Electronics,G,3G1,671,8500.0,,FENTON,,ST,38.9954,-77.0244,3D,"(38.9954, -77.0244)"
201302251,5311,200036365,09/16/2020 08:31:07 PM,2020-09-16 20:31:00,,90C,1,Crime Against Society,Disorderly Conduct,PUBLIC PEACE - DISORDERLY CONDUCT,GERMANTOWN,12800 BLK  LOCBURY CIR,GERMANTOWN,MD,20874.0,MCPD,Parking Lot - Residential,N,5N1,702,12800.0,,LOCBURY,,CIR,39.18555,-77.2656,5D,"(39.1855, -77.2656)"
201256857,2399,190044364,09/16/2019 03:16:00 PM,2019-09-15 18:00:00,09/15/2019 10:00:00 PM,23H,1,Crime Against Property,All other Larceny,LARCENY (DESCRIBE OFFENSE),WHEATON,300 BLK  EDNOR RD,SILVER SPRING,MD,20905.0,MCPD,Church/Synagogue/Temple,J,4J1,390,300.0,,EDNOR,,RD,39.12822,-77.016,4D,"(39.1282, -77.016)"
201288120,2902,200019692,05/16/2020 03:08:45 PM,2020-05-15 18:00:00,05/16/2020 11:00:00 AM,290,1,Crime Against Property,Destruction/Damage/Vandalism of Property,DAMAGE PROPERTY - PRIVATE,WHEATON,12900 BLK  MIDDLEVALE LA,SILVER SPRING,MD,20906.0,MCPD,Street - Residential,J,4J1,368,12900.0,,MIDDLEVALE,,LA,39.06806,-77.0405,4D,"(39.0681, -77.0405)"
201430631,2404,230028170,06/12/2023 07:40:35 AM,2023-06-11 22:00:00,06/12/2023 07:00:00 AM,240,1,Crime Against Property,Motor Vehicle Theft,AUTO THEFT - VEHICLE THEFT,MONTGOMERY VILLAGE,800 BLK  QUINCE ORCHARD BLV,GAITHERSBURG,MD,20878.0,MCPD,Parking Lot - Residential,P,6P2,554,800.0,,QUINCE ORCHARD,,BLV,39.14077,-77.2285,6D,"(39.1408, -77.2285)"
201429841,2308,230027236,06/06/2023 07:44:16 PM,2023-06-06 19:44:00,,23D,1,Crime Against Property,Theft from Building,LARCENY - FROM BLDG,ROCKVILLE,8300 BLK  BELLS MILL RD,POTOMAC,MD,20854.0,MCPD,School - Elementary/Secondary,B,1B1,221,8300.0,,BELLS MILL,,RD,39.03124,-77.1691,1D,"(39.0312, -77.1691)"
201340778,2202,210030512,08/06/2021 07:52:34 AM,2021-08-05 22:00:00,08/06/2021 07:52:00 AM,220,1,Crime Against Property,Burglary/Breaking and Entering,BURGLARY - FORCED ENTRY-RESIDENTIAL,ROCKVILLE,1300 BLK  PICCARD DR,ROCKVILLE,MD,20850.0,RCPD,Residence - Apartment/Condo,A,1A3,242,1300.0,,PICCARD,,DR,39.10186,-77.1771,1D,"(39.1019, -77.1771)"
201367338,2605,220009786,03/07/2022 11:37:16 AM,2022-03-04 09:00:00,,26B,1,Crime Against Property,Credit Card/Automatic Teller Machine Fraud,FRAUD - ILLEGAL USE CREDIT CARDS,GERMANTOWN,1  BLK  GARFIELD CT,GAITHERSBURG,MD,20882.0,MCPD,Other/Unknown,M,5M2,627,1.0,,GARFIELD,,CT,39.24354,-77.1814,5D,"(39.2435, -77.1814)"
201275760,2305,200004977,01/30/2020 01:30:17 PM,2020-01-29 21:00:00,01/30/2020 07:30:00 AM,23F,1,Crime Against Property,Theft From Motor Vehicle,LARCENY - FROM AUTO,WHEATON,4900 BLK  BAFFIN BAY LA,ROCKVILLE,MD,20853.0,MCPD,Residence - Driveway,K,4K2,344,4900.0,,BAFFIN BAY,,LA,39.09537,-77.0979,4D,"(39.0954, -77.0979)"
201251688,2304,190037992,08/09/2019 01:16:01 PM,2019-08-08 17:00:00,08/09/2019 12:00:00 PM,23G,1,Crime Against Property,Theft of Motor Vehicle Parts or Accessories,LARCENY - AUTO PARTS,WHEATON,1000 BLK  PLAYFORD LA,SILVER SPRING,MD,20901.0,MCPD,Street - Residential,L,4L2,158,1000.0,,PLAYFORD,,LA,39.03651,-77.017,4D,"(39.0365, -77.017)"
201381285,2303,220026750,06/21/2022 03:46:12 PM,2022-06-20 19:42:00,,23C,1,Crime Against Property,Shoplifting,LARCENY - SHOPLIFTING,BETHESDA,7100 BLK  WESTLAKE TER,BETHESDA,MD,20817.0,MCPD,Retail - Hardware,E,2E3,520,7100.0,,WESTLAKE,,TER,39.02649,-77.1439,2D,"(39.0265, -77.1439)"
201228943,4104,190009033,02/25/2019 06:08:01 PM,2019-02-25 22:07:00,,90G,1,Crime Against Society,Liquor Law Violations,LIQUOR - POSSESS,SILVER SPRING,11700 BLK  CHERRY HILL RD,SILVER SPRING,MD,20904.0,MCPD,Liquor Store - Beer & Wine,I,3I1,146,11700.0,,CHERRY HILL,,RD,39.04659,-76.9519,3D,"(39.0466, -76.9519)"
201387930,2308,220034746,08/12/2022 03:36:39 PM,2022-08-05 23:00:00,08/06/2022 01:00:00 PM,23D,1,Crime Against Property,Theft from Building,LARCENY - FROM BLDG,SILVER SPRING,11400 BLK  LOCKWOOD DR,SILVER SPRING,MD,20904.0,MCPD,Residence - Apartment/Condo,I,3I1,145,11400.0,,LOCKWOOD,,DR,39.04091,-76.9878,3D,"(39.0409, -76.9878)"
201319858,2203,210005826,02/14/2021 02:32:51 PM,2021-02-14 05:00:00,02/14/2021 04:00:00 PM,220,1,Crime Against Property,Burglary/Breaking and Entering,BURGLARY - FORCED ENTRY-NONRESIDENTIAL,ROCKVILLE,100 BLK  ROLLINS AVE,ROCKVILLE,MD,20852.0,RCPD,Retail - Drug Store/Pharmacy,A,1A1,269,100.0,,ROLLINS,,AVE,39.05883,-77.1213,1D,"(39.0588, -77.1213)"
201262954,2305,190052115,10/29/2019 07:30:04 PM,2019-10-29 19:30:00,,23F,1,Crime Against Property,Theft From Motor Vehicle,LARCENY - FROM AUTO,SILVER SPRING,600 BLK  CHICHESTER LA,SILVER SPRING,MD,20904.0,MCPD,Residence - Driveway,I,3I1,149,600.0,,CHICHESTER,,LA,39.06897,-76.9996,3D,"(39.069, -76.9996)"
201309943,2304,200045661,11/19/2020 08:36:54 AM,2020-11-18 23:00:00,11/19/2020 07:00:00 AM,23G,1,Crime Against Property,Theft of Motor Vehicle Parts or Accessories,LARCENY - AUTO PARTS,BETHESDA,10300 BLK  OLD GEORGETOWN RD,BETHESDA,MD,20814.0,MCPD,Parking Lot - Commercial,D,2D4,191,10300.0,,OLD GEORGETOWN,,RD,39.02408,-77.1247,2D,"(39.0241, -77.1247)"
201257788,2399,190045525,09/23/2019 08:28:50 AM,2019-09-23 08:28:00,,23H,1,Crime Against Property,All other Larceny,LARCENY (DESCRIBE OFFENSE),MONTGOMERY VILLAGE,300 BLK W DEER PARK RD,GAITHERSBURG,MD,20877.0,GPD,Street - In vehicle,P,6P1,434,300.0,W,DEER PARK,,RD,39.132,-77.2022,6D,"(39.132, -77.2022)"
201446169,1399,230057672,09/30/2023 11:21:36 AM,2023-09-30 11:21:00,,13B,1,Crime Against Person,Simple Assault,ASSAULT - 2ND DEGREE,ROCKVILLE,11500 BLK  SWAINS LOCK TER,POTOMAC,MD,20854.0,MCPD,Residence - Driveway,B,1B2,558,11500.0,,SWAINS LOCK,,TER,39.03586,-77.2376,1D,"(39.0359, -77.2376)"
201287353,2305,200018832,05/09/2020 08:05:41 AM,2020-05-08 17:00:00,05/09/2020 07:30:00 AM,23F,1,Crime Against Property,Theft From Motor Vehicle,LARCENY - FROM AUTO,MONTGOMERY VILLAGE,100 BLK E DEER PARK DR,GAITHERSBURG,MD,20877.0,MCPD,Residence - Driveway,P,6P3,432,100.0,E,DEER PARK,,DR,39.13343,-77.1869,6D,"(39.1334, -77.1869)"
201269947,2305,190060728,12/17/2019 11:20:16 AM,2019-12-15 18:00:00,12/16/2019 12:00:00 PM,23F,1,Crime Against Property,Theft From Motor Vehicle,LARCENY - FROM AUTO,BETHESDA,4700 BLK  CHEVY CHASE BLV,CHEVY CHASE,MD,20815.0,MCPD,Residence - Driveway,E,2E1,015,4700.0,,CHEVY CHASE,,BLV,38.97353,-77.0925,2D,"(38.9735, -77.0925)"
201338454,2902,210027631,07/17/2021 02:47:45 PM,2021-07-17 14:47:00,,290,1,Crime Against Property,Destruction/Damage/Vandalism of Property,DAMAGE PROPERTY - PRIVATE,MONTGOMERY VILLAGE,10500 BLK  APPLE RIDGE RD,MONTGOMERY VILLAGE,MD,20886.0,MCPD,Residence -Townhouse/Duplex,R,6R2,547,10500.0,,APPLE RIDGE,,RD,39.18054,-77.2151,6D,"(39.1805, -77.2151)"
201286219,2901,200017500,04/28/2020 08:08:42 PM,2020-04-28 20:18:00,,290,1,Crime Against Property,Destruction/Damage/Vandalism of Property,DAMAGE PROPERTY - BUSINESS,SILVER SPRING,13800 BLK  OLD COLUMBIA PIK,SILVER SPRING,MD,20904.0,MCPD,Retail - Other,I,3I2,379,13800.0,,OLD COLUMBIA,,PIK,39.08191,-76.9535,3D,"(39.0819, -76.9535)"
201300537,5202,200034270,09/01/2020 10:51:01 PM,2020-09-01 22:51:00,,520,1,Crime Against Society,Weapon Law Violations,WEAPON - CONCEALED,SILVER SPRING,11200 BLK  NEW HAMPSHIRE AVE,SILVER SPRING,MD,20904.0,MCPD,Retail - Other,I,3I1,518,11200.0,,NEW HAMPSHIRE,,AVE,39.03978,-76.9906,3D,"(39.0398, -76.9906)"
201318498,2303,210004246,02/02/2021 07:20:20 PM,2021-02-02 19:00:00,,23C,1,Crime Against Property,Shoplifting,LARCENY - SHOPLIFTING,MONTGOMERY VILLAGE,9000 BLK  SNOUFFER SCHOOL RD,GAITHERSBURG,MD,20879.0,MCPD,Convenience Store,R,6R2,714,9000.0,,SNOUFFER SCHOOL,,RD,39.18524,-77.1836,6D,"(39.1852, -77.1836)"
201252426,1313,190038904,08/14/2019 08:40:36 PM,2019-08-14 20:40:00,,13B,2,Crime Against Person,Simple Assault,ASSAULT - SIMPLE,ROCKVILLE,12600 BLK  TOBYTOWN DR,POTOMAC,MD,20854.0,MCPD,Street - Other,B,1B2,507,12600.0,,TOBYTOWN,,DR,39.06175,-77.2854,1D,"(39.0618, -77.2854)"
201385161,2902,220031385,07/21/2022 10:46:54 AM,2022-07-21 10:46:00,,290,1,Crime Against Property,Destruction/Damage/Vandalism of Property,DAMAGE PROPERTY - PRIVATE,BETHESDA,4300 BLK  HOWARD AVE,KENSINGTON,MD,20895.0,MCPD,Street - In vehicle,D,2D3,181,4300.0,,HOWARD,,AVE,39.03108,-77.0844,2D,"(39.0311, -77.0844)"
201303717,2901,200038094,09/28/2020 10:41:22 AM,2020-09-28 10:41:00,,290,1,Crime Against Property,Destruction/Damage/Vandalism of Property,DAMAGE PROPERTY - BUSINESS,GERMANTOWN,24100 BLK  PREAKNESS DR,DAMASCUS,MD,20872.0,MCPD,Street - Residential,M,5M2,619,24100.0,,PREAKNESS,,DR,39.25327,-77.225,5D,"(39.2533, -77.225)"
201355089,2605,210048075,11/26/2021 07:28:17 PM,2021-11-26 18:00:00,11/26/2021 07:00:00 PM,26B,1,Crime Against Property,Credit Card/Automatic Teller Machine Fraud,FRAUD - ILLEGAL USE CREDIT CARDS,ROCKVILLE,1700 BLK E JEFFERSON ST,ROCKVILLE,MD,20852.0,MCPD,Retail - Drug Store/Pharmacy,A,1A1,270,1700.0,E,JEFFERSON,,ST,39.05848,-77.1264,1D,"(39.0585, -77.1264)"
201267989,2305,190058424,12/04/2019 02:10:48 PM,2019-12-03 17:30:00,12/04/2019 11:00:00 AM,23F,1,Crime Against Property,Theft From Motor Vehicle,LARCENY - FROM AUTO,SILVER SPRING,1700 BLK  BRISBANE ST,SILVER SPRING,MD,20902.0,MCPD,Street - Residential,G,3G2,168,1700.0,,BRISBANE,,ST,39.02063,-77.038,3D,"(39.0206, -77.038)"
201339527,2699,210028971,07/26/2021 04:54:34 PM,2021-07-26 16:50:00,,26A,1,Crime Against Property,False Pretenses/Swindle/Confidence Game,FRAUD (DESCRIBE OFFENSE),SILVER SPRING,8800 BLK  COLESVILLE RD,SILVER SPRING,MD,20910.0,MCPD,Residence - Apartment/Condo,G,3G2,118,8800.0,,COLESVILLE,,RD,38.999,-77.0261,3D,"(38.999, -77.0261)"
201350770,2902,210043162,10/26/2021 03:35:22 PM,2021-10-25 23:45:00,10/26/2021 02:30:00 PM,290,1,Crime Against Property,Destruction/Damage/Vandalism of Property,DAMAGE PROPERTY - PRIVATE,ROCKVILLE,2000 BLK  BALTIMORE RD,ROCKVILLE,MD,20851.0,MCPD,Parking Lot - Residential,A,1A2,290,2000.0,,BALTIMORE,,RD,39.08424,-77.119,1D,"(39.0842, -77.119)"
201340101,2399,210029761,07/31/2021 11:17:18 PM,2021-07-31 20:45:00,07/31/2021 10:50:00 PM,23H,1,Crime Against Property,All other Larceny,LARCENY (DESCRIBE OFFENSE),ROCKVILLE,1600 BLK  ROCKVILLE PIK,ROCKVILLE,MD,20852.0,RCPD,Restaurant,A,1A1,266,1600.0,,ROCKVILLE,,PIK,39.06279,-77.1247,1D,"(39.0628, -77.1247)"
201365840,2305,220008184,02/24/2022 10:02:22 PM,2022-02-24 20:00:00,02/24/2022 09:45:00 PM,23F,1,Crime Against Property,Theft From Motor Vehicle,LARCENY - FROM AUTO,MONTGOMERY VILLAGE,1  BLK  FIRSTFIELD RD,GAITHERSBURG,MD,20878.0,MCPD,Parking Lot - Residential,P,6P2,554,1.0,,FIRSTFIELD,,RD,39.14368,-77.2237,6D,"(39.1437, -77.2237)"
201235259,2303,190017635,04/15/2019 04:18:04 PM,2019-04-15 16:25:00,,23C,1,Crime Against Property,Shoplifting,LARCENY - SHOPLIFTING,BETHESDA,7800 BLK  WISCONSIN AVE,BETHESDA,MD,20814.0,MCPD,Retail - Drug Store/Pharmacy,D,2D2,045,7800.0,,WISCONSIN,,AVE,38.98827,-77.095,2D,"(38.9883, -77.095)"
201385632,5203,220032027,07/25/2022 02:03:18 PM,2022-07-24 12:00:00,,520,1,Crime Against Society,Weapon Law Violations,CARRYING PROHIBITED WEAPON (SPECIFY WEAPON),ROCKVILLE,19600 BLK  FISHER AVE,POOLESVILLE,MD,20837.0,MCPD,Parking Lot - Commercial,B,1B3,499,19600.0,,FISHER,,AVE,39.14382,-77.4085,1D,"(39.1438, -77.4085)"
201324890,2605,210011125,03/24/2021 07:00:45 PM,2021-03-24 12:15:00,03/24/2021 12:41:00 PM,26B,1,Crime Against Property,Credit Card/Automatic Teller Machine Fraud,FRAUD - ILLEGAL USE CREDIT CARDS,WHEATON,11100 BLK  VEIRS MILL RD,SILVER SPRING,MD,20902.0,MCPD,Retail - Department/Discount Store,L,4L2,321,11100.0,,VEIRS MILL,,RD,39.03758,-77.0519,4D,"(39.0376, -77.0519)"
201423170,2605,230019054,04/21/2023 01:27:41 PM,2023-04-20 18:25:00,04/20/2023 06:35:00 PM,26B,1,Crime Against Property,Credit Card/Automatic Teller Machine Fraud,FRAUD - ILLEGAL USE CREDIT CARDS,ROCKVILLE,12200 BLK  ROCKVILLE PIK,ROCKVILLE,MD,20852.0,MCPD,Other/Unknown,A,1A1,270,12200.0,,ROCKVILLE,,PIK,39.05505,-77.1182,1D,"(39.0551, -77.1182)"
201250679,2305,190036759,08/01/2019 07:45:34 PM,2019-07-31 23:30:00,,23F,1,Crime Against Property,Theft From Motor Vehicle,LARCENY - FROM AUTO,WHEATON,3800 BLK  WENDY LA,SILVER SPRING,MD,20906.0,MCPD,Residence - Single Family,K,4K2,337,3800.0,,WENDY,,LA,39.07915,-77.075,4D,"(39.0791, -77.075)"
201276724,2399,200006029,02/05/2020 05:50:29 PM,2020-02-05 07:00:00,02/05/2020 05:00:00 PM,23H,1,Crime Against Property,All other Larceny,LARCENY (DESCRIBE OFFENSE),WHEATON,18800 BLK  HERITAGE HILLS DR,BROOKEVILLE,MD,20833.0,MCPD,Residence - Other,J,4J2,540,18800.0,,HERITAGE HILLS,,DR,39.16445,-77.0712,4D,"(39.1645, -77.0712)"
201344614,2308,210034460,09/02/2021 07:17:22 PM,2021-09-02 19:17:00,,23D,1,Crime Against Property,Theft from Building,LARCENY - FROM BLDG,WHEATON,11100 BLK  VEIRS MILL RD,SILVER SPRING,MD,20902.0,MCPD,Retail - Drug Store/Pharmacy,L,4L2,321,11100.0,,VEIRS MILL,,RD,39.03758,-77.0519,4D,"(39.0376, -77.0519)"
201390581,2902,220037998,09/02/2022 06:30:06 AM,2022-09-01 18:00:00,09/02/2022 05:30:00 AM,290,1,Crime Against Property,Destruction/Damage/Vandalism of Property,DAMAGE PROPERTY - PRIVATE,MONTGOMERY VILLAGE,1  BLK  CEDAR AVE,GAITHERSBURG,MD,20877.0,MCPD,Street - Residential,P,6P3,433,1.0,,CEDAR,,AVE,39.13975,-77.1964,6D,"(39.1397, -77.1964)"
201367805,1313,220010354,03/10/2022 02:41:58 PM,2022-03-10 14:41:00,,13B,2,Crime Against Person,Simple Assault,ASSAULT - SIMPLE,MONTGOMERY VILLAGE,9400 BLK  VINEYARD HAVEN DR,MONTGOMERY VILLAGE,MD,20886.0,MCPD,Residence - Single Family,R,6R2,508,9400.0,,VINEYARD HAVEN,,DR,39.1958,-77.1923,6D,"(39.1958, -77.1923)"
201278360,2308,200008273,02/19/2020 06:39:27 AM,2020-02-19 03:00:00,02/19/2020 05:30:00 AM,23D,1,Crime Against Property,Theft from Building,LARCENY - FROM BLDG,MONTGOMERY VILLAGE,9900 BLK  MEDICAL CENTER DR,ROCKVILLE,MD,20850.0,MCPD,Hospital/Emergency Care Center,P,6P1,721,9900.0,,MEDICAL CENTER,,DR,39.09661,-77.1993,6D,"(39.0966, -77.1993)"
201312635,2303,200048865,12/11/2020 04:49:22 PM,2020-12-11 16:49:00,,23C,1,Crime Against Property,Shoplifting,LARCENY - SHOPLIFTING,GERMANTOWN,20600 BLK  SENECA MEADOWS PKW,GERMANTOWN,MD,20876.0,MCPD,Grocery/Supermarket,M,5M1,701,20600.0,,SENECA MEADOWS,,PKW,39.1985,-77.2561,5D,"(39.1985, -77.2561)"
201271014,2202,190062111,12/26/2019 04:20:05 AM,2019-12-25 23:00:00,12/26/2019 04:20:00 AM,220,1,Crime Against Property,Burglary/Breaking and Entering,BURGLARY - FORCED ENTRY-RESIDENTIAL,MONTGOMERY VILLAGE,18800 BLK  SEVERN RD,GAITHERSBURG,MD,20879.0,MCPD,Residence - Single Family,R,6R1,423,18800.0,,SEVERN,,RD,39.16413,-77.1938,6D,"(39.1641, -77.1938)"
201351549,3532,210044165,11/01/2021 05:13:08 PM,2021-11-01 17:24:00,,35A,1,Crime Against Society,Drug/Narcotic Violations,DRUGS - COCAINE - POSSESS,BETHESDA,8600 BLK  OLD GEORGETOWN RD,BETHESDA,MD,20814.0,MCPD,Hospital/Emergency Care Center,E,2E2,055,8600.0,,OLD GEORGETOWN,,RD,38.99656,-77.109,2D,"(38.9966, -77.109)"
201271114,3562,190062231,12/26/2019 08:29:45 PM,2019-12-26 21:28:00,,35A,1,Crime Against Society,Drug/Narcotic Violations,DRUGS - MARIJUANA - POSSESS,BETHESDA,,BETHESDA,MD,20889.0,MCPD,Street - In vehicle,E,2E2,073,,,ROCKVILLE,,PIK,39.07219,-77.1332,2D,"(39.0722, -77.1332)"
201293852,5311,200026421,07/07/2020 09:41:53 PM,2020-07-07 21:41:00,07/07/2020 10:00:00 PM,90C,1,Crime Against Society,Disorderly Conduct,PUBLIC PEACE - DISORDERLY CONDUCT,SILVER SPRING,11200 BLK  NEW HAMPSHIRE AVE,SILVER SPRING,MD,20904.0,MCPD,Grocery/Supermarket,I,3I1,518,11200.0,,NEW HAMPSHIRE,,AVE,39.03978,-76.9906,3D,"(39.0398, -76.9906)"
201241521,2308,190025387,05/28/2019 04:53:03 PM,2019-05-28 12:15:00,,23D,1,Crime Against Property,Theft from Building,LARCENY - FROM BLDG,BETHESDA,5300 BLK  GOLDSBORO RD,BETHESDA,MD,20817.0,MCPD,Residence - Single Family,E,2E2,024,5300.0,,GOLDSBORO,,RD,38.97717,-77.1066,2D,"(38.9772, -77.1066)"
201364526,2610,220006764,02/16/2022 11:25:19 AM,2022-02-02 09:00:00,,26F,1,Crime Against Property,Identity Theft,FRAUD - IDENTITY THEFT,GERMANTOWN,19600 BLK  WATERS RD,GERMANTOWN,MD,20874.0,MCPD,Other/Unknown,N,5N1,702,19600.0,,WATERS,,RD,39.17691,-77.2731,5D,"(39.1769, -77.2731)"
201340545,2399,210030273,08/04/2021 03:49:44 PM,2021-08-04 11:45:00,08/04/2021 02:00:00 PM,23H,1,Crime Against Property,All other Larceny,LARCENY (DESCRIBE OFFENSE),ROCKVILLE,800 BLK  NELSON ST,ROCKVILLE,MD,20850.0,RCPD,Recreation Center,A,1A3,246,800.0,,NELSON,,ST,39.09442,-77.1708,1D,"(39.0944, -77.1708)"
201374177,2903,220018164,04/29/2022 09:49:28 AM,2022-04-29 08:20:00,04/29/2022 09:48:00 AM,290,1,Crime Against Property,Destruction/Damage/Vandalism of Property,DAMAGE PROPERTY - PUBLIC,SILVER SPRING,300 BLK  WAYNE AVE,SILVER SPRING,MD,20910.0,MCPD,School - Elementary/Secondary,G,3G2,119,300.0,,WAYNE,,AVE,38.99988,-77.0133,3D,"(38.9999, -77.0133)"
201317571,2304,210003164,01/25/2021 07:03:54 PM,2021-01-24 00:00:00,01/25/2021 05:00:00 PM,23G,1,Crime Against Property,Theft of Motor Vehicle Parts or Accessories,LARCENY - AUTO PARTS,WHEATON,3600 BLK  PEAR TREE CT,SILVER SPRING,MD,20906.0,MCPD,Parking Lot - Residential,K,4K1,534,3600.0,,PEAR TREE,,CT,39.09051,-77.0719,4D,"(39.0905, -77.0719)"
201252971,2304,190039553,08/19/2019 08:26:14 AM,2019-08-16 17:00:00,08/19/2019 07:45:00 AM,23G,1,Crime Against Property,Theft of Motor Vehicle Parts or Accessories,LARCENY - AUTO PARTS,WHEATON,1300 BLK  LAMBERTON DR,SILVER SPRING,MD,20902.0,MCPD,Parking Garage - Commercial,L,4L1,360,1300.0,,LAMBERTON,,DR,39.04096,-77.0294,4D,"(39.041, -77.0294)"
201383129,2610,220028920,07/06/2022 08:34:55 AM,2022-07-06 08:34:00,,26F,1,Crime Against Property,Identity Theft,FRAUD - IDENTITY THEFT,BETHESDA,8100 BLK  KERRY LA,CHEVY CHASE,MD,20815.0,MCPD,Other/Unknown,D,2D1,038,8100.0,,KERRY,,LA,38.99118,-77.0704,2D,"(38.9912, -77.0704)"
201253035,2999,190039673,08/19/2019 07:29:53 PM,2019-08-19 12:50:00,08/19/2019 06:50:00 PM,290,1,Crime Against Property,Destruction/Damage/Vandalism of Property,DAMAGE PROPERTY (DESCRIBE OFFENSE),BETHESDA,4400 BLK E WEST HWY,BETHESDA,MD,20814.0,MCPD,Parking Lot - Commercial,D,2D2,046,4400.0,E,WEST,,HWY,0.0,0.0,2D,"(0.0, 0.0)"
201400160,2901,220049653,11/10/2022 11:40:21 AM,2022-11-06 00:00:00,11/07/2022 12:00:00 AM,290,1,Crime Against Property,Destruction/Damage/Vandalism of Property,DAMAGE PROPERTY - BUSINESS,BETHESDA,9600 BLK  CEDAR LA,BETHESDA,MD,20814.0,MCPD,Parking Lot - Church,D,2D3,184,9600.0,,CEDAR,,LA,39.01269,-77.0907,2D,"(39.0127, -77.0907)"
201310933,2304,200046846,11/27/2020 04:17:32 PM,2020-11-24 12:00:00,11/27/2020 07:00:00 AM,23G,1,Crime Against Property,Theft of Motor Vehicle Parts or Accessories,LARCENY - AUTO PARTS,BETHESDA,5400 BLK  WESTBARD AVE,BETHESDA,MD,20816.0,MCPD,Parking Lot - Commercial,E,2E1,019,5400.0,,WESTBARD,,AVE,38.96357,-77.1065,2D,"(38.9636, -77.1065)"
201352528,2304,210045399,11/09/2021 03:25:33 PM,2021-11-08 06:30:00,11/09/2021 03:00:00 PM,23G,1,Crime Against Property,Theft of Motor Vehicle Parts or Accessories,LARCENY - AUTO PARTS,WHEATON,14800 BLK  ROCKING SPRING DR,ROCKVILLE,MD,20853.0,MCPD,Residence - Driveway,K,4K2,394,14800.0,,ROCKING SPRING,,DR,39.09785,-77.1047,4D,"(39.0979, -77.1047)"
201240482,2304,190024176,05/21/2019 09:15:37 PM,2019-05-19 21:00:00,05/20/2019 08:00:00 AM,23G,1,Crime Against Property,Theft of Motor Vehicle Parts or Accessories,LARCENY - AUTO PARTS,SILVER SPRING,9300 BLK  LONG BRANCH PKW,SILVER SPRING,MD,20901.0,MCPD,Street - Residential,G,3G2,125,9300.0,,LONG BRANCH,,PKW,39.00758,-77.0003,3D,"(39.0076, -77.0003)"
201395336,5311,220043659,10/06/2022 01:43:36 PM,2022-10-06 13:40:00,,90C,1,Crime Against Society,Disorderly Conduct,PUBLIC PEACE - DISORDERLY CONDUCT,BETHESDA,7400 BLK  RIVER RD,BETHESDA,MD,20817.0,MCPD,Street - Other,E,2E2,060,7400.0,,RIVER,,RD,38.99024,-77.1526,2D,"(38.9902, -77.1526)"
201309554,2305,200045199,11/16/2020 10:07:14 AM,2020-11-10 09:00:00,11/16/2020 09:30:00 AM,23F,1,Crime Against Property,Theft From Motor Vehicle,LARCENY - FROM AUTO,GERMANTOWN,20200 BLK  GOLDENROD LA,GERMANTOWN,MD,20876.0,MCPD,Parking Lot - Other,M,5M1,468,20200.0,,GOLDENROD,,LA,39.18414,-77.2456,5D,"(39.1841, -77.2456)"
201354484,3562,210047863,11/24/2021 08:37:28 PM,2021-11-24 20:37:00,11/24/2021 08:37:00 PM,35A,1,Crime Against Society,Drug/Narcotic Violations,DRUGS - MARIJUANA - POSSESS,ROCKVILLE,,ROCKVILLE,MD,20850.0,RCPD,Street - In vehicle,A,1A3,254,,N,WASHINGTON,,ST,39.08686,-77.1532,1D,"(39.0869, -77.1532)"
201336144,1399,210024614,06/27/2021 06:09:11 AM,2021-06-27 06:09:00,06/27/2021 07:00:00 AM,13B,2,Crime Against Person,Simple Assault,ASSAULT - 2ND DEGREE,WHEATON,13500 BLK  GEORGIA AVE,SILVER SPRING,MD,20906.0,MCPD,Parking Lot - Residential,K,4K1,348,13500.0,,GEORGIA,,AVE,39.07753,-77.0708,4D,"(39.0775, -77.0708)"
201287932,1310,200019370,05/14/2020 12:21:42 AM,2020-05-14 00:21:00,,13A,2,Crime Against Person,Aggravated Assault,ASSAULT - AGGRAVATED - POL OFF-GUN,MONTGOMERY VILLAGE,9000 BLK  SNOUFFER SCHOOL RD,GAITHERSBURG,MD,20879.0,MCPD,Convenience Store,R,6R2,714,9000.0,,SNOUFFER SCHOOL,,RD,39.18524,-77.1836,6D,"(39.1852, -77.1836)"
201312234,1399,200048445,12/09/2020 02:09:09 AM,2020-12-09 02:09:00,,13B,1,Crime Against Person,Simple Assault,ASSAULT - 2ND DEGREE,MONTGOMERY VILLAGE,100 BLK  DUVALL LA,GAITHERSBURG,MD,20877.0,GPD,Residence - Apartment/Condo,P,6P1,434,100.0,,DUVALL,,LA,39.13036,-77.204,6D,"(39.1304, -77.204)"
201233315,2305,190015144,04/01/2019 08:41:14 PM,2019-04-01 20:41:00,,23F,1,Crime Against Property,Theft From Motor Vehicle,LARCENY - FROM AUTO,GERMANTOWN,20000 BLK  AIRCRAFT DR,GERMANTOWN,MD,20874.0,MCPD,Street - In vehicle,N,5N1,702,20000.0,,AIRCRAFT,,DR,39.18396,-77.2617,5D,"(39.184, -77.2617)"
201260438,2202,190048835,10/11/2019 11:58:50 AM,2019-10-09 14:50:00,10/09/2019 02:55:00 PM,220,1,Crime Against Property,Burglary/Breaking and Entering,BURGLARY - FORCED ENTRY-RESIDENTIAL,SILVER SPRING,8800 BLK  COLESVILLE RD,SILVER SPRING,MD,20910.0,MCPD,Residence - Apartment/Condo,G,3G2,118,8800.0,,COLESVILLE,,RD,38.999,-77.0261,3D,"(38.999, -77.0261)"
201439317,2399,230049142,08/12/2023 05:34:46 PM,2023-08-12 17:30:00,,23H,1,Crime Against Property,All other Larceny,LARCENY (DESCRIBE OFFENSE),WHEATON,2000 BLK  PRICHARD RD,SILVER SPRING,MD,20902.0,MCPD,Street - Residential,L,4L2,170,2000.0,,PRICHARD,,RD,39.036,-77.0429,4D,"(39.036, -77.0429)"
201359188,2305,210053151,12/30/2021 08:54:56 AM,2021-10-27 09:00:00,10/28/2021 09:00:00 PM,23F,1,Crime Against Property,Theft From Motor Vehicle,LARCENY - FROM AUTO,MONTGOMERY VILLAGE,400 BLK  MUDDY BRANCH RD,GAITHERSBURG,MD,20878.0,MCPD,Parking Lot - Residential,P,6P2,443,400.0,,MUDDY BRANCH,,RD,39.12731,-77.2097,6D,"(39.1273, -77.2097)"
201287478,2799,200018996,05/10/2020 05:26:05 PM,2020-05-10 18:44:00,,270,1,Crime Against Property,Embezzlement,EMBEZZLE (DESCRIBE OFFENSE),GERMANTOWN,12200 BLK  EMERALD WAY,GERMANTOWN,MD,20876.0,MCPD,Other/Unknown,M,5M3,474,12200.0,,EMERALD,,WAY,39.20354,-77.2515,5D,"(39.2035, -77.2515)"
201278781,1313,200008836,02/22/2020 06:21:05 AM,2020-02-22 06:00:00,02/22/2020 06:21:00 AM,13B,1,Crime Against Person,Simple Assault,ASSAULT - SIMPLE,ROCKVILLE,600 BLK  ELMCROFT BLV,ROCKVILLE,MD,20850.0,RCPD,Residence - Apartment/Condo,A,1A3,242,600.0,,ELMCROFT,,BLV,39.11405,-77.1662,1D,"(39.114, -77.1662)"
201426798,2308,230023445,05/16/2023 12:12:01 PM,2023-05-15 07:45:00,05/15/2023 05:00:00 PM,23D,1,Crime Against Property,Theft from Building,LARCENY - FROM BLDG,MONTGOMERY VILLAGE,9600 BLK  BLACKWELL RD,ROCKVILLE,MD,20850.0,MCPD,Hospital/Emergency Care Center,P,6P1,721,9600.0,,BLACKWELL,,RD,39.10095,-77.1918,6D,"(39.1009, -77.1918)"
201232433,2902,190014119,03/27/2019 08:20:46 AM,2019-03-26 06:10:00,03/26/2019 09:05:00 AM,290,1,Crime Against Property,Destruction/Damage/Vandalism of Property,DAMAGE PROPERTY - PRIVATE,GERMANTOWN,12500 BLK  BLUE SKY DR,CLARKSBURG,MD,20871.0,MCPD,Parking Lot - School,M,5M3,476,12500.0,,BLUE SKY,,DR,39.23995,-77.2602,5D,"(39.24, -77.2602)"
201357609,1399,210051771,12/19/2021 09:04:42 PM,2021-12-19 21:04:00,,13B,1,Crime Against Person,Simple Assault,ASSAULT - 2ND DEGREE,GERMANTOWN,11800 BLK  SUMMER OAK DR,GERMANTOWN,MD,20874.0,MCPD,Residence -Townhouse/Duplex,N,5N1,447,11800.0,,SUMMER OAK,,DR,39.16568,-77.2449,5D,"(39.1657, -77.2449)"
201337658,2601,210026585,07/10/2021 07:24:01 PM,2021-07-06 11:00:00,,26A,1,Crime Against Property,False Pretenses/Swindle/Confidence Game,FRAUD - CONFIDENCE GAME,WHEATON,12700 BLK  VEIRS MILL RD,ROCKVILLE,MD,20853.0,MCPD,Other/Unknown,K,4K2,305,12700.0,,VEIRS MILL,,RD,39.0645,-77.0971,4D,"(39.0645, -77.0971)"
201403179,5311,220053301,12/02/2022 08:10:50 PM,2022-12-02 20:09:00,12/02/2022 11:30:00 PM,90C,1,Crime Against Society,Disorderly Conduct,PUBLIC PEACE - DISORDERLY CONDUCT,GERMANTOWN,19500 BLK  WATERS RD,GERMANTOWN,MD,20874.0,MCPD,Residence - Apartment/Condo,N,5N1,702,19500.0,,WATERS,,RD,39.17596,-77.273,5D,"(39.176, -77.273)"
201362859,2501,220004751,02/03/2022 04:22:49 PM,2022-01-03 00:00:00,,250,1,Crime Against Property,Counterfeiting/Forgery,FORGERY OF CHECKS,BETHESDA,,BETHESDA,MD,20814.0,MCPD,Other/Unknown,D,2D2,048,,,WISCONSIN,,AVE,38.9777,-77.0909,2D,"(38.9777, -77.0909)"
201345444,2303,210036336,09/15/2021 10:13:08 AM,2021-07-06 11:51:00,,23C,1,Crime Against Property,Shoplifting,LARCENY - SHOPLIFTING,WHEATON,14000 BLK  GEORGIA AVE,SILVER SPRING,MD,20906.0,MCPD,Retail - Hardware,K,4K2,342,14000.0,,GEORGIA,,AVE,39.08376,-77.0778,4D,"(39.0838, -77.0778)"
201346270,2699,210037396,09/22/2021 08:52:21 AM,2021-09-20 15:00:00,,26A,1,Crime Against Property,False Pretenses/Swindle/Confidence Game,FRAUD (DESCRIBE OFFENSE),BETHESDA,8800 BLK  BURNING TREE RD,BETHESDA,MD,20817.0,MCPD,Residence - Single Family,E,2E2,060,8800.0,,BURNING TREE,,RD,38.99937,-77.138,2D,"(38.9994, -77.138)"
201369479,2399,220011994,03/20/2022 01:32:39 PM,2022-03-18 10:00:00,03/20/2022 12:00:00 PM,23H,1,Crime Against Property,All other Larceny,LARCENY (DESCRIBE OFFENSE),GERMANTOWN,24100 BLK  FREDERICK RD,CLARKSBURG,MD,20871.0,MCPD,Residence - Driveway,M,5M3,509,24100.0,,FREDERICK,,RD,39.2522,-77.2993,5D,"(39.2522, -77.2993)"
201398622,3560,220047883,10/31/2022 06:17:55 PM,2022-10-31 18:17:00,,35A,1,Crime Against Society,Drug/Narcotic Violations,DRUGS - MARIJUANA - SELL,GERMANTOWN,19900 BLK  CENTURY BLV,GERMANTOWN,MD,20874.0,MCPD,Restaurant,N,5N1,702,19900.0,,CENTURY,,BLV,39.18295,-77.2636,5D,"(39.1829, -77.2636)"
201421615,1399,230017168,04/11/2023 12:17:38 AM,2023-04-11 00:10:00,04/11/2023 12:17:00 AM,13B,1,Crime Against Person,Simple Assault,ASSAULT - 2ND DEGREE,MONTGOMERY VILLAGE,100 BLK  ODEND HAL AVE,GAITHERSBURG,MD,20877.0,GPD,Street - In vehicle,R,6R1,548,100.0,,ODEND HAL,,AVE,39.15027,-77.2044,6D,"(39.1503, -77.2044)"
201349391,2589,210041398,10/15/2021 05:08:47 PM,2021-10-01 09:00:00,10/15/2021 05:00:00 PM,250,1,Crime Against Property,Counterfeiting/Forgery,FORGERY (DESCRIBE OFFENSE),BETHESDA,10300 BLK  MONTROSE AVE,BETHESDA,MD,20814.0,MCPD,Other/Unknown,D,2D4,185,10300.0,,MONTROSE,,AVE,39.02432,-77.1018,2D,"(39.0243, -77.1018)"
201388961,2304,220035898,08/19/2022 04:26:43 PM,2022-08-18 22:00:00,08/19/2022 06:30:00 AM,23G,1,Crime Against Property,Theft of Motor Vehicle Parts or Accessories,LARCENY - AUTO PARTS,BETHESDA,11300 BLK  SCHUYLKILL RD,ROCKVILLE,MD,20852.0,MCPD,Residence - Driveway,D,2D4,309,11300.0,,SCHUYLKILL,,RD,39.04048,-77.0917,2D,"(39.0405, -77.0917)"
201302821,2305,200037025,09/21/2020 01:53:29 PM,2020-09-20 00:00:00,,23F,1,Crime Against Property,Theft From Motor Vehicle,LARCENY - FROM AUTO,SILVER SPRING,600 BLK  ELDRID DR,SILVER SPRING,MD,20904.0,MCPD,Residence - Yard,I,3I1,519,600.0,,ELDRID,,DR,39.06606,-76.999,3D,"(39.0661, -76.999)"
201231088,2305,190012486,03/18/2019 02:23:11 PM,2019-03-12 19:00:00,,23F,1,Crime Against Property,Theft From Motor Vehicle,LARCENY - FROM AUTO,MONTGOMERY VILLAGE,400 BLK N FREDERICK AVE,GAITHERSBURG,MD,20877.0,MCPD,Restaurant,P,6P2,428,400.0,N,FREDERICK,,AVE,39.1457,-77.2037,6D,"(39.1457, -77.2037)"
201221733,3550,190000697,01/04/2019 08:10:23 PM,2019-01-04 20:10:00,,35B,1,Crime Against Society,Drug Equipment Violations,DRUGS - NARCOTIC EQUIP - POSSESS,GERMANTOWN,19800 BLK  LARENTIA DR,GERMANTOWN,MD,20874.0,MCPD,Street - In vehicle,N,5N1,465,19800.0,,LARENTIA,,DR,39.18195,-77.2787,5D,"(39.182, -77.2787)"
201284831,1399,200015920,04/13/2020 07:25:55 PM,2020-04-13 19:25:00,,13B,1,Crime Against Person,Simple Assault,ASSAULT - 2ND DEGREE,BETHESDA,5900 BLK  EXECUTIVE BLV,ROCKVILLE,MD,20852.0,MCPD,Street - Residential,D,2D4,188,5900.0,,EXECUTIVE,,BLV,39.0463,-77.1167,2D,"(39.0463, -77.1167)"
201251194,5404,190036794,08/02/2019 12:28:18 AM,2019-08-02 00:28:00,,90D,1,Crime Against Society,Driving Under the Influence,DRIVING UNDER THE INFLUENCE LIQUOR,SILVER SPRING,,SILVER SPRING,MD,20901.0,MCPD,Street - In vehicle,H,3H1,672,,,UNIVERSITY,E,BLV,38.98852,-76.9871,3D,"(38.9885, -76.9871)"
201296204,2305,200029197,07/27/2020 08:38:04 PM,2020-07-27 09:00:00,07/27/2020 06:00:00 PM,23F,1,Crime Against Property,Theft From Motor Vehicle,LARCENY - FROM AUTO,SILVER SPRING,2200 BLK  BROADBIRCH DR,SILVER SPRING,MD,20904.0,MCPD,Parking Lot - Other,I,3I1,146,2200.0,,BROADBIRCH,,DR,39.05588,-76.9665,3D,"(39.0559, -76.9665)"
201340364,2305,210030072,08/03/2021 09:47:01 AM,2021-08-02 21:30:00,08/03/2021 09:00:00 AM,23F,1,Crime Against Property,Theft From Motor Vehicle,LARCENY - FROM AUTO,SILVER SPRING,12200 BLK  GALWAY DR,SILVER SPRING,MD,20904.0,MCPD,Residence - Driveway,I,3I1,377,12200.0,,GALWAY,,DR,39.05619,-76.9443,3D,"(39.0562, -76.9443)"
201335958,5212,210024496,06/26/2021 10:18:17 AM,2021-06-26 07:30:00,06/26/2021 10:00:00 AM,520,1,Crime Against Society,Weapon Law Violations,WEAPON - POSSESSION,WHEATON,1700 BLK  FRANWALL AVE,SILVER SPRING,MD,20902.0,MCPD,Street - In vehicle,L,4L1,360,1700.0,,FRANWALL,,AVE,39.04604,-77.0346,4D,"(39.046, -77.0346)"
201289128,2316,200020773,05/25/2020 02:39:58 PM,2020-05-09 14:39:00,,23H,1,Crime Against Property,All other Larceny,LARCENY - POSTAL,SILVER SPRING,13200 BLK  NEW HAMPSHIRE AVE,SILVER SPRING,MD,20904.0,MCPD,Other/Unknown,I,3I1,149,13200.0,,NEW HAMPSHIRE,,AVE,39.0714,-77.0032,3D,"(39.0714, -77.0032)"
201296685,5403,200029711,07/31/2020 02:22:19 PM,2020-07-31 14:22:00,07/31/2020 04:00:00 PM,90D,1,Crime Against Society,Driving Under the Influence,DRIVING UNDER THE INFLUENCE DRUGS,ROCKVILLE,,ROCKVILLE,MD,20851.0,RCPD,Street - In vehicle,A,1A2,287,,,NORBECK,,RD,39.11257,-77.0589,1D,"(39.1126, -77.0589)"
201422976,1399,230018822,04/18/2023 12:48:37 PM,2023-04-18 12:48:00,,13B,1,Crime Against Person,Simple Assault,ASSAULT - 2ND DEGREE,GERMANTOWN,25900 BLK  RIDGE MANOR DR,DAMASCUS,MD,20872.0,MCPD,Park,M,5M2,615,25900.0,,RIDGE MANOR,,DR,39.28282,-77.2075,5D,"(39.2828, -77.2075)"
201269683,2203,190060424,12/15/2019 12:02:19 PM,2019-12-15 11:00:00,12/15/2019 12:00:00 PM,220,1,Crime Against Property,Burglary/Breaking and Entering,BURGLARY - FORCED ENTRY-NONRESIDENTIAL,MONTGOMERY VILLAGE,18100 BLK  WASHINGTON GROVE LA,GAITHERSBURG,MD,20877.0,MCPD,School/College - DO NOT USE,R,6R3,420,18100.0,,WASHINGTON GROVE,,LA,39.15235,-77.1647,6D,"(39.1523, -77.1647)"
201355407,2305,210046246,11/15/2021 04:54:34 AM,2021-11-15 04:54:00,,23F,1,Crime Against Property,Theft From Motor Vehicle,LARCENY - FROM AUTO,SILVER SPRING,3400 BLK  OAKHURST DR,BURTONSVILLE,MD,20866.0,MCPD,Residence - Single Family,I,3I2,384,3400.0,,OAKHURST,,DR,39.10076,-76.9413,3D,"(39.1008, -76.9413)"
201403306,5404,220053487,12/04/2022 02:22:31 AM,2022-12-04 02:22:00,,90D,1,Crime Against Society,Driving Under the Influence,DRIVING UNDER THE INFLUENCE LIQUOR,WHEATON,,OLNEY,MD,20853.0,MCPD,Street - In vehicle,J,4J2,399,,,GEORGIA,,AVE,39.11237,-77.0755,4D,"(39.1124, -77.0755)"
201266783,2305,190056902,11/25/2019 12:24:24 PM,2019-11-25 12:24:00,,23F,1,Crime Against Property,Theft From Motor Vehicle,LARCENY - FROM AUTO,SILVER SPRING,11400 BLK  DECEMBER WAY,SILVER SPRING,MD,20904.0,MCPD,Parking Lot - Residential,I,3I1,145,11400.0,,DECEMBER,,WAY,39.04104,-76.9802,3D,"(39.041, -76.9802)"
201279434,2399,200009578,02/26/2020 03:40:18 PM,2019-03-14 12:00:00,02/14/2020 01:00:00 PM,23H,1,Crime Against Property,All other Larceny,LARCENY (DESCRIBE OFFENSE),ROCKVILLE,14200 BLK  SENECA RD,GERMANTOWN,MD,20874.0,MCPD,Residence - Other,B,1B2,560,14200.0,,SENECA,,RD,39.0999,-77.2945,1D,"(39.0999, -77.2945)"
201362042,2308,220003714,01/28/2022 08:15:33 AM,2022-01-24 08:15:00,,23D,1,Crime Against Property,Theft from Building,LARCENY - FROM BLDG,WHEATON,11800 BLK  GRANDVIEW AVE,SILVER SPRING,MD,20902.0,MCPD,Residence - Single Family,L,4L1,327,11800.0,,GRANDVIEW,,AVE,39.04953,-77.053,4D,"(39.0495, -77.053)"
201377687,2999,220022435,05/25/2022 09:28:52 PM,2022-05-25 21:28:00,05/25/2022 11:00:00 PM,290,1,Crime Against Property,Destruction/Damage/Vandalism of Property,DAMAGE PROPERTY (DESCRIBE OFFENSE),,,SILVER SPRING,MD,20901.0,MCPD,Residence - Driveway,w,own,Unknown,,,,,,0.0,0.0,Unknown,"(0.0, 0.0)"
201415297,1117,230009791,02/27/2023 02:24:01 PM,2023-02-27 14:24:00,,11D,2,Crime Against Person,Forcible Fondling,SEX ASSAULT - CARNAL ABUSE,BETHESDA,5500 BLK  MASSACHUSETTS AVE,BETHESDA,MD,20816.0,MCPD,School - Elementary/Secondary,E,2E1,019,5500.0,,MASSACHUSETTS,,AVE,38.9582,-77.1096,2D,"(38.9582, -77.1096)"
201314684,2305,200051309,12/30/2020 09:38:06 AM,2020-12-28 19:00:00,12/30/2020 09:30:00 AM,23F,1,Crime Against Property,Theft From Motor Vehicle,LARCENY - FROM AUTO,SILVER SPRING,8400 BLK  QUEEN ANNES DR,SILVER SPRING,MD,20910.0,MCPD,Residence - Driveway,G,3G1,114,8400.0,,QUEEN ANNES,,DR,38.99713,-77.0189,3D,"(38.9971, -77.0189)"
201244180,1399,190028812,06/16/2019 09:07:09 PM,2019-06-16 21:07:00,,13B,1,Crime Against Person,Simple Assault,ASSAULT - 2ND DEGREE,WHEATON,18800 BLK  HERITAGE HILLS DR,BROOKEVILLE,MD,20833.0,MCPD,Street - Residential,J,4J2,540,18800.0,,HERITAGE HILLS,,DR,39.16445,-77.0712,4D,"(39.1645, -77.0712)"
201262351,2301,190051292,10/25/2019 11:13:57 AM,2019-10-25 10:30:00,10/25/2019 11:30:00 AM,23A,1,Crime Against Property,Pocket/picking,LARCENY - POCKET PICKING,WHEATON,12200 BLK  VEIRS MILL RD,SILVER SPRING,MD,20906.0,MCPD,Retail - Clothing,K,4K2,525,12200.0,,VEIRS MILL,,RD,39.05614,-77.0826,4D,"(39.0561, -77.0826)"
201238392,2610,190021365,05/06/2019 05:40:32 PM,2019-04-16 14:00:00,04/17/2019 11:59:00 PM,26F,1,Crime Against Property,Identity Theft,FRAUD - IDENTITY THEFT,ROCKVILLE,13500 BLK  HADDONFIELD LA,GAITHERSBURG,MD,20878.0,MCPD,Other/Unknown,B,1B2,458,13500.0,,HADDONFIELD,,LA,39.11288,-77.282,1D,"(39.1129, -77.282)"
201375145,3564,220019229,05/06/2022 02:10:00 AM,2022-05-06 03:22:00,,35A,1,Crime Against Society,Drug/Narcotic Violations,DRUGS - MARIJUANA (DESCRIBE OFFENSE),GERMANTOWN,,GERMANTOWN,MD,20876.0,MCPD,Street - In vehicle,M,5M1,471,,,SCENERY,,DR,39.18288,-77.2318,5D,"(39.1829, -77.2318)"
201336901,2499,210025646,07/04/2021 12:00:43 PM,2021-07-04 11:55:00,,240,1,Crime Against Property,Motor Vehicle Theft,STOLEN VEHICLE (DESCRIBE OFFENSE),GERMANTOWN,18800 BLK  BENT WILLOW CIR,GERMANTOWN,MD,20874.0,MCPD,Street - Other,N,5N1,447,18800.0,,BENT WILLOW,,CIR,39.16366,-77.2602,5D,"(39.1637, -77.2602)"
201343529,2305,210033943,08/30/2021 08:36:36 PM,2021-08-30 20:36:00,,23F,1,Crime Against Property,Theft From Motor Vehicle,LARCENY - FROM AUTO,ROCKVILLE,1  BLK  MONONA CT,DERWOOD,MD,20855.0,MCPD,Residence - Single Family,A,1A4,281,1.0,,MONONA,,CT,39.11066,-77.1523,1D,"(39.1107, -77.1523)"
201267221,2902,190057437,11/28/2019 12:41:06 PM,2019-11-28 12:41:00,11/28/2019 12:41:00 PM,290,1,Crime Against Property,Destruction/Damage/Vandalism of Property,DAMAGE PROPERTY - PRIVATE,BETHESDA,6500 BLK  DANVILLE CT,ROCKVILLE,MD,20852.0,MCPD,Residence - Driveway,E,2E3,200,6500.0,,DANVILLE,,CT,39.04706,-77.1314,2D,"(39.0471, -77.1314)"
201226420,1399,190006668,02/11/2019 11:32:18 AM,2019-02-11 11:32:00,,13B,2,Crime Against Person,Simple Assault,ASSAULT - 2ND DEGREE,GERMANTOWN,13500 BLK  STATION ST,GERMANTOWN,MD,20874.0,MCPD,Residence -Townhouse/Duplex,N,5N1,702,13500.0,,STATION,,ST,39.17695,-77.2771,5D,"(39.1769, -77.2771)"
201319862,2999,210005828,02/14/2021 02:23:57 PM,2021-02-13 18:00:00,02/14/2021 01:00:00 PM,290,1,Crime Against Property,Destruction/Damage/Vandalism of Property,DAMAGE PROPERTY (DESCRIBE OFFENSE),SILVER SPRING,2100 BLK  INDUSTRIAL PKW,SILVER SPRING,MD,20904.0,MCPD,Restaurant,I,3I1,146,2100.0,,INDUSTRIAL,,PKW,39.05583,-76.9709,3D,"(39.0558, -76.9709)"
201349022,5404,210040109,10/07/2021 09:32:01 PM,2021-10-07 21:32:00,,90D,1,Crime Against Society,Driving Under the Influence,DRIVING UNDER THE INFLUENCE LIQUOR,BETHESDA,,CHEVY CHASE,MD,20815.0,MCPD,Street - In vehicle,D,2D3,076,,,KENSINGTON,,PKW,39.0042,-77.0739,2D,"(39.0042, -77.0739)"
201227531,2305,190007737,02/17/2019 02:31:17 PM,2019-02-17 12:20:00,02/17/2019 02:10:00 PM,23F,1,Crime Against Property,Theft From Motor Vehicle,LARCENY - FROM AUTO,BETHESDA,,ROCKVILLE',MD,20852.0,MCPD,Street - Commercial,D,2D4,186,,,ROCKVILLE,,PIK,39.07219,-77.1332,2D,"(39.0722, -77.1332)"
201425259,2303,230021589,05/05/2023 05:19:29 PM,2023-05-05 17:19:00,,23C,1,Crime Against Property,Shoplifting,LARCENY - SHOPLIFTING,SILVER SPRING,900 BLK  THAYER AVE,SILVER SPRING,MD,20910.0,MCPD,Grocery/Supermarket,G,3G1,670,900.0,,THAYER,,AVE,38.99304,-77.024,3D,"(38.993, -77.024)"
201375364,2304,220019075,05/05/2022 08:45:32 AM,2022-05-05 03:00:00,05/05/2022 07:00:00 AM,23G,1,Crime Against Property,Theft of Motor Vehicle Parts or Accessories,LARCENY - AUTO PARTS,SILVER SPRING,1700 BLK  HAMPSHIRE GREEN LA,SILVER SPRING,MD,20903.0,MCPD,Parking Lot - Residential,H,3H2,138,1700.0,,HAMPSHIRE GREEN,,LA,39.01506,-76.9761,3D,"(39.0151, -76.9761)"
201366757,3572,220009041,03/02/2022 12:29:48 PM,2022-03-02 12:29:00,,35A,1,Crime Against Society,Drug/Narcotic Violations,DRUGS - AMPHETAMINE - POSSESS,WHEATON,11200 BLK  GEORGIA AVE,SILVER SPRING,MD,20902.0,MCPD,Street - In vehicle,L,4L2,324,11200.0,,GEORGIA,,AVE,39.03867,-77.0508,4D,"(39.0387, -77.0508)"
201300244,2305,200033934,08/30/2020 05:28:35 PM,2020-08-29 16:00:00,08/30/2020 02:30:00 PM,23F,1,Crime Against Property,Theft From Motor Vehicle,LARCENY - FROM AUTO,MONTGOMERY VILLAGE,9300 BLK  WEATHERVANE PL,MONTGOMERY VILLAGE,MD,20886.0,MCPD,Parking Lot - Residential,R,6R2,504,9300.0,,WEATHERVANE,,PL,39.18235,-77.1913,6D,"(39.1824, -77.1913)"
201305620,1399,200040225,10/12/2020 06:45:11 PM,2020-10-12 18:45:00,,13B,1,Crime Against Person,Simple Assault,ASSAULT - 2ND DEGREE,GERMANTOWN,12600 BLK  GREY EAGLE CT,GERMANTOWN,MD,20874.0,MCPD,Residence - Apartment/Condo,N,5N1,447,12600.0,,GREY EAGLE,,CT,39.16706,-77.2635,5D,"(39.1671, -77.2635)"
201446981,2305,230058679,10/05/2023 09:50:19 AM,2023-10-04 20:30:00,10/05/2023 08:30:00 AM,23F,1,Crime Against Property,Theft From Motor Vehicle,LARCENY - FROM AUTO,BETHESDA,10400 BLK  MONTROSE AVE,BETHESDA,MD,20814.0,MCPD,Parking Lot - Residential,D,2D4,185,10400.0,,MONTROSE,,AVE,39.02592,-77.1008,2D,"(39.0259, -77.1008)"
201236889,3562,190018710,04/21/2019 07:02:11 PM,2019-04-21 19:32:00,,35A,1,Crime Against Society,Drug/Narcotic Violations,DRUGS - MARIJUANA - POSSESS,WHEATON,,WHEATON,,20902.0,MCPD,Street - In vehicle,L,4L2,354,,,PRICE,,AVE,39.04013,-77.0512,4D,"(39.0401, -77.0512)"
201261674,2305,190050469,10/21/2019 11:27:58 AM,2019-10-20 18:00:00,10/21/2019 11:00:00 AM,23F,1,Crime Against Property,Theft From Motor Vehicle,LARCENY - FROM AUTO,MONTGOMERY VILLAGE,17100 BLK  DOWNING ST,GAITHERSBURG,MD,20877.0,MCPD,Parking Lot - Residential,P,6P1,429,17100.0,,DOWNING,,ST,39.13708,-77.208,6D,"(39.1371, -77.208)"
201314385,2304,200050988,12/28/2020 08:55:59 AM,2020-12-26 13:00:00,12/27/2020 09:30:00 AM,23G,1,Crime Against Property,Theft of Motor Vehicle Parts or Accessories,LARCENY - AUTO PARTS,SILVER SPRING,11400 BLK  STEWART LA,SILVER SPRING,MD,20904.0,MCPD,Parking Lot - Residential,I,3I1,145,11400.0,,STEWART,,LA,39.04396,-76.9802,3D,"(39.044, -76.9802)"
201226144,5311,190006333,02/08/2019 07:27:31 PM,2019-02-08 19:27:00,02/08/2019 09:00:00 PM,90C,1,Crime Against Society,Disorderly Conduct,PUBLIC PEACE - DISORDERLY CONDUCT,WHEATON,3200 BLK  HENDERSON AVE,SILVER SPRING,MD,20902.0,MCPD,Street - Residential,L,4L1,330,3200.0,,HENDERSON,,AVE,39.05479,-77.0638,4D,"(39.0548, -77.0638)"
201371623,1399,220015068,04/09/2022 12:37:59 AM,2022-04-09 00:30:00,04/09/2022 12:37:00 AM,13B,1,Crime Against Person,Simple Assault,ASSAULT - 2ND DEGREE,TAKOMA PARK,1200 BLK  KIRKLYNN AVE,TAKOMA PARK,MD,20912.0,TPPD,Street - Other,T,8T3,806,1200.0,,KIRKLYNN,,AVE,38.98727,-76.9908,TPPD,"(38.9873, -76.9908)"
201416955,2303,230011816,03/10/2023 04:05:03 PM,2023-02-22 17:56:00,,23C,1,Crime Against Property,Shoplifting,LARCENY - SHOPLIFTING,MONTGOMERY VILLAGE,16500 BLK S FREDERICK AVE,GAITHERSBURG,MD,20877.0,MCPD,Liquor Store - County,P,6P3,437,16500.0,S,FREDERICK,,AVE,39.05909,-77.1162,6D,"(39.0591, -77.1162)"
201275728,2404,200004933,01/30/2020 08:51:41 AM,2020-01-29 17:00:00,01/30/2020 08:15:00 AM,240,1,Crime Against Property,Motor Vehicle Theft,AUTO THEFT - VEHICLE THEFT,SILVER SPRING,8500 BLK  CAMERON ST,SILVER SPRING,MD,20910.0,MCPD,Parking Garage - County,G,3G1,095,8500.0,,CAMERON,,ST,38.99637,-77.0311,3D,"(38.9964, -77.0311)"
201436984,2305,230046498,07/27/2023 05:23:08 PM,2023-07-27 15:50:00,,23F,1,Crime Against Property,Theft From Motor Vehicle,LARCENY - FROM AUTO,ROCKVILLE,12100 BLK  PENNYFIELD LOCK RD,POTOMAC,MD,20854.0,MCPD,Park,B,1B2,507,12100.0,,PENNYFIELD LOCK,,RD,39.05395,-77.2889,1D,"(39.054, -77.2889)"
201222746,2308,190001953,01/12/2019 03:10:05 PM,2019-01-12 14:20:00,,23D,1,Crime Against Property,Theft from Building,LARCENY - FROM BLDG,MONTGOMERY VILLAGE,1  BLK  MAPLEWOOD CT,GAITHERSBURG,MD,20877.0,GPD,Residence - Apartment/Condo,P,6P3,419,1.0,,MAPLEWOOD,,CT,39.14637,-77.19,6D,"(39.1464, -77.19)"
201223511,5404,190002987,01/19/2019 02:00:07 AM,2019-01-19 02:01:00,,90D,1,Crime Against Society,Driving Under the Influence,DRIVING UNDER THE INFLUENCE LIQUOR,GERMANTOWN,,GERMANTOWN,MD,20876.0,MCPD,Street - In vehicle,M,5M1,471,,,FREDERICK,,RD,39.17545,-77.2381,5D,"(39.1754, -77.2381)"
201258766,3562,190046146,,2019-09-26 11:50:00,09/26/2019 12:15:00 PM,35A,1,Crime Against Society,Drug/Narcotic Violations,DRUGS - MARIJUANA - POSSESS,WHEATON,300 BLK  NORWOOD RD,SILVER SPRING,MD,20905.0,MCPD,School/College - DO NOT USE,J,4J1,372,300.0,,NORWOOD,,RD,39.11409,-77.0146,4D,"(39.1141, -77.0146)"
201380855,2608,220026210,06/17/2022 11:00:58 PM,2022-06-08 12:00:00,,26E,1,Crime Against Property,Wire Fraud,FRAUD BY WIRE,WHEATON,5000 BLK  ASPEN HILL RD,ROCKVILLE,MD,20853.0,MCPD,Retail - Other,K,4K2,340,5000.0,,ASPEN HILL,,RD,39.071,-77.1018,4D,"(39.071, -77.1018)"
201238609,2305,190021672,05/08/2019 09:40:05 AM,2019-05-07 18:55:00,05/08/2019 09:15:00 AM,23F,1,Crime Against Property,Theft From Motor Vehicle,LARCENY - FROM AUTO,MONTGOMERY VILLAGE,300 BLK  WOODLAND RD,GAITHERSBURG,,20877.0,MCPD,Residence - Driveway,P,6P3,432,300.0,,WOODLAND,,RD,39.13893,-77.1869,6D,"(39.1389, -77.1869)"
201288325,2699,200019959,05/18/2020 07:55:47 PM,2019-08-30 08:00:00,05/18/2020 08:00:00 PM,26A,1,Crime Against Property,False Pretenses/Swindle/Confidence Game,FRAUD (DESCRIBE OFFENSE),MONTGOMERY VILLAGE,7800 BLK  POLARA PL,DERWOOD,MD,20855.0,MCPD,Residence - Single Family,P,6P3,551,7800.0,,POLARA,,PL,39.13642,-77.1596,6D,"(39.1364, -77.1596)"
201449369,2610,230061622,,2023-10-18 00:01:00,10/19/2023 11:59:00 PM,26F,1,Crime Against Property,Identity Theft,IDENTITY THEFT,BETHESDA,5000 BLK  DRUID DR,KENSINGTON,MD,20895.0,MCPD,Other/Unknown,D,2D4,694,5000.0,,DRUID,,DR,0.0,0.0,2D,"(0.0, 0.0)"
201265964,5404,190055589,11/18/2019 09:30:26 AM,2019-11-18 09:30:00,,90D,1,Crime Against Society,Driving Under the Influence,DRIVING UNDER THE INFLUENCE LIQUOR,SILVER SPRING,12000 BLK  CHERRY HILL RD,SILVER SPRING,MD,20904.0,MCPD,Gas Station,I,3I1,146,12000.0,,CHERRY HILL,,RD,39.05259,-76.9531,3D,"(39.0526, -76.9531)"
201292121,2308,200024425,06/22/2020 03:33:18 PM,2020-06-22 15:33:00,,23D,1,Crime Against Property,Theft from Building,LARCENY - FROM BLDG,MONTGOMERY VILLAGE,1  BLK  GRAND CORNER AVE,GAITHERSBURG,MD,20878.0,GPD,Retail - Department/Discount Store,P,6P1,549,1.0,,GRAND CORNER,,AVE,39.11801,-77.2004,6D,"(39.118, -77.2004)"
201437577,2404,230047278,08/01/2023 11:46:28 AM,2023-07-31 17:00:00,07/31/2023 07:30:00 AM,240,1,Crime Against Property,Motor Vehicle Theft,AUTO THEFT - VEHICLE THEFT,SILVER SPRING,11700 BLK  OLD COLUMBIA PIK,SILVER SPRING,MD,20904.0,MCPD,Parking Garage - Residential,I,3I1,145,11700.0,,OLD COLUMBIA,,PIK,39.04846,-76.9806,3D,"(39.0485, -76.9806)"
201442869,2902,230053571,09/07/2023 07:57:29 AM,2023-09-07 07:57:00,,290,1,Crime Against Property,Destruction/Damage/Vandalism of Property,DAMAGE PROPERTY - PRIVATE,SILVER SPRING,,SILVER SPRING,MD,20901.0,MCPD,Street - Residential,H,3H1,126,,,PINEY BRANCH,,RD,38.99563,-77.0062,3D,"(38.9956, -77.0062)"
201321581,2399,210007707,03/01/2021 10:41:44 AM,2021-02-24 10:40:00,02/25/2021 02:50:00 PM,23H,1,Crime Against Property,All other Larceny,LARCENY (DESCRIBE OFFENSE),GERMANTOWN,12700 BLK  GORMAN CIR,BOYDS,MD,20841.0,MCPD,Residence - Other,M,5M3,708,12700.0,,GORMAN,,CIR,39.21418,-77.2639,5D,"(39.2142, -77.2639)"
201358024,2901,210051401,12/17/2021 02:24:40 PM,2021-12-17 14:24:00,,290,1,Crime Against Property,Destruction/Damage/Vandalism of Property,DAMAGE PROPERTY - BUSINESS,SILVER SPRING,1100 BLK  WAYNE AVE,SILVER SPRING,MD,20910.0,MCPD,Commercial - Office Building,G,3G1,094,1100.0,,WAYNE,,AVE,38.99454,-77.028,3D,"(38.9945, -77.028)"
201356633,3562,210050558,12/12/2021 09:51:22 PM,2021-12-12 21:51:00,,35A,1,Crime Against Society,Drug/Narcotic Violations,DRUGS - MARIJUANA - POSSESS,WHEATON,,OLNEY,MD,20832.0,MCPD,Parking Lot - Other,J,4J2,412,,,WICKHAM,,RD,39.16312,-77.0992,4D,"(39.1631, -77.0992)"
201393968,3562,220042094,09/27/2022 12:06:10 PM,2022-09-27 12:06:00,,35A,1,Crime Against Society,Drug/Narcotic Violations,DRUGS - MARIJUANA - POSSESS,MONTGOMERY VILLAGE,5900 BLK  MUNCASTER MILL RD,DERWOOD,MD,20855.0,MCPD,School - Elementary/Secondary,R,6R3,397,5900.0,,MUNCASTER MILL,,RD,39.12941,-77.1183,6D,"(39.1294, -77.1183)"
201401405,2204,220051235,11/19/2022 04:15:16 PM,2022-11-19 15:30:00,11/19/2022 04:15:00 PM,220,1,Crime Against Property,Burglary/Breaking and Entering,BURGLARY - NO FORCED ENTRY-RESIDENTIAL,WHEATON,3400 BLK  JANET RD,SILVER SPRING,MD,20906.0,MCPD,Residence - Single Family,K,4K2,336,3400.0,,JANET,,RD,39.06671,-77.0672,4D,"(39.0667, -77.0672)"
201436253,2502,230034982,07/22/2023 10:56:21 PM,2023-07-06 01:00:00,07/22/2023 11:00:00 AM,250,1,Crime Against Property,Counterfeiting/Forgery,FORGERY OF OTHER,TAKOMA PARK,1  BLK  LEE AVE,TAKOMA PARK,MD,20912.0,TPPD,Residence -Townhouse/Duplex,T,8T2,804,1.0,,LEE,,AVE,38.97886,-77.0054,TPPD,"(38.9789, -77.0054)"
201402261,2303,220052222,11/26/2022 06:50:08 PM,2022-11-26 18:50:00,,23C,1,Crime Against Property,Shoplifting,LARCENY - SHOPLIFTING,WHEATON,11100 BLK  VEIRS MILL RD,SILVER SPRING,MD,20902.0,MCPD,Retail - Clothing,L,4L2,321,11100.0,,VEIRS MILL,,RD,39.03758,-77.0519,4D,"(39.0376, -77.0519)"
201361073,2610,220002190,01/18/2022 03:44:42 PM,2021-12-20 16:00:00,12/20/2021 04:00:00 PM,26F,1,Crime Against Property,Identity Theft,FRAUD - IDENTITY THEFT,WHEATON,15100 BLK  INTERLACHEN DR,SILVER SPRING,MD,20906.0,MCPD,Other/Unknown,K,4K1,346,15100.0,,INTERLACHEN,,DR,39.10575,-77.0694,4D,"(39.1058, -77.0694)"
201290209,1204,200022082,06/04/2020 06:19:43 PM,2020-06-04 18:20:00,,120,1,Crime Against Property,Robbery,ROBBERY - STREET-GUN,SILVER SPRING,,SILVER SPRING,MD,20910.0,MCPD,Street - Alley,G,3G1,116,,,BONIFANT,,ST,38.9946,-77.0237,3D,"(38.9946, -77.0237)"
201314612,5404,200050585,12/24/2020 12:52:40 AM,2020-12-24 00:52:00,,90D,1,Crime Against Society,Driving Under the Influence,DRIVING UNDER THE INFLUENCE LIQUOR,WHEATON,,SILVER SPRING,MD,20902.0,MCPD,Street - In vehicle,L,4L2,171,,,GEORGIA,,AVE,39.11237,-77.0755,4D,"(39.1124, -77.0755)"
201391372,1399,220038867,09/07/2022 02:53:16 PM,2022-09-07 15:00:00,,13B,1,Crime Against Person,Simple Assault,ASSAULT - 2ND DEGREE,MONTGOMERY VILLAGE,8200 BLK  SNOUFFER SCHOOL RD,GAITHERSBURG,MD,20879.0,MCPD,Auto Dealership,R,6R3,421,8200.0,,SNOUFFER SCHOOL,,RD,39.16512,-77.1685,6D,"(39.1651, -77.1685)"
201376723,2399,220021239,05/18/2022 08:09:12 PM,2022-05-18 19:26:00,05/18/2022 07:49:00 PM,23H,1,Crime Against Property,All other Larceny,LARCENY (DESCRIBE OFFENSE),TAKOMA PARK,6800 BLK  NEW HAMPSHIRE AVE,TAKOMA PARK,MD,20912.0,TPPD,Liquor Store - Beer & Wine,T,8T3,808,6800.0,,NEW HAMPSHIRE,,AVE,38.97297,-76.9968,TPPD,"(38.973, -76.9968)"
201224820,2303,190004624,01/29/2019 06:56:12 PM,2019-01-29 18:45:00,,23C,1,Crime Against Property,Shoplifting,LARCENY - SHOPLIFTING,MONTGOMERY VILLAGE,9600 BLK  LOST KNIFE RD,GAITHERSBURG,MD,20877.0,MCPD,Grocery/Supermarket,R,6R1,505,9600.0,,LOST KNIFE,,RD,39.15237,-77.1983,6D,"(39.1524, -77.1983)"
201261106,3806,190049659,10/16/2019 02:08:18 PM,2019-10-16 14:08:00,10/16/2019 02:15:00 PM,90F,1,Crime Against Society,"Family Offenses, NonViolent",FAMILY OFFENSE - NEGLECT CHILD (INCLUDES NONSUPPOR,SILVER SPRING,9700 BLK  MT PISGAH RD,SILVER SPRING,MD,20903.0,MCPD,Residence - Apartment/Condo,H,3H2,138,9700.0,,MT PISGAH,,RD,39.01519,-76.9768,3D,"(39.0152, -76.9768)"
201303170,2303,200037408,09/23/2020 04:27:55 PM,2020-09-23 16:11:00,,23C,1,Crime Against Property,Shoplifting,LARCENY - SHOPLIFTING,BETHESDA,5400 BLK  WISCONSIN AVE,CHEVY CHASE,MD,20815.0,MCPD,Retail - Department/Discount Store,E,2E1,516,5400.0,,WISCONSIN,,AVE,38.96082,-77.0857,2D,"(38.9608, -77.0857)"
201409579,2305,230003108,01/19/2023 04:47:10 PM,2023-01-18 20:00:00,01/19/2023 08:55:00 AM,23F,1,Crime Against Property,Theft From Motor Vehicle,LARCENY - FROM AUTO,WHEATON,19400 BLK  OLNEY MILL RD,OLNEY,MD,20832.0,MCPD,Residence - Driveway,J,4J2,400,19400.0,,OLNEY MILL,,RD,39.17514,-77.0749,4D,"(39.1751, -77.0749)"
201294259,9003,200026932,07/11/2020 01:13:16 PM,2020-07-11 13:13:00,,11C,1,Crime Against Person,Sexual Assault With An Object,SEX ASSAULT - WITH AN OBJECT,BETHESDA,2700 BLK  CASSEDY ST,SILVER SPRING,MD,20910.0,MCPD,Residence - Single Family,D,2D3,079,2700.0,,CASSEDY,,ST,39.01032,-77.0545,2D,"(39.0103, -77.0545)"
201300861,2902,200034703,09/04/2020 06:11:50 PM,2020-09-04 18:11:00,,290,1,Crime Against Property,Destruction/Damage/Vandalism of Property,DAMAGE PROPERTY - PRIVATE,GERMANTOWN,6600 BLK  BELLE CHASE CT,GAITHERSBURG,MD,20882.0,MCPD,Residence - Yard,M,5M2,416,6600.0,,BELLE CHASE,,CT,39.18852,-77.1376,5D,"(39.1885, -77.1376)"
201440655,2202,230050790,08/22/2023 09:29:36 PM,2023-08-22 21:29:00,,220,1,Crime Against Property,Burglary/Breaking and Entering,BURGLARY - FORCED ENTRY-RESIDENTIAL,GERMANTOWN,20000 BLK  APPLEDOWRE CIR,GERMANTOWN,MD,20876.0,MCPD,Residence - Apartment/Condo,M,5M1,471,20000.0,,APPLEDOWRE,,CIR,39.18326,-77.2342,5D,"(39.1833, -77.2342)"
201262289,5404,190051234,10/25/2019 12:08:42 AM,2019-10-25 00:08:00,10/25/2019 01:38:00 AM,90D,1,Crime Against Society,Driving Under the Influence,DRIVING UNDER THE INFLUENCE LIQUOR,WHEATON,8800 BLK  W200 X10 TO X8 HWY,SILVER SPRING,MD,20906.0,MCPD,Street - In vehicle,K,4K1,783,8800.0,,W200 X10 TO X8,,HWY,39.11124,-77.0589,4D,"(39.1112, -77.0589)"
201384007,2999,220030000,07/12/2022 08:29:08 PM,2022-07-12 20:29:00,,290,1,Crime Against Property,Destruction/Damage/Vandalism of Property,DAMAGE PROPERTY (DESCRIBE OFFENSE),GERMANTOWN,,GERMANTOWN,,20874.0,MCPD,Street - Residential,N,5N1,447,,,GUNNERFIELD,,LA,39.17079,-77.2539,5D,"(39.1708, -77.2539)"
201432658,2604,230030638,06/26/2023 08:36:08 PM,2023-06-26 02:30:00,,26C,1,Crime Against Property,Impersonation,FRAUD - IMPERSONATION,BETHESDA,2700 BLK  LINDEN LA,SILVER SPRING,MD,20910.0,MCPD,Residence - Single Family,D,2D3,079,2700.0,,LINDEN,,LA,39.00992,-77.0549,2D,"(39.0099, -77.0549)"
201354038,2399,210047312,11/21/2021 03:42:08 PM,2021-11-21 14:00:00,11/21/2021 02:50:00 PM,23H,1,Crime Against Property,All other Larceny,LARCENY (DESCRIBE OFFENSE),ROCKVILLE,,ROCKVILLE,MD,20850.0,MCPD,Park,A,1A3,246,,,WELSH PARK,,DR,39.09095,-77.1621,1D,"(39.0909, -77.1621)"
201235413,5311,190017749,04/16/2019 10:10:27 AM,2019-04-16 10:03:00,04/16/2019 12:17:00 PM,90C,1,Crime Against Society,Disorderly Conduct,PUBLIC PEACE - DISORDERLY CONDUCT,SILVER SPRING,9200 BLK  COLUMBIA BLV,SILVER SPRING,MD,20910.0,MCPD,Street - Residential,G,3G2,084,9200.0,,COLUMBIA,,BLV,39.00627,-77.0404,3D,"(39.0063, -77.0404)"
201255744,2305,190042703,09/06/2019 10:58:10 AM,2019-09-06 00:00:00,,23F,1,Crime Against Property,Theft From Motor Vehicle,LARCENY - FROM AUTO,SILVER SPRING,700 BLK  SEEK LA,TAKOMA PARK,MD,20912.0,MCPD,Residence - Yard,H,3H1,130,700.0,,SEEK,,LA,38.99727,-76.9962,3D,"(38.9973, -76.9962)"
201434885,2304,230033207,07/12/2023 01:03:02 PM,2023-07-09 19:30:00,07/11/2023 04:00:00 PM,23G,1,Crime Against Property,Theft of Motor Vehicle Parts or Accessories,LARCENY - AUTO PARTS,GERMANTOWN,13500 BLK  ALE HOUSE CIR,GERMANTOWN,MD,20874.0,MCPD,Parking Lot - Residential,N,5N2,448,13500.0,,ALE HOUSE,,CIR,39.15929,-77.282,5D,"(39.1593, -77.282)"
201230356,1399,190010713,03/07/2019 08:46:22 PM,2019-03-07 15:30:00,03/07/2019 03:45:00 PM,13B,1,Crime Against Person,Simple Assault,ASSAULT - 2ND DEGREE,SILVER SPRING,900 BLK  THAYER AVE,SILVER SPRING,MD,20910.0,MCPD,Street - Other,G,3G1,670,900.0,,THAYER,,AVE,38.99304,-77.024,3D,"(38.993, -77.024)"
201253154,3562,190037929,08/09/2019 12:14:37 AM,2019-08-09 00:05:00,,35A,1,Crime Against Society,Drug/Narcotic Violations,DRUGS - MARIJUANA - POSSESS,ROCKVILLE,,ROCKVILLE,MD,20852.0,MCPD,Street - In vehicle,A,1A1,259,,,WOOTTON,,PKW,39.07578,-77.1402,1D,"(39.0758, -77.1402)"
201382035,2203,220027598,06/27/2022 10:20:02 AM,2022-06-26 22:20:00,06/27/2022 12:18:00 PM,220,1,Crime Against Property,Burglary/Breaking and Entering,BURGLARY - FORCED ENTRY-NONRESIDENTIAL,SILVER SPRING,8600 BLK  COLESVILLE RD,SILVER SPRING,MD,20910.0,MCPD,Retail - Jewelry,G,3G1,109,8600.0,,COLESVILLE,,RD,38.99602,-77.0281,3D,"(38.996, -77.0281)"
201429365,2308,230026637,06/03/2023 10:21:16 AM,2023-06-03 10:51:00,,23D,1,Crime Against Property,Theft from Building,LARCENY - FROM BLDG,SILVER SPRING,11500 BLK  LOCKWOOD DR,SILVER SPRING,MD,20904.0,MCPD,Residence - Apartment/Condo,I,3I1,145,11500.0,,LOCKWOOD,,DR,39.0412,-76.9862,3D,"(39.0412, -76.9862)"
201331698,1399,210019288,05/21/2021 09:32:16 PM,2021-05-21 21:32:00,05/21/2021 10:30:00 PM,13B,2,Crime Against Person,Simple Assault,ASSAULT - 2ND DEGREE,ROCKVILLE,300 BLK  CEDAR LA,ROCKVILLE,MD,20851.0,RCPD,Residence - Single Family,A,1A2,293,300.0,,CEDAR,,LA,39.07764,-77.1218,1D,"(39.0776, -77.1218)"
201389685,2305,220036866,08/26/2022 09:18:25 AM,2022-08-25 15:00:00,08/26/2022 09:00:00 AM,23F,1,Crime Against Property,Theft From Motor Vehicle,LARCENY - FROM AUTO,BETHESDA,4500 BLK  HARLING LA,BETHESDA,MD,20814.0,MCPD,Street - Residential,D,2D2,043,4500.0,,HARLING,,LA,38.98946,-77.0892,2D,"(38.9895, -77.0892)"
201236134,1399,190018553,04/20/2019 05:41:57 PM,2019-04-20 17:00:00,04/20/2019 05:14:00 PM,13B,1,Crime Against Person,Simple Assault,ASSAULT - 2ND DEGREE,BETHESDA,7200 BLK  WOODMONT AVE,BETHESDA,MD,20814.0,MCPD,Street - Commercial,D,2D2,033,7200.0,,WOODMONT,,AVE,38.98098,-77.095,2D,"(38.981, -77.095)"
201291335,2303,200023474,06/15/2020 02:29:43 PM,2020-06-15 14:29:00,,23C,1,Crime Against Property,Shoplifting,LARCENY - SHOPLIFTING,GERMANTOWN,20900 BLK  FREDERICK RD,GERMANTOWN,MD,20876.0,MCPD,Retail - Department/Discount Store,M,5M1,701,20900.0,,FREDERICK,,RD,39.19829,-77.2448,5D,"(39.1983, -77.2448)"
201271159,5404,190061268,12/20/2019 03:00:13 AM,2019-12-20 03:00:00,,90D,1,Crime Against Society,Driving Under the Influence,DRIVING UNDER THE INFLUENCE LIQUOR,ROCKVILLE,,ROCKVILLE,MD,20851.0,MCPD,Street - In vehicle,A,1A2,521,,,ATLANTIC,,AVE,39.07198,-77.1157,1D,"(39.072, -77.1157)"
201392982,2301,220040734,09/19/2022 12:11:55 PM,2022-09-19 11:36:00,,23A,1,Crime Against Property,Pocket/picking,LARCENY - POCKET PICKING,SILVER SPRING,100 BLK  UNIVERSITY BLV,SILVER SPRING,MD,20901.0,MCPD,Restaurant,H,3H2,160,100.0,,UNIVERSITY,,BLV,39.02006,-77.0136,3D,"(39.0201, -77.0136)"
201341787,2902,210031766,08/15/2021 09:51:45 PM,2021-08-15 21:50:00,,290,1,Crime Against Property,Destruction/Damage/Vandalism of Property,DAMAGE PROPERTY - PRIVATE,WHEATON,2100 BLK  ARCOLA AVE,SILVER SPRING,MD,20902.0,MCPD,Residence - Single Family,L,4L1,359,2100.0,,ARCOLA,,AVE,39.04722,-77.0445,4D,"(39.0472, -77.0445)"
201351140,3562,210043611,10/29/2021 12:29:35 AM,2021-10-29 01:55:00,,35A,1,Crime Against Society,Drug/Narcotic Violations,DRUGS - MARIJUANA - POSSESS,MONTGOMERY VILLAGE,,GAITHERSBURG,MD,20877.0,GPD,Street - In vehicle,P,6P3,431,,S,SUMMIT,,AVE,38.98392,-77.0671,6D,"(38.9839, -77.0671)"
201309093,2901,200044625,11/12/2020 09:19:14 AM,2020-11-10 18:30:00,11/12/2020 08:40:00 AM,290,1,Crime Against Property,Destruction/Damage/Vandalism of Property,DAMAGE PROPERTY - BUSINESS,GERMANTOWN,19700 BLK  GERMANTOWN RD,GERMANTOWN,MD,20874.0,MCPD,Bank/S&L/Credit Union,N,5N1,595,19700.0,,GERMANTOWN,,RD,39.17881,-77.2673,5D,"(39.1788, -77.2673)"
201428371,2308,230025412,05/27/2023 12:59:13 AM,2023-05-19 16:00:00,05/27/2023 01:00:00 AM,23D,1,Crime Against Property,Theft from Building,LARCENY - FROM BLDG,ROCKVILLE,1000 BLK  ROCKVILLE PIK,ROCKVILLE,MD,20852.0,RCPD,Residence - Apartment/Condo,A,1A1,265,1000.0,,ROCKVILLE,,PIK,39.07356,-77.1345,1D,"(39.0736, -77.1345)"
201448126,2404,230060088,,2023-10-12 14:51:00,,240,1,Crime Against Property,Motor Vehicle Theft,AUTO THEFT - VEHICLE THEFT,MONTGOMERY VILLAGE,800 BLK  CLOPPER RD,GAITHERSBURG,MD,20878.0,MCPD,Parking Lot - Other,P,6P2,593,800.0,,CLOPPER,,RD,39.14445,-77.2254,6D,"(39.1444, -77.2254)"
201409444,3532,230002752,01/17/2023 08:25:50 PM,2023-01-17 20:25:00,,35A,1,Crime Against Society,Drug/Narcotic Violations,DRUGS - COCAINE - POSSESS,BETHESDA,5300 BLK  MARINELLI RD,ROCKVILLE,MD,20852.0,MCPD,Shelter-Mission/Homeless,D,2D4,187,5300.0,,MARINELLI,,RD,39.04795,-77.1054,2D,"(39.048, -77.1054)"
201388693,5311,220035670,08/18/2022 04:02:03 PM,2022-08-18 14:55:00,,90C,1,Crime Against Society,Disorderly Conduct,PUBLIC PEACE - DISORDERLY CONDUCT,BETHESDA,4800 BLK  SANGAMORE RD,BETHESDA,MD,20816.0,MCPD,Street - Other,E,2E1,021,4800.0,,SANGAMORE,,RD,38.95042,-77.1204,2D,"(38.9504, -77.1204)"
201347475,4104,210038859,09/30/2021 05:31:31 PM,2021-09-30 17:32:00,,90G,1,Crime Against Society,Liquor Law Violations,LIQUOR - POSSESS,WHEATON,,SILVER SPRING,MD,20906.0,MCPD,Street - Bus Stop,J,4J1,368,,,LAYHILL,,RD,39.0637,-77.0498,4D,"(39.0637, -77.0498)"
201262627,2304,190051691,10/27/2019 02:18:31 PM,2019-10-24 00:00:00,10/26/2019 11:00:00 PM,23G,1,Crime Against Property,Theft of Motor Vehicle Parts or Accessories,LARCENY - AUTO PARTS,WHEATON,2300 BLK  SUN VALLEY CIR,SILVER SPRING,MD,20906.0,MCPD,Parking Lot - Residential,K,4K1,530,2300.0,,SUN VALLEY,,CIR,39.09049,-77.0485,4D,"(39.0905, -77.0485)"
201414542,2303,230008986,02/22/2023 07:48:02 PM,2023-02-22 19:48:00,,23C,1,Crime Against Property,Shoplifting,LARCENY - SHOPLIFTING,WHEATON,11100 BLK  VEIRS MILL RD,SILVER SPRING,MD,20902.0,MCPD,Retail - Mall,L,4L2,321,11100.0,,VEIRS MILL,,RD,39.03758,-77.0519,4D,"(39.0376, -77.0519)"
201416023,5212,230010763,03/04/2023 05:48:03 PM,2023-03-04 17:42:00,,520,1,Crime Against Society,Weapon Law Violations,WEAPON - POSSESSION,SILVER SPRING,8800 BLK  FLOWER AVE,SILVER SPRING,MD,20901.0,MCPD,Parking Lot - Commercial,H,3H1,127,8800.0,,FLOWER,,AVE,38.99942,-77.0039,3D,"(38.9994, -77.0039)"
201301183,1399,200034870,09/06/2020 12:28:30 AM,2020-09-06 00:28:00,09/06/2020 01:25:00 AM,13B,2,Crime Against Person,Simple Assault,ASSAULT - 2ND DEGREE,WHEATON,12800 BLK  CALDWELL ST,ROCKVILLE,MD,20853.0,MCPD,Street - Residential,K,4K2,527,12800.0,,CALDWELL,,ST,39.06555,-77.0914,4D,"(39.0656, -77.0914)"
201427756,2605,230024657,05/23/2023 08:34:59 AM,2023-05-22 16:30:00,05/22/2023 05:00:00 PM,26B,1,Crime Against Property,Credit Card/Automatic Teller Machine Fraud,FRAUD - ILLEGAL USE CREDIT CARDS,BETHESDA,10200 BLK  OLD GEORGETOWN RD,BETHESDA,MD,20814.0,MCPD,Retail - Hardware,D,2D4,191,10200.0,,OLD GEORGETOWN,,RD,39.02308,-77.1239,2D,"(39.0231, -77.1239)"
201428123,3532,230024945,05/24/2023 06:02:43 PM,2023-05-24 18:02:00,,35A,1,Crime Against Society,Drug/Narcotic Violations,DRUGS - COCAINE - POSSESS,WHEATON,2300 BLK  GLENALLAN AVE,SILVER SPRING,MD,20906.0,MCPD,Street - In vehicle,J,4J1,368,2300.0,,GLENALLAN,,AVE,39.06236,-77.0479,4D,"(39.0624, -77.0479)"
201420414,2203,230015737,04/02/2023 12:27:38 AM,2023-04-02 00:20:00,04/02/2023 12:22:00 AM,220,1,Crime Against Property,Burglary/Breaking and Entering,BURGLARY - FORCED ENTRY-NONRESIDENTIAL,ROCKVILLE,16000 BLK  FREDERICK RD,DERWOOD,MD,20855.0,MCPD,Liquor Store - Beer & Wine,A,1A4,438,16000.0,,FREDERICK,,RD,39.11787,-77.17,1D,"(39.1179, -77.17)"
201302102,2610,200036202,09/15/2020 05:47:25 PM,2020-09-15 17:14:00,,26F,1,Crime Against Property,Identity Theft,FRAUD - IDENTITY THEFT,WHEATON,14100 BLK  WHISPERING PINES CT,SILVER SPRING,MD,20906.0,MCPD,Other/Unknown,K,4K1,348,14100.0,,WHISPERING PINES,,CT,39.08777,-77.0628,4D,"(39.0878, -77.0628)"
201282193,2399,200012414,03/13/2020 02:33:26 PM,2020-03-11 17:00:00,03/12/2020 12:00:00 PM,23H,1,Crime Against Property,All other Larceny,LARCENY (DESCRIBE OFFENSE),SILVER SPRING,11600 BLK  LOCKWOOD DR,SILVER SPRING,MD,20904.0,MCPD,Other/Unknown,I,3I1,145,11600.0,,LOCKWOOD,,DR,39.04129,-76.9851,3D,"(39.0413, -76.9851)"
201259619,3562,190047851,10/05/2019 06:03:36 PM,2019-10-05 18:03:00,10/05/2019 07:04:00 PM,35A,1,Crime Against Society,Drug/Narcotic Violations,DRUGS - MARIJUANA - POSSESS,WHEATON,2800 BLK  CLEAR SHOT DR,SILVER SPRING,MD,20906.0,MCPD,Residence - Other,K,4K1,347,2800.0,,CLEAR SHOT,,DR,39.10694,-77.0545,4D,"(39.1069, -77.0545)"
201403227,2605,220053365,12/03/2022 10:07:48 AM,2022-12-03 10:07:00,,26B,1,Crime Against Property,Credit Card/Automatic Teller Machine Fraud,FRAUD - ILLEGAL USE CREDIT CARDS,WHEATON,4800 BLK  CHICHESTER HOUSE RD,OLNEY,MD,20832.0,MCPD,Retail - Hardware,J,4J2,412,4800.0,,CHICHESTER HOUSE,,RD,39.16516,-77.1009,4D,"(39.1652, -77.1009)"
201248187,1399,190033687,07/15/2019 11:42:34 PM,2019-07-14 21:00:00,,13B,1,Crime Against Person,Simple Assault,ASSAULT - 2ND DEGREE,GERMANTOWN,22400 BLK  BROADWAY AVE,CLARKSBURG,MD,20871.0,MCPD,Residence -Townhouse/Duplex,N,5N3,466,22400.0,,BROADWAY,,AVE,39.22059,-77.2868,5D,"(39.2206, -77.2868)"
201378483,2305,220023317,05/31/2022 05:57:10 PM,2022-05-30 17:57:00,05/31/2022 05:57:00 PM,23F,1,Crime Against Property,Theft From Motor Vehicle,LARCENY - FROM AUTO,TAKOMA PARK,7400 BLK  ASPEN CT,TAKOMA PARK,MD,20912.0,TPPD,Parking Lot - Residential,T,8T3,808,7400.0,,ASPEN,,CT,38.98071,-76.9987,TPPD,"(38.9807, -76.9987)"
201299131,2303,200032539,08/20/2020 01:59:25 PM,2020-08-20 13:00:00,08/20/2020 01:05:00 PM,23C,1,Crime Against Property,Shoplifting,LARCENY - SHOPLIFTING,SILVER SPRING,1200 BLK E WEST HWY,SILVER SPRING,MD,20910.0,MCPD,Retail - Other,G,3G1,089,1200.0,E,WEST,,HWY,39.12378,-77.2033,3D,"(39.1238, -77.2033)"
201351116,1103,210043593,10/28/2021 07:48:08 PM,2021-10-28 19:48:00,,11A,1,Crime Against Person,Forcible Rape,RAPE - STRONG-ARM,SILVER SPRING,8200 BLK  NOLTE AVE,SILVER SPRING,MD,20910.0,MCPD,Residence - Apartment/Condo,G,3G1,113,8200.0,,NOLTE,,AVE,38.99257,-77.0131,3D,"(38.9926, -77.0131)"
201255089,5403,190041301,08/29/2019 01:10:25 AM,2019-08-29 01:01:00,08/29/2019 01:10:00 AM,90D,1,Crime Against Society,Driving Under the Influence,DRIVING UNDER THE INFLUENCE DRUGS,MONTGOMERY VILLAGE,8500 BLK  S270CD X9 TO X8 HWY,GAITHERSBURG,MD,20878.0,GPD,Street - In vehicle,P,6P2,660,8500.0,,S270CD X9 TO X8,,HWY,39.11742,-77.1952,6D,"(39.1174, -77.1952)"
201307176,2399,200042246,10/26/2020 04:17:57 PM,2020-10-26 15:45:00,,23H,1,Crime Against Property,All other Larceny,LARCENY (DESCRIBE OFFENSE),SILVER SPRING,900 BLK  ELLSWORTH DR,SILVER SPRING,MD,20910.0,MCPD,Street - Commercial,G,3G1,109,900.0,,ELLSWORTH,,DR,38.99686,-77.0254,3D,"(38.9969, -77.0254)"
201272427,3530,200000865,,2019-12-23 12:00:00,01/06/2020 12:00:00 PM,35A,1,Crime Against Society,Drug/Narcotic Violations,DRUGS - COCAINE - SELL,ROCKVILLE,100 BLK  EDISON PARK DR,GAITHERSBURG,MD,20878.0,MCPD,Other/Unknown,B,1B2,725,100.0,,EDISON PARK,,DR,39.11173,-77.2352,1D,"(39.1117, -77.2352)"
201443364,2605,230054248,,2023-08-18 00:00:00,08/18/2023 12:00:00 AM,26B,1,Crime Against Property,Credit Card/Automatic Teller Machine Fraud,FRAUD - ILLEGAL USE CREDIT CARDS,,,GERMANTOWN,MD,20876.0,MCPD,Grocery/Supermarket,w,own,Unknown,,,,,,0.0,0.0,Unknown,"(0.0, 0.0)"
201304262,2304,200038728,10/02/2020 06:25:49 AM,2020-10-02 06:43:00,,23G,1,Crime Against Property,Theft of Motor Vehicle Parts or Accessories,LARCENY - AUTO PARTS,BETHESDA,8300 BLK  16TH ST,SILVER SPRING,MD,20910.0,MCPD,Street - Residential,D,2D1,666,8300.0,,16TH,,ST,38.99266,-77.0363,2D,"(38.9927, -77.0363)"
201356564,2304,210050485,12/12/2021 12:04:15 PM,2021-11-05 00:00:00,12/05/2021 12:00:00 AM,23G,1,Crime Against Property,Theft of Motor Vehicle Parts or Accessories,LARCENY - AUTO PARTS,GERMANTOWN,,GERMANTOWN,MD,20874.0,MCPD,Street - Residential,N,5N1,447,,,WISTERIA,,DR,39.17752,-77.2711,5D,"(39.1775, -77.2711)"
201399620,2605,220049072,11/07/2022 09:56:54 AM,2022-07-01 00:00:00,08/10/2022 12:00:00 AM,26B,1,Crime Against Property,Credit Card/Automatic Teller Machine Fraud,FRAUD - ILLEGAL USE CREDIT CARDS,WHEATON,1100 BLK  UNIVERSITY BLV,SILVER SPRING,MD,20902.0,MCPD,Residence - Apartment/Condo,L,4L1,360,1100.0,,UNIVERSITY,,BLV,39.03585,-77.0268,4D,"(39.0359, -77.0268)"
201262017,2305,190050922,10/23/2019 01:18:26 PM,2019-10-23 13:18:00,10/23/2019 01:18:00 PM,23F,1,Crime Against Property,Theft From Motor Vehicle,LARCENY - FROM AUTO,ROCKVILLE,5700 BLK  FISHERS LA,ROCKVILLE,MD,20852.0,RCPD,Parking Garage - Residential,A,1A2,300,5700.0,,FISHERS,,LA,39.06275,-77.1172,1D,"(39.0628, -77.1172)"
201351186,2305,210040348,10/09/2021 12:39:59 PM,2021-10-07 12:00:00,10/09/2021 09:00:00 AM,23F,1,Crime Against Property,Theft From Motor Vehicle,LARCENY - FROM AUTO,SILVER SPRING,500 BLK  THAYER AVE,SILVER SPRING,MD,20910.0,MCPD,Parking Lot - Residential,G,3G1,514,500.0,,THAYER,,AVE,38.99384,-77.0115,3D,"(38.9938, -77.0115)"
201269605,5404,190060032,12/13/2019 02:25:34 AM,2019-12-13 02:25:00,,90D,1,Crime Against Society,Driving Under the Influence,DRIVING UNDER THE INFLUENCE LIQUOR,SILVER SPRING,,SILVER SPRING,MD,20910.0,MCPD,Street - Commercial,G,3G1,108,,,GEORGIA,,AVE,39.11237,-77.0755,3D,"(39.1124, -77.0755)"
201435391,1204,230033941,07/17/2023 03:10:29 AM,2023-07-17 03:10:00,,120,1,Crime Against Property,Robbery,ROBBERY - STREET-GUN,WHEATON,,SILVER SPRING,MD,20905.0,MCPD,Street - In vehicle,J,4J1,646,,,STURTEVANT,,RD,39.09207,-76.9709,4D,"(39.0921, -76.9709)"
201421756,2199,230017310,04/11/2023 05:09:27 PM,2023-04-11 17:09:00,,210,1,Crime Against Property,Extortion/Blackmail,EXTORTION (DESCRIBE OFFENSE),BETHESDA,3900 BLK  DENFELD AVE,KENSINGTON,,20895.0,MCPD,Residence - Single Family,D,2D3,312,3900.0,,DENFELD,,AVE,39.0387,-77.0763,2D,"(39.0387, -77.0763)"
201233197,2303,190013609,03/24/2019 04:56:00 PM,2019-03-24 15:30:00,03/24/2019 04:55:00 PM,23C,1,Crime Against Property,Shoplifting,LARCENY - SHOPLIFTING,BETHESDA,7100 BLK  DEMOCRACY BLV,BETHESDA,MD,20817.0,MCPD,Retail - Mall,E,2E3,204,7100.0,,DEMOCRACY,,BLV,39.02207,-77.1473,2D,"(39.0221, -77.1473)"
201341986,2601,210032014,08/17/2021 04:01:27 PM,2021-08-16 17:00:00,08/16/2021 06:00:00 PM,26A,1,Crime Against Property,False Pretenses/Swindle/Confidence Game,FRAUD - CONFIDENCE GAME,GERMANTOWN,18700 BLK  SUMMER OAK CT,GERMANTOWN,MD,20874.0,MCPD,Residence -Townhouse/Duplex,N,5N1,447,18700.0,,SUMMER OAK,,CT,39.16352,-77.2464,5D,"(39.1635, -77.2464)"
201439925,2610,230049948,,2023-08-17 00:00:00,,26F,1,Crime Against Property,Identity Theft,IDENTITY THEFT,SILVER SPRING,8700 BLK  GEORGIA AVE,SILVER SPRING,MD,20910.0,MCPD,Other/Unknown,G,3G1,095,8700.0,,GEORGIA,,AVE,38.99752,-77.0297,3D,"(38.9975, -77.0297)"
201451044,2399,230063695,10/31/2023 10:58:42 PM,2023-10-31 17:00:00,10/31/2023 07:48:00 PM,23H,1,Crime Against Property,All other Larceny,LARCENY (DESCRIBE OFFENSE),ROCKVILLE,700 BLK  TWINBROOK PKW,ROCKVILLE,MD,20851.0,RCPD,Residence - Single Family,A,1A2,293,700.0,,TWINBROOK,,PKW,39.08055,-77.1135,1D,"(39.0806, -77.1135)"
201391621,1399,220039258,09/09/2022 06:02:43 PM,2022-09-09 18:02:00,,13B,4,Crime Against Person,Simple Assault,ASSAULT - 2ND DEGREE,MONTGOMERY VILLAGE,18700 BLK  WALKERS CHOICE RD,MONTGOMERY VILLAGE,MD,20886.0,MCPD,Residence - Apartment/Condo,R,6R1,766,18700.0,,WALKERS CHOICE,,RD,39.16202,-77.2047,6D,"(39.162, -77.2047)"
201235478,911,190017895,04/16/2019 09:16:19 PM,2019-04-16 21:15:00,,09A,1,Crime Against Person,Murder and Nonnegligent Manslaughter,HOMICIDE - WILLFUL KILL-GUN,GERMANTOWN,18700 BLK  CURRY POWDER LA,GERMANTOWN,MD,20874.0,MCPD,Parking Lot - Residential,N,5N2,594,18700.0,,CURRY POWDER,,LA,39.16197,-77.2646,5D,"(39.162, -77.2646)"
201425520,2303,230021834,05/07/2023 01:46:40 PM,2023-05-07 13:46:00,05/07/2023 02:30:00 PM,23C,1,Crime Against Property,Shoplifting,LARCENY - SHOPLIFTING,BETHESDA,11400 BLK  ROCKVILLE PIK,ROCKVILLE,MD,20852.0,MCPD,Retail - Drug Store/Pharmacy,D,2D4,189,11400.0,,ROCKVILLE,,PIK,39.04189,-77.1103,2D,"(39.0419, -77.1103)"
201279734,2303,200009917,02/28/2020 01:09:12 PM,2020-02-28 19:00:00,02/28/2020 07:35:00 PM,23C,1,Crime Against Property,Shoplifting,LARCENY - SHOPLIFTING,MONTGOMERY VILLAGE,15700 BLK  SHADY GROVE RD,GAITHERSBURG,MD,20877.0,GPD,Retail - Department/Discount Store,P,6P3,756,15700.0,,SHADY GROVE,,RD,39.11327,-77.1865,6D,"(39.1133, -77.1865)"
201304139,2999,200038580,10/01/2020 08:08:57 AM,2020-07-01 08:08:00,09/13/2020 11:59:00 PM,290,1,Crime Against Property,Destruction/Damage/Vandalism of Property,DAMAGE PROPERTY (DESCRIBE OFFENSE),ROCKVILLE,1300 BLK  CLAGETT DR,ROCKVILLE,MD,20851.0,RCPD,Street - Residential,A,1A2,296,1300.0,,CLAGETT,,DR,39.07675,-77.1284,1D,"(39.0767, -77.1284)"
201277114,1313,200006681,02/09/2020 08:21:25 PM,2020-02-09 20:10:00,,13B,1,Crime Against Person,Simple Assault,ASSAULT - SIMPLE,BETHESDA,9600 BLK  CULVER ST,KENSINGTON,MD,20895.0,MCPD,Residence - Single Family,D,2D3,184,9600.0,,CULVER,,ST,39.00976,-77.0841,2D,"(39.0098, -77.0841)"
201223220,2308,190002572,01/16/2019 04:12:38 PM,2019-01-16 16:12:00,,23D,1,Crime Against Property,Theft from Building,LARCENY - FROM BLDG,MONTGOMERY VILLAGE,18300 BLK  CONTOUR RD,GAITHERSBURG,MD,20877.0,MCPD,Restaurant,R,6R1,505,18300.0,,CONTOUR,,RD,39.15531,-77.2004,6D,"(39.1553, -77.2004)"
201232689,2303,190014014,03/26/2019 06:05:11 PM,2019-03-26 18:05:00,,23C,1,Crime Against Property,Shoplifting,LARCENY - SHOPLIFTING,BETHESDA,7100 BLK  DEMOCRACY BLV,BETHESDA,MD,20817.0,MCPD,Retail - Sporting Goods,E,2E3,204,7100.0,,DEMOCRACY,,BLV,39.02207,-77.1473,2D,"(39.0221, -77.1473)"
201387673,3532,220034455,08/11/2022 03:33:14 AM,2022-08-11 03:35:00,,35A,1,Crime Against Society,Drug/Narcotic Violations,DRUGS - COCAINE - POSSESS,SILVER SPRING,3200 BLK  BRIGGS CHANEY RD,SILVER SPRING,MD,20904.0,MCPD,Street - Other,I,3I2,380,3200.0,,BRIGGS CHANEY,,RD,39.07943,-76.9452,3D,"(39.0794, -76.9452)"
201263401,5404,190051621,10/27/2019 02:13:12 AM,2019-10-27 02:00:00,10/27/2019 02:10:00 AM,90D,1,Crime Against Society,Driving Under the Influence,DRIVING UNDER THE INFLUENCE LIQUOR,WHEATON,1700 BLK  UNIVERSITY BLV W,SILVER SPRING,MD,20902.0,MCPD,Street - In vehicle,L,4L2,357,1700.0,,UNIVERSITY,W,BLV,39.03783,-77.0403,4D,"(39.0378, -77.0403)"
201417032,5404,230011685,03/09/2023 11:13:53 PM,2023-03-09 23:14:00,,90D,1,Crime Against Society,Driving Under the Influence,DRIVING UNDER THE INFLUENCE LIQUOR,MONTGOMERY VILLAGE,,GAITHERSBURG,MD,20899.0,GPD,Street - In vehicle,P,6P2,445,,,BUREAU,,DR,39.14352,-77.2169,6D,"(39.1435, -77.2169)"
201372253,2699,220015828,04/14/2022 01:06:15 PM,2022-01-18 13:06:00,04/14/2022 12:00:00 AM,26A,1,Crime Against Property,False Pretenses/Swindle/Confidence Game,FRAUD (DESCRIBE OFFENSE),BETHESDA,6700 BLK  WISCONSIN AVE,CHEVY CHASE,MD,20815.0,MCPD,Auto Dealership,D,2D2,031,6700.0,,WISCONSIN,,AVE,38.97717,-77.0906,2D,"(38.9772, -77.0906)"
201405314,2304,220056001,12/18/2022 12:23:05 AM,2022-12-17 04:30:00,12/17/2022 01:00:00 PM,23G,1,Crime Against Property,Theft of Motor Vehicle Parts or Accessories,LARCENY - AUTO PARTS,ROCKVILLE,1100 BLK  BROADWOOD DR,ROCKVILLE,MD,20851.0,MCPD,Parking Lot - Residential,A,1A2,296,1100.0,,BROADWOOD,,DR,39.07275,-77.1317,1D,"(39.0727, -77.1317)"
201290019,2305,200021862,06/03/2020 07:28:35 AM,2020-06-02 23:00:00,06/03/2020 07:00:00 AM,23F,1,Crime Against Property,Theft From Motor Vehicle,LARCENY - FROM AUTO,WHEATON,12100 BLK  VEIRS MILL RD,SILVER SPRING,MD,20906.0,MCPD,Street - Residential,L,4L1,332,12100.0,,VEIRS MILL,,RD,39.05364,-77.0783,4D,"(39.0536, -77.0783)"
201388673,2610,220035526,08/17/2022 04:48:46 PM,2022-08-16 12:04:00,08/16/2022 12:04:00 PM,26F,1,Crime Against Property,Identity Theft,IDENTITY THEFT,WHEATON,2100 BLK  ROSE THEATRE CIR,OLNEY,MD,20832.0,MCPD,Other/Unknown,J,4J2,681,2100.0,,ROSE THEATRE,,CIR,39.14599,-77.0462,4D,"(39.146, -77.0462)"
201338642,2308,210027913,07/19/2021 03:36:39 PM,2021-07-19 14:45:00,07/19/2021 02:50:00 PM,23D,1,Crime Against Property,Theft from Building,LARCENY - FROM BLDG,ROCKVILLE,1400 BLK  RESEARCH BLV,ROCKVILLE,MD,20850.0,RCPD,Restaurant,B,1B1,241,1400.0,,RESEARCH,,BLV,39.09084,-77.1792,1D,"(39.0908, -77.1792)"
201396760,2305,220045607,10/17/2022 07:07:15 PM,2022-10-16 20:00:00,10/17/2022 07:00:00 AM,23F,1,Crime Against Property,Theft From Motor Vehicle,LARCENY - FROM AUTO,ROCKVILLE,1  BLK  RESEARCH CT,ROCKVILLE,MD,20850.0,RCPD,Parking Lot - Commercial,B,1B1,241,1.0,,RESEARCH,,CT,39.10662,-77.1869,1D,"(39.1066, -77.1869)"
201289887,2305,200021737,06/02/2020 06:34:20 AM,2020-06-01 20:30:00,06/02/2020 06:00:00 AM,23F,1,Crime Against Property,Theft From Motor Vehicle,LARCENY - FROM AUTO,BETHESDA,11800 BLK  OLD DROVERS WAY,ROCKVILLE,MD,20852.0,MCPD,Residence - Driveway,D,2D4,308,11800.0,,OLD DROVERS,,WAY,39.04892,-77.0966,2D,"(39.0489, -77.0966)"
201307205,3562,200042262,10/26/2020 04:46:41 PM,2020-10-26 16:46:00,,35A,1,Crime Against Society,Drug/Narcotic Violations,DRUGS - MARIJUANA - POSSESS,MONTGOMERY VILLAGE,200 BLK  KENTLANDS BLV,GAITHERSBURG,MD,20878.0,GPD,Street - Commercial,P,6P2,450,200.0,,KENTLANDS,,BLV,39.12313,-77.2357,6D,"(39.1231, -77.2357)"
201294013,2399,200025268,06/29/2020 12:14:53 PM,2020-06-14 12:00:00,06/27/2020 06:45:00 PM,23H,1,Crime Against Property,All other Larceny,LARCENY (DESCRIBE OFFENSE),MONTGOMERY VILLAGE,15200 BLK  SIESTA KEY WAY,ROCKVILLE,MD,20850.0,MCPD,Parking Garage - Residential,P,6P1,721,15200.0,,SIESTA KEY,,WAY,39.10502,-77.1947,6D,"(39.105, -77.1947)"
201396410,1216,220045137,10/14/2022 08:34:22 PM,2022-10-14 20:34:00,,120,1,Crime Against Property,Robbery,ROBBERY - STRONG ARM,SILVER SPRING,8500 BLK  PINEY BRANCH RD,SILVER SPRING,MD,20901.0,MCPD,Street - Alley,H,3H1,127,8500.0,,PINEY BRANCH,,RD,38.99823,-77.0036,3D,"(38.9982, -77.0036)"
201321816,1399,210007935,03/02/2021 07:58:35 PM,2021-03-02 19:58:00,,13B,2,Crime Against Person,Simple Assault,ASSAULT - 2ND DEGREE,SILVER SPRING,1200 BLK  BLAIR MILL RD,SILVER SPRING,MD,20910.0,MCPD,Street - Alley,G,3G1,669,1200.0,,BLAIR MILL,,RD,38.98994,-77.0289,3D,"(38.9899, -77.0289)"
201308256,1399,200043579,11/04/2020 08:51:20 PM,2020-11-04 20:51:00,,13B,1,Crime Against Person,Simple Assault,ASSAULT - 2ND DEGREE,WHEATON,12700 BLK  LAYHILL RD,SILVER SPRING,MD,20906.0,MCPD,Parking Lot - Residential,J,4J1,368,12700.0,,LAYHILL,,RD,39.06447,-77.049,4D,"(39.0645, -77.049)"
201391748,2305,220039376,09/10/2022 04:23:12 PM,2022-09-10 16:23:00,,23F,1,Crime Against Property,Theft From Motor Vehicle,LARCENY - FROM AUTO,GERMANTOWN,,GERMANTOWN,MD,20874.0,MCPD,Street - Residential,N,5N1,447,,,WISTERIA,,DR,39.17752,-77.2711,5D,"(39.1775, -77.2711)"
201279876,1399,200010137,02/29/2020 05:01:43 PM,2020-02-29 16:50:00,,13B,1,Crime Against Person,Simple Assault,ASSAULT - 2ND DEGREE,GERMANTOWN,19700 BLK  CRYSTAL ROCK DR,GERMANTOWN,MD,20874.0,MCPD,Residence -Townhouse/Duplex,N,5N1,595,19700.0,,CRYSTAL ROCK,,DR,39.17902,-77.2616,5D,"(39.179, -77.2616)"
201347720,2399,210039261,10/03/2021 09:33:11 AM,2021-08-01 09:33:00,,23H,1,Crime Against Property,All other Larceny,LARCENY (DESCRIBE OFFENSE),SILVER SPRING,800 BLK E FRANKLIN AVE,SILVER SPRING,MD,20901.0,MCPD,Residence - Single Family,H,3H1,672,800.0,E,FRANKLIN,,AVE,39.01316,-76.9962,3D,"(39.0132, -76.9962)"
201251281,3512,190036717,08/01/2019 02:41:55 PM,2019-08-01 14:51:00,,35A,1,Crime Against Society,Drug/Narcotic Violations,DRUGS - HEROIN - POSSESS,MONTGOMERY VILLAGE,,GAITHERSBURG,MD,20879.0,MCPD,Street - In vehicle,R,6R1,426,,,CHRISTOPHER,,AVE,39.15952,-77.209,6D,"(39.1595, -77.209)"
201407304,2308,230000383,01/03/2023 05:40:24 PM,2023-01-02 16:15:00,01/03/2023 04:00:00 PM,23D,1,Crime Against Property,Theft from Building,LARCENY - FROM BLDG,BETHESDA,4900 BLK  ELM ST,BETHESDA,MD,20814.0,MCPD,Parking Lot - Commercial,D,2D2,033,4900.0,,ELM,,ST,38.98215,-77.096,2D,"(38.9821, -77.096)"
201256248,2305,190043570,09/11/2019 06:28:58 PM,2019-09-11 06:57:00,09/11/2019 03:40:00 PM,23F,1,Crime Against Property,Theft From Motor Vehicle,LARCENY - FROM AUTO,WHEATON,14500 BLK  MACBETH DR,SILVER SPRING,MD,20906.0,MCPD,Parking Lot - Residential,K,4K1,346,14500.0,,MACBETH,,DR,39.09305,-77.0704,4D,"(39.093, -77.0704)"
201283115,1399,200013870,03/24/2020 07:11:47 PM,2020-03-24 19:11:00,03/24/2020 08:00:00 PM,13B,3,Crime Against Person,Simple Assault,ASSAULT - 2ND DEGREE,ROCKVILLE,5900 BLK  CORAL SEA AVE,ROCKVILLE,MD,20851.0,RCPD,Residence - Single Family,A,1A2,297,5900.0,,CORAL SEA,,AVE,39.07352,-77.1201,1D,"(39.0735, -77.1201)"
201260284,2302,190048669,10/10/2019 12:16:19 PM,2019-10-10 08:42:00,10/10/2019 12:00:00 PM,23B,1,Crime Against Property,Purse-snatching,LARCENY - PURSE SNATCHING - NO FORCE,SILVER SPRING,12100 BLK  PLUM ORCHARD DR,SILVER SPRING,MD,20904.0,MCPD,Hospital/Emergency Care Center,I,3I1,146,12100.0,,PLUM ORCHARD,,DR,39.05068,-76.957,3D,"(39.0507, -76.957)"
201252957,2305,190039592,08/19/2019 10:55:34 AM,2019-08-18 20:00:00,08/19/2019 09:00:00 AM,23F,1,Crime Against Property,Theft From Motor Vehicle,LARCENY - FROM AUTO,MONTGOMERY VILLAGE,18900 BLK  WHETSTONE CIR,MONTGOMERY VILLAGE,MD,20886.0,MCPD,Residence - Driveway,R,6R1,423,18900.0,,WHETSTONE,,CIR,39.16844,-77.1957,6D,"(39.1684, -77.1957)"
201414415,2399,230008815,02/21/2023 10:21:45 PM,2023-02-21 11:20:00,02/21/2023 01:30:00 PM,23H,1,Crime Against Property,All other Larceny,LARCENY (DESCRIBE OFFENSE),BETHESDA,7100 BLK  ARLINGTON RD,BETHESDA,MD,20814.0,MCPD,Retail - Other,D,2D2,032,7100.0,,ARLINGTON,,RD,38.98085,-77.0984,2D,"(38.9808, -77.0984)"
201408844,5311,230002118,01/13/2023 03:05:02 PM,2023-01-13 15:05:00,,90C,1,Crime Against Society,Disorderly Conduct,PUBLIC PEACE - DISORDERLY CONDUCT,WHEATON,11100 BLK  VEIRS MILL RD,SILVER SPRING,MD,20902.0,MCPD,Retail - Mall,L,4L2,321,11100.0,,VEIRS MILL,,RD,39.03758,-77.0519,4D,"(39.0376, -77.0519)"
201319549,2303,210005453,02/11/2021 01:32:14 PM,2021-02-11 12:50:00,,23C,1,Crime Against Property,Shoplifting,LARCENY - SHOPLIFTING,BETHESDA,4800 BLK  BETHESDA AVE,BETHESDA,MD,20814.0,MCPD,Retail - Clothing,D,2D2,031,4800.0,,BETHESDA,,AVE,38.98096,-77.0956,2D,"(38.981, -77.0956)"
201254349,2305,190041293,08/28/2019 11:20:02 PM,2019-08-28 15:20:00,08/28/2019 04:20:00 PM,23F,1,Crime Against Property,Theft From Motor Vehicle,LARCENY - FROM AUTO,GERMANTOWN,20500 BLK  SENECA MEADOWS PKW,GERMANTOWN,MD,20876.0,MCPD,Parking Lot - Commercial,M,5M1,701,20500.0,,SENECA MEADOWS,,PKW,39.19671,-77.2582,5D,"(39.1967, -77.2582)"
201236612,2902,190017469,04/14/2019 03:30:33 PM,2019-04-14 15:30:00,,290,1,Crime Against Property,Destruction/Damage/Vandalism of Property,DAMAGE PROPERTY - PRIVATE,SILVER SPRING,800 BLK  WAYNE AVE,SILVER SPRING,MD,20910.0,MCPD,Parking Lot - Commercial,G,3G1,671,800.0,,WAYNE,,AVE,38.99717,-77.0218,3D,"(38.9972, -77.0218)"
201357918,1213,210052177,12/22/2021 11:40:28 AM,2021-12-22 11:40:00,,120,1,Crime Against Property,Robbery,ROBBERY - GUN,SILVER SPRING,13200 BLK  NEW HAMPSHIRE AVE,SILVER SPRING,MD,20904.0,MCPD,Parking Garage - Other,I,3I1,150,13200.0,,NEW HAMPSHIRE,,AVE,39.0714,-77.0032,3D,"(39.0714, -77.0032)"
201312333,5404,200048020,12/05/2020 09:57:30 PM,2020-12-05 21:57:00,,90D,1,Crime Against Society,Driving Under the Influence,DRIVING UNDER THE INFLUENCE LIQUOR,MONTGOMERY VILLAGE,100 BLK E DIAMOND AVE,GAITHERSBURG,MD,20877.0,MCPD,Street - In vehicle,P,6P3,431,100.0,E,DIAMOND,,AVE,39.14184,-77.1964,6D,"(39.1418, -77.1964)"
201242158,1399,190026244,06/02/2019 03:16:43 AM,2019-06-02 03:16:00,,13B,1,Crime Against Person,Simple Assault,ASSAULT - 2ND DEGREE,GERMANTOWN,19500 BLK  CRYSTAL ROCK DR,GERMANTOWN,MD,20874.0,MCPD,Street - In vehicle,N,5N1,595,19500.0,,CRYSTAL ROCK,,DR,39.17692,-77.2643,5D,"(39.1769, -77.2643)"
201282303,2404,200013067,03/17/2020 07:26:55 PM,2020-03-17 19:20:00,03/17/2020 12:00:00 AM,240,1,Crime Against Property,Motor Vehicle Theft,AUTO THEFT - VEHICLE THEFT,SILVER SPRING,,SILVER SPRING,,20910.0,MCPD,Street - Other,G,3G1,094,,,GEORGIA,,AVE,39.11237,-77.0755,3D,"(39.1124, -77.0755)"
201260529,2304,190048821,10/11/2019 11:13:07 AM,2019-10-04 07:00:00,10/10/2019 06:45:00 PM,23G,1,Crime Against Property,Theft of Motor Vehicle Parts or Accessories,LARCENY - AUTO PARTS,WHEATON,4800 BLK  ASPEN HILL RD,ROCKVILLE,MD,20853.0,MCPD,Street - Residential,K,4K2,339,4800.0,,ASPEN HILL,,RD,39.07321,-77.0959,4D,"(39.0732, -77.0959)"
201349694,1399,21009840,,2021-10-08 10:00:00,,13B,1,Crime Against Person,Simple Assault,ASSAULT - 2ND DEGREE,GERMANTOWN,18800 BLK  WARING STATION RD,GERMANTOWN,MD,20874.0,MCPD,School/College - DO NOT USE,N,5N1,447,18800.0,,WARING STATION,,RD,39.16467,-77.2473,5D,"(39.1647, -77.2473)"
201367609,2303,220009096,03/02/2022 06:55:44 PM,2022-03-02 18:55:00,,23C,1,Crime Against Property,Shoplifting,LARCENY - SHOPLIFTING,MONTGOMERY VILLAGE,700 BLK  RUSSELL AVE,GAITHERSBURG,MD,20877.0,GPD,Retail - Mall,R,6R1,548,700.0,,RUSSELL,,AVE,39.15063,-77.2039,6D,"(39.1506, -77.2039)"
201269677,2303,190060281,12/14/2019 01:04:23 PM,2019-12-14 13:04:00,,23C,1,Crime Against Property,Shoplifting,LARCENY - SHOPLIFTING,WHEATON,11100 BLK  VEIRS MILL RD,SILVER SPRING,MD,20902.0,MCPD,Retail - Mall,L,4L2,321,11100.0,,VEIRS MILL,,RD,39.03758,-77.0519,4D,"(39.0376, -77.0519)"
201255368,2399,190042515,09/05/2019 10:18:02 AM,2019-08-31 09:00:00,08/31/2019 10:00:00 AM,23H,1,Crime Against Property,All other Larceny,LARCENY (DESCRIBE OFFENSE),TAKOMA PARK,6900 BLK  LAUREL AVE,TAKOMA PARK,MD,20912.0,TPPD,Street - Commercial,T,8T1,801,6900.0,,LAUREL,,AVE,38.9739,-77.0128,TPPD,"(38.9739, -77.0128)"
201367804,2305,220010470,03/11/2022 07:27:47 AM,2022-03-10 20:30:00,03/11/2022 07:00:00 AM,23F,1,Crime Against Property,Theft From Motor Vehicle,LARCENY - FROM AUTO,WHEATON,12200 BLK  LIVINGSTON ST,SILVER SPRING,MD,20902.0,MCPD,Residence - Driveway,L,4L1,330,12200.0,,LIVINGSTON,,ST,39.05632,-77.0579,4D,"(39.0563, -77.0579)"
201286562,2305,200017875,05/01/2020 10:45:34 PM,2020-05-01 22:40:00,05/01/2020 10:44:00 PM,23F,1,Crime Against Property,Theft From Motor Vehicle,LARCENY - FROM AUTO,ROCKVILLE,500 BLK S HORNERS LA,ROCKVILLE,MD,20850.0,RCPD,Street - Residential,A,1A3,286,500.0,S,HORNERS,,LA,39.09083,-77.1434,1D,"(39.0908, -77.1434)"
201318048,2610,210003696,01/29/2021 12:26:52 PM,2021-01-29 00:00:00,,26F,1,Crime Against Property,Identity Theft,FRAUD - IDENTITY THEFT,ROCKVILLE,5500 BLK  MUNCASTER MILL RD,DERWOOD,MD,20855.0,MCPD,Other/Unknown,A,1A4,395,5500.0,,MUNCASTER MILL,,RD,39.1197,-77.1089,1D,"(39.1197, -77.1089)"
201280678,2203,200011072,03/06/2020 08:53:50 AM,2020-03-06 08:53:00,,220,1,Crime Against Property,Burglary/Breaking and Entering,BURGLARY - FORCED ENTRY-NONRESIDENTIAL,MONTGOMERY VILLAGE,9900 BLK  STEDWICK RD,MONTGOMERY VILLAGE,MD,20886.0,MCPD,Retail - Drug Store/Pharmacy,R,6R2,546,9900.0,,STEDWICK,,RD,39.1697,-77.2043,6D,"(39.1697, -77.2043)"
201237832,2605,190020807,05/03/2019 01:19:43 PM,2019-05-01 21:00:00,,26B,1,Crime Against Property,Credit Card/Automatic Teller Machine Fraud,FRAUD - ILLEGAL USE CREDIT CARDS,GERMANTOWN,12900 BLK  MIDDLEBROOK RD,GERMANTOWN,MD,20874.0,MCPD,Other/Unknown,N,5N1,702,12900.0,,MIDDLEBROOK,,RD,39.17881,-77.2673,5D,"(39.1788, -77.2673)"
201357246,1399,210051293,12/17/2021 12:00:15 AM,2021-12-16 20:00:00,12/16/2021 08:20:00 PM,13B,1,Crime Against Person,Simple Assault,ASSAULT - 2ND DEGREE,ROCKVILLE,2800 BLK  BALMORAL DR,ROCKVILLE,MD,20850.0,RCPD,Residence - Single Family,B,1B1,238,2800.0,,BALMORAL,,DR,39.08763,-77.1871,1D,"(39.0876, -77.1871)"
201385332,5404,220031336,07/20/2022 11:28:30 PM,2022-07-20 23:29:00,,90D,1,Crime Against Society,Driving Under the Influence,DRIVING UNDER THE INFLUENCE LIQUOR,GERMANTOWN,,MT AIRY,MD,21771.0,MCPD,Street - In vehicle,M,5M2,611,,,RIDGE,,RD,39.30489,-77.1976,5D,"(39.3049, -77.1976)"
201437091,1199,230046687,07/28/2023 04:47:28 PM,2023-07-28 16:47:00,,11D,1,Crime Against Person,Forcible Fondling,SEX ASSAULT - FONDLING,MONTGOMERY VILLAGE,8800 BLK E VILLAGE AVE,MONTGOMERY VILLAGE,MD,20886.0,MCPD,Pool,R,6R2,714,8800.0,E,VILLAGE,,AVE,39.18797,-77.1805,6D,"(39.188, -77.1805)"
201259643,5404,190047900,10/06/2019 01:25:15 AM,2019-10-06 01:25:00,10/06/2019 04:00:00 AM,90D,1,Crime Against Society,Driving Under the Influence,DRIVING UNDER THE INFLUENCE LIQUOR,BETHESDA,10000 BLK  GRANT AVE,SILVER SPRING,MD,20910.0,MCPD,Street - In vehicle,D,2D3,673,10000.0,,GRANT,,AVE,39.02049,-77.0606,2D,"(39.0205, -77.0606)"
201384204,2608,220030226,07/14/2022 10:53:51 AM,2022-07-14 10:53:00,,26E,1,Crime Against Property,Wire Fraud,FRAUD BY WIRE,BETHESDA,4800 BLK  RUGBY AVE,BETHESDA,MD,20814.0,MCPD,Residence - Single Family,D,2D2,049,4800.0,,RUGBY,,AVE,38.99133,-77.0967,2D,"(38.9913, -77.0967)"
201395535,1204,220044073,10/09/2022 12:59:38 AM,2022-10-09 00:59:00,,120,1,Crime Against Property,Robbery,ROBBERY - STREET-GUN,BETHESDA,8500 BLK  16TH ST,SILVER SPRING,MD,20910.0,MCPD,Parking Lot - Residential,D,2D1,517,8500.0,,16TH,,ST,38.99652,-77.0364,2D,"(38.9965, -77.0364)"
201235627,1399,190018017,04/17/2019 04:52:10 PM,2019-04-17 16:52:00,,13B,2,Crime Against Person,Simple Assault,ASSAULT - 2ND DEGREE,WHEATON,2700 BLK  UNIVERSITY BLV W,SILVER SPRING,MD,20902.0,MCPD,Commercial - Office Building,L,4L2,321,2700.0,,UNIVERSITY,W,BLV,39.04002,-77.0554,4D,"(39.04, -77.0554)"
201222371,1399,190001433,01/09/2019 03:39:36 PM,2019-01-09 21:23:00,,13B,1,Crime Against Person,Simple Assault,ASSAULT - 2ND DEGREE,WHEATON,11500 BLK  BUCKNELL DR,SILVER SPRING,MD,20902.0,MCPD,Residence - Apartment/Condo,L,4L1,359,11500.0,,BUCKNELL,,DR,39.04308,-77.046,4D,"(39.0431, -77.046)"
201297007,2601,200030103,08/03/2020 02:38:21 PM,2020-08-03 12:56:00,,26A,1,Crime Against Property,False Pretenses/Swindle/Confidence Game,FRAUD - CONFIDENCE GAME,GERMANTOWN,7800 BLK  BRINK RD,GAITHERSBURG,MD,20882.0,MCPD,Other/Unknown,M,5M2,631,7800.0,,BRINK,,RD,39.21016,-77.1589,5D,"(39.2102, -77.1589)"
201361018,2303,220002507,01/20/2022 12:05:52 PM,2022-01-20 11:40:00,01/20/2022 11:52:00 AM,23C,1,Crime Against Property,Shoplifting,LARCENY - SHOPLIFTING,BETHESDA,7100 BLK  DEMOCRACY BLV,BETHESDA,MD,20817.0,MCPD,Retail - Mall,E,2E3,204,7100.0,,DEMOCRACY,,BLV,39.02207,-77.1473,2D,"(39.0221, -77.1473)"
201351161,2308,210030419,08/05/2021 03:29:23 PM,2020-07-20 00:00:00,07/20/2021 12:00:00 AM,23D,1,Crime Against Property,Theft from Building,LARCENY - FROM BLDG,MONTGOMERY VILLAGE,1  BLK  GRAND CORNER AVE,GAITHERSBURG,MD,20878.0,MCPD,Retail - Department/Discount Store,P,6P1,549,1.0,,GRAND CORNER,,AVE,39.11801,-77.2004,6D,"(39.118, -77.2004)"
201403273,5404,220051919,11/24/2022 12:08:33 AM,2022-11-23 23:56:00,,90D,1,Crime Against Society,Driving Under the Influence,DRIVING UNDER THE INFLUENCE LIQUOR,WHEATON,,SILVER SPRING,MD,20905.0,MCPD,Street - In vehicle,J,4J2,391,,,NORBECK,,RD,39.11257,-77.0589,4D,"(39.1126, -77.0589)"
201348957,2305,210040694,10/11/2021 06:15:45 PM,2021-10-10 17:30:00,10/11/2021 09:00:00 AM,23F,1,Crime Against Property,Theft From Motor Vehicle,LARCENY - FROM AUTO,BETHESDA,5600 BLK  ROOSEVELT ST,BETHESDA,MD,20817.0,MCPD,Street - Residential,E,2E2,056,5600.0,,ROOSEVELT,,ST,38.99505,-77.1139,2D,"(38.995, -77.1139)"
201449259,2304,230061482,10/19/2023 04:32:17 PM,2023-10-10 13:30:00,10/19/2023 04:00:00 PM,23G,1,Crime Against Property,Theft of Motor Vehicle Parts or Accessories,LARCENY - AUTO PARTS,ROCKVILLE,17500 BLK  CHRISTER ST,POOLESVILLE,MD,20837.0,MCPD,Parking Lot - Residential,B,1B3,499,17500.0,,CHRISTER,,ST,39.14278,-77.414,1D,"(39.1428, -77.414)"
201442574,2305,230052605,09/01/2023 10:27:17 AM,2023-08-31 16:00:00,09/01/2023 07:00:00 AM,23F,1,Crime Against Property,Theft From Motor Vehicle,LARCENY - FROM AUTO,SILVER SPRING,4300 BLK  LEATHERWOOD TER,BURTONSVILLE,MD,20866.0,MCPD,Parking Lot - Residential,I,3I2,381,4300.0,,LEATHERWOOD,,TER,39.09812,-76.9212,3D,"(39.0981, -76.9212)"
201399569,5404,220048909,11/06/2022 01:50:49 AM,2022-11-06 01:56:00,,90D,1,Crime Against Society,Driving Under the Influence,DRIVING UNDER THE INFLUENCE LIQUOR,SILVER SPRING,,SILVER SPRING,MD,20903.0,MCPD,Street - Other,H,3H2,136,,,NEW HAMPSHIRE,,AVE,38.97994,-76.9899,3D,"(38.9799, -76.9899)"
201419506,1399,230014627,03/26/2023 03:12:11 PM,2023-03-26 15:12:00,,13B,2,Crime Against Person,Simple Assault,ASSAULT - 2ND DEGREE,GERMANTOWN,12600 BLK  WISTERIA DR,GERMANTOWN,MD,20874.0,MCPD,Restaurant,N,5N1,447,12600.0,,WISTERIA,,DR,39.16948,-77.2612,5D,"(39.1695, -77.2612)"
201301369,2399,200035321,09/09/2020 11:14:31 AM,2020-09-08 16:00:00,09/09/2020 09:10:00 AM,23H,1,Crime Against Property,All other Larceny,LARCENY (DESCRIBE OFFENSE),BETHESDA,2500 BLK  LYTTONSVILLE RD,SILVER SPRING,MD,20910.0,MCPD,Street - Commercial,D,2D1,085,2500.0,,LYTTONSVILLE,,RD,38.99885,-77.0523,2D,"(38.9988, -77.0523)"
201360533,1302,220001923,01/16/2022 04:15:28 AM,2022-01-16 04:15:00,,13A,1,Crime Against Person,Aggravated Assault,ASSAULT - AGGRAVATED - FAMILY-OTHER WEAPON,MONTGOMERY VILLAGE,1  BLK  OAK SHADE RD,GAITHERSBURG,MD,20878.0,MCPD,Residence -Townhouse/Duplex,P,6P2,593,1.0,,OAK SHADE,,RD,39.15082,-77.2358,6D,"(39.1508, -77.2358)"
201354053,2303,210047304,11/21/2021 02:35:08 PM,2021-11-21 14:26:00,,23C,1,Crime Against Property,Shoplifting,LARCENY - SHOPLIFTING,GERMANTOWN,12900 BLK  MIDDLEBROOK RD,GERMANTOWN,MD,20874.0,MCPD,Retail - Department/Discount Store,N,5N1,702,12900.0,,MIDDLEBROOK,,RD,39.17881,-77.2673,5D,"(39.1788, -77.2673)"
201390033,2305,220037327,08/29/2022 10:04:09 AM,2022-08-28 17:30:00,08/29/2022 07:45:00 AM,23F,1,Crime Against Property,Theft From Motor Vehicle,LARCENY - FROM AUTO,BETHESDA,7300 BLK  BURDETTE CT,BETHESDA,MD,20817.0,MCPD,Residence - Driveway,E,2E2,060,7300.0,,BURDETTE,,CT,38.99349,-77.1502,2D,"(38.9935, -77.1502)"
201386510,2999,220033048,08/01/2022 04:19:41 PM,2022-08-01 16:19:00,,290,1,Crime Against Property,Destruction/Damage/Vandalism of Property,DAMAGE PROPERTY (DESCRIBE OFFENSE),GERMANTOWN,19600 BLK  GALWAY BAY CIR,GERMANTOWN,MD,20874.0,MCPD,Parking Garage - Residential,N,5N1,702,19600.0,,GALWAY BAY,,CIR,39.17855,-77.2787,5D,"(39.1786, -77.2787)"
201374933,4104,220019097,05/05/2022 12:29:23 PM,2022-05-05 12:29:00,,90G,1,Crime Against Society,Liquor Law Violations,LIQUOR - POSSESS,WHEATON,11400 BLK  AMHERST AVE,SILVER SPRING,MD,20902.0,MCPD,Parking Lot - Other,L,4L2,355,11400.0,,AMHERST,,AVE,39.04128,-77.0482,4D,"(39.0413, -77.0482)"
201448195,1212,230060176,10/12/2023 09:06:56 PM,2023-10-12 21:06:00,,120,1,Crime Against Property,Robbery,ROBBERY - CARJACKING - ARMED,BETHESDA,8000 BLK  WISCONSIN AVE,BETHESDA,MD,20814.0,MCPD,Street - In vehicle,D,2D2,045,8000.0,,WISCONSIN,,AVE,38.99057,-77.0956,2D,"(38.9906, -77.0956)"
201415640,2199,230010184,03/01/2023 01:58:09 PM,2023-03-01 13:59:00,,210,1,Crime Against Property,Extortion/Blackmail,EXTORTION (DESCRIBE OFFENSE),MONTGOMERY VILLAGE,18200 BLK  CONTOUR RD,GAITHERSBURG,MD,20877.0,MCPD,Other/Unknown,R,6R1,505,18200.0,,CONTOUR,,RD,39.15572,-77.1997,6D,"(39.1557, -77.1997)"
201435300,2501,230033834,07/16/2023 09:41:30 AM,2023-07-16 09:41:00,,250,1,Crime Against Property,Counterfeiting/Forgery,FORGERY OF CHECKS,TAKOMA PARK,400 BLK  MISSISSIPPI AVE,SILVER SPRING,MD,20910.0,TPPD,Bank/S&L/Credit Union,T,8T2,804,400.0,,MISSISSIPPI,,AVE,38.98735,-77.0091,TPPD,"(38.9873, -77.0091)"
201349640,1399,210041730,10/17/2021 10:36:12 PM,2021-10-15 11:00:00,10/15/2021 12:00:00 PM,13B,1,Crime Against Person,Simple Assault,ASSAULT - 2ND DEGREE,BETHESDA,11900 BLK  CHAPMAN AVE,ROCKVILLE,MD,20852.0,MCPD,Commercial - Industrial park,D,2D4,187,11900.0,,CHAPMAN,,AVE,39.05166,-77.1128,2D,"(39.0517, -77.1128)"
201444818,1399,230056025,09/21/2023 12:36:21 AM,2023-09-20 23:47:00,,13B,1,Crime Against Person,Simple Assault,ASSAULT - 2ND DEGREE,SILVER SPRING,,SILVER SPRING,MD,20910.0,MCPD,Street - Residential,G,3G1,094,,,DIXON,,AVE,38.99271,-77.0279,3D,"(38.9927, -77.0279)"
201311569,1399,200047655,12/03/2020 02:23:06 PM,2020-12-03 14:23:00,,13B,2,Crime Against Person,Simple Assault,ASSAULT - 2ND DEGREE,MONTGOMERY VILLAGE,1  BLK  BUREAU DR,GAITHERSBURG,MD,20878.0,MCPD,Parking Lot - Commercial,P,6P2,445,1.0,,BUREAU,,DR,39.14197,-77.2175,6D,"(39.142, -77.2175)"
201285619,2308,200016802,04/22/2020 02:22:58 PM,2020-04-21 19:09:00,,23D,1,Crime Against Property,Theft from Building,LARCENY - FROM BLDG,MONTGOMERY VILLAGE,700 BLK  QUINCE ORCHARD BLV,GAITHERSBURG,MD,20878.0,MCPD,Residence - Apartment/Condo,P,6P2,554,700.0,,QUINCE ORCHARD,,BLV,39.14181,-77.2244,6D,"(39.1418, -77.2244)"
201269675,1313,190060410,12/15/2019 09:36:42 AM,2019-12-15 09:36:00,12/15/2019 10:15:00 AM,13B,2,Crime Against Person,Simple Assault,ASSAULT - SIMPLE,WHEATON,4500 BLK  RANDOLPH RD,SILVER SPRING,MD,20906.0,MCPD,Residence - Driveway,K,4K2,307,4500.0,,RANDOLPH,,RD,39.05454,-77.0861,4D,"(39.0545, -77.0861)"
201404967,2305,220055524,12/15/2022 02:33:31 PM,2022-12-14 16:00:00,12/15/2022 02:00:00 PM,23F,1,Crime Against Property,Theft From Motor Vehicle,LARCENY - FROM AUTO,ROCKVILLE,14000 BLK  GREAT NOTCH TER,GAITHERSBURG,MD,20878.0,MCPD,Street - Residential,B,1B2,557,14000.0,,GREAT NOTCH,,TER,39.08711,-77.2389,1D,"(39.0871, -77.2389)"
201367589,2605,220010160,03/09/2022 03:17:35 PM,2022-03-09 12:00:00,03/09/2022 12:00:00 PM,26B,1,Crime Against Property,Credit Card/Automatic Teller Machine Fraud,FRAUD - ILLEGAL USE CREDIT CARDS,SILVER SPRING,1500 BLK  DECEMBER DR,SILVER SPRING,MD,20904.0,MCPD,Other/Unknown,I,3I1,145,1500.0,,DECEMBER,,DR,39.04165,-76.9813,3D,"(39.0416, -76.9813)"
201323389,2902,210009783,03/07/2021 02:36:43 PM,2020-09-23 00:00:00,,290,1,Crime Against Property,Destruction/Damage/Vandalism of Property,DAMAGE PROPERTY - PRIVATE,ROCKVILLE,8000 BLK  TRIBECA ST,DERWOOD,MD,20855.0,MCPD,Residence -Townhouse/Duplex,A,1A4,414,8000.0,,TRIBECA,,ST,39.12656,-77.166,1D,"(39.1266, -77.166)"
201259070,2610,190047015,10/01/2019 11:29:04 AM,2019-09-16 00:00:00,,26F,1,Crime Against Property,Identity Theft,FRAUD - IDENTITY THEFT,BETHESDA,6000 BLK  WELBORN DR,BETHESDA,MD,20816.0,MCPD,Other/Unknown,E,2E1,020,6000.0,,WELBORN,,DR,38.96825,-77.1219,2D,"(38.9682, -77.1219)"
201403955,2304,220054296,12/08/2022 03:07:04 PM,2022-12-07 20:30:00,12/08/2022 01:30:00 PM,23G,1,Crime Against Property,Theft of Motor Vehicle Parts or Accessories,LARCENY - AUTO PARTS,WHEATON,17500 BLK  LONGVIEW LA,OLNEY,MD,20832.0,MCPD,Parking Lot - Residential,J,4J2,539,17500.0,,LONGVIEW,,LA,39.14355,-77.0875,4D,"(39.1435, -77.0875)"
201344763,2304,210035489,09/09/2021 04:32:54 PM,2021-09-06 17:00:00,09/07/2021 07:30:00 AM,23G,1,Crime Against Property,Theft of Motor Vehicle Parts or Accessories,LARCENY - AUTO PARTS,ROCKVILLE,1900 BLK  MC AULIFFE DR,ROCKVILLE,MD,20851.0,MCPD,Street - Residential,A,1A2,293,1900.0,,MC AULIFFE,,DR,39.0778,-77.1188,1D,"(39.0778, -77.1188)"
201281086,3562,200011603,03/09/2020 11:38:06 AM,2020-03-09 11:38:00,03/09/2020 12:18:00 PM,35A,1,Crime Against Society,Drug/Narcotic Violations,DRUGS - MARIJUANA - POSSESS,TAKOMA PARK,7500 BLK  NEW HAMPSHIRE AVE,TAKOMA PARK,MD,20912.0,TPPD,Parking Lot - Commercial,T,8T3,807,7500.0,,NEW HAMPSHIRE,,AVE,38.98516,-76.9882,TPPD,"(38.9852, -76.9882)"
201316507,2314,210001881,01/15/2021 04:24:25 PM,2021-01-15 16:24:00,,23H,1,Crime Against Property,All other Larceny,LARCENY - THEFT OF US GOVERNMENT PROPERTY,SILVER SPRING,10100 BLK  COLESVILLE RD,SILVER SPRING,MD,20901.0,MCPD,Parking Lot - Commercial,H,3H2,155,10100.0,,COLESVILLE,,RD,39.02037,-77.0127,3D,"(39.0204, -77.0127)"
201386623,5212,220033080,08/01/2022 08:33:38 PM,2022-08-01 12:02:00,08/02/2022 02:24:00 AM,520,1,Crime Against Society,Weapon Law Violations,WEAPON - POSSESSION,GERMANTOWN,20200 BLK  GOLDENROD LA,GERMANTOWN,MD,20876.0,MCPD,Hotel/Motel/Etc.,M,5M1,468,20200.0,,GOLDENROD,,LA,39.18414,-77.2456,5D,"(39.1841, -77.2456)"
201394198,5404,220041685,09/24/2022 10:15:58 PM,2022-09-24 22:15:00,09/24/2022 10:15:00 PM,90D,1,Crime Against Society,Driving Under the Influence,DRIVING UNDER THE INFLUENCE LIQUOR,MONTGOMERY VILLAGE,,MONTGOMERY VILLAGE,MD,20886.0,MCPD,Street - In vehicle,R,6R2,508,,,GOSHEN,,RD,39.16324,-77.1921,6D,"(39.1632, -77.1921)"
201440624,2902,230050782,08/22/2023 08:43:53 PM,2023-08-22 20:40:00,08/22/2023 08:43:00 PM,290,1,Crime Against Property,Destruction/Damage/Vandalism of Property,DAMAGE PROPERTY - PRIVATE,ROCKVILLE,1600 BLK  YALE PL,ROCKVILLE,MD,20850.0,RCPD,Residence -Townhouse/Duplex,A,1A3,244,1600.0,,YALE,,PL,39.1015,-77.161,1D,"(39.1015, -77.161)"
201400415,2203,220049970,11/12/2022 08:25:48 AM,2022-11-12 08:25:00,,220,1,Crime Against Property,Burglary/Breaking and Entering,BURGLARY - FORCED ENTRY-NONRESIDENTIAL,SILVER SPRING,800 BLK  ISLINGTON ST,SILVER SPRING,MD,20910.0,MCPD,Residence - Shed,G,3G1,512,800.0,,ISLINGTON,,ST,38.98607,-77.0219,3D,"(38.9861, -77.0219)"
201415958,2604,230009784,02/27/2023 02:17:09 PM,2023-02-27 14:17:00,02/27/2023 02:45:00 PM,26C,1,Crime Against Property,Impersonation,FRAUD - IMPERSONATION,GERMANTOWN,20200 BLK  SHIPLEY TER,GERMANTOWN,MD,20874.0,MCPD,Cyberspace,N,5N1,465,20200.0,,SHIPLEY,,TER,39.18627,-77.275,5D,"(39.1863, -77.275)"
201299571,2305,200033144,08/25/2020 08:25:30 AM,2020-08-24 21:00:00,08/25/2020 06:00:00 AM,23F,1,Crime Against Property,Theft From Motor Vehicle,LARCENY - FROM AUTO,GERMANTOWN,19500 BLK  FREDERICK RD,GERMANTOWN,MD,20876.0,MCPD,Residence - Driveway,M,5M1,470,19500.0,,FREDERICK,,RD,39.17546,-77.2381,5D,"(39.1755, -77.2381)"
201233010,2404,190014845,03/31/2019 12:56:41 AM,2019-03-30 18:40:00,03/31/2019 12:30:00 AM,240,1,Crime Against Property,Motor Vehicle Theft,AUTO THEFT - VEHICLE THEFT,SILVER SPRING,8500 BLK  FENTON ST,SILVER SPRING,MD,20910.0,MCPD,Parking Garage - County,G,3G1,671,8500.0,,FENTON,,ST,38.9954,-77.0244,3D,"(38.9954, -77.0244)"
201321836,2999,210008083,03/03/2021 05:39:36 PM,2021-03-03 17:39:00,,290,1,Crime Against Property,Destruction/Damage/Vandalism of Property,DAMAGE PROPERTY (DESCRIBE OFFENSE),SILVER SPRING,1000 BLK  QUEBEC TER,SILVER SPRING,MD,20903.0,MCPD,Street - Residential,H,3H1,132,1000.0,,QUEBEC,,TER,38.99907,-76.9893,3D,"(38.9991, -76.9893)"
201403607,2308,220053837,12/06/2022 11:50:58 AM,2022-12-05 15:00:00,12/06/2022 12:00:00 PM,23D,1,Crime Against Property,Theft from Building,LARCENY - FROM BLDG,MONTGOMERY VILLAGE,20000 BLK  GOSHEN RD,GAITHERSBURG,MD,20879.0,MCPD,Retail - Other,R,6R2,504,20000.0,,GOSHEN,,RD,39.18526,-77.1874,6D,"(39.1853, -77.1874)"
201410735,2202,230004472,01/27/2023 02:48:39 PM,2023-01-27 07:45:00,01/27/2023 01:45:00 PM,220,1,Crime Against Property,Burglary/Breaking and Entering,BURGLARY - FORCED ENTRY-RESIDENTIAL,BETHESDA,11300 BLK  CUSHMAN RD,ROCKVILLE,MD,20852.0,MCPD,Residence - Single Family,E,2E3,199,11300.0,,CUSHMAN,,RD,39.04017,-77.1313,2D,"(39.0402, -77.1313)"
201284979,1313,200016060,04/15/2020 11:06:49 AM,2020-04-15 14:00:00,,13B,2,Crime Against Person,Simple Assault,ASSAULT - SIMPLE,SILVER SPRING,900 BLK  THAYER AVE,SILVER SPRING,MD,20910.0,MCPD,Street - Commercial,G,3G1,670,900.0,,THAYER,,AVE,38.99304,-77.024,3D,"(38.993, -77.024)"
201388543,2404,220035498,08/17/2022 02:02:22 PM,2022-08-17 12:04:00,08/17/2022 01:30:00 PM,240,1,Crime Against Property,Motor Vehicle Theft,AUTO THEFT - VEHICLE THEFT,BETHESDA,7100 BLK  WOODMONT AVE,CHEVY CHASE,MD,20815.0,MCPD,Parking Garage - Commercial,D,2D2,031,7100.0,,WOODMONT,,AVE,38.97995,-77.093,2D,"(38.98, -77.093)"
201228434,3532,190009069,02/25/2019 10:00:01 PM,2019-02-25 22:02:00,02/26/2019 03:30:00 AM,35A,1,Crime Against Society,Drug/Narcotic Violations,DRUGS - COCAINE - POSSESS,MONTGOMERY VILLAGE,,ROCKVILLE,MD,20850.0,GPD,Street - In vehicle,P,6P1,721,,,SHADY GROVE,,RD,39.14114,-77.1518,6D,"(39.1411, -77.1518)"
201364672,1399,220006742,02/16/2022 08:51:30 AM,2022-02-16 08:51:00,,13B,1,Crime Against Person,Simple Assault,ASSAULT - 2ND DEGREE,SILVER SPRING,14800 BLK  SILVER ASH CT,BURTONSVILLE,MD,20866.0,MCPD,Residence - Single Family,I,3I2,381,14800.0,,SILVER ASH,,CT,39.09827,-76.9259,3D,"(39.0983, -76.9259)"
201262926,5404,190051442,,2019-10-26 02:05:00,,90D,1,Crime Against Society,Driving Under the Influence,DRIVING UNDER THE INFLUENCE LIQUOR,GERMANTOWN,,GERMANTOWN,MD,20874.0,MCPD,Street - In vehicle,N,5N1,465,,,FATHER HURLEY,,BLV,39.18621,-77.2737,5D,"(39.1862, -77.2737)"
201307798,2605,200043039,11/01/2020 01:11:38 AM,2020-10-01 18:00:00,10/01/2020 06:00:00 PM,26B,1,Crime Against Property,Credit Card/Automatic Teller Machine Fraud,FRAUD - ILLEGAL USE CREDIT CARDS,ROCKVILLE,12200 BLK  GREENLEAF AVE,POTOMAC,MD,20854.0,MCPD,Other/Unknown,B,1B1,203,12200.0,,GREENLEAF,,AVE,39.05499,-77.1595,1D,"(39.055, -77.1595)"
201243611,2309,190028050,06/12/2019 02:42:23 PM,2019-06-12 14:42:00,,23H,1,Crime Against Property,All other Larceny,LARCENY - FROM YARDS,SILVER SPRING,4400 BLK  REGALWOOD TER,BURTONSVILLE,MD,20866.0,MCPD,Residence -Townhouse/Duplex,I,3I2,381,4400.0,,REGALWOOD,,TER,39.09918,-76.9196,3D,"(39.0992, -76.9196)"
201224800,5311,190003806,01/24/2019 04:35:55 PM,2019-01-24 16:35:00,,90C,1,Crime Against Society,Disorderly Conduct,PUBLIC PEACE - DISORDERLY CONDUCT,MONTGOMERY VILLAGE,20000 BLK  GOSHEN RD,GAITHERSBURG,MD,20879.0,MCPD,Parking Lot - Commercial,R,6R2,504,20000.0,,GOSHEN,,RD,39.18526,-77.1874,6D,"(39.1853, -77.1874)"
201395751,2303,220042970,10/02/2022 03:57:05 PM,2022-10-02 13:21:00,10/02/2022 12:00:00 AM,23C,1,Crime Against Property,Shoplifting,LARCENY - SHOPLIFTING,WHEATON,14000 BLK  GEORGIA AVE,SILVER SPRING,MD,20906.0,MCPD,Retail - Hardware,K,4K2,342,14000.0,,GEORGIA,,AVE,39.08376,-77.0778,4D,"(39.0838, -77.0778)"
201409648,2303,230003173,01/20/2023 01:31:29 AM,2023-01-20 01:31:00,,23C,1,Crime Against Property,Shoplifting,LARCENY - SHOPLIFTING,SILVER SPRING,1200 BLK E WEST HWY,SILVER SPRING,MD,20910.0,MCPD,Retail - Drug Store/Pharmacy,G,3G1,089,1200.0,E,WEST,,HWY,39.12378,-77.2033,3D,"(39.1238, -77.2033)"
201391700,5404,220039274,09/09/2022 08:06:49 PM,2022-09-09 20:06:00,,90D,1,Crime Against Society,Driving Under the Influence,DRIVING UNDER THE INFLUENCE LIQUOR,SILVER SPRING,10100 BLK  NEW HAMPSHIRE AVE,SILVER SPRING,MD,20903.0,MCPD,Street - In vehicle,H,3H2,140,10100.0,,NEW HAMPSHIRE,,AVE,39.02039,-76.9766,3D,"(39.0204, -76.9766)"
201389237,2305,220036344,08/23/2022 09:10:29 AM,2022-08-22 18:30:00,08/23/2022 08:15:00 AM,23F,1,Crime Against Property,Theft From Motor Vehicle,LARCENY - FROM AUTO,ROCKVILLE,1100 BLK  HIGGINS PL,ROCKVILLE,MD,20852.0,MCPD,Parking Garage - Residential,A,1A2,300,1100.0,,HIGGINS,,PL,39.06274,-77.118,1D,"(39.0627, -77.118)"
201349729,2304,210041820,10/18/2021 03:24:25 PM,2021-10-16 17:24:00,,23G,1,Crime Against Property,Theft of Motor Vehicle Parts or Accessories,LARCENY - AUTO PARTS,MONTGOMERY VILLAGE,18300 BLK  SWAN STREAM DR,GAITHERSBURG,MD,20877.0,GPD,Street - In vehicle,R,6R3,542,18300.0,,SWAN STREAM,,DR,39.15561,-77.1594,6D,"(39.1556, -77.1594)"
201397158,2204,220046049,10/20/2022 08:46:36 AM,2022-10-18 18:00:00,10/20/2022 10:00:00 AM,220,1,Crime Against Property,Burglary/Breaking and Entering,BURGLARY - NO FORCED ENTRY-RESIDENTIAL,ROCKVILLE,700 BLK  MONROE ST,ROCKVILLE,MD,20850.0,RCPD,Residence - Apartment/Condo,A,1A1,258,700.0,,MONROE,,ST,39.07537,-77.153,1D,"(39.0754, -77.153)"
201243409,2610,190027654,06/10/2019 10:43:56 AM,2019-05-13 13:00:00,,26F,1,Crime Against Property,Identity Theft,FRAUD - IDENTITY THEFT,WHEATON,3900 BLK  ARBOR CREST WAY,ROCKVILLE,MD,20853.0,MCPD,Other/Unknown,J,4J2,393,3900.0,,ARBOR CREST,,WAY,39.11384,-77.0771,4D,"(39.1138, -77.0771)"
201331039,2303,210018310,05/15/2021 01:14:40 PM,2021-05-15 13:14:00,,23C,1,Crime Against Property,Shoplifting,LARCENY - SHOPLIFTING,WHEATON,11100 BLK  VEIRS MILL RD,SILVER SPRING,MD,20902.0,MCPD,Retail - Mall,L,4L2,321,11100.0,,VEIRS MILL,,RD,39.03758,-77.0519,4D,"(39.0376, -77.0519)"
201230179,2901,190011371,03/12/2019 07:15:02 AM,2019-03-11 17:00:00,03/12/2019 07:00:00 AM,290,1,Crime Against Property,Destruction/Damage/Vandalism of Property,DAMAGE PROPERTY - BUSINESS,BETHESDA,4700 BLK  MONTGOMERY LA,BETHESDA,MD,20814.0,MCPD,Commercial - Office Building,D,2D2,033,4700.0,,MONTGOMERY,,LA,38.9836,-77.0938,2D,"(38.9836, -77.0938)"
201261754,2602,190050578,10/21/2019 07:41:00 PM,2019-10-21 19:41:00,,26A,1,Crime Against Property,False Pretenses/Swindle/Confidence Game,FRAUD - SWINDLE,TAKOMA PARK,7700 BLK  MAPLE AVE,TAKOMA PARK,MD,20912.0,TPPD,Other/Unknown,T,8T2,804,7700.0,,MAPLE,,AVE,38.98397,-77.0052,TPPD,"(38.984, -77.0052)"
201416083,2204,230010827,03/05/2023 05:12:31 AM,2023-03-05 05:05:00,03/05/2023 05:15:00 AM,220,1,Crime Against Property,Burglary/Breaking and Entering,BURGLARY - NO FORCED ENTRY-RESIDENTIAL,BETHESDA,8500 BLK  GAVIN MANOR CT,CHEVY CHASE,MD,20815.0,MCPD,Residence - Single Family,D,2D3,039,8500.0,,GAVIN MANOR,,CT,38.99687,-77.0722,2D,"(38.9969, -77.0722)"
201355160,2305,210040591,10/11/2021 09:32:51 AM,2021-10-10 22:00:00,10/11/2021 06:30:00 AM,23F,1,Crime Against Property,Theft From Motor Vehicle,LARCENY - FROM AUTO,BETHESDA,5500 BLK  ROOSEVELT ST,BETHESDA,MD,20817.0,MCPD,Residence - Driveway,E,2E2,056,5500.0,,ROOSEVELT,,ST,38.99547,-77.1115,2D,"(38.9955, -77.1115)"
201304132,2901,200038568,10/01/2020 06:06:33 AM,2020-09-30 17:00:00,10/01/2020 05:50:00 AM,290,1,Crime Against Property,Destruction/Damage/Vandalism of Property,DAMAGE PROPERTY - BUSINESS,MONTGOMERY VILLAGE,,MONTGOMERY VILLAGE,MD,20886.0,MCPD,Street - Residential,R,6R2,424,,,WATKINS MILL,,DR,39.16774,-77.2119,6D,"(39.1677, -77.2119)"
201370365,1399,220013517,03/30/2022 09:31:32 AM,2022-03-30 09:31:00,,13B,1,Crime Against Person,Simple Assault,ASSAULT - 2ND DEGREE,BETHESDA,6600 BLK  MELODY LA,BETHESDA,MD,20817.0,MCPD,Residence - Single Family,E,2E2,059,6600.0,,MELODY,,LA,38.99149,-77.1332,2D,"(38.9915, -77.1332)"
201371334,2305,220014721,04/06/2022 10:28:26 PM,2022-04-06 16:25:00,,23F,1,Crime Against Property,Theft From Motor Vehicle,LARCENY - FROM AUTO,WHEATON,14000 BLK  GEORGIA AVE,SILVER SPRING,MD,20906.0,MCPD,Parking Lot - Commercial,K,4K2,342,14000.0,,GEORGIA,,AVE,39.08376,-77.0778,4D,"(39.0838, -77.0778)"
201398761,3562,220048025,11/01/2022 01:29:26 PM,2022-11-01 08:00:00,11/01/2022 01:23:00 PM,35A,1,Crime Against Society,Drug/Narcotic Violations,DRUGS - MARIJUANA - POSSESS,GERMANTOWN,22400 BLK  BRICK HAVEN WAY,CLARKSBURG,,20871.0,MCPD,School - Elementary/Secondary,M,5M3,598,22400.0,,BRICK HAVEN,,WAY,39.22071,-77.263,5D,"(39.2207, -77.263)"
201255139,2204,190042203,09/03/2019 03:36:45 PM,2019-09-02 11:59:00,09/02/2019 12:57:00 PM,220,1,Crime Against Property,Burglary/Breaking and Entering,BURGLARY - NO FORCED ENTRY-RESIDENTIAL,GERMANTOWN,22500 BLK  TATE ST,CLARKSBURG,MD,20871.0,MCPD,Residence -Townhouse/Duplex,M,5M3,598,22500.0,,TATE,,ST,39.2255,-77.273,5D,"(39.2255, -77.273)"
201409569,2303,230003085,01/19/2023 03:52:38 PM,2023-01-19 15:52:00,,23C,1,Crime Against Property,Shoplifting,LARCENY - SHOPLIFTING,WHEATON,11100 BLK  VEIRS MILL RD,SILVER SPRING,MD,20902.0,MCPD,Retail - Mall,L,4L2,321,11100.0,,VEIRS MILL,,RD,39.03758,-77.0519,4D,"(39.0376, -77.0519)"
201383884,1214,220029866,07/12/2022 06:24:49 AM,2022-07-12 06:24:00,,120,1,Crime Against Property,Robbery,ROBBERY - KNIFE,MONTGOMERY VILLAGE,400 BLK N FREDERICK AVE,GAITHERSBURG,MD,20877.0,GPD,Parking Lot - Residential,R,6R1,548,400.0,N,FREDERICK,,AVE,39.1457,-77.2037,6D,"(39.1457, -77.2037)"
201390949,2902,220038451,09/05/2022 07:31:12 AM,2022-09-05 07:31:00,,290,1,Crime Against Property,Destruction/Damage/Vandalism of Property,DAMAGE PROPERTY - PRIVATE,ROCKVILLE,1400 BLK  VEIRS MILL RD,ROCKVILLE,MD,20851.0,RCPD,Residence - Driveway,A,1A2,296,1400.0,,VEIRS MILL,,RD,39.0775,-77.1244,1D,"(39.0775, -77.1244)"
201242089,2303,190022076,05/10/2019 01:59:13 PM,2019-05-03 13:59:00,05/06/2019 12:20:00 PM,23C,1,Crime Against Property,Shoplifting,LARCENY - SHOPLIFTING,MONTGOMERY VILLAGE,1  BLK  MARKET ST,GAITHERSBURG,MD,20878.0,GPD,Retail - Hardware,P,6P2,450,1.0,,MARKET,,ST,39.12411,-77.235,6D,"(39.1241, -77.235)"
201276745,3806,200006212,02/06/2020 05:58:53 PM,2020-02-06 17:55:00,02/06/2020 06:05:00 PM,90F,1,Crime Against Society,"Family Offenses, NonViolent",FAMILY OFFENSE - NEGLECT CHILD (INCLUDES NONSUPPOR,MONTGOMERY VILLAGE,600 BLK  QUINCE ORCHARD RD,GAITHERSBURG,MD,20878.0,GPD,Parking Lot - Commercial,P,6P2,554,600.0,,QUINCE ORCHARD,,RD,39.14263,-77.2208,6D,"(39.1426, -77.2208)"
201356824,2610,210050800,12/14/2021 11:27:53 AM,2021-12-14 00:00:00,,26F,1,Crime Against Property,Identity Theft,FRAUD - IDENTITY THEFT,BETHESDA,9700 BLK  KENSINGTON PKW,KENSINGTON,MD,20895.0,MCPD,Cyberspace,D,2D3,178,9700.0,,KENSINGTON,,PKW,39.01315,-77.0753,2D,"(39.0132, -77.0753)"
201289899,2902,200021599,06/01/2020 06:32:02 AM,2020-06-01 06:32:00,,290,1,Crime Against Property,Destruction/Damage/Vandalism of Property,DAMAGE PROPERTY - PRIVATE,SILVER SPRING,12200 BLK  TECH RD,SILVER SPRING,MD,20904.0,MCPD,Retail - Other,I,3I1,146,12200.0,,TECH,,RD,39.05513,-76.9666,3D,"(39.0551, -76.9666)"
201255960,2204,190043261,09/09/2019 08:37:41 PM,2019-09-09 09:00:00,09/09/2019 11:00:00 AM,220,1,Crime Against Property,Burglary/Breaking and Entering,BURGLARY - NO FORCED ENTRY-RESIDENTIAL,ROCKVILLE,7300 BLK  OSKALOOSA DR,DERWOOD,MD,20855.0,MCPD,Residence - Garage,A,1A4,281,7300.0,,OSKALOOSA,,DR,39.11301,-77.1439,1D,"(39.113, -77.1439)"
201308786,5707,200044260,11/09/2020 03:51:20 PM,2020-11-09 15:51:00,,90J,1,Crime Against Society,Trespass of Real Property,TRESPASSING,GERMANTOWN,26300 BLK  RIDGE RD,DAMASCUS,MD,20872.0,MCPD,Convenience Store,M,5M2,484,26300.0,,RIDGE,,RD,39.28845,-77.2043,5D,"(39.2884, -77.2043)"
201430589,2301,230028132,06/11/2023 09:35:02 PM,2023-06-11 17:00:00,06/11/2023 05:42:00 PM,23A,1,Crime Against Property,Pocket/picking,LARCENY - POCKET PICKING,BETHESDA,,BETHESDA,MD,20814.0,MCPD,Other/Unknown,D,2D2,032,,,BETHESDA,,AVE,38.98092,-77.0967,2D,"(38.9809, -77.0967)"
201319133,1114,210004590,,2021-02-08 10:44:00,,11B,1,Crime Against Person,Forcible Sodomy,SEX ASSAULT - SODOMY-GIRL-STRONG-ARM,SILVER SPRING,2900 BLK  HICKORY LEAF WAY,SILVER SPRING,MD,20904.0,MCPD,Residence -Townhouse/Duplex,I,3I2,379,2900.0,,HICKORY LEAF,,WAY,39.08252,-76.9503,3D,"(39.0825, -76.9503)"
201315582,2303,210000065,01/01/2021 01:33:57 PM,2020-12-10 19:00:00,12/10/2020 07:29:00 PM,23C,1,Crime Against Property,Shoplifting,LARCENY - SHOPLIFTING,GERMANTOWN,20900 BLK  FREDERICK RD,GERMANTOWN,MD,20876.0,MCPD,Retail - Department/Discount Store,M,5M1,701,20900.0,,FREDERICK,,RD,39.19829,-77.2448,5D,"(39.1983, -77.2448)"
201269100,3562,190059821,12/12/2019 06:42:13 AM,2019-12-12 07:10:00,,35A,1,Crime Against Society,Drug/Narcotic Violations,DRUGS - MARIJUANA - POSSESS,ROCKVILLE,200 BLK  EDISON PARK DR,GAITHERSBURG,MD,20878.0,MCPD,Parking Lot - County,B,1B2,725,200.0,,EDISON PARK,,DR,39.11367,-77.2341,1D,"(39.1137, -77.2341)"
201262720,2404,190051792,10/28/2019 09:02:40 AM,2019-10-26 20:00:00,10/27/2019 11:00:00 AM,240,1,Crime Against Property,Motor Vehicle Theft,AUTO THEFT - VEHICLE THEFT,ROCKVILLE,500 BLK  SILVER KING LA,ROCKVILLE,MD,20850.0,MCPD,Street - Residential,A,1A3,242,500.0,,SILVER KING,,LA,39.10794,-77.164,1D,"(39.1079, -77.164)"
201374681,3504,220018126,04/28/2022 08:55:20 PM,2022-04-28 20:55:00,,35A,1,Crime Against Society,Drug/Narcotic Violations,DRUGS - HALLUCINOGEN - POSSESS,MONTGOMERY VILLAGE,200 BLK  PROFESSIONAL DR,GAITHERSBURG,MD,20879.0,MCPD,Street - In vehicle,P,6P2,425,200.0,,PROFESSIONAL,,DR,39.16278,-77.2277,6D,"(39.1628, -77.2277)"
201307931,1313,200043227,11/02/2020 11:12:39 AM,2020-10-29 11:37:00,,13B,2,Crime Against Person,Simple Assault,ASSAULT - SIMPLE,MONTGOMERY VILLAGE,5600 BLK  SILO HILL CT,DERWOOD,MD,20855.0,MCPD,Residence - Single Family,R,6R3,724,5600.0,,SILO HILL,,CT,39.14935,-77.1108,6D,"(39.1493, -77.1108)"
201381637,1399,220027126,06/23/2022 05:18:54 PM,2022-06-23 17:18:00,,13B,1,Crime Against Person,Simple Assault,ASSAULT - 2ND DEGREE,MONTGOMERY VILLAGE,19000 BLK  MILLS CHOICE RD,MONTGOMERY VILLAGE,MD,20886.0,MCPD,Residence - Apartment/Condo,R,6R2,546,19000.0,,MILLS CHOICE,,RD,39.16801,-77.2083,6D,"(39.168, -77.2083)"
201338109,3699,210023761,06/21/2021 04:41:26 PM,2021-06-21 00:00:00,,11D,1,Crime Against Person,Forcible Fondling,SEX OFFENSE - FONDLING,ROCKVILLE,7300 BLK  CALHOUN PL,DERWOOD,MD,20855.0,MCPD,Residence - Single Family,A,1A4,281,7300.0,,CALHOUN,,PL,39.10793,-77.148,1D,"(39.1079, -77.148)"
201362730,2399,220004585,02/02/2022 04:23:23 PM,2022-02-02 16:23:00,,23H,1,Crime Against Property,All other Larceny,LARCENY (DESCRIBE OFFENSE),ROCKVILLE,1600 BLK  CHAPMAN AVE,ROCKVILLE,MD,20852.0,MCPD,Parking Lot - Metro,A,1A1,272,1600.0,,CHAPMAN,,AVE,39.06222,-77.1219,1D,"(39.0622, -77.1219)"
201255667,2999,190042889,09/07/2019 12:03:41 PM,2019-09-07 12:03:00,,290,1,Crime Against Property,Destruction/Damage/Vandalism of Property,DAMAGE PROPERTY (DESCRIBE OFFENSE),ROCKVILLE,400 BLK  ELMCROFT BLV,ROCKVILLE,MD,20850.0,RCPD,Parking Lot - Residential,A,1A3,242,400.0,,ELMCROFT,,BLV,39.11292,-77.1645,1D,"(39.1129, -77.1645)"
201333576,1399,210021531,06/06/2021 07:57:49 PM,2021-06-06 19:57:00,,13B,2,Crime Against Person,Simple Assault,ASSAULT - 2ND DEGREE,SILVER SPRING,8100 BLK  GEORGIA AVE,SILVER SPRING,MD,20910.0,MCPD,Community Center,G,3G1,094,8100.0,,GEORGIA,,AVE,38.99064,-77.0266,3D,"(38.9906, -77.0266)"
201446079,2608,230057553,09/29/2023 06:04:34 PM,2023-09-25 18:04:00,09/26/2023 11:59:00 PM,26E,1,Crime Against Property,Wire Fraud,FRAUD BY WIRE,MONTGOMERY VILLAGE,8800 BLK  BRINK RD,GAITHERSBURG,MD,20882.0,MCPD,Residence - Single Family,R,6R2,543,8800.0,,BRINK,,RD,0.0,0.0,6D,"(0.0, 0.0)"
201418005,2303,230012860,03/16/2023 06:15:30 PM,2023-03-16 18:15:00,,23C,1,Crime Against Property,Shoplifting,LARCENY - SHOPLIFTING,WHEATON,11100 BLK  VEIRS MILL RD,SILVER SPRING,MD,20902.0,MCPD,Retail - Department/Discount Store,L,4L2,321,11100.0,,VEIRS MILL,,RD,39.03758,-77.0519,4D,"(39.0376, -77.0519)"
201340861,1399,210030630,08/07/2021 12:31:47 AM,2021-08-07 00:31:00,08/07/2021 12:31:00 AM,13B,1,Crime Against Person,Simple Assault,ASSAULT - 2ND DEGREE,SILVER SPRING,8800 BLK  ARLISS ST,SILVER SPRING,MD,20901.0,MCPD,Residence -Townhouse/Duplex,H,3H1,127,8800.0,,ARLISS,,ST,39.0005,-77.0019,3D,"(39.0005, -77.0019)"
201425385,1215,230021765,05/06/2023 10:48:26 PM,2023-05-06 22:48:00,,120,1,Crime Against Property,Robbery,ROBBERY - OTHER WEAPON,SILVER SPRING,11900 BLK  CRIMSON LA,SILVER SPRING,MD,20904.0,MCPD,Other/Unknown,I,3I1,146,11900.0,,CRIMSON,,LA,39.05186,-76.9736,3D,"(39.0519, -76.9736)"
201277772,2305,200007556,02/14/2020 03:48:26 PM,2020-02-12 22:30:00,02/13/2020 07:00:00 AM,23F,1,Crime Against Property,Theft From Motor Vehicle,LARCENY - FROM AUTO,WHEATON,13400 BLK  BRIAR PATH LA,SILVER SPRING,MD,20906.0,MCPD,Street - Residential,K,4K1,350,13400.0,,BRIAR PATH,,LA,39.07501,-77.0577,4D,"(39.075, -77.0577)"
201221852,4199,190000850,01/05/2019 09:21:17 PM,2019-01-05 21:10:00,01/05/2019 09:45:00 PM,90G,1,Crime Against Society,Liquor Law Violations,LIQUOR (DESCRIBE OFFENSE),ROCKVILLE,700 BLK  HUNGERFORD DR,ROCKVILLE,MD,20850.0,RCPD,Parking Lot - Other,A,1A3,278,700.0,,HUNGERFORD,,DR,39.09308,-77.1534,1D,"(39.0931, -77.1534)"
201361434,2399,220002876,01/22/2022 06:39:19 PM,2022-01-22 18:39:00,,23H,1,Crime Against Property,All other Larceny,LARCENY (DESCRIBE OFFENSE),SILVER SPRING,100 BLK  UNIVERSITY BLV W,SILVER SPRING,MD,20901.0,MCPD,Restaurant,H,3H2,160,100.0,,UNIVERSITY,W,BLV,39.02006,-77.0136,3D,"(39.0201, -77.0136)"
201297792,2204,200031075,08/10/2020 02:02:23 PM,2020-08-07 18:30:00,08/08/2020 04:30:00 PM,220,1,Crime Against Property,Burglary/Breaking and Entering,BURGLARY - NO FORCED ENTRY-RESIDENTIAL,SILVER SPRING,11200 BLK  LOCKWOOD DR,SILVER SPRING,MD,20901.0,MCPD,Residence - Apartment/Condo,I,3I1,518,11200.0,,LOCKWOOD,,DR,39.03877,-76.9925,3D,"(39.0388, -76.9925)"
201242390,1399,190026539,06/03/2019 08:59:51 PM,2019-06-03 20:59:00,,13B,1,Crime Against Person,Simple Assault,ASSAULT - 2ND DEGREE,BETHESDA,7100 BLK  DEMOCRACY BLV,BETHESDA,MD,20817.0,MCPD,Retail - Mall,E,2E3,204,7100.0,,DEMOCRACY,,BLV,39.02207,-77.1473,2D,"(39.0221, -77.1473)"
201252669,2902,190039196,08/16/2019 05:53:48 PM,2019-08-16 17:53:00,08/16/2019 05:55:00 PM,290,1,Crime Against Property,Destruction/Damage/Vandalism of Property,DAMAGE PROPERTY - PRIVATE,SILVER SPRING,14100 BLK  CASTLE BLV,SILVER SPRING,MD,20904.0,MCPD,Residence - Apartment/Condo,I,3I2,380,14100.0,,CASTLE,,BLV,39.08632,-76.94,3D,"(39.0863, -76.94)"
201369952,1399,220013068,03/26/2022 10:38:14 PM,2022-03-26 22:38:00,,13B,2,Crime Against Person,Simple Assault,ASSAULT - 2ND DEGREE,BETHESDA,8500 BLK  16TH ST,SILVER SPRING,MD,20910.0,MCPD,Residence - Apartment/Condo,D,2D1,517,8500.0,,16TH,,ST,38.99652,-77.0364,2D,"(38.9965, -77.0364)"
201242729,2304,190026955,06/05/2019 09:10:34 PM,2019-05-29 21:10:00,06/05/2019 09:20:00 PM,23G,1,Crime Against Property,Theft of Motor Vehicle Parts or Accessories,LARCENY - AUTO PARTS,WHEATON,2400 BLK  UNIVERSITY BLV W,SILVER SPRING,MD,20902.0,MCPD,Auto Repair,L,4L2,355,2400.0,,UNIVERSITY,W,BLV,39.0416,-77.0503,4D,"(39.0416, -77.0503)"
201393500,2316,220041501,09/23/2022 02:55:22 PM,2022-09-18 12:00:00,09/23/2022 12:00:00 PM,23H,1,Crime Against Property,All other Larceny,LARCENY - POSTAL,BETHESDA,4900 BLK  BATTERY LA,BETHESDA,MD,20814.0,MCPD,Other/Unknown,E,2E2,054,4900.0,,BATTERY,,LA,38.9925,-77.0992,2D,"(38.9925, -77.0992)"
201244706,2303,190029406,06/19/2019 06:45:11 PM,2019-06-19 18:45:00,,23C,1,Crime Against Property,Shoplifting,LARCENY - SHOPLIFTING,WHEATON,11100 BLK  VEIRS MILL RD,SILVER SPRING,MD,20902.0,MCPD,Retail - Drug Store/Pharmacy,L,4L2,321,11100.0,,VEIRS MILL,,RD,39.03758,-77.0519,4D,"(39.0376, -77.0519)"
201281036,2305,200011545,03/09/2020 07:30:44 AM,2020-03-08 20:00:00,03/09/2020 07:30:00 AM,23F,1,Crime Against Property,Theft From Motor Vehicle,LARCENY - FROM AUTO,SILVER SPRING,,SILVER SPRING,MD,20910.0,MCPD,Street - Residential,G,3G2,118,,,SPRINGVALE,,RD,38.9995,-77.0223,3D,"(38.9995, -77.0223)"
201266185,1399,190056111,11/20/2019 06:53:16 PM,2019-11-20 18:53:00,,13B,1,Crime Against Person,Simple Assault,ASSAULT - 2ND DEGREE,SILVER SPRING,11200 BLK  NEW HAMPSHIRE AVE,SILVER SPRING,MD,20904.0,MCPD,Other/Unknown,I,3I1,518,11200.0,,NEW HAMPSHIRE,,AVE,39.03978,-76.9906,3D,"(39.0398, -76.9906)"
201360400,5707,220001715,01/14/2022 12:08:56 PM,2022-01-14 12:08:00,01/14/2022 12:10:00 PM,90J,1,Crime Against Society,Trespass of Real Property,TRESPASSING,SILVER SPRING,8000 BLK  13TH ST,SILVER SPRING,MD,20910.0,MCPD,Hotel/Motel/Etc.,G,3G1,090,8000.0,,13TH,,ST,38.98692,-77.0296,3D,"(38.9869, -77.0296)"
201234376,1399,190008952,02/25/2019 11:33:46 AM,2019-04-09 16:09:00,,13B,1,Crime Against Person,Simple Assault,ASSAULT - 2ND DEGREE,ROCKVILLE,2100 BLK  BALTIMORE RD,ROCKVILLE,MD,20851.0,MCPD,School/College - DO NOT USE,A,1A2,290,2100.0,,BALTIMORE,,RD,39.08472,-77.1183,1D,"(39.0847, -77.1183)"
201314099,1314,200050647,12/24/2020 01:23:42 PM,2020-12-24 13:11:00,,13A,1,Crime Against Person,Aggravated Assault,ASSAULT - AGGRAVATED - GUN,MONTGOMERY VILLAGE,9800 BLK  WASHINGTONIAN BLV,GAITHERSBURG,MD,20878.0,MCPD,Retail - Clothing,P,6P1,549,9800.0,,WASHINGTONIAN,,BLV,39.11415,-77.197,6D,"(39.1142, -77.197)"
201435185,2303,230033696,07/15/2023 11:00:13 AM,2023-07-15 11:15:00,,23C,1,Crime Against Property,Shoplifting,LARCENY - SHOPLIFTING,SILVER SPRING,8700 BLK  GEORGIA AVE,SILVER SPRING,MD,20910.0,MCPD,Convenience Store,G,3G1,108,8700.0,,GEORGIA,,AVE,38.99752,-77.0297,3D,"(38.9975, -77.0297)"
201358980,2399,220000038,01/01/2022 10:28:43 AM,2022-01-01 01:00:00,01/01/2022 10:28:00 AM,23H,1,Crime Against Property,All other Larceny,LARCENY (DESCRIBE OFFENSE),SILVER SPRING,8100 BLK  GEORGIA AVE,SILVER SPRING,MD,20910.0,MCPD,Restaurant,G,3G1,094,8100.0,,GEORGIA,,AVE,38.99064,-77.0266,3D,"(38.9906, -77.0266)"
201302933,3806,200037170,09/22/2020 10:21:11 AM,2020-09-22 10:21:00,,90F,1,Crime Against Society,"Family Offenses, NonViolent",FAMILY OFFENSE - NEGLECT CHILD (INCLUDES NONSUPPOR,BETHESDA,11300 BLK  SCHUYLKILL RD,ROCKVILLE,MD,20852.0,MCPD,Residence - Single Family,D,2D4,309,11300.0,,SCHUYLKILL,,RD,39.04048,-77.0917,2D,"(39.0405, -77.0917)"
201238262,2699,190021329,05/06/2019 03:42:11 PM,2019-05-06 11:15:00,,26A,1,Crime Against Property,False Pretenses/Swindle/Confidence Game,FRAUD (DESCRIBE OFFENSE),BETHESDA,8400 BLK  CONNECTICUT AVE,CHEVY CHASE,MD,20815.0,MCPD,Other/Unknown,D,2D1,038,8400.0,,CONNECTICUT,,AVE,38.99392,-77.0771,2D,"(38.9939, -77.0771)"
201336180,2308,210024774,06/28/2021 01:18:38 PM,2021-06-27 17:00:00,06/28/2021 10:00:00 AM,23D,1,Crime Against Property,Theft from Building,LARCENY - FROM BLDG,MONTGOMERY VILLAGE,18500 BLK  CHERRY LAUREL LA,GAITHERSBURG,MD,20879.0,MCPD,Residence -Townhouse/Duplex,R,6R3,420,18500.0,,CHERRY LAUREL,,LA,39.16073,-77.1657,6D,"(39.1607, -77.1657)"
201374574,3806,220018653,05/02/2022 03:02:00 PM,2022-05-02 15:02:00,05/02/2022 12:00:00 AM,90F,1,Crime Against Society,"Family Offenses, NonViolent",FAMILY OFFENSE - NEGLECT CHILD (INCLUDES NONSUPPOR,ROCKVILLE,1700 BLK E JEFFERSON ST,ROCKVILLE,MD,20852.0,MCPD,Parking Garage - Commercial,A,1A1,270,1700.0,E,JEFFERSON,,ST,39.05848,-77.1264,1D,"(39.0585, -77.1264)"
201270479,2308,190061373,12/20/2019 05:23:15 PM,2019-12-20 17:20:00,12/20/2019 05:30:00 PM,23D,1,Crime Against Property,Theft from Building,LARCENY - FROM BLDG,TAKOMA PARK,7000 BLK  CARROLL AVE,TAKOMA PARK,MD,20912.0,TPPD,Retail - Department/Discount Store,T,8T1,801,7000.0,,CARROLL,,AVE,38.97464,-77.0121,TPPD,"(38.9746, -77.0121)"
201263256,1216,190052523,10/31/2019 10:27:40 PM,2019-10-31 22:27:00,,120,1,Crime Against Property,Robbery,ROBBERY - STRONG ARM,GERMANTOWN,,CLARKSBURG,MD,20871.0,MCPD,Street - Residential,M,5M3,476,,,SNOWDEN FARM,,PKW,39.21686,-77.2416,5D,"(39.2169, -77.2416)"
201293092,5399,200025560,07/01/2020 09:42:16 AM,2020-07-01 08:30:00,07/01/2020 09:30:00 AM,90C,1,Crime Against Society,Disorderly Conduct,PUBLIC PEACE (DESCRIBE OFFENSE),WHEATON,2300 BLK  JONES LA,SILVER SPRING,MD,20902.0,MCPD,Parking Lot - Residential,L,4L1,674,2300.0,,JONES,,LA,39.05366,-77.0492,4D,"(39.0537, -77.0492)"
201307038,1399,200041965,10/24/2020 11:50:03 AM,2020-10-24 11:50:00,,13B,1,Crime Against Person,Simple Assault,ASSAULT - 2ND DEGREE,MONTGOMERY VILLAGE,700 BLK  RUSSELL AVE,GAITHERSBURG,MD,20877.0,GPD,Retail - Mall,R,6R1,548,700.0,,RUSSELL,,AVE,39.15063,-77.2039,6D,"(39.1506, -77.2039)"
201294567,2902,200026759,07/10/2020 08:28:23 AM,2020-07-09 18:00:00,07/10/2020 07:35:00 AM,290,1,Crime Against Property,Destruction/Damage/Vandalism of Property,DAMAGE PROPERTY - PRIVATE,BETHESDA,9300 BLK  LINDEN AVE,BETHESDA,MD,20814.0,MCPD,Residence - Driveway,E,2E2,071,9300.0,,LINDEN,,AVE,39.0069,-77.106,2D,"(39.0069, -77.106)"
201390770,2610,220038263,09/03/2022 06:39:39 PM,2022-08-30 12:00:00,,26F,1,Crime Against Property,Identity Theft,IDENTITY THEFT,BETHESDA,4600 BLK  WOODFIELD RD,BETHESDA,MD,20814.0,MCPD,Bank - ATM,D,2D3,183,4600.0,,WOODFIELD,,RD,39.01933,-77.0922,2D,"(39.0193, -77.0922)"
201387162,2605,220033848,08/06/2022 10:17:33 PM,2022-08-06 13:30:00,08/06/2022 03:30:00 PM,26B,1,Crime Against Property,Credit Card/Automatic Teller Machine Fraud,FRAUD - ILLEGAL USE CREDIT CARDS,BETHESDA,10800 BLK  MAC ARTHUR BLV,POTOMAC,MD,20854.0,MCPD,Parking Lot - Other,E,2E4,214,10800.0,,MAC ARTHUR,,BLV,38.98187,-77.2259,2D,"(38.9819, -77.2259)"
201239861,2399,190023337,05/17/2019 02:10:07 PM,2019-05-17 13:00:00,05/17/2019 01:30:00 PM,23H,1,Crime Against Property,All other Larceny,LARCENY (DESCRIBE OFFENSE),SILVER SPRING,900 BLK  WAYNE AVE,SILVER SPRING,MD,20910.0,MCPD,Other/Unknown,G,3G1,109,900.0,,WAYNE,,AVE,38.9954,-77.0244,3D,"(38.9954, -77.0244)"
201346847,1399,210038150,09/26/2021 11:25:50 PM,2021-09-26 23:25:00,,13B,1,Crime Against Person,Simple Assault,ASSAULT - 2ND DEGREE,SILVER SPRING,8200 BLK  GEORGIA AVE,SILVER SPRING,MD,20910.0,MCPD,Street - Commercial,G,3G1,093,8200.0,,GEORGIA,,AVE,38.99163,-77.0266,3D,"(38.9916, -77.0266)"
201275627,5707,200004652,01/28/2020 03:40:32 PM,2020-01-28 15:00:00,,90J,1,Crime Against Society,Trespass of Real Property,TRESPASSING,GERMANTOWN,20900 BLK  FREDERICK RD,GERMANTOWN,MD,20876.0,MCPD,Retail - Department/Discount Store,M,5M1,701,20900.0,,FREDERICK,,RD,39.19829,-77.2448,5D,"(39.1983, -77.2448)"
201239800,2610,190022934,05/15/2019 02:38:09 PM,2019-05-15 14:38:00,,26F,1,Crime Against Property,Identity Theft,FRAUD - IDENTITY THEFT,ROCKVILLE,7900 BLK  TUCKERMAN LA,POTOMAC,MD,20854.0,MCPD,Bank - ATM,B,1B1,203,7900.0,,TUCKERMAN,,LA,39.03995,-77.1572,1D,"(39.0399, -77.1572)"
201250298,3550,190036226,07/29/2019 10:28:04 PM,2019-07-29 22:28:00,,35B,1,Crime Against Society,Drug Equipment Violations,DRUGS - NARCOTIC EQUIP - POSSESS,GERMANTOWN,12800 BLK  CLOPPER RD,GERMANTOWN,MD,20874.0,MCPD,Street - Bus Stop,N,5N2,594,12800.0,,CLOPPER,,RD,39.15612,-77.2645,5D,"(39.1561, -77.2645)"
201448065,2305,230060010,10/12/2023 08:13:00 AM,2023-10-11 19:00:00,10/12/2023 07:30:00 PM,23F,1,Crime Against Property,Theft From Motor Vehicle,LARCENY - FROM AUTO,BETHESDA,6900 BLK  CLARENDON RD,BETHESDA,,20814.0,MCPD,Parking Lot - Residential,D,2D2,031,6900.0,,CLARENDON,,RD,38.9793,-77.1012,2D,"(38.9793, -77.1012)"
201408765,1399,230002123,01/13/2023 03:56:52 PM,2022-12-06 14:50:00,12/06/2022 03:10:00 PM,13B,1,Crime Against Person,Simple Assault,ASSAULT - 2ND DEGREE,GERMANTOWN,19800 BLK  OBSERVATION DR,GERMANTOWN,MD,20876.0,MCPD,Parking Garage - Commercial,M,5M1,468,19800.0,,OBSERVATION,,DR,39.18056,-77.2438,5D,"(39.1806, -77.2438)"
201375706,2304,220019239,05/06/2022 08:14:26 AM,2022-05-05 16:00:00,05/06/2022 06:00:00 AM,23G,1,Crime Against Property,Theft of Motor Vehicle Parts or Accessories,LARCENY - AUTO PARTS,MONTGOMERY VILLAGE,7600 BLK  RICKENBACKER DR,GAITHERSBURG,MD,20879.0,MCPD,Parking Lot - Commercial,R,6R3,421,7600.0,,RICKENBACKER,,DR,39.17344,-77.1569,6D,"(39.1734, -77.1569)"
201353995,1399,210047250,11/21/2021 02:20:32 AM,2021-11-21 02:10:00,11/21/2021 02:17:00 AM,13B,1,Crime Against Person,Simple Assault,ASSAULT - 2ND DEGREE,WHEATON,11500 BLK  BUCKNELL DR,SILVER SPRING,MD,20902.0,MCPD,Residence - Apartment/Condo,L,4L1,359,11500.0,,BUCKNELL,,DR,39.04308,-77.046,4D,"(39.0431, -77.046)"
201307903,2305,200043188,11/02/2020 08:27:11 AM,2020-11-02 03:00:00,,23F,1,Crime Against Property,Theft From Motor Vehicle,LARCENY - FROM AUTO,WHEATON,5100 BLK  LUPINE CT,ROCKVILLE,MD,20853.0,MCPD,Residence - Driveway,K,4K2,394,5100.0,,LUPINE,,CT,39.10512,-77.1017,4D,"(39.1051, -77.1017)"
201405610,2303,220056381,12/20/2022 10:09:41 AM,2022-12-19 17:00:00,12/20/2022 04:30:00 AM,23C,1,Crime Against Property,Shoplifting,LARCENY - SHOPLIFTING,WHEATON,15000 BLK  SHAMROCK RIDGE RD,SILVER SPRING,MD,20906.0,MCPD,Retail - Department/Discount Store,K,4K1,531,15000.0,,SHAMROCK RIDGE,,RD,39.10202,-77.0506,4D,"(39.102, -77.0506)"
201322919,2202,210009210,03/11/2021 05:47:20 PM,2021-03-09 17:47:00,,220,1,Crime Against Property,Burglary/Breaking and Entering,BURGLARY - FORCED ENTRY-RESIDENTIAL,GERMANTOWN,19500 BLK  GUNNERS BRANCH RD,GERMANTOWN,MD,20876.0,MCPD,Residence - Apartment/Condo,M,5M1,469,19500.0,,GUNNERS BRANCH,,RD,39.17525,-77.2409,5D,"(39.1752, -77.2409)"
201236938,2601,190019548,04/26/2019 11:12:00 AM,2019-04-18 20:28:00,,26A,1,Crime Against Property,False Pretenses/Swindle/Confidence Game,FRAUD - CONFIDENCE GAME,BETHESDA,7700 BLK  WOODMONT AVE,BETHESDA,MD,20814.0,MCPD,Government Building,D,2D2,048,7700.0,,WOODMONT,,AVE,38.98623,-77.0967,2D,"(38.9862, -77.0967)"
201320699,5707,210006791,02/22/2021 01:12:32 PM,2021-02-19 11:20:00,,90J,1,Crime Against Society,Trespass of Real Property,TRESPASSING,GERMANTOWN,20600 BLK  SENECA MEADOWS PKW,GERMANTOWN,MD,20876.0,MCPD,Grocery/Supermarket,M,5M1,701,20600.0,,SENECA MEADOWS,,PKW,39.1985,-77.2561,5D,"(39.1985, -77.2561)"
201247536,2305,190032879,07/11/2019 08:11:37 AM,2019-07-10 22:15:00,07/11/2019 07:30:00 AM,23F,1,Crime Against Property,Theft From Motor Vehicle,LARCENY - FROM AUTO,WHEATON,14200 BLK  GRAND PRE RD,SILVER SPRING,MD,20906.0,MCPD,Street - Residential,K,4K1,534,14200.0,,GRAND PRE,,RD,39.08863,-77.0751,4D,"(39.0886, -77.0751)"
201391240,2308,220038801,09/07/2022 10:26:57 AM,2022-09-05 00:00:00,09/05/2022 10:00:00 PM,23D,1,Crime Against Property,Theft from Building,LARCENY - FROM BLDG,SILVER SPRING,9200 BLK  PINEY BRANCH RD,SILVER SPRING,MD,20903.0,MCPD,Residence - Apartment/Condo,H,3H1,133,9200.0,,PINEY BRANCH,,RD,39.00121,-76.9876,3D,"(39.0012, -76.9876)"
201437287,1399,230046945,07/30/2023 10:51:05 AM,2023-07-30 10:51:00,,13B,2,Crime Against Person,Simple Assault,ASSAULT - 2ND DEGREE,SILVER SPRING,,BURTONSVILLE,MD,20866.0,MCPD,Street - Other,I,3I2,381,,,ISLESWOOD,,TER,39.09665,-76.9215,3D,"(39.0966, -76.9215)"
201387809,2305,220034630,08/11/2022 11:58:57 PM,2022-08-11 23:58:00,,23F,1,Crime Against Property,Theft From Motor Vehicle,LARCENY - FROM AUTO,GERMANTOWN,,GERMANTOWN,MD,20876.0,MCPD,Street - In vehicle,M,5M1,470,,,CEDARBLUFF,,DR,39.1842,-77.2304,5D,"(39.1842, -77.2304)"
201378682,2902,220023538,06/01/2022 11:03:24 PM,2022-06-01 20:00:00,06/01/2022 11:00:00 PM,290,1,Crime Against Property,Destruction/Damage/Vandalism of Property,DAMAGE PROPERTY - PRIVATE,BETHESDA,1  BLK  FAIRFAX CT,CHEVY CHASE,MD,20815.0,MCPD,Residence - Apartment/Condo,D,2D2,016,1.0,,FAIRFAX,,CT,38.97589,-77.1029,2D,"(38.9759, -77.1029)"
201429440,2305,230026713,06/03/2023 07:45:21 PM,2023-06-03 12:00:00,06/03/2023 04:00:00 PM,23F,1,Crime Against Property,Theft From Motor Vehicle,LARCENY - FROM AUTO,SILVER SPRING,2300 BLK  BROADBIRCH DR,SILVER SPRING,MD,20904.0,MCPD,Parking Lot - Other,I,3I1,146,2300.0,,BROADBIRCH,,DR,39.05561,-76.9617,3D,"(39.0556, -76.9617)"
201370317,2203,220013495,03/30/2022 04:27:36 AM,2022-03-30 01:25:00,,220,1,Crime Against Property,Burglary/Breaking and Entering,BURGLARY - FORCED ENTRY-NONRESIDENTIAL,SILVER SPRING,138800 BLK  OUTLET DR,SILVER SPRING,MD,20904.0,MCPD,Restaurant,I,3I2,380,138800.0,,OUTLET,,DR,0.0,0.0,3D,"(0.0, 0.0)"
201395315,2601,220043768,10/07/2022 12:36:55 AM,2022-10-06 20:05:00,10/07/2022 12:35:00 AM,26A,1,Crime Against Property,False Pretenses/Swindle/Confidence Game,FRAUD - CONFIDENCE GAME,GERMANTOWN,19500 BLK  WATERS RD,GERMANTOWN,MD,20874.0,MCPD,Residence - Apartment/Condo,N,5N1,702,19500.0,,WATERS,,RD,39.17596,-77.273,5D,"(39.176, -77.273)"
201353030,2902,210046076,11/13/2021 04:53:49 PM,2021-10-01 00:00:00,11/13/2021 05:00:00 PM,290,1,Crime Against Property,Destruction/Damage/Vandalism of Property,DAMAGE PROPERTY - PRIVATE,MONTGOMERY VILLAGE,17700 BLK  TOWNE CREST DR,GAITHERSBURG,MD,20877.0,MCPD,Residence - Apartment/Condo,P,6P3,767,17700.0,,TOWNE CREST,,DR,39.14646,-77.1737,6D,"(39.1465, -77.1737)"
201302916,2305,200037148,09/22/2020 08:46:40 AM,2020-09-21 02:00:00,09/21/2020 08:15:00 AM,23F,1,Crime Against Property,Theft From Motor Vehicle,LARCENY - FROM AUTO,MONTGOMERY VILLAGE,18400 BLK  HONEYLOCUST CIR,GAITHERSBURG,MD,20879.0,MCPD,Parking Lot - Residential,R,6R3,420,18400.0,,HONEYLOCUST,,CIR,39.15794,-77.1702,6D,"(39.1579, -77.1702)"
201350474,2305,210042754,10/24/2021 09:19:10 AM,2021-10-24 03:30:00,10/24/2021 09:00:00 AM,23F,1,Crime Against Property,Theft From Motor Vehicle,LARCENY - FROM AUTO,SILVER SPRING,8100 BLK  FENTON ST,SILVER SPRING,MD,20910.0,MCPD,Parking Garage - County,G,3G1,093,8100.0,,FENTON,,ST,38.99021,-77.0239,3D,"(38.9902, -77.0239)"
201365876,2304,220008219,02/25/2022 10:03:44 AM,2022-02-23 20:30:00,02/24/2022 08:15:00 AM,23G,1,Crime Against Property,Theft of Motor Vehicle Parts or Accessories,LARCENY - AUTO PARTS,BETHESDA,10100 BLK  THORNWOOD RD,KENSINGTON,MD,20895.0,MCPD,Street - Residential,D,2D3,182,10100.0,,THORNWOOD,,RD,39.02083,-77.0866,2D,"(39.0208, -77.0866)"
201334864,3562,210023114,06/17/2021 01:17:29 AM,2021-06-17 02:45:00,,35A,1,Crime Against Society,Drug/Narcotic Violations,DRUGS - MARIJUANA - POSSESS,SILVER SPRING,,SILVER SPRING,MD,20910.0,MCPD,Street - In vehicle,G,3G1,671,,,ELLSWORTH,,DR,39.00132,-77.0233,3D,"(39.0013, -77.0233)"
201295852,1313,200028647,07/23/2020 05:53:34 PM,2020-07-23 17:53:00,,13B,2,Crime Against Person,Simple Assault,ASSAULT - SIMPLE,GERMANTOWN,20000 BLK  DUNSTABLE CIR,GERMANTOWN,MD,20876.0,MCPD,Park,M,5M1,470,20000.0,,DUNSTABLE,,CIR,39.18311,-77.23,5D,"(39.1831, -77.23)"
201430815,2901,230028397,06/13/2023 09:50:09 AM,2023-06-11 09:50:00,06/13/2023 09:42:00 AM,290,1,Crime Against Property,Destruction/Damage/Vandalism of Property,DAMAGE PROPERTY - BUSINESS,TAKOMA PARK,7000 BLK  CARROLL AVE,TAKOMA PARK,MD,20912.0,TPPD,Commercial - Office Building,T,8T1,801,7000.0,,CARROLL,,AVE,38.97464,-77.0121,TPPD,"(38.9746, -77.0121)"
201283047,2305,200013688,03/23/2020 06:06:41 AM,2020-03-22 16:00:00,03/23/2020 04:30:00 AM,23F,1,Crime Against Property,Theft From Motor Vehicle,LARCENY - FROM AUTO,WHEATON,12800 BLK  HOLDRIDGE RD,SILVER SPRING,MD,20906.0,MCPD,Residence - Driveway,K,4K2,336,12800.0,,HOLDRIDGE,,RD,39.06582,-77.0622,4D,"(39.0658, -77.0622)"
201315427,2308,210000668,01/06/2021 10:21:53 AM,2020-12-29 10:00:00,12/30/2020 06:00:00 AM,23D,1,Crime Against Property,Theft from Building,LARCENY - FROM BLDG,SILVER SPRING,11800 BLK  HEALING WAY,SILVER SPRING,MD,20904.0,MCPD,Hospital/Emergency Care Center,I,3I1,146,11800.0,,HEALING,,WAY,39.04821,-76.9556,3D,"(39.0482, -76.9556)"
201225881,3562,190005989,02/06/2019 10:13:26 PM,2019-02-06 22:15:00,,35A,1,Crime Against Society,Drug/Narcotic Violations,DRUGS - MARIJUANA - POSSESS,GERMANTOWN,,GERMANTOWN,MD,20874.0,MCPD,Street - In vehicle,N,5N2,688,,,GERMANTOWN,,RD,39.1921,-77.233,5D,"(39.1921, -77.233)"
201263195,4199,190051411,10/25/2019 10:27:45 PM,2019-10-25 22:27:00,,90G,1,Crime Against Society,Liquor Law Violations,LIQUOR (DESCRIBE OFFENSE),SILVER SPRING,800 BLK  WAYNE AVE,SILVER SPRING,MD,20910.0,MCPD,Street - In vehicle,G,3G1,671,800.0,,WAYNE,,AVE,38.99717,-77.0218,3D,"(38.9972, -77.0218)"
201355295,1199,210048873,,2021-10-12 00:01:00,10/12/2021 11:59:00 PM,11D,1,Crime Against Person,Forcible Fondling,SEX ASSAULT - FONDLING,WHEATON,1100 BLK  UNIVERSITY BLV W,SILVER SPRING,MD,20902.0,MCPD,Residence - Apartment/Condo,L,4L1,360,1100.0,,UNIVERSITY,W,BLV,39.03585,-77.0268,4D,"(39.0359, -77.0268)"
201262255,1314,190051027,10/24/2019 12:46:25 AM,2019-10-24 00:44:00,,13A,1,Crime Against Person,Aggravated Assault,ASSAULT - AGGRAVATED - GUN,MONTGOMERY VILLAGE,,GAITHERSBURG,MD,20877.0,MCPD,Street - In vehicle,P,6P3,775,,,SHADY GROVE,,RD,39.14114,-77.1518,6D,"(39.1411, -77.1518)"
201343251,2305,210033575,08/28/2021 09:56:48 AM,2021-08-28 04:08:00,,23F,1,Crime Against Property,Theft From Motor Vehicle,LARCENY - FROM AUTO,GERMANTOWN,24000 BLK  NEWBURY RD,GAITHERSBURG,MD,20882.0,MCPD,Residence - Driveway,M,5M2,619,24000.0,,NEWBURY,,RD,39.25007,-77.2029,5D,"(39.2501, -77.2029)"
201369053,5404,220011953,03/20/2022 03:03:20 AM,2022-03-20 17:46:00,,90D,1,Crime Against Society,Driving Under the Influence,DRIVING UNDER THE INFLUENCE LIQUOR,GERMANTOWN,5300 BLK  DAMASCUS RD,GAITHERSBURG,MD,20882.0,MCPD,Street - In vehicle,M,5M2,409,5300.0,,DAMASCUS,,RD,39.239,-77.1062,5D,"(39.239, -77.1062)"
201367662,2602,220010304,03/10/2022 11:15:16 AM,2022-02-24 11:15:00,,26A,1,Crime Against Property,False Pretenses/Swindle/Confidence Game,FRAUD - SWINDLE,GERMANTOWN,1  BLK  CLEARWATER CT,DAMASCUS,MD,20872.0,MCPD,Residence - Other,M,5M2,481,1.0,,CLEARWATER,,CT,39.27423,-77.206,5D,"(39.2742, -77.206)"
201385561,1399,220031932,07/25/2022 12:19:37 AM,2022-07-25 00:19:00,,13B,3,Crime Against Person,Simple Assault,ASSAULT - 2ND DEGREE,MONTGOMERY VILLAGE,9800 BLK  WASHINGTONIAN BLV,GAITHERSBURG,MD,20878.0,GPD,Parking Lot - Commercial,P,6P1,549,9800.0,,WASHINGTONIAN,,BLV,39.11415,-77.197,6D,"(39.1142, -77.197)"
201372624,2305,220016251,04/17/2022 07:10:20 AM,2022-04-16 22:00:00,04/17/2022 06:00:00 AM,23F,1,Crime Against Property,Theft From Motor Vehicle,LARCENY - FROM AUTO,ROCKVILLE,500 BLK W MONTGOMERY AVE,ROCKVILLE,MD,20850.0,MCPD,Street - Residential,A,1A3,249,500.0,W,MONTGOMERY,,AVE,39.08484,-77.1624,1D,"(39.0848, -77.1624)"
201316524,3562,210001913,01/15/2021 09:57:31 PM,2021-01-15 21:57:00,01/15/2021 10:30:00 PM,35A,1,Crime Against Society,Drug/Narcotic Violations,DRUGS - MARIJUANA - POSSESS,ROCKVILLE,,ROCKVILLE,MD,20852.0,RCPD,Street - In vehicle,A,1A2,274,,,ROCKVILLE,,PIK,39.07219,-77.1332,1D,"(39.0722, -77.1332)"
201442203,2999,230052765,09/02/2023 09:30:01 AM,2023-09-02 09:30:00,,290,1,Crime Against Property,Destruction/Damage/Vandalism of Property,DAMAGE PROPERTY (DESCRIBE OFFENSE),MONTGOMERY VILLAGE,7300 BLK  HADLEY FARMS DR,GAITHERSBURG,MD,20879.0,MCPD,School - Elementary/Secondary,R,6R3,421,7300.0,,HADLEY FARMS,,DR,39.17993,-77.1505,6D,"(39.1799, -77.1505)"
201354290,2399,210047569,11/23/2021 09:29:11 AM,2021-11-23 00:59:00,,23H,1,Crime Against Property,All other Larceny,LARCENY (DESCRIBE OFFENSE),SILVER SPRING,9900 BLK  EDGEHILL LA,SILVER SPRING,MD,20901.0,MCPD,Residence - Yard,H,3H2,153,9900.0,,EDGEHILL,,LA,39.01735,-77.0043,3D,"(39.0174, -77.0043)"
201298743,2305,200030848,08/08/2020 06:01:23 PM,2020-08-07 17:00:00,08/08/2020 05:30:00 AM,23F,1,Crime Against Property,Theft From Motor Vehicle,LARCENY - FROM AUTO,SILVER SPRING,7900 BLK  EASTERN AVE,SILVER SPRING,MD,20910.0,MCPD,Street - Residential,G,3G1,090,7900.0,,EASTERN,,AVE,38.98597,-77.0284,3D,"(38.986, -77.0284)"
201443213,2305,230054036,09/09/2023 09:40:56 PM,2023-09-09 21:40:00,,23F,1,Crime Against Property,Theft From Motor Vehicle,LARCENY - FROM AUTO,,,BETHESDA,MD,20817.0,MCPD,Parking Lot - Commercial,w,own,Unknown,,,,,,0.0,0.0,Unknown,"(0.0, 0.0)"
201241458,4199,190025368,05/28/2019 03:55:39 PM,2019-05-28 15:55:00,,90G,1,Crime Against Society,Liquor Law Violations,LIQUOR (DESCRIBE OFFENSE),TAKOMA PARK,8600 BLK  FLOWER AVE,TAKOMA PARK,MD,20912.0,MCPD,Retail - Other,T,8T2,803,8600.0,,FLOWER,,AVE,38.99645,-77.0031,TPPD,"(38.9965, -77.0031)"
201366268,2308,220008689,02/28/2022 04:22:42 PM,2022-02-25 12:06:00,02/25/2022 04:30:00 PM,23D,1,Crime Against Property,Theft from Building,LARCENY - FROM BLDG,GERMANTOWN,12800 BLK  MIDDLEBROOK RD,GERMANTOWN,MD,20874.0,MCPD,Doctor/Dentist/Vet Office,N,5N1,447,12800.0,,MIDDLEBROOK,,RD,39.17787,-77.2658,5D,"(39.1779, -77.2658)"
201387128,2610,220033651,08/05/2022 01:57:22 PM,2022-06-15 13:00:00,,26F,1,Crime Against Property,Identity Theft,IDENTITY THEFT,WHEATON,3100 BLK  BENTON SQUARE DR,OLNEY,MD,20832.0,MCPD,Other/Unknown,J,4J2,642,3100.0,,BENTON SQUARE,,DR,39.13967,-77.0628,4D,"(39.1397, -77.0628)"
201346379,2610,210036876,09/18/2021 07:21:18 PM,2021-09-07 11:00:00,,26F,1,Crime Against Property,Identity Theft,FRAUD - IDENTITY THEFT,BETHESDA,4900 BLK  FLANDERS AVE,KENSINGTON,MD,20895.0,MCPD,Other/Unknown,D,2D4,694,4900.0,,FLANDERS,,AVE,39.0378,-77.0976,2D,"(39.0378, -77.0976)"
201416732,3550,230011502,03/08/2023 11:52:25 PM,2023-03-08 23:53:00,,35B,1,Crime Against Society,Drug Equipment Violations,DRUGS - NARCOTIC EQUIP - POSSESS,GERMANTOWN,,GERMANTOWN,MD,20874.0,MCPD,Street - In vehicle,N,5N1,447,,,GREAT SENECA,,HWY,39.12814,-77.2372,5D,"(39.1281, -77.2372)"
201447938,2305,230059844,10/11/2023 11:52:34 AM,2023-10-11 11:00:00,10/11/2023 11:15:00 AM,23F,1,Crime Against Property,Theft From Motor Vehicle,LARCENY - FROM AUTO,ROCKVILLE,700 BLK  FALLSGROVE DR,ROCKVILLE,MD,20850.0,RCPD,Parking Lot - Rec Center,B,1B1,241,700.0,,FALLSGROVE,,DR,39.09881,-77.1896,1D,"(39.0988, -77.1896)"
201345781,1199,210036816,09/18/2021 11:26:22 AM,2021-09-16 07:25:00,09/16/2021 07:35:00 AM,11D,1,Crime Against Person,Forcible Fondling,SEX ASSAULT - FONDLING,MONTGOMERY VILLAGE,17000 BLK  DOWNING ST,GAITHERSBURG,MD,20877.0,MCPD,Residence - Apartment/Condo,P,6P1,429,17000.0,,DOWNING,,ST,39.13477,-77.2085,6D,"(39.1348, -77.2085)"
201406839,2404,220057886,12/30/2022 03:27:45 PM,2022-12-28 21:30:00,12/30/2022 12:00:00 PM,240,1,Crime Against Property,Motor Vehicle Theft,AUTO THEFT - VEHICLE THEFT,SILVER SPRING,11200 BLK  COLUMBIA PIK,SILVER SPRING,MD,20901.0,MCPD,Street - Residential,H,3H2,144,11200.0,,COLUMBIA,,PIK,39.03935,-76.9977,3D,"(39.0393, -76.9977)"
201263471,2901,190052824,,2019-11-02 03:29:00,,290,1,Crime Against Property,Destruction/Damage/Vandalism of Property,DAMAGE PROPERTY - BUSINESS,MONTGOMERY VILLAGE,200 BLK  MUDDY BRANCH RD,GAITHERSBURG,MD,20878.0,GPD,Bar/Night Club,P,6P1,550,200.0,,MUDDY BRANCH,,RD,39.12996,-77.2073,6D,"(39.13, -77.2073)"
201352518,2305,210045341,11/09/2021 10:01:25 AM,2021-11-08 17:30:00,11/09/2021 08:00:00 AM,23F,1,Crime Against Property,Theft From Motor Vehicle,LARCENY - FROM AUTO,MONTGOMERY VILLAGE,400 BLK  EXCHANGE AVE,GAITHERSBURG,MD,20878.0,MCPD,Street - Residential,P,6P2,593,400.0,,EXCHANGE,,AVE,39.15114,-77.2254,6D,"(39.1511, -77.2254)"
201321187,2699,210007371,02/26/2021 11:34:58 AM,2021-02-22 13:28:00,,26A,1,Crime Against Property,False Pretenses/Swindle/Confidence Game,FRAUD (DESCRIBE OFFENSE),MONTGOMERY VILLAGE,1  BLK  HAWK RUN CT,MONTGOMERY VILLAGE,MD,20886.0,MCPD,Other/Unknown,R,6R2,714,1.0,,HAWK RUN,,CT,39.18717,-77.1792,6D,"(39.1872, -77.1792)"
201432913,2303,230030926,06/28/2023 04:06:58 PM,2023-06-28 16:06:00,,23C,1,Crime Against Property,Shoplifting,LARCENY - SHOPLIFTING,BETHESDA,900 BLK  ROSE AVE,ROCKVILLE,MD,20852.0,MCPD,Retail - Department/Discount Store,D,2D4,188,900.0,,ROSE,,AVE,39.05109,-77.1162,2D,"(39.0511, -77.1162)"
201324133,2610,210010500,03/20/2021 01:56:10 PM,2021-02-21 00:00:00,,26F,1,Crime Against Property,Identity Theft,FRAUD - IDENTITY THEFT,ROCKVILLE,7500 BLK  HEATHERTON LA,POTOMAC,MD,20854.0,MCPD,Other/Unknown,B,1B1,203,7500.0,,HEATHERTON,,LA,39.0429,-77.1545,1D,"(39.0429, -77.1545)"
201363404,2902,220005395,02/08/2022 12:13:35 AM,2022-02-07 20:00:00,02/07/2022 11:45:00 PM,290,1,Crime Against Property,Destruction/Damage/Vandalism of Property,DAMAGE PROPERTY - PRIVATE,GERMANTOWN,1  BLK  PICKERING CT,GERMANTOWN,MD,20874.0,MCPD,Parking Lot - Residential,N,5N1,702,1.0,,PICKERING,,CT,39.18853,-77.2717,5D,"(39.1885, -77.2717)"
201296897,2605,200029985,08/02/2020 03:33:14 PM,2020-08-02 13:30:00,,26B,1,Crime Against Property,Credit Card/Automatic Teller Machine Fraud,FRAUD - ILLEGAL USE CREDIT CARDS,BETHESDA,10400 BLK  OLD GEORGETOWN RD,BETHESDA,MD,20817.0,MCPD,Other/Unknown,E,2E3,197,10400.0,,OLD GEORGETOWN,,RD,39.02487,-77.1253,2D,"(39.0249, -77.1253)"
201406771,1399,220057778,12/29/2022 09:11:35 PM,2022-12-29 21:11:00,,13B,1,Crime Against Person,Simple Assault,ASSAULT - 2ND DEGREE,SILVER SPRING,8500 BLK  FENTON ST,SILVER SPRING,MD,20910.0,MCPD,Community Center,G,3G1,671,8500.0,,FENTON,,ST,38.9954,-77.0244,3D,"(38.9954, -77.0244)"
201262348,2305,190051297,10/25/2019 11:35:36 AM,2019-10-24 20:15:00,10/25/2019 11:00:00 AM,23F,1,Crime Against Property,Theft From Motor Vehicle,LARCENY - FROM AUTO,MONTGOMERY VILLAGE,19500 BLK  BRASSIE PL,MONTGOMERY VILLAGE,MD,20886.0,MCPD,Parking Lot - Residential,R,6R2,544,19500.0,,BRASSIE,,PL,39.17571,-77.2,6D,"(39.1757, -77.2)"
201328200,2902,210015027,04/22/2021 05:26:02 PM,2021-04-22 08:00:00,04/22/2021 04:00:00 PM,290,1,Crime Against Property,Destruction/Damage/Vandalism of Property,DAMAGE PROPERTY - PRIVATE,WHEATON,18200 BLK  MEHRENS TER,OLNEY,MD,20832.0,MCPD,Residence - Driveway,J,4J2,399,18200.0,,MEHRENS,,TER,39.15633,-77.0786,4D,"(39.1563, -77.0786)"
201250364,3562,190036403,07/30/2019 10:17:22 PM,2019-07-30 21:50:00,07/30/2019 10:50:00 PM,35A,1,Crime Against Society,Drug/Narcotic Violations,DRUGS - MARIJUANA - POSSESS,GERMANTOWN,,GERMANTOWN,MD,20874.0,MCPD,Street - In vehicle,N,5N2,594,,,GREAT SENECA,,HWY,39.12814,-77.2372,5D,"(39.1281, -77.2372)"
201261982,2305,190050874,10/23/2019 07:59:26 AM,2019-10-22 17:00:00,10/23/2019 07:25:00 AM,23F,1,Crime Against Property,Theft From Motor Vehicle,LARCENY - FROM AUTO,WHEATON,13300 BLK  RIPPLING BROOK DR,SILVER SPRING,MD,20906.0,MCPD,Residence - Driveway,K,4K1,350,13300.0,,RIPPLING BROOK,,DR,39.0741,-77.0614,4D,"(39.0741, -77.0614)"
201283754,2308,200014638,03/31/2020 02:46:08 PM,2020-03-31 14:30:00,,23D,1,Crime Against Property,Theft from Building,LARCENY - FROM BLDG,WHEATON,1100 BLK  UNIVERSITY BLV W,SILVER SPRING,MD,20902.0,MCPD,Residence - Apartment/Condo,L,4L1,360,1100.0,,UNIVERSITY,W,BLV,39.03585,-77.0268,4D,"(39.0359, -77.0268)"
201435497,2901,230034082,07/17/2023 08:45:23 PM,2023-07-17 17:30:00,07/17/2023 07:00:00 PM,290,1,Crime Against Property,Destruction/Damage/Vandalism of Property,DAMAGE PROPERTY - BUSINESS,MONTGOMERY VILLAGE,18200 BLK  FLOWER HILL WAY,GAITHERSBURG,MD,20879.0,MCPD,Parking Lot - Commercial,R,6R3,420,18200.0,,FLOWER HILL,,WAY,39.15466,-77.1637,6D,"(39.1547, -77.1637)"
201245993,2305,190031037,06/29/2019 03:05:31 PM,2019-06-18 13:00:00,06/29/2019 12:00:00 PM,23F,1,Crime Against Property,Theft From Motor Vehicle,LARCENY - FROM AUTO,SILVER SPRING,900 BLK  HERON DR,SILVER SPRING,MD,20901.0,MCPD,Street - Residential,H,3H1,133,900.0,,HERON,,DR,39.00142,-76.9918,3D,"(39.0014, -76.9918)"
201450073,1199,230062471,10/25/2023 10:44:31 AM,2023-10-24 00:00:00,,11D,1,Crime Against Person,Forcible Fondling,SEX ASSAULT - FONDLING,SILVER SPRING,900 BLK  JACKSON RD,SILVER SPRING,MD,20904.0,MCPD,Residence - Apartment/Condo,I,3I1,519,900.0,,JACKSON,,RD,39.0559,-76.9925,3D,"(39.0559, -76.9925)"
201221357,3562,190000123,01/01/2019 08:17:51 PM,2019-01-01 20:10:00,01/01/2019 08:45:00 PM,35A,1,Crime Against Society,Drug/Narcotic Violations,DRUGS - MARIJUANA - POSSESS,SILVER SPRING,,SILVER SPRING,MD,20910.0,MCPD,Street - Commercial,G,3G1,094,,,GEORGIA,,AVE,39.11237,-77.0755,3D,"(39.1124, -77.0755)"
201447914,2399,230059675,10/10/2023 02:53:36 PM,2023-10-10 12:30:00,10/10/2023 02:00:00 PM,23H,1,Crime Against Property,All other Larceny,LARCENY (DESCRIBE OFFENSE),ROCKVILLE,200 BLK  RICHARD MONTGOMERY DR,ROCKVILLE,MD,20852.0,RCPD,School - Elementary/Secondary,A,1A3,262,200.0,,RICHARD MONTGOMERY,,DR,39.07938,-77.1446,1D,"(39.0794, -77.1446)"
201382453,2303,220028109,06/30/2022 10:48:08 AM,2022-06-30 10:48:00,,23C,1,Crime Against Property,Shoplifting,LARCENY - SHOPLIFTING,WHEATON,3800 BLK  INTERNATIONAL DR,SILVER SPRING,MD,20906.0,MCPD,Grocery/Supermarket,K,4K1,346,3800.0,,INTERNATIONAL,,DR,39.10371,-77.0758,4D,"(39.1037, -77.0758)"
201321220,3615,210007413,02/26/2021 06:35:17 PM,2021-02-26 18:35:00,,90C,1,Crime Against Society,Disorderly Conduct,INDECENT EXPOSURE TO ADULT,SILVER SPRING,7500 BLK  BLAIR RD,TAKOMA PARK,MD,20912.0,MCPD,Residence - Apartment/Condo,G,3G1,091,7500.0,,BLAIR,,RD,38.98125,-77.0223,3D,"(38.9813, -77.0223)"
201348204,2501,210039860,10/06/2021 03:58:44 PM,2021-09-11 00:00:00,09/15/2021 12:00:00 AM,250,1,Crime Against Property,Counterfeiting/Forgery,FORGERY OF CHECKS,BETHESDA,,CHEVY CHASE,MD,20815.0,MCPD,Other/Unknown,D,2D1,037,,,BROOKVILLE,,RD,39.00386,-77.0517,2D,"(39.0039, -77.0517)"
201252076,2501,190038469,08/12/2019 03:31:43 PM,2019-08-12 15:31:00,,250,1,Crime Against Property,Counterfeiting/Forgery,FORGERY OF CHECKS,GERMANTOWN,20000 BLK  AIRCRAFT DR,GERMANTOWN,MD,20874.0,MCPD,Bank/S&L/Credit Union,N,5N1,702,20000.0,,AIRCRAFT,,DR,39.18396,-77.2617,5D,"(39.184, -77.2617)"
201396677,2605,220045510,10/17/2022 12:17:36 PM,2022-10-13 00:00:00,,26B,1,Crime Against Property,Credit Card/Automatic Teller Machine Fraud,FRAUD - ILLEGAL USE CREDIT CARDS,BETHESDA,1900 BLK  ROSEMARY HILLS DR,SILVER SPRING,MD,20910.0,MCPD,Other/Unknown,D,2D1,086,1900.0,,ROSEMARY HILLS,,DR,38.9977,-77.0419,2D,"(38.9977, -77.0419)"
201307596,2699,200042545,10/28/2020 01:54:38 PM,2020-10-27 00:00:00,,26A,1,Crime Against Property,False Pretenses/Swindle/Confidence Game,FRAUD (DESCRIBE OFFENSE),WHEATON,13900 BLK  FLINT ROCK RD,ROCKVILLE,MD,20853.0,MCPD,Other/Unknown,K,4K2,340,13900.0,,FLINT ROCK,,RD,39.08513,-77.1015,4D,"(39.0851, -77.1015)"
201304695,2303,200039182,10/05/2020 02:51:14 PM,2020-10-03 21:54:00,10/03/2020 09:57:00 PM,23C,1,Crime Against Property,Shoplifting,LARCENY - SHOPLIFTING,ROCKVILLE,5700 BLK  BOU AVE,ROCKVILLE,MD,20852.0,MCPD,Retail - Department/Discount Store,A,1A2,735,5700.0,,BOU,,AVE,39.05597,-77.1136,1D,"(39.056, -77.1136)"
201392465,2501,220039976,09/14/2022 12:44:23 PM,2022-08-11 12:44:00,09/15/2022 02:20:00 PM,250,1,Crime Against Property,Counterfeiting/Forgery,FORGERY OF CHECKS,BETHESDA,5400 BLK  EDSON LA,ROCKVILLE,MD,20852.0,MCPD,Commercial - Office Building,D,2D4,189,5400.0,,EDSON,,LA,39.04038,-77.1096,2D,"(39.0404, -77.1096)"
201223912,2305,190003477,01/23/2019 08:16:17 AM,2019-01-22 07:30:00,01/23/2019 07:45:00 AM,23F,1,Crime Against Property,Theft From Motor Vehicle,LARCENY - FROM AUTO,BETHESDA,5800 BLK  NICHOLSON LA,ROCKVILLE,MD,20852.0,MCPD,Parking Garage - Residential,D,2D4,188,5800.0,,NICHOLSON,,LA,39.04498,-77.1146,2D,"(39.045, -77.1146)"
201312472,5404,200048024,12/05/2020 10:34:44 PM,2020-12-05 22:41:00,,90D,1,Crime Against Society,Driving Under the Influence,DRIVING UNDER THE INFLUENCE LIQUOR,SILVER SPRING,100 BLK E FRANKLIN AVE,SILVER SPRING,MD,20901.0,MCPD,Street - In vehicle,G,3G2,125,100.0,E,FRANKLIN,,AVE,39.00989,-77.0104,3D,"(39.0099, -77.0104)"
201261473,2305,190050245,10/19/2019 07:49:31 PM,2019-10-16 14:00:00,10/16/2019 06:00:00 PM,23F,1,Crime Against Property,Theft From Motor Vehicle,LARCENY - FROM AUTO,WHEATON,15100 BLK  COSMOS CT,ROCKVILLE,MD,20853.0,MCPD,Residence - Driveway,K,4K2,394,15100.0,,COSMOS,,CT,39.10429,-77.0899,4D,"(39.1043, -77.0899)"
201221793,2404,190000756,01/05/2019 08:29:44 AM,2019-01-03 16:30:00,01/05/2019 08:00:00 AM,240,1,Crime Against Property,Motor Vehicle Theft,AUTO THEFT - VEHICLE THEFT,GERMANTOWN,19300 BLK  LIBERTY MILL RD,GERMANTOWN,MD,20874.0,MCPD,Parking Lot - Commercial,N,5N2,594,19300.0,,LIBERTY MILL,,RD,39.17212,-77.273,5D,"(39.1721, -77.273)"
201306937,5404,200041931,10/24/2020 12:56:24 AM,2020-10-24 00:56:00,,90D,1,Crime Against Society,Driving Under the Influence,DRIVING UNDER THE INFLUENCE LIQUOR,GERMANTOWN,,GERMANTOWN,MD,20874.0,MCPD,Street - In vehicle,N,5N1,702,,,GERMANTOWN,,RD,39.1921,-77.233,5D,"(39.1921, -77.233)"
201281971,2305,200012702,03/15/2020 08:05:37 AM,2020-03-15 08:05:00,,23F,1,Crime Against Property,Theft From Motor Vehicle,LARCENY - FROM AUTO,BETHESDA,,CHEVY CHASE,MD,20815.0,MCPD,Street - Residential,D,2D1,011,,,THORNAPPLE,,ST,38.98221,-77.0761,2D,"(38.9822, -77.0761)"
201351823,2399,210044487,11/03/2021 11:46:31 AM,2021-11-03 11:46:00,,23H,1,Crime Against Property,All other Larceny,LARCENY (DESCRIBE OFFENSE),ROCKVILLE,1  BLK  MARYLAND AVE,ROCKVILLE,MD,20850.0,RCPD,Street - Commercial,A,1A3,277,1.0,,MARYLAND,,AVE,39.14486,-77.2027,1D,"(39.1449, -77.2027)"
201292161,5404,200024443,06/22/2020 04:37:07 PM,2020-06-22 16:37:00,06/22/2020 07:00:00 PM,90D,1,Crime Against Society,Driving Under the Influence,DRIVING UNDER THE INFLUENCE LIQUOR,ROCKVILLE,400 BLK  COLLEGE PKW,ROCKVILLE,MD,20850.0,RCPD,Street - Residential,A,1A3,692,400.0,,COLLEGE,,PKW,39.10226,-77.1582,1D,"(39.1023, -77.1582)"
201240406,1206,190024022,05/21/2019 09:19:18 AM,2019-05-21 09:19:00,,120,1,Crime Against Property,Robbery,ROBBERY - STREET-STRONG-ARM,SILVER SPRING,,SILVER SPRING,MD,20910.0,MCPD,Street - Residential,G,3G2,096,,,SPRING,,ST,39.1365,-77.2033,3D,"(39.1365, -77.2033)"
201224761,2401,190004535,01/29/2019 10:31:32 AM,2019-01-29 10:31:00,,240,1,Crime Against Property,Motor Vehicle Theft,AUTO THEFT - THEFT AND SALE VEHICLE,WHEATON,22300 BLK  GEORGIA AVE,BROOKEVILLE,MD,20833.0,MCPD,Residence - Single Family,J,4J2,408,22300.0,,GEORGIA,,AVE,39.22154,-77.0598,4D,"(39.2215, -77.0598)"
201322402,2610,210008661,03/08/2021 08:17:57 AM,2021-02-15 10:00:00,,26F,1,Crime Against Property,Identity Theft,FRAUD - IDENTITY THEFT,BETHESDA,4900 BLK  SENTINEL DR,BETHESDA,MD,20816.0,MCPD,Residence - Apartment/Condo,E,2E1,003,4900.0,,SENTINEL,,DR,38.95014,-77.117,2D,"(38.9501, -77.117)"
201382203,1399,220027847,06/28/2022 06:22:42 PM,2022-06-28 18:22:00,,13B,2,Crime Against Person,Simple Assault,ASSAULT - 2ND DEGREE,ROCKVILLE,14000 BLK  NATIA MANOR DR,GAITHERSBURG,MD,20878.0,MCPD,Residence - Single Family,B,1B2,452,14000.0,,NATIA MANOR,,DR,39.082,-77.2391,1D,"(39.082, -77.2391)"
201375644,2699,220019933,05/10/2022 08:01:30 PM,2022-05-02 00:00:00,05/02/2022 12:00:00 AM,26A,1,Crime Against Property,False Pretenses/Swindle/Confidence Game,FRAUD (DESCRIBE OFFENSE),SILVER SPRING,600 BLK  UNIVERSITY BLV E,SILVER SPRING,MD,20901.0,MCPD,Retail - Other,H,3H1,133,600.0,,UNIVERSITY,E,BLV,39.00254,-76.9957,3D,"(39.0025, -76.9957)"
201386264,1299,220032759,07/30/2022 04:04:12 PM,2022-07-30 16:04:00,,120,1,Crime Against Property,Robbery,ROBBERY (DESCRIBE OFFENSE),SILVER SPRING,800 BLK  WAYNE AVE,SILVER SPRING,MD,20910.0,MCPD,Parking Lot - Commercial,G,3G1,671,800.0,,WAYNE,,AVE,38.99717,-77.0218,3D,"(38.9972, -77.0218)"
201426129,2404,230022631,05/11/2023 03:53:25 PM,2023-05-11 05:30:00,05/11/2023 11:00:00 AM,240,1,Crime Against Property,Motor Vehicle Theft,AUTO THEFT - VEHICLE THEFT,MONTGOMERY VILLAGE,400 BLK  CHRISTOPHER AVE,GAITHERSBURG,MD,20879.0,MCPD,Parking Lot - Residential,R,6R1,426,400.0,,CHRISTOPHER,,AVE,39.1589,-77.2118,6D,"(39.1589, -77.2118)"
201264136,5311,190053518,11/06/2019 05:22:18 PM,2019-11-06 17:21:00,,90C,1,Crime Against Society,Disorderly Conduct,PUBLIC PEACE - DISORDERLY CONDUCT,TAKOMA PARK,7600 BLK  NEW HAMPSHIRE AVE,TAKOMA PARK,MD,20912.0,TPPD,Grocery/Supermarket,T,8T3,807,7600.0,,NEW HAMPSHIRE,,AVE,38.9859,-76.9881,TPPD,"(38.9859, -76.9881)"
201386904,2610,220033505,08/04/2022 03:29:33 PM,2022-08-04 11:25:00,,26F,1,Crime Against Property,Identity Theft,IDENTITY THEFT,ROCKVILLE,15000 BLK  GOOD MEADOW CT,GAITHERSBURG,MD,20878.0,MCPD,Cyberspace,B,1B2,451,15000.0,,GOOD MEADOW,,CT,39.1018,-77.2437,1D,"(39.1018, -77.2437)"
201366978,1399,220009514,03/05/2022 11:28:06 AM,2022-03-05 11:28:00,,13B,2,Crime Against Person,Simple Assault,ASSAULT - 2ND DEGREE,GERMANTOWN,1  BLK  TALL CEDAR CT,GERMANTOWN,MD,20876.0,MCPD,Residence - Single Family,M,5M1,472,1.0,,TALL CEDAR,,CT,39.2034,-77.2408,5D,"(39.2034, -77.2408)"
201286576,3523,200017802,05/01/2020 01:29:07 PM,2020-05-01 13:29:00,,35A,1,Crime Against Society,Drug/Narcotic Violations,DRUGS - OPIUM OR DERIVATIVE (DESCRIBE OFFENSE),SILVER SPRING,800 BLK  ROEDER RD,SILVER SPRING,MD,20910.0,MCPD,Parking Garage - County,G,3G1,671,800.0,,ROEDER,,RD,38.99809,-77.0255,3D,"(38.9981, -77.0255)"
201327199,3562,210013860,04/13/2021 09:26:42 PM,2021-04-13 21:26:00,04/13/2021 10:13:00 PM,35A,1,Crime Against Society,Drug/Narcotic Violations,DRUGS - MARIJUANA - POSSESS,ROCKVILLE,,ROCKVILLE,MD,20850.0,RCPD,Street - In vehicle,A,1A3,277,,E,MIDDLE,,LA,39.05751,-77.0885,1D,"(39.0575, -77.0885)"
201375075,2399,220019288,05/06/2022 01:34:38 PM,2022-05-06 12:55:00,05/06/2022 01:00:00 PM,23H,1,Crime Against Property,All other Larceny,LARCENY (DESCRIBE OFFENSE),ROCKVILLE,1800 BLK  ROCKVILLE PIK,ROCKVILLE,MD,20852.0,RCPD,Retail - Drug Store/Pharmacy,A,1A1,272,1800.0,,ROCKVILLE,,PIK,39.06028,-77.1226,1D,"(39.0603, -77.1226)"
201257191,2901,190044762,09/18/2019 05:45:26 PM,2019-09-18 17:45:00,,290,1,Crime Against Property,Destruction/Damage/Vandalism of Property,DAMAGE PROPERTY - BUSINESS,SILVER SPRING,8700 BLK  1ST AVE,SILVER SPRING,MD,20910.0,MCPD,Street - Other,G,3G1,095,8700.0,,1ST,,AVE,38.99738,-77.0317,3D,"(38.9974, -77.0317)"
201234265,3562,190016254,04/08/2019 08:24:39 AM,2019-04-08 08:24:00,,35A,1,Crime Against Society,Drug/Narcotic Violations,DRUGS - MARIJUANA - POSSESS,SILVER SPRING,11100 BLK  NEW HAMPSHIRE AVE,SILVER SPRING,MD,20901.0,MCPD,Restaurant,I,3I1,518,11100.0,,NEW HAMPSHIRE,,AVE,39.03777,-76.9897,3D,"(39.0378, -76.9897)"
201412779,2308,230006868,02/10/2023 04:57:30 PM,2023-02-10 16:57:00,,23D,1,Crime Against Property,Theft from Building,LARCENY - FROM BLDG,MONTGOMERY VILLAGE,1  BLK  MARKET ST,GAITHERSBURG,MD,20878.0,MCPD,Parking Lot - Other,P,6P2,450,1.0,,MARKET,,ST,39.12411,-77.235,6D,"(39.1241, -77.235)"
201413980,1399,230008119,02/17/2023 04:06:04 PM,2023-02-17 16:06:00,,13B,1,Crime Against Person,Simple Assault,ASSAULT - 2ND DEGREE,GERMANTOWN,11200 BLK  SIBLEY TER,GERMANTOWN,MD,20876.0,MCPD,Residence -Townhouse/Duplex,M,5M1,470,11200.0,,SIBLEY,,TER,39.17749,-77.2334,5D,"(39.1775, -77.2334)"
201408646,5202,230001963,01/12/2023 05:32:39 PM,2023-01-12 17:32:00,,520,1,Crime Against Society,Weapon Law Violations,WEAPON - CONCEALED,WHEATON,2200 BLK  GLENALLAN AVE,SILVER SPRING,MD,20906.0,MCPD,Parking Lot - Residential,J,4J1,368,2200.0,,GLENALLAN,,AVE,39.0617,-77.0462,4D,"(39.0617, -77.0462)"
201249543,2601,190035354,07/25/2019 12:07:12 PM,2019-07-25 09:30:00,,26A,1,Crime Against Property,False Pretenses/Swindle/Confidence Game,FRAUD - CONFIDENCE GAME,WHEATON,300 BLK  MARVIN RD,SILVER SPRING,MD,20901.0,MCPD,Other/Unknown,L,4L2,158,300.0,,MARVIN,,RD,39.02902,-77.0151,4D,"(39.029, -77.0151)"
201282436,2902,200013186,03/18/2020 04:16:39 PM,2020-03-17 20:00:00,03/18/2020 02:40:00 PM,290,1,Crime Against Property,Destruction/Damage/Vandalism of Property,DAMAGE PROPERTY - PRIVATE,SILVER SPRING,100 BLK  SCHUYLER RD,SILVER SPRING,MD,20901.0,MCPD,Parking Lot - Residential,G,3G2,123,100.0,,SCHUYLER,,RD,39.00365,-77.0114,3D,"(39.0037, -77.0114)"
201356622,5299,210050504,12/12/2021 03:24:30 PM,2021-12-12 15:24:00,,520,1,Crime Against Society,Weapon Law Violations,WEAPON OFFENSE (DESCRIBE OFFENSE),MONTGOMERY VILLAGE,900 BLK N FREDERICK AVE,GAITHERSBURG,MD,20879.0,GPD,Hotel/Motel/Etc.,P,6P2,425,900.0,N,FREDERICK,,AVE,39.15763,-77.2179,6D,"(39.1576, -77.2179)"
201417926,2399,230012939,03/17/2023 08:46:58 AM,2023-03-17 08:46:00,,23H,1,Crime Against Property,All other Larceny,LARCENY (DESCRIBE OFFENSE),MONTGOMERY VILLAGE,19300 BLK  WATKINS MILL RD,MONTGOMERY VILLAGE,MD,20886.0,MCPD,Residence -Townhouse/Duplex,R,6R2,546,19300.0,,WATKINS MILL,,RD,39.17252,-77.2083,6D,"(39.1725, -77.2083)"
201343673,2404,210034115,08/31/2021 08:38:52 PM,2021-08-30 21:00:00,08/31/2021 08:00:00 PM,240,1,Crime Against Property,Motor Vehicle Theft,AUTO THEFT - VEHICLE THEFT,GERMANTOWN,26300 BLK  WOODFIELD RD,DAMASCUS,MD,20872.0,MCPD,Parking Garage - Residential,M,5M2,612,26300.0,,WOODFIELD,,RD,39.28914,-77.2012,5D,"(39.2891, -77.2012)"
201404135,1206,220054503,12/09/2022 04:10:49 PM,2022-12-09 16:00:00,12/09/2022 04:10:00 PM,120,1,Crime Against Property,Robbery,ROBBERY - STREET-STRONG-ARM,ROCKVILLE,12300 BLK  PARKLAWN DR,ROCKVILLE,MD,20852.0,MCPD,Parking Lot - Other,A,1A2,303,12300.0,,PARKLAWN,,DR,39.05895,-77.1108,1D,"(39.059, -77.1108)"
201408896,1303,230002293,01/14/2023 08:38:01 PM,2023-01-14 20:38:00,,13A,1,Crime Against Person,Aggravated Assault,ASSAULT - AGGRAVATED - FAMILY-STRONG-ARM,SILVER SPRING,1  BLK  TIMBERWOOD AVE,SILVER SPRING,MD,20901.0,MCPD,Residence - Single Family,H,3H2,155,1.0,,TIMBERWOOD,,AVE,39.02127,-77.0108,3D,"(39.0213, -77.0108)"
201287752,2305,200019181,05/12/2020 01:07:13 PM,2020-05-07 23:39:00,05/11/2020 01:00:00 PM,23F,1,Crime Against Property,Theft From Motor Vehicle,LARCENY - FROM AUTO,SILVER SPRING,,SILVER SPRING,MD,20901.0,MCPD,Street - Other,H,3H2,157,,,UNIVERSITY,E,BLV,38.98852,-76.9871,3D,"(38.9885, -76.9871)"
201382677,2305,220028385,,2022-06-26 16:10:00,06/28/2022 06:30:00 PM,23F,1,Crime Against Property,Theft From Motor Vehicle,LARCENY - FROM AUTO,BETHESDA,5600 BLK  RIVER RD,BETHESDA,MD,20816.0,MCPD,Golf Course,E,2E1,023,5600.0,,RIVER,,RD,38.96982,-77.112,2D,"(38.9698, -77.112)"
201275780,3572,200004881,01/29/2020 09:33:38 PM,2020-01-29 21:33:00,,35A,1,Crime Against Society,Drug/Narcotic Violations,DRUGS - AMPHETAMINE - POSSESS,SILVER SPRING,900 BLK  BONIFANT ST,SILVER SPRING,MD,20910.0,MCPD,Street - Alley,G,3G1,670,900.0,,BONIFANT,,ST,38.99442,-77.0241,3D,"(38.9944, -77.0241)"
201236228,1399,190018677,04/21/2019 02:40:59 PM,2019-04-21 14:40:00,,13B,1,Crime Against Person,Simple Assault,ASSAULT - 2ND DEGREE,SILVER SPRING,500 BLK  UNIVERSITY BLV E,SILVER SPRING,MD,20901.0,MCPD,Residence - Single Family,H,3H1,128,500.0,,UNIVERSITY,E,BLV,39.00618,-76.9975,3D,"(39.0062, -76.9975)"
201335103,1399,210023454,06/19/2021 02:51:33 AM,2021-06-19 02:30:00,06/19/2021 02:51:00 AM,13B,3,Crime Against Person,Simple Assault,ASSAULT - 2ND DEGREE,,,BELTSVILLE,MD,20705.0,MCPD,Bar/Night Club,w,own,Unknown,,,,,,0.0,0.0,Unknown,"(0.0, 0.0)"
201238061,3562,190021053,05/04/2019 06:23:34 PM,2019-05-04 18:23:00,,35A,1,Crime Against Society,Drug/Narcotic Violations,DRUGS - MARIJUANA - POSSESS,BETHESDA,,ROCKVILLE,MD,20852.0,MCPD,Street - In vehicle,E,2E3,199,,,OLD GEORGETOWN,,RD,39.0387,-77.1228,2D,"(39.0387, -77.1228)"
201391832,5311,220035906,08/19/2022 09:17:56 PM,2022-08-19 21:14:00,,90C,1,Crime Against Society,Disorderly Conduct,PUBLIC PEACE - DISORDERLY CONDUCT,GERMANTOWN,19900 BLK  CENTURY BLV,GERMANTOWN,MD,20874.0,MCPD,Air/Bus/Train/Metro Terminal,N,5N1,702,19900.0,,CENTURY,,BLV,39.18295,-77.2636,5D,"(39.1829, -77.2636)"
201271090,2305,190062192,12/26/2019 05:14:56 PM,2019-08-20 00:00:00,,23F,1,Crime Against Property,Theft From Motor Vehicle,LARCENY - FROM AUTO,BETHESDA,7700 BLK  WISCONSIN AVE,BETHESDA,MD,20814.0,MCPD,Auto Dealership,D,2D2,047,7700.0,,WISCONSIN,,AVE,38.98673,-77.0947,2D,"(38.9867, -77.0947)"
201441797,1399,230052272,08/30/2023 04:58:14 PM,2023-08-30 16:58:00,,13B,1,Crime Against Person,Simple Assault,ASSAULT - 2ND DEGREE,MONTGOMERY VILLAGE,1  BLK  METROPOLITAN GROVE RD,GAITHERSBURG,MD,20878.0,MCPD,Parking Lot - Commercial,P,6P2,593,1.0,,METROPOLITAN GROVE,,RD,39.14601,-77.2282,6D,"(39.146, -77.2282)"
201359392,2902,210046829,11/18/2021 01:34:14 PM,2021-11-17 19:00:00,11/18/2021 07:45:00 AM,290,1,Crime Against Property,Destruction/Damage/Vandalism of Property,DAMAGE PROPERTY - PRIVATE,SILVER SPRING,8200 BLK  FENTON ST,SILVER SPRING,MD,20910.0,MCPD,Parking Lot - Residential,G,3G1,093,8200.0,,FENTON,,ST,38.99169,-77.024,3D,"(38.9917, -77.024)"
201299849,2316,200033350,08/26/2020 01:44:30 PM,2020-08-26 13:44:00,,23H,1,Crime Against Property,All other Larceny,LARCENY - POSTAL,WHEATON,11100 BLK  VEIRS MILL RD,SILVER SPRING,MD,20902.0,MCPD,Residence - Yard,L,4L2,321,11100.0,,VEIRS MILL,,RD,39.03758,-77.0519,4D,"(39.0376, -77.0519)"
201280975,2999,200011458,03/08/2020 04:37:44 PM,2020-03-07 08:30:00,03/08/2020 04:38:00 PM,290,1,Crime Against Property,Destruction/Damage/Vandalism of Property,DAMAGE PROPERTY (DESCRIBE OFFENSE),MONTGOMERY VILLAGE,1  BLK  EARTH STAR CT,GAITHERSBURG,MD,20878.0,GPD,Parking Lot - Residential,P,6P1,552,1.0,,EARTH STAR,,CT,39.11342,-77.2183,6D,"(39.1134, -77.2183)"
201427487,2308,230024326,05/21/2023 08:41:50 AM,2023-05-07 00:00:00,05/21/2023 07:00:00 AM,23D,1,Crime Against Property,Theft from Building,LARCENY - FROM BLDG,GERMANTOWN,12900 BLK  POPPYSEED CT,GERMANTOWN,MD,20874.0,MCPD,Residence -Townhouse/Duplex,N,5N2,594,12900.0,,POPPYSEED,,CT,39.16323,-77.268,5D,"(39.1632, -77.268)"
201284347,1399,200015320,04/07/2020 05:55:41 PM,2020-04-07 17:55:00,,13B,2,Crime Against Person,Simple Assault,ASSAULT - 2ND DEGREE,GERMANTOWN,12100 BLK  FLAG HARBOR DR,GERMANTOWN,MD,20874.0,MCPD,Residence -Townhouse/Duplex,N,5N1,447,12100.0,,FLAG HARBOR,,DR,39.16454,-77.2529,5D,"(39.1645, -77.2529)"
201405195,2303,220055773,12/16/2022 05:11:03 PM,2022-12-16 17:11:00,,23C,1,Crime Against Property,Shoplifting,LARCENY - SHOPLIFTING,SILVER SPRING,800 BLK  WAYNE AVE,SILVER SPRING,MD,20910.0,MCPD,Grocery/Supermarket,G,3G1,671,800.0,,WAYNE,,AVE,38.99717,-77.0218,3D,"(38.9972, -77.0218)"
201328657,2304,210015577,04/26/2021 06:01:23 PM,2021-04-26 12:00:00,04/26/2021 05:20:00 PM,23G,1,Crime Against Property,Theft of Motor Vehicle Parts or Accessories,LARCENY - AUTO PARTS,BETHESDA,8800 BLK  LANIER DR,SILVER SPRING,MD,20910.0,MCPD,Residence - Driveway,D,2D1,085,8800.0,,LANIER,,DR,38.99923,-77.0478,2D,"(38.9992, -77.0478)"
201342800,2605,210032625,08/21/2021 03:35:23 PM,2021-08-19 13:00:00,08/21/2021 01:00:00 PM,26B,1,Crime Against Property,Credit Card/Automatic Teller Machine Fraud,FRAUD - ILLEGAL USE CREDIT CARDS,MONTGOMERY VILLAGE,800 BLK  BAYRIDGE DR,GAITHERSBURG,MD,20878.0,MCPD,Parking Lot - Residential,P,6P2,449,800.0,,BAYRIDGE,,DR,39.13066,-77.234,6D,"(39.1307, -77.234)"
201389270,2316,220036379,08/23/2022 12:24:07 PM,2022-08-04 00:00:00,08/16/2022 12:00:00 AM,23H,1,Crime Against Property,All other Larceny,LARCENY - POSTAL,SILVER SPRING,12000 BLK  PLUM ORCHARD DR,SILVER SPRING,MD,20904.0,MCPD,Government Building,I,3I1,146,12000.0,,PLUM ORCHARD,,DR,39.05259,-76.9531,3D,"(39.0526, -76.9531)"
201310640,2303,200046477,11/24/2020 08:10:32 PM,2020-11-24 18:50:00,11/24/2020 06:57:00 PM,23C,1,Crime Against Property,Shoplifting,LARCENY - SHOPLIFTING,BETHESDA,900 BLK  ROSE AVE,ROCKVILLE,MD,20852.0,MCPD,Retail - Sporting Goods,D,2D4,188,900.0,,ROSE,,AVE,39.05109,-77.1162,2D,"(39.0511, -77.1162)"
201371704,2902,220015170,04/09/2022 09:50:44 PM,2022-04-07 12:00:00,04/09/2022 07:56:00 PM,290,1,Crime Against Property,Destruction/Damage/Vandalism of Property,DAMAGE PROPERTY - PRIVATE,WHEATON,11400 BLK  DEWEY RD,SILVER SPRING,MD,20906.0,MCPD,Residence - Single Family,L,4L1,310,11400.0,,DEWEY,,RD,39.0429,-77.0854,4D,"(39.0429, -77.0854)"
201382593,1399,220028146,06/30/2022 01:37:40 PM,2022-06-30 13:37:00,06/30/2022 03:30:00 PM,13B,1,Crime Against Person,Simple Assault,ASSAULT - 2ND DEGREE,MONTGOMERY VILLAGE,9300 BLK  WILLOW CREEK DR,MONTGOMERY VILLAGE,,20886.0,MCPD,Residence - Apartment/Condo,R,6R1,505,9300.0,,WILLOW CREEK,,DR,39.1551,-77.193,6D,"(39.1551, -77.193)"
201233628,2999,190015567,04/04/2019 04:01:55 AM,2019-04-03 22:50:00,04/04/2019 03:40:00 AM,290,1,Crime Against Property,Destruction/Damage/Vandalism of Property,DAMAGE PROPERTY (DESCRIBE OFFENSE),SILVER SPRING,8500 BLK  CAMERON ST,SILVER SPRING,MD,20910.0,MCPD,Parking Garage - County,G,3G1,095,8500.0,,CAMERON,,ST,38.99637,-77.0311,3D,"(38.9964, -77.0311)"
201407131,1399,220056809,12/22/2022 01:06:51 PM,2022-12-22 13:06:00,,13B,1,Crime Against Person,Simple Assault,ASSAULT - 2ND DEGREE,WHEATON,21500 BLK  ZION RD,BROOKEVILLE,MD,20833.0,MCPD,School - Elementary/Secondary,J,4J2,633,21500.0,,ZION,,RD,39.20886,-77.0925,4D,"(39.2089, -77.0925)"
201278769,5404,200008816,02/22/2020 02:02:46 AM,2020-02-22 02:00:00,02/22/2020 03:05:00 AM,90D,1,Crime Against Society,Driving Under the Influence,DRIVING UNDER THE INFLUENCE LIQUOR,ROCKVILLE,,ROCKVILLE,MD,20850.0,RCPD,Street - In vehicle,A,1A3,253,,W,MONTGOMERY,,AVE,38.97447,-77.0077,1D,"(38.9745, -77.0077)"
201264882,5404,190054607,11/12/2019 09:10:58 PM,2019-11-12 21:10:00,,90D,1,Crime Against Society,Driving Under the Influence,DRIVING UNDER THE INFLUENCE LIQUOR,ROCKVILLE,,ROCKVILLE,MD,20850.0,MCPD,Street - In vehicle,B,1B1,237,,,SHADY GROVE,,RD,39.14114,-77.1518,1D,"(39.1411, -77.1518)"
201346638,2305,210037914,09/25/2021 04:47:49 AM,2021-09-25 01:45:00,09/25/2021 04:15:00 AM,23F,1,Crime Against Property,Theft From Motor Vehicle,LARCENY - FROM AUTO,WHEATON,4500 BLK  BENNION RD,SILVER SPRING,MD,20906.0,MCPD,Residence - Driveway,L,4L1,310,4500.0,,BENNION,,RD,39.05348,-77.0853,4D,"(39.0535, -77.0853)"
201384351,2303,220030435,07/15/2022 02:10:30 PM,2022-07-15 14:10:00,,23C,1,Crime Against Property,Shoplifting,LARCENY - SHOPLIFTING,BETHESDA,900 BLK  ROSE AVE,ROCKVILLE,MD,20852.0,MCPD,Retail - Sporting Goods,D,2D4,188,900.0,,ROSE,,AVE,39.05109,-77.1162,2D,"(39.0511, -77.1162)"
201393410,2404,220041423,09/23/2022 06:09:57 AM,2022-09-22 20:30:00,09/23/2022 01:00:00 AM,240,1,Crime Against Property,Motor Vehicle Theft,AUTO THEFT - VEHICLE THEFT,SILVER SPRING,500 BLK  SILVER SPRING AVE,SILVER SPRING,MD,20910.0,MCPD,Residence - Driveway,G,3G1,113,500.0,,SILVER SPRING,,AVE,38.99288,-77.0116,3D,"(38.9929, -77.0116)"
201325528,2610,210011851,03/30/2021 10:45:45 AM,2021-03-26 07:00:00,,26F,1,Crime Against Property,Identity Theft,FRAUD - IDENTITY THEFT,MONTGOMERY VILLAGE,9700 BLK  SKYHILL WAY,ROCKVILLE,MD,20850.0,MCPD,Other/Unknown,P,6P1,721,9700.0,,SKYHILL,,WAY,39.10957,-77.2022,6D,"(39.1096, -77.2022)"
201240130,2399,190023605,05/18/2019 09:35:58 PM,2019-05-18 21:35:00,,23H,1,Crime Against Property,All other Larceny,LARCENY (DESCRIBE OFFENSE),SILVER SPRING,8800 BLK  PINEY BRANCH RD,SILVER SPRING,MD,20903.0,MCPD,Residence - Apartment/Condo,H,3H1,133,8800.0,,PINEY BRANCH,,RD,38.99963,-76.9953,3D,"(38.9996, -76.9953)"
201413292,2308,230007547,02/14/2023 04:39:53 PM,2023-02-14 16:39:00,,23D,1,Crime Against Property,Theft from Building,LARCENY - FROM BLDG,BETHESDA,5400 BLK  WISCONSIN AVE,CHEVY CHASE,MD,20815.0,MCPD,Doctor/Dentist/Vet Office,E,2E1,516,5400.0,,WISCONSIN,,AVE,38.96082,-77.0857,2D,"(38.9608, -77.0857)"
201347488,5707,210038909,10/01/2021 07:32:59 AM,2021-10-01 07:32:00,,90J,1,Crime Against Society,Trespass of Real Property,TRESPASSING,GERMANTOWN,15100 BLK  BARNESVILLE RD,BOYDS,MD,20841.0,MCPD,Residence - Yard,N,5N2,585,15100.0,,BARNESVILLE,,RD,39.18492,-77.3144,5D,"(39.1849, -77.3144)"
201239931,2404,190023437,05/17/2019 10:28:02 PM,2019-05-17 06:35:00,05/17/2019 10:00:00 PM,240,1,Crime Against Property,Motor Vehicle Theft,AUTO THEFT - VEHICLE THEFT,BETHESDA,8200 BLK  WOODMONT AVE,BETHESDA,MD,20814.0,MCPD,Parking Garage - County,D,2D2,049,8200.0,,WOODMONT,,AVE,38.99192,-77.0968,2D,"(38.9919, -77.0968)"
201275207,4104,200004331,01/26/2020 07:03:05 PM,2020-01-26 18:50:00,01/26/2020 07:10:00 PM,90G,1,Crime Against Society,Liquor Law Violations,LIQUOR - POSSESS,ROCKVILLE,100 BLK  GIBBS ST,ROCKVILLE,MD,20850.0,RCPD,Retail - Other,A,1A3,277,100.0,,GIBBS,,ST,39.08571,-77.1519,1D,"(39.0857, -77.1519)"
201276967,2205,200006496,02/08/2020 12:25:25 PM,2020-02-07 21:00:00,02/08/2020 09:50:00 AM,220,1,Crime Against Property,Burglary/Breaking and Entering,BURGLARY - NO FORCED ENTRY-NONRESIDENTIAL,MONTGOMERY VILLAGE,1  BLK W WATKINS MILL RD,GAITHERSBURG,MD,20878.0,MCPD,Commercial - Office Building,P,6P2,593,1.0,W,WATKINS MILL,,RD,39.15929,-77.2191,6D,"(39.1593, -77.2191)"
201405472,2501,220056193,12/19/2022 11:20:51 AM,2022-10-26 00:00:00,10/31/2022 12:00:00 AM,250,1,Crime Against Property,Counterfeiting/Forgery,FORGERY OF CHECKS,MONTGOMERY VILLAGE,9200 BLK  WIGHTMAN RD,MONTGOMERY VILLAGE,,20886.0,MCPD,Bank/S&L/Credit Union,R,6R2,504,9200.0,,WIGHTMAN,,RD,39.18863,-77.1894,6D,"(39.1886, -77.1894)"
201339134,2399,210028494,07/23/2021 07:09:06 AM,2021-07-22 16:00:00,07/23/2021 06:00:00 AM,23H,1,Crime Against Property,All other Larceny,LARCENY (DESCRIBE OFFENSE),ROCKVILLE,800 BLK  BALTIMORE RD,ROCKVILLE,MD,20851.0,MCPD,Construction Site,A,1A2,291,800.0,,BALTIMORE,,RD,39.08457,-77.1362,1D,"(39.0846, -77.1362)"
201422219,2902,230017915,04/15/2023 12:34:35 AM,2023-03-16 23:30:00,,290,1,Crime Against Property,Destruction/Damage/Vandalism of Property,DAMAGE PROPERTY - PRIVATE,GERMANTOWN,13000 BLK  MILL HOUSE CT,GERMANTOWN,MD,20874.0,MCPD,Parking Lot - Residential,N,5N2,448,13000.0,,MILL HOUSE,,CT,39.15528,-77.268,5D,"(39.1553, -77.268)"
201364106,2605,220006304,02/13/2022 01:08:14 PM,2022-02-12 18:45:00,02/12/2022 07:09:00 PM,26B,1,Crime Against Property,Credit Card/Automatic Teller Machine Fraud,FRAUD - ILLEGAL USE CREDIT CARDS,SILVER SPRING,8600 BLK  COLESVILLE RD,SILVER SPRING,MD,20910.0,MCPD,Retail - Other,G,3G1,109,8600.0,,COLESVILLE,,RD,38.99602,-77.0281,3D,"(38.996, -77.0281)"
201441309,2303,230051683,08/27/2023 01:55:03 PM,2023-08-27 13:55:00,,23C,1,Crime Against Property,Shoplifting,LARCENY - SHOPLIFTING,GERMANTOWN,20900 BLK  FREDERICK RD,GERMANTOWN,MD,20876.0,MCPD,Retail - Other,M,5M1,701,20900.0,,FREDERICK,,RD,39.19829,-77.2448,5D,"(39.1983, -77.2448)"
201330367,2610,210017704,05/11/2021 01:42:45 PM,2021-04-19 00:00:00,,26F,1,Crime Against Property,Identity Theft,FRAUD - IDENTITY THEFT,ROCKVILLE,13200 BLK  BEALL CREEK CT,POTOMAC,MD,20854.0,MCPD,Other/Unknown,B,1B2,454,13200.0,,BEALL CREEK,,CT,39.05717,-77.2678,1D,"(39.0572, -77.2678)"
201314814,2605,200051475,12/31/2020 01:05:41 PM,2020-12-28 00:01:00,12/28/2020 11:59:00 PM,26B,1,Crime Against Property,Credit Card/Automatic Teller Machine Fraud,FRAUD - ILLEGAL USE CREDIT CARDS,ROCKVILLE,1  BLK  GREYSWOOD CT,POTOMAC,MD,20854.0,MCPD,Other/Unknown,B,1B1,227,1.0,,GREYSWOOD,,CT,39.05884,-77.1682,1D,"(39.0588, -77.1682)"
201396912,2605,220045773,10/18/2022 08:10:28 PM,2022-10-17 10:00:00,10/18/2022 12:00:00 AM,26B,1,Crime Against Property,Credit Card/Automatic Teller Machine Fraud,FRAUD - ILLEGAL USE CREDIT CARDS,SILVER SPRING,400 BLK  TORRINGTON PL,SILVER SPRING,MD,20901.0,MCPD,Other/Unknown,H,3H1,672,400.0,,TORRINGTON,,PL,39.01327,-77.0023,3D,"(39.0133, -77.0023)"
201407359,1399,230000442,01/03/2023 11:19:13 PM,2023-01-03 23:19:00,,13B,1,Crime Against Person,Simple Assault,ASSAULT - 2ND DEGREE,MONTGOMERY VILLAGE,900 BLK  HILLSIDE LAKE TER,GAITHERSBURG,MD,20878.0,GPD,Residence - Apartment/Condo,P,6P1,552,900.0,,HILLSIDE LAKE,,TER,39.10928,-77.2183,6D,"(39.1093, -77.2183)"
201418714,2303,230013827,03/22/2023 01:36:58 AM,2023-03-22 01:36:00,,23C,1,Crime Against Property,Shoplifting,LARCENY - SHOPLIFTING,SILVER SPRING,15500 BLK  OLD COLUMBIA PIK,BURTONSVILLE,MD,20866.0,MCPD,Convenience Store,I,3I2,383,15500.0,,OLD COLUMBIA,,PIK,39.10949,-76.9351,3D,"(39.1095, -76.9351)"
201281791,2902,200012456,03/13/2020 05:52:54 PM,2020-03-13 15:00:00,03/13/2020 04:00:00 PM,290,1,Crime Against Property,Destruction/Damage/Vandalism of Property,DAMAGE PROPERTY - PRIVATE,MONTGOMERY VILLAGE,1  BLK  EARTH STAR CT,GAITHERSBURG,MD,20878.0,MCPD,Parking Lot - Residential,P,6P1,552,1.0,,EARTH STAR,,CT,39.11342,-77.2183,6D,"(39.1134, -77.2183)"
201244330,2303,190029012,06/17/2019 07:46:24 PM,2019-06-17 19:46:00,,23C,1,Crime Against Property,Shoplifting,LARCENY - SHOPLIFTING,BETHESDA,7800 BLK  WISCONSIN AVE,BETHESDA,MD,20814.0,MCPD,Retail - Drug Store/Pharmacy,D,2D2,045,7800.0,,WISCONSIN,,AVE,38.98827,-77.095,2D,"(38.9883, -77.095)"
201236379,2303,190018160,04/18/2019 01:50:04 PM,2019-04-18 13:50:00,,23C,1,Crime Against Property,Shoplifting,LARCENY - SHOPLIFTING,WHEATON,11100 BLK  VEIRS MILL RD,SILVER SPRING,MD,20902.0,MCPD,Retail - Clothing,L,4L2,321,11100.0,,VEIRS MILL,,RD,39.03758,-77.0519,4D,"(39.0376, -77.0519)"
201263320,2399,190052612,11/01/2019 09:52:35 AM,2019-10-30 08:30:00,10/30/2019 10:30:00 AM,23H,1,Crime Against Property,All other Larceny,LARCENY (DESCRIBE OFFENSE),ROCKVILLE,12700 BLK  HUNTSMAN WAY,POTOMAC,MD,20854.0,MCPD,Residence - Single Family,B,1B1,727,12700.0,,HUNTSMAN,,WAY,39.06329,-77.1881,1D,"(39.0633, -77.1881)"
201421409,2404,230016923,04/09/2023 12:46:26 PM,2023-04-06 10:00:00,04/09/2023 12:30:00 PM,240,1,Crime Against Property,Motor Vehicle Theft,AUTO THEFT - VEHICLE THEFT,BETHESDA,5400 BLK  MC GRATH BLV,ROCKVILLE,MD,20852.0,MCPD,Parking Garage - Residential,D,2D4,187,5400.0,,MC GRATH,,BLV,39.04857,-77.1082,2D,"(39.0486, -77.1082)"
201241366,1199,190025188,05/27/2019 01:42:27 PM,2019-05-23 08:00:00,05/23/2019 05:00:00 PM,11D,1,Crime Against Person,Forcible Fondling,SEX ASSAULT - FONDLING,MONTGOMERY VILLAGE,1  BLK W WATKINS MILL RD,GAITHERSBURG,MD,20878.0,MCPD,Residence - Single Family,P,6P2,593,1.0,W,WATKINS MILL,,RD,39.15929,-77.2191,6D,"(39.1593, -77.2191)"
201308705,1399,200044139,11/09/2020 05:08:36 AM,2020-11-09 05:08:00,11/09/2020 05:35:00 AM,13B,1,Crime Against Person,Simple Assault,ASSAULT - 2ND DEGREE,TAKOMA PARK,7600 BLK  MAPLE AVE,TAKOMA PARK,MD,20912.0,TPPD,Residence - Apartment/Condo,T,8T2,804,7600.0,,MAPLE,,AVE,38.98266,-77.0074,TPPD,"(38.9827, -77.0074)"
201354950,2304,210048441,11/29/2021 03:07:28 PM,2021-11-27 21:00:00,11/28/2021 10:00:00 AM,23G,1,Crime Against Property,Theft of Motor Vehicle Parts or Accessories,LARCENY - AUTO PARTS,WHEATON,18200 BLK  WINDSOR HILL DR,OLNEY,MD,20832.0,MCPD,Parking Lot - Residential,J,4J2,401,18200.0,,WINDSOR HILL,,DR,39.15302,-77.0589,4D,"(39.153, -77.0589)"
201273869,3562,200002578,01/15/2020 09:40:32 PM,2020-01-15 21:35:00,,35A,1,Crime Against Society,Drug/Narcotic Violations,DRUGS - MARIJUANA - POSSESS,WHEATON,2500 BLK  BLUERIDGE AVE,SILVER SPRING,MD,20902.0,MCPD,Street - Commercial,L,4L1,326,2500.0,,BLUERIDGE,,AVE,39.04308,-77.052,4D,"(39.0431, -77.052)"
201368616,3705,220011452,03/17/2022 09:38:26 AM,2022-03-17 10:09:00,,370,1,Crime Against Society,Pornography/Obscene Material,OBSCENE MATERIAL - DISTRIBUTE,WHEATON,3300 BLK  HEWITT AVE,SILVER SPRING,MD,20906.0,MCPD,Government Building,K,4K1,348,3300.0,,HEWITT,,AVE,39.07955,-77.0661,4D,"(39.0795, -77.0661)"
201323605,2304,210010007,03/17/2021 02:11:33 PM,2020-12-17 08:00:00,03/15/2021 12:00:00 PM,23G,1,Crime Against Property,Theft of Motor Vehicle Parts or Accessories,LARCENY - AUTO PARTS,MONTGOMERY VILLAGE,8800 BLK  EMORY GROVE RD,GAITHERSBURG,MD,20877.0,MCPD,Residence - Driveway,P,6P3,768,8800.0,,EMORY GROVE,,RD,39.15808,-77.1807,6D,"(39.1581, -77.1807)"
201263999,4004,190053367,,2019-11-05 22:41:00,11/05/2019 10:41:00 PM,40A,1,Crime Against Society,Prostitution,COMM SEX OFF - PROSTITUTION,SILVER SPRING,8000 BLK  13TH ST,SILVER SPRING,MD,20910.0,MCPD,Hotel/Motel/Etc.,G,3G1,090,8000.0,,13TH,,ST,38.98692,-77.0296,3D,"(38.9869, -77.0296)"
201276331,1399,200005530,02/03/2020 12:59:53 AM,2020-02-03 00:59:00,,13B,1,Crime Against Person,Simple Assault,ASSAULT - 2ND DEGREE,ROCKVILLE,14200 BLK  QUINCE ORCHARD RD,GAITHERSBURG,MD,20878.0,MCPD,Street - Other,B,1B2,557,14200.0,,QUINCE ORCHARD,,RD,39.08785,-77.25,1D,"(39.0879, -77.25)"
201338739,2305,210027889,07/19/2021 09:10:41 AM,2021-07-18 11:00:00,07/19/2021 08:30:00 AM,23F,1,Crime Against Property,Theft From Motor Vehicle,LARCENY - FROM AUTO,SILVER SPRING,1600 BLK  REGENT MANOR CT,SILVER SPRING,MD,20904.0,MCPD,Residence - Driveway,I,3I1,145,1600.0,,REGENT MANOR,,CT,39.04289,-76.9781,3D,"(39.0429, -76.9781)"
201372274,2605,220014837,04/07/2022 04:49:05 PM,2022-04-07 11:00:00,04/07/2022 02:00:00 PM,26B,1,Crime Against Property,Credit Card/Automatic Teller Machine Fraud,FRAUD - ILLEGAL USE CREDIT CARDS,GERMANTOWN,20400 BLK  OBSERVATION DR,GERMANTOWN,MD,20876.0,MCPD,Retail - Department/Discount Store,M,5M1,468,20400.0,,OBSERVATION,,DR,39.19075,-77.2477,5D,"(39.1908, -77.2477)"
201352560,3601,210045411,11/09/2021 03:38:22 PM,2021-06-01 08:00:00,,11D,1,Crime Against Person,Forcible Fondling,SEX OFFENSE - AGAINST CHILD-FONDLING,SILVER SPRING,11400 BLK  STEWART LA,SILVER SPRING,MD,20904.0,MCPD,Residence - Apartment/Condo,I,3I1,145,11400.0,,STEWART,,LA,39.04396,-76.9802,3D,"(39.044, -76.9802)"
201411224,1103,230005103,,2023-01-30 16:00:00,,11A,1,Crime Against Person,Forcible Rape,RAPE - STRONG-ARM,ROCKVILLE,8700 BLK  BUNNELL DR,POTOMAC,MD,20854.0,MCPD,Residence - Single Family,B,1B1,225,8700.0,,BUNNELL,,DR,39.04719,-77.1785,1D,"(39.0472, -77.1785)"
201356868,2501,210050849,12/14/2021 03:57:28 PM,2021-09-17 00:00:00,12/02/2021 11:59:00 PM,250,1,Crime Against Property,Counterfeiting/Forgery,FORGERY OF CHECKS,BETHESDA,,BETHESDA,MD,20817.0,MCPD,Other/Unknown,E,2E1,025,,,BANNOCKBURN,,DR,38.9752,-77.1375,2D,"(38.9752, -77.1375)"
201386537,2610,220033034,08/01/2022 03:12:23 PM,2022-08-01 12:00:00,08/01/2022 01:00:00 PM,26F,1,Crime Against Property,Identity Theft,IDENTITY THEFT,BETHESDA,9600 BLK  PAGE AVE,BETHESDA,MD,20814.0,MCPD,Bank/S&L/Credit Union,E,2E2,071,9600.0,,PAGE,,AVE,39.01314,-77.1109,2D,"(39.0131, -77.1109)"
201395517,1399,220043960,10/08/2022 03:23:47 AM,2022-10-08 03:23:00,,13B,1,Crime Against Person,Simple Assault,ASSAULT - 2ND DEGREE,SILVER SPRING,8800 BLK  COLESVILLE RD,SILVER SPRING,MD,20910.0,MCPD,Street - Commercial,G,3G2,118,8800.0,,COLESVILLE,,RD,38.999,-77.0261,3D,"(38.999, -77.0261)"
201258809,2902,190046846,09/30/2019 01:41:49 PM,2019-09-14 09:00:00,09/28/2019 02:30:00 PM,290,1,Crime Against Property,Destruction/Damage/Vandalism of Property,DAMAGE PROPERTY - PRIVATE,GERMANTOWN,11200 BLK  BENT CREEK TER,GERMANTOWN,MD,20876.0,MCPD,Street - Residential,M,5M1,471,11200.0,,BENT CREEK,,TER,39.19018,-77.2345,5D,"(39.1902, -77.2345)"
201382448,2610,220027944,06/29/2022 12:08:13 PM,2022-06-28 00:00:00,,26F,1,Crime Against Property,Identity Theft,FRAUD - IDENTITY THEFT,BETHESDA,4700 BLK  BRADLEY BLV,CHEVY CHASE,MD,20815.0,MCPD,Cyberspace,D,2D2,031,4700.0,,BRADLEY,,BLV,38.97784,-77.0924,2D,"(38.9778, -77.0924)"
201247128,3562,190031423,07/01/2019 09:37:11 PM,2019-07-01 16:36:00,,35A,1,Crime Against Society,Drug/Narcotic Violations,DRUGS - MARIJUANA - POSSESS,SILVER SPRING,,SILVER SPRING,MD,20903.0,MCPD,Gas Station,H,3H1,131,,,CARROLL,,AVE,38.98074,-77.0038,3D,"(38.9807, -77.0038)"
201368849,5404,220011613,03/18/2022 12:33:47 AM,2022-03-18 00:34:00,,90D,1,Crime Against Society,Driving Under the Influence,DRIVING UNDER THE INFLUENCE LIQUOR,GERMANTOWN,,GERMANTOWN,MD,20874.0,MCPD,Street - In vehicle,N,5N1,595,,,MIDDLEBROOK,,RD,39.17603,-77.2458,5D,"(39.176, -77.2458)"
201415590,2305,230010258,03/01/2023 08:13:04 PM,2023-03-01 14:12:00,03/01/2023 02:18:00 PM,23F,1,Crime Against Property,Theft From Motor Vehicle,LARCENY - FROM AUTO,SILVER SPRING,9500 BLK  GEORGIA AVE,SILVER SPRING,MD,20910.0,MCPD,Retail - Other,G,3G2,081,9500.0,,GEORGIA,,AVE,39.01032,-77.0408,3D,"(39.0103, -77.0408)"
201276157,2308,200005462,02/02/2020 02:13:19 PM,2020-01-31 12:05:00,02/01/2020 12:00:00 PM,23D,1,Crime Against Property,Theft from Building,LARCENY - FROM BLDG,SILVER SPRING,8700 BLK  CAMERON ST,SILVER SPRING,MD,20910.0,MCPD,Residence - Other,G,3G1,108,8700.0,,CAMERON,,ST,38.9984,-77.0287,3D,"(38.9984, -77.0287)"
201267399,2605,190057690,,2019-11-28 18:00:00,11/28/2019 07:00:00 PM,26B,1,Crime Against Property,Credit Card/Automatic Teller Machine Fraud,FRAUD - ILLEGAL USE CREDIT CARDS,ROCKVILLE,,POTOMAC,MD,20854.0,MCPD,Street - Commercial,B,1B1,223,,,TUCKERMAN,,LA,39.03082,-77.1151,1D,"(39.0308, -77.1151)"
201382929,3560,220028208,06/30/2022 09:40:29 PM,2022-06-30 21:30:00,,35A,1,Crime Against Society,Drug/Narcotic Violations,DRUGS - MARIJUANA - SELL,SILVER SPRING,,SILVER SPRING,MD,20910.0,MCPD,Street - In vehicle,G,3G2,098,,,SPRING,,ST,39.1365,-77.2033,3D,"(39.1365, -77.2033)"
201260792,2610,190049339,,2019-10-14 12:00:00,,26F,1,Crime Against Property,Identity Theft,FRAUD - IDENTITY THEFT,ROCKVILLE,19700 BLK  SELBY AVE,POOLESVILLE,MD,20837.0,MCPD,Residence - Single Family,B,1B3,492,19700.0,,SELBY,,AVE,39.14735,-77.4117,1D,"(39.1474, -77.4117)"
201296276,2902,200029275,07/28/2020 10:44:21 AM,2020-07-27 22:00:00,,290,1,Crime Against Property,Destruction/Damage/Vandalism of Property,DAMAGE PROPERTY - PRIVATE,WHEATON,12200 BLK  JUDSON RD,SILVER SPRING,MD,20902.0,MCPD,Street - Residential,L,4L1,329,12200.0,,JUDSON,,RD,39.05537,-77.0552,4D,"(39.0554, -77.0552)"
201399234,2501,220048431,11/03/2022 02:07:47 PM,2022-11-04 11:29:00,,250,1,Crime Against Property,Counterfeiting/Forgery,FORGERY OF CHECKS,BETHESDA,5200 BLK  VENTNOR RD,BETHESDA,MD,20816.0,MCPD,Bank/S&L/Credit Union,E,2E1,004,5200.0,,VENTNOR,,RD,38.95904,-77.1014,2D,"(38.959, -77.1014)"
201397116,2399,220045991,10/20/2022 07:00:10 AM,2022-04-30 10:00:00,,23H,1,Crime Against Property,All other Larceny,LARCENY (DESCRIBE OFFENSE),GERMANTOWN,1  BLK  STONEY POINT CT,GERMANTOWN,,20876.0,MCPD,Residence -Townhouse/Duplex,M,5M1,471,1.0,,STONEY POINT,,CT,39.18228,-77.2369,5D,"(39.1823, -77.2369)"
201264272,4104,190051674,10/27/2019 12:38:24 PM,2019-10-26 12:36:00,10/26/2019 02:00:00 PM,90G,1,Crime Against Society,Liquor Law Violations,LIQUOR - POSSESS,SILVER SPRING,8500 BLK  FENTON ST,SILVER SPRING,MD,20910.0,MCPD,Street - Commercial,G,3G1,671,8500.0,,FENTON,,ST,38.9954,-77.0244,3D,"(38.9954, -77.0244)"
201367006,2404,220009552,03/05/2022 04:49:40 PM,2022-03-05 16:49:00,,240,1,Crime Against Property,Motor Vehicle Theft,AUTO THEFT - VEHICLE THEFT,SILVER SPRING,900 BLK  ERIE AVE,TAKOMA PARK,MD,20912.0,MCPD,Residence - Apartment/Condo,H,3H1,129,900.0,,ERIE,,AVE,38.98916,-77.0001,3D,"(38.9892, -77.0001)"
201251408,2399,190037680,08/07/2019 04:23:58 PM,2019-06-10 16:00:00,06/14/2019 02:00:00 PM,23H,1,Crime Against Property,All other Larceny,LARCENY (DESCRIBE OFFENSE),SILVER SPRING,12500 BLK  PROSPERITY DR,SILVER SPRING,MD,20904.0,MCPD,Other/Unknown,I,3I1,146,12500.0,,PROSPERITY,,DR,39.06059,-76.9633,3D,"(39.0606, -76.9633)"
201289366,2305,200021033,05/27/2020 03:01:58 PM,2020-05-26 20:00:00,05/27/2020 11:00:00 AM,23F,1,Crime Against Property,Theft From Motor Vehicle,LARCENY - FROM AUTO,SILVER SPRING,8700 BLK  BRADFORD RD,SILVER SPRING,MD,20901.0,MCPD,Residence - Driveway,H,3H1,126,8700.0,,BRADFORD,,RD,38.99837,-77.0069,3D,"(38.9984, -77.0069)"
201432934,2404,230030796,06/27/2023 06:08:12 PM,2023-06-13 00:01:00,06/26/2023 11:59:00 PM,240,1,Crime Against Property,Motor Vehicle Theft,AUTO THEFT - VEHICLE THEFT,MONTGOMERY VILLAGE,,GAITHERSBURG,MD,20877.0,GPD,Street - Commercial,P,6P3,419,,,VICTORY FARM,,DR,39.14694,-77.1834,6D,"(39.1469, -77.1834)"
201343344,2305,210033711,08/29/2021 11:01:51 AM,2021-08-28 21:15:00,08/29/2021 10:45:00 AM,23F,1,Crime Against Property,Theft From Motor Vehicle,LARCENY - FROM AUTO,MONTGOMERY VILLAGE,18600 BLK  CROSS COUNTRY LA,GAITHERSBURG,MD,20879.0,MCPD,Parking Lot - Residential,R,6R3,420,18600.0,,CROSS COUNTRY,,LA,39.16266,-77.1834,6D,"(39.1627, -77.1834)"
201224083,2204,190003695,01/24/2019 06:40:16 AM,2019-01-23 17:30:00,01/24/2019 06:30:00 AM,220,1,Crime Against Property,Burglary/Breaking and Entering,BURGLARY - NO FORCED ENTRY-RESIDENTIAL,WHEATON,10800 BLK  GEORGIA AVE,SILVER SPRING,MD,20902.0,MCPD,Residence - Apartment/Condo,L,4L2,323,10800.0,,GEORGIA,,AVE,39.03193,-77.0483,4D,"(39.0319, -77.0483)"
201284563,2203,200015582,04/10/2020 04:36:37 AM,2020-04-10 04:36:00,,220,1,Crime Against Property,Burglary/Breaking and Entering,BURGLARY - FORCED ENTRY-NONRESIDENTIAL,GERMANTOWN,18900 BLK  KINGSVIEW RD,GERMANTOWN,MD,20874.0,MCPD,School/College - DO NOT USE,N,5N2,596,18900.0,,KINGSVIEW,,RD,39.16482,-77.2872,5D,"(39.1648, -77.2872)"
201412300,1313,230006219,02/07/2023 01:17:31 PM,2023-02-07 13:17:00,,13B,1,Crime Against Person,Simple Assault,ASSAULT - SIMPLE,MONTGOMERY VILLAGE,9800 BLK  MAHOGANY DR,GAITHERSBURG,MD,20878.0,MCPD,Residence - Apt Ofc/Storage,P,6P1,752,9800.0,,MAHOGANY,,DR,39.11459,-77.2017,6D,"(39.1146, -77.2017)"
201333084,2610,210020939,06/02/2021 03:01:06 PM,2021-06-02 00:00:00,,26F,1,Crime Against Property,Identity Theft,FRAUD - IDENTITY THEFT,MONTGOMERY VILLAGE,19000 BLK  RAINES DR,DERWOOD,MD,20855.0,MCPD,Other/Unknown,R,6R3,724,19000.0,,RAINES,,DR,39.17358,-77.1118,6D,"(39.1736, -77.1118)"
201361337,2902,220002852,01/22/2022 04:42:52 PM,2022-01-22 16:42:00,01/22/2022 05:14:00 PM,290,1,Crime Against Property,Destruction/Damage/Vandalism of Property,DAMAGE PROPERTY - PRIVATE,MONTGOMERY VILLAGE,19800 BLK  BAZZELLTON PL,MONTGOMERY VILLAGE,MD,20886.0,MCPD,Parking Lot - Residential,R,6R2,504,19800.0,,BAZZELLTON,,PL,39.18013,-77.193,6D,"(39.1801, -77.193)"
201238515,3562,190021604,05/07/2019 08:00:06 PM,2019-05-07 20:00:00,,35A,1,Crime Against Society,Drug/Narcotic Violations,DRUGS - MARIJUANA - POSSESS,SILVER SPRING,11200 BLK  NEW HAMPSHIRE AVE,SILVER SPRING,MD,20904.0,MCPD,Street - In vehicle,I,3I1,518,11200.0,,NEW HAMPSHIRE,,AVE,39.03978,-76.9906,3D,"(39.0398, -76.9906)"
201294280,1313,200026955,07/11/2020 04:59:34 PM,2020-07-11 16:59:00,07/11/2020 06:00:00 PM,13B,1,Crime Against Person,Simple Assault,ASSAULT - SIMPLE,ROCKVILLE,300 BLK  HURLEY AVE,ROCKVILLE,MD,20850.0,RCPD,Residence - Single Family,B,1B1,238,300.0,,HURLEY,,AVE,39.08786,-77.179,1D,"(39.0879, -77.179)"
201410335,2203,230004018,01/25/2023 04:27:45 AM,2023-01-25 04:27:00,,220,1,Crime Against Property,Burglary/Breaking and Entering,BURGLARY - FORCED ENTRY-NONRESIDENTIAL,ROCKVILLE,15500 BLK  FREDERICK RD,DERWOOD,MD,20855.0,MCPD,Auto Repair,A,1A4,280,15500.0,,FREDERICK,,RD,39.11,-77.1604,1D,"(39.11, -77.1604)"
201367275,2303,220009861,03/07/2022 06:02:10 PM,2022-03-07 11:32:00,03/07/2022 11:35:00 AM,23C,1,Crime Against Property,Shoplifting,LARCENY - SHOPLIFTING,ROCKVILLE,600 BLK  HUNGERFORD DR,ROCKVILLE,MD,20850.0,RCPD,Grocery/Supermarket,A,1A3,278,600.0,,HUNGERFORD,,DR,39.09199,-77.1532,1D,"(39.092, -77.1532)"
201431270,2303,230028909,06/16/2023 12:13:27 AM,2023-06-16 00:13:00,,23C,1,Crime Against Property,Shoplifting,LARCENY - SHOPLIFTING,ROCKVILLE,12000 BLK  ROCKVILLE PIK,ROCKVILLE,MD,20852.0,MCPD,Retail - Department/Discount Store,A,1A2,735,12000.0,,ROCKVILLE,,PIK,39.05313,-77.1167,1D,"(39.0531, -77.1167)"
201295647,5404,200028529,07/22/2020 10:32:46 PM,2020-07-22 22:30:00,07/22/2020 10:50:00 PM,90D,1,Crime Against Society,Driving Under the Influence,DRIVING UNDER THE INFLUENCE LIQUOR,ROCKVILLE,,ROCKVILLE,MD,20850.0,RCPD,Street - In vehicle,A,1A2,287,,,1ST,,ST,39.08623,-77.1355,1D,"(39.0862, -77.1355)"
201434648,1399,230033042,07/11/2023 02:26:38 PM,2023-07-11 14:26:00,,13B,1,Crime Against Person,Simple Assault,ASSAULT - 2ND DEGREE,WHEATON,12500 BLK  WINEXBURG MANOR DR,SILVER SPRING,MD,20906.0,MCPD,Residence - Apartment/Condo,J,4J1,368,12500.0,,WINEXBURG MANOR,,DR,39.06116,-77.0441,4D,"(39.0612, -77.0441)"
201398974,2902,220048283,11/02/2022 06:30:21 PM,2022-11-01 17:00:00,11/02/2022 05:00:00 PM,290,1,Crime Against Property,Destruction/Damage/Vandalism of Property,DAMAGE PROPERTY - PRIVATE,BETHESDA,4600 BLK  RANDOLPH RD,ROCKVILLE,MD,20852.0,MCPD,Residence - Yard,D,2D4,308,4600.0,,RANDOLPH,,RD,39.05355,-77.0908,2D,"(39.0536, -77.0908)"
201323517,2601,210009919,03/16/2021 09:18:04 PM,2021-03-15 00:00:00,03/16/2021 12:00:00 AM,26A,1,Crime Against Property,False Pretenses/Swindle/Confidence Game,FRAUD - CONFIDENCE GAME,BETHESDA,5700 BLK  BREWER HOUSE CIR,ROCKVILLE,MD,20852.0,MCPD,Other/Unknown,D,2D4,189,5700.0,,BREWER HOUSE,,CIR,39.03114,-77.1137,2D,"(39.0311, -77.1137)"
201262858,1399,190051093,10/24/2019 11:42:36 AM,2019-10-24 11:42:00,,13B,1,Crime Against Person,Simple Assault,ASSAULT - 2ND DEGREE,SILVER SPRING,900 BLK  ELLSWORTH DR,SILVER SPRING,MD,20910.0,MCPD,Retail - Other,G,3G1,109,900.0,,ELLSWORTH,,DR,38.99686,-77.0254,3D,"(38.9969, -77.0254)"
201226198,1399,190006400,02/09/2019 10:31:44 AM,2019-02-09 10:31:00,,13B,1,Crime Against Person,Simple Assault,ASSAULT - 2ND DEGREE,SILVER SPRING,900 BLK  WAYNE AVE,SILVER SPRING,MD,20910.0,MCPD,Library,G,3G1,670,900.0,,WAYNE,,AVE,38.9954,-77.0244,3D,"(38.9954, -77.0244)"
201426299,5707,230022844,05/12/2023 04:30:39 PM,2023-05-12 16:30:00,,90J,1,Crime Against Society,Trespass of Real Property,TRESPASSING,SILVER SPRING,8400 BLK  GEORGIA AVE,SILVER SPRING,MD,20910.0,MCPD,Convenience Store,G,3G1,094,8400.0,,GEORGIA,,AVE,38.99349,-77.0267,3D,"(38.9935, -77.0267)"
201234464,2301,190016618,04/10/2019 12:21:48 AM,2019-04-05 11:00:00,04/05/2019 11:30:00 AM,23A,1,Crime Against Property,Pocket/picking,LARCENY - POCKET PICKING,ROCKVILLE,500 BLK E GUDE DR,ROCKVILLE,MD,20850.0,MCPD,Restaurant,A,1A3,282,500.0,E,GUDE,,DR,39.10631,-77.1467,1D,"(39.1063, -77.1467)"
201265752,2308,190055588,11/18/2019 09:35:49 AM,2019-11-17 11:00:00,,23D,1,Crime Against Property,Theft from Building,LARCENY - FROM BLDG,WHEATON,11200 BLK  GEORGIA AVE,SILVER SPRING,MD,20902.0,MCPD,Grocery/Supermarket,L,4L2,324,11200.0,,GEORGIA,,AVE,39.03867,-77.0508,4D,"(39.0387, -77.0508)"
201445610,2202,230057013,09/26/2023 05:20:52 PM,2023-09-26 08:00:00,09/26/2023 04:00:00 PM,220,1,Crime Against Property,Burglary/Breaking and Entering,BURGLARY - FORCED ENTRY-RESIDENTIAL,ROCKVILLE,900 BLK  BALTIMORE RD,ROCKVILLE,MD,20851.0,RCPD,Residence - Single Family,A,1A2,291,900.0,,BALTIMORE,,RD,39.08444,-77.1344,1D,"(39.0844, -77.1344)"
201411998,2610,230005999,02/06/2023 10:53:51 AM,2023-02-06 10:00:00,,26F,1,Crime Against Property,Identity Theft,IDENTITY THEFT,WHEATON,18900 BLK  ABBEY MANOR DR,BROOKEVILLE,MD,20833.0,MCPD,Other/Unknown,J,4J2,682,18900.0,,ABBEY MANOR,,DR,39.16395,-77.0564,4D,"(39.164, -77.0564)"
201305192,2305,200039840,10/09/2020 08:22:12 PM,2020-10-09 20:42:00,,23F,1,Crime Against Property,Theft From Motor Vehicle,LARCENY - FROM AUTO,ROCKVILLE,15900 BLK  FREDERICK RD,DERWOOD,MD,20855.0,MCPD,Bank/S&L/Credit Union,A,1A4,438,15900.0,,FREDERICK,,RD,39.11561,-77.1662,1D,"(39.1156, -77.1662)"
201290992,1302,200023039,06/11/2020 10:52:48 PM,2020-06-11 22:52:00,,13A,1,Crime Against Person,Aggravated Assault,ASSAULT - AGGRAVATED - FAMILY-OTHER WEAPON,GERMANTOWN,19300 BLK  WHITE GROUND RD,BOYDS,MD,20841.0,MCPD,Residence - Single Family,N,5N2,585,19300.0,,WHITE GROUND,,RD,39.17228,-77.329,5D,"(39.1723, -77.329)"
201405884,1103,220056716,12/21/2022 07:04:15 PM,2022-12-18 23:00:00,,11A,1,Crime Against Person,Forcible Rape,RAPE - STRONG-ARM,GERMANTOWN,18800 BLK  BENT WILLOW CIR,GERMANTOWN,MD,20874.0,MCPD,Residence - Apartment/Condo,N,5N1,447,18800.0,,BENT WILLOW,,CIR,39.16366,-77.2602,5D,"(39.1637, -77.2602)"
201300274,1302,200033867,08/30/2020 03:23:25 AM,2020-08-30 03:23:00,,13A,1,Crime Against Person,Aggravated Assault,ASSAULT - AGGRAVATED - FAMILY-OTHER WEAPON,GERMANTOWN,18400 BLK  BROAD LEAF RD,BOYDS,MD,20841.0,MCPD,Residence - Single Family,N,5N2,464,18400.0,,BROAD LEAF,,RD,39.16193,-77.2977,5D,"(39.1619, -77.2977)"
201240885,3562,190024520,05/23/2019 01:40:56 PM,2019-05-23 13:40:00,,35A,1,Crime Against Society,Drug/Narcotic Violations,DRUGS - MARIJUANA - POSSESS,WHEATON,2400 BLK  BEL PRE RD,SILVER SPRING,MD,20906.0,MCPD,School/College - DO NOT USE,K,4K1,349,2400.0,,BEL PRE,,RD,39.09045,-77.0504,4D,"(39.0904, -77.0504)"
201359911,2305,220001149,01/10/2022 04:01:57 PM,2022-01-10 13:00:00,01/10/2022 02:00:00 PM,23F,1,Crime Against Property,Theft From Motor Vehicle,LARCENY - FROM AUTO,ROCKVILLE,1  BLK  MARYLAND AVE,ROCKVILLE,MD,20850.0,RCPD,Parking Garage - Commercial,A,1A3,277,1.0,,MARYLAND,,AVE,39.14486,-77.2027,1D,"(39.1449, -77.2027)"
201272018,2305,200000167,01/02/2020 05:31:23 AM,2020-01-02 05:31:00,01/02/2020 06:30:00 AM,23F,1,Crime Against Property,Theft From Motor Vehicle,LARCENY - FROM AUTO,MONTGOMERY VILLAGE,9800 BLK  DELLCASTLE RD,MONTGOMERY VILLAGE,MD,20886.0,MCPD,Residence - Garage,R,6R2,422,9800.0,,DELLCASTLE,,RD,39.18522,-77.2036,6D,"(39.1852, -77.2036)"
201372254,1116,220015827,04/14/2022 12:11:36 PM,2022-04-14 12:11:00,04/14/2022 12:00:00 AM,36B,1,Crime Against Person,Statuory Rape,STATUTORY RAPE - NO FORCE,BETHESDA,11700 BLK  PARKLAWN DR,ROCKVILLE,MD,20852.0,MCPD,Residence - Single Family,D,2D4,523,11700.0,,PARKLAWN,,DR,39.04696,-77.1027,2D,"(39.047, -77.1027)"
201414620,5311,230009052,02/23/2023 10:54:07 AM,2022-10-22 23:10:00,,90C,1,Crime Against Society,Disorderly Conduct,PUBLIC PEACE - DISORDERLY CONDUCT,MONTGOMERY VILLAGE,500 BLK S FREDERICK AVE,GAITHERSBURG,MD,20877.0,MCPD,Residence - Apartment/Condo,P,6P3,433,500.0,S,FREDERICK,,AVE,39.14893,-77.2076,6D,"(39.1489, -77.2076)"
201267235,2404,190057453,,2019-11-27 10:00:00,11/27/2019 09:30:00 PM,240,1,Crime Against Property,Motor Vehicle Theft,AUTO THEFT - VEHICLE THEFT,SILVER SPRING,8700 BLK  RAMSEY AVE,SILVER SPRING,MD,20910.0,MCPD,Street - Other,G,3G1,095,8700.0,,RAMSEY,,AVE,38.9961,-77.0298,3D,"(38.9961, -77.0298)"
201360805,5203,220002223,01/18/2022 03:34:42 PM,2022-01-18 15:34:00,,520,1,Crime Against Society,Weapon Law Violations,CARRYING PROHIBITED WEAPON (SPECIFY WEAPON),GERMANTOWN,22500 BLK  WIMS RD,CLARKSBURG,MD,20871.0,MCPD,School - Elementary/Secondary,M,5M3,598,22500.0,,WIMS,,RD,39.22544,-77.2647,5D,"(39.2254, -77.2647)"
201279598,2303,200009770,02/27/2020 03:18:20 PM,2020-02-27 15:11:00,02/27/2020 03:15:00 PM,23C,1,Crime Against Property,Shoplifting,LARCENY - SHOPLIFTING,WHEATON,11100 BLK  VEIRS MILL RD,SILVER SPRING,MD,20902.0,MCPD,Retail - Drug Store/Pharmacy,L,4L2,321,11100.0,,VEIRS MILL,,RD,39.03758,-77.0519,4D,"(39.0376, -77.0519)"
201403730,2305,220053985,12/07/2022 06:14:14 AM,2022-12-07 05:45:00,12/07/2022 05:50:00 AM,23F,1,Crime Against Property,Theft From Motor Vehicle,LARCENY - FROM AUTO,BETHESDA,9800 BLK  HILLRIDGE DR,KENSINGTON,MD,20895.0,MCPD,Residence - Single Family,D,2D3,697,9800.0,,HILLRIDGE,,DR,39.01695,-77.0688,2D,"(39.017, -77.0688)"
201262861,2305,190051495,10/26/2019 11:45:25 AM,2019-10-25 22:00:00,10/26/2019 10:30:00 AM,23F,1,Crime Against Property,Theft From Motor Vehicle,LARCENY - FROM AUTO,SILVER SPRING,1100 BLK W NOLCREST DR,SILVER SPRING,MD,20903.0,MCPD,Street - Residential,H,3H2,144,1100.0,W,NOLCREST,,DR,39.03115,-76.99,3D,"(39.0311, -76.99)"
201283814,1399,200014737,04/01/2020 06:01:26 PM,2020-04-01 18:01:00,,13B,1,Crime Against Person,Simple Assault,ASSAULT - 2ND DEGREE,BETHESDA,4500 BLK  AVONDALE ST,BETHESDA,MD,20814.0,MCPD,Residence - Apartment/Condo,D,2D2,047,4500.0,,AVONDALE,,ST,38.98623,-77.0922,2D,"(38.9862, -77.0922)"
201445443,2404,230056816,,2023-09-25 07:00:00,09/25/2023 03:45:00 PM,240,1,Crime Against Property,Motor Vehicle Theft,AUTO THEFT - VEHICLE THEFT,BETHESDA,4900 BLK  AUBURN AVE,BETHESDA,MD,20814.0,MCPD,Parking Garage - Commercial,D,2D2,049,4900.0,,AUBURN,,AVE,0.0,0.0,2D,"(0.0, 0.0)"
201436044,2203,230034690,07/21/2023 06:24:58 AM,2023-07-21 06:24:00,,220,1,Crime Against Property,Burglary/Breaking and Entering,BURGLARY - FORCED ENTRY-NONRESIDENTIAL,SILVER SPRING,11200 BLK  NEW HAMPSHIRE AVE,SILVER SPRING,MD,20904.0,MCPD,Restaurant,I,3I1,518,11200.0,,NEW HAMPSHIRE,,AVE,39.03978,-76.9906,3D,"(39.0398, -76.9906)"
201249267,2305,190034822,07/22/2019 03:08:30 PM,2019-07-18 19:00:00,07/20/2019 02:00:00 PM,23F,1,Crime Against Property,Theft From Motor Vehicle,LARCENY - FROM AUTO,WHEATON,10700 BLK  CASPER ST,KENSINGTON,MD,20895.0,MCPD,Street - Residential,L,4L2,322,10700.0,,CASPER,,ST,39.03163,-77.0569,4D,"(39.0316, -77.0569)"
201436474,2605,230035257,07/24/2023 11:40:04 AM,2023-07-23 00:00:00,07/24/2023 04:00:00 PM,26B,1,Crime Against Property,Credit Card/Automatic Teller Machine Fraud,FRAUD - ILLEGAL USE CREDIT CARDS,MONTGOMERY VILLAGE,20400 BLK  LINDOS CT,MONTGOMERY VILLAGE,MD,20886.0,MCPD,Cyberspace,R,6R2,714,20400.0,,LINDOS,,CT,39.18903,-77.179,6D,"(39.189, -77.179)"
201328750,3614,210009008,,2020-12-21 14:15:00,,90C,1,Crime Against Society,Disorderly Conduct,INDECENT EXPOSURE TO MINOR,WHEATON,3400 BLK  OLNEY LAYTONSVILLE RD,OLNEY,MD,20832.0,MCPD,Parking Lot - Commercial,J,4J2,399,3400.0,,OLNEY LAYTONSVILLE,,RD,39.15322,-77.0668,4D,"(39.1532, -77.0668)"
201258126,2303,190045993,09/25/2019 02:17:19 PM,2019-09-25 14:17:00,,23C,1,Crime Against Property,Shoplifting,LARCENY - SHOPLIFTING,WHEATON,11100 BLK  VEIRS MILL RD,SILVER SPRING,MD,20902.0,MCPD,Retail - Department/Discount Store,L,4L2,321,11100.0,,VEIRS MILL,,RD,39.03758,-77.0519,4D,"(39.0376, -77.0519)"
201243681,3562,190028117,06/12/2019 08:04:33 PM,2019-06-12 23:04:00,,35A,1,Crime Against Society,Drug/Narcotic Violations,DRUGS - MARIJUANA - POSSESS,GERMANTOWN,22700 BLK  SWEET SHRUB DR,CLARKSBURG,MD,20871.0,MCPD,Parking Lot - Commercial,M,5M3,476,22700.0,,SWEET SHRUB,,DR,39.22965,-77.2507,5D,"(39.2296, -77.2507)"
201448695,2404,230060809,10/16/2023 09:04:32 AM,2023-10-15 18:00:00,10/16/2023 08:30:00 AM,240,1,Crime Against Property,Motor Vehicle Theft,AUTO THEFT - VEHICLE THEFT,SILVER SPRING,3900 BLK  GREENCASTLE RIDGE DR,BURTONSVILLE,MD,20866.0,MCPD,Parking Lot - Residential,I,3I2,380,3900.0,,GREENCASTLE RIDGE,,DR,39.07667,-76.9305,3D,"(39.0767, -76.9305)"
201364875,2699,220007147,02/18/2022 01:01:36 PM,2022-02-17 09:00:00,,26A,1,Crime Against Property,False Pretenses/Swindle/Confidence Game,FRAUD (DESCRIBE OFFENSE),SILVER SPRING,300 BLK  PLYMOUTH ST,SILVER SPRING,MD,20901.0,MCPD,Other/Unknown,H,3H1,127,300.0,,PLYMOUTH,,ST,39.00169,-77.0046,3D,"(39.0017, -77.0046)"
201223637,5404,190002066,01/14/2019 12:04:46 AM,2019-01-14 00:46:00,,90D,1,Crime Against Society,Driving Under the Influence,DRIVING UNDER THE INFLUENCE LIQUOR,WHEATON,,SILVER SPRING,MD,20906.0,MCPD,Street - In vehicle,J,4J1,368,,,RANDOLPH,,RD,39.07542,-77.0039,4D,"(39.0754, -77.0039)"
201401201,1116,220050971,,2022-11-18 08:11:00,11/18/2022 08:11:00 AM,36B,1,Crime Against Person,Statuory Rape,STATUTORY RAPE - NO FORCE,TAKOMA PARK,1000 BLK  LARCH AVE,TAKOMA PARK,MD,20912.0,TPPD,School - Elementary/Secondary,T,8T3,808,1000.0,,LARCH,,AVE,38.97767,-76.9918,TPPD,"(38.9777, -76.9918)"
201249704,2303,190035562,07/26/2019 12:03:55 PM,2019-07-26 11:55:00,,23C,1,Crime Against Property,Shoplifting,LARCENY - SHOPLIFTING,MONTGOMERY VILLAGE,18200 BLK  CONTOUR RD,GAITHERSBURG,MD,20877.0,MCPD,Retail - Department/Discount Store,R,6R1,505,18200.0,,CONTOUR,,RD,39.15572,-77.1997,6D,"(39.1557, -77.1997)"
201355679,2202,210049375,,2021-12-05 15:43:00,,220,1,Crime Against Property,Burglary/Breaking and Entering,BURGLARY - FORCED ENTRY-RESIDENTIAL,MONTGOMERY VILLAGE,700 BLK  QUINCE ORCHARD BLV,GAITHERSBURG,MD,20878.0,GPD,Residence - Apartment/Condo,P,6P2,554,700.0,,QUINCE ORCHARD,,BLV,39.14181,-77.2244,6D,"(39.1418, -77.2244)"
201267792,2308,190056045,11/20/2019 02:03:41 PM,2019-11-19 14:03:00,,23D,1,Crime Against Property,Theft from Building,LARCENY - FROM BLDG,BETHESDA,7200 BLK  WOODMONT AVE,BETHESDA,MD,20814.0,MCPD,Restaurant,D,2D2,033,7200.0,,WOODMONT,,AVE,38.98098,-77.095,2D,"(38.981, -77.095)"
201365821,5707,220008048,02/24/2022 05:10:12 AM,2022-02-24 05:10:00,,90J,1,Crime Against Society,Trespass of Real Property,TRESPASSING,SILVER SPRING,1200 BLK E WEST HWY,SILVER SPRING,MD,20910.0,MCPD,Residence - Apartment/Condo,G,3G1,089,1200.0,E,WEST,,HWY,39.12378,-77.2033,3D,"(39.1238, -77.2033)"
201393055,2605,220041009,09/20/2022 07:29:17 PM,2022-09-01 00:01:00,09/05/2022 11:59:00 PM,26B,1,Crime Against Property,Credit Card/Automatic Teller Machine Fraud,FRAUD - ILLEGAL USE CREDIT CARDS,SILVER SPRING,1700 BLK  HAMPSHIRE GREEN LA,SILVER SPRING,MD,20903.0,MCPD,Other/Unknown,H,3H2,138,1700.0,,HAMPSHIRE GREEN,,LA,39.01506,-76.9761,3D,"(39.0151, -76.9761)"
201254882,2305,190041922,09/02/2019 12:33:35 AM,2019-08-31 23:30:00,09/01/2019 02:00:00 AM,23F,1,Crime Against Property,Theft From Motor Vehicle,LARCENY - FROM AUTO,ROCKVILLE,100 BLK  GIBBS ST,ROCKVILLE,MD,20850.0,MCPD,Parking Garage - Commercial,A,1A3,277,100.0,,GIBBS,,ST,39.08571,-77.1519,1D,"(39.0857, -77.1519)"
201265480,1313,190055275,11/16/2019 08:24:15 AM,2019-11-16 08:24:00,,13B,1,Crime Against Person,Simple Assault,ASSAULT - SIMPLE,MONTGOMERY VILLAGE,1  BLK N SUMMIT DR,GAITHERSBURG,MD,20877.0,GPD,Residence - Apartment/Condo,P,6P3,419,1.0,N,SUMMIT,,DR,39.14581,-77.1925,6D,"(39.1458, -77.1925)"
201268024,2303,190058429,,2019-12-04 14:24:00,,23C,1,Crime Against Property,Shoplifting,LARCENY - SHOPLIFTING,GERMANTOWN,20600 BLK  SENECA MEADOWS PKW,GERMANTOWN,MD,20876.0,MCPD,Grocery/Supermarket,M,5M1,701,20600.0,,SENECA MEADOWS,,PKW,39.1985,-77.2561,5D,"(39.1985, -77.2561)"
201336237,2303,210024827,06/28/2021 05:32:57 PM,2021-06-28 17:32:00,,23C,1,Crime Against Property,Shoplifting,LARCENY - SHOPLIFTING,ROCKVILLE,12000 BLK  ROCKVILLE PIK,ROCKVILLE,MD,20852.0,MCPD,Retail - Department/Discount Store,A,1A2,735,12000.0,,ROCKVILLE,,PIK,39.05313,-77.1167,1D,"(39.0531, -77.1167)"
201312584,3550,200048745,12/10/2020 10:49:21 PM,2020-12-10 22:49:00,,35B,1,Crime Against Society,Drug Equipment Violations,DRUGS - NARCOTIC EQUIP - POSSESS,MONTGOMERY VILLAGE,100 BLK  DUVALL LA,GAITHERSBURG,MD,20877.0,GPD,Street - In vehicle,P,6P1,434,100.0,,DUVALL,,LA,39.13036,-77.204,6D,"(39.1304, -77.204)"
201242421,1399,190026582,06/04/2019 07:01:03 AM,2019-06-04 07:01:00,,13B,1,Crime Against Person,Simple Assault,ASSAULT - 2ND DEGREE,SILVER SPRING,1  BLK  ALMANAC CT,BURTONSVILLE,MD,20866.0,MCPD,Residence -Townhouse/Duplex,I,3I2,381,1.0,,ALMANAC,,CT,39.09424,-76.9312,3D,"(39.0942, -76.9312)"
201301228,2903,200035136,09/08/2020 09:04:36 AM,2020-09-07 16:16:00,,290,1,Crime Against Property,Destruction/Damage/Vandalism of Property,DAMAGE PROPERTY - PUBLIC,MONTGOMERY VILLAGE,1  BLK  TEACHERS WAY,GAITHERSBURG,MD,20877.0,GPD,School/College - DO NOT USE,P,6P3,419,1.0,,TEACHERS,,WAY,39.14315,-77.1894,6D,"(39.1431, -77.1894)"
201302250,5311,200036354,09/16/2020 07:47:20 PM,2020-09-16 19:47:00,,90C,1,Crime Against Society,Disorderly Conduct,PUBLIC PEACE - DISORDERLY CONDUCT,ROCKVILLE,15800 BLK  REDLAND RD,DERWOOD,MD,20855.0,MCPD,Commercial - Office Building,A,1A4,438,15800.0,,REDLAND,,RD,39.11561,-77.1662,1D,"(39.1156, -77.1662)"
201360537,2303,220001552,01/13/2022 12:56:22 PM,2022-01-13 12:47:00,01/13/2022 02:00:00 PM,23C,1,Crime Against Property,Shoplifting,LARCENY - SHOPLIFTING,WHEATON,14000 BLK  GEORGIA AVE,SILVER SPRING,MD,20906.0,MCPD,Retail - Hardware,K,4K2,342,14000.0,,GEORGIA,,AVE,39.08376,-77.0778,4D,"(39.0838, -77.0778)"
201283642,1399,200014485,03/30/2020 12:49:30 PM,2020-03-30 12:49:00,,13B,1,Crime Against Person,Simple Assault,ASSAULT - 2ND DEGREE,WHEATON,3200 BLK  WEEPING WILLOW CT,SILVER SPRING,MD,20906.0,MCPD,Residence - Apartment/Condo,K,4K1,348,3200.0,,WEEPING WILLOW,,CT,39.08999,-77.0691,4D,"(39.09, -77.0691)"
201314883,2202,210000037,01/01/2021 05:55:30 AM,2021-01-01 05:55:00,,220,1,Crime Against Property,Burglary/Breaking and Entering,BURGLARY - FORCED ENTRY-RESIDENTIAL,WHEATON,10800 BLK  GEORGIA AVE,SILVER SPRING,MD,20902.0,MCPD,Residence - Apartment/Condo,L,4L2,323,10800.0,,GEORGIA,,AVE,39.03193,-77.0483,4D,"(39.0319, -77.0483)"
201421347,1399,230016839,04/08/2023 07:20:01 PM,2023-04-08 19:20:00,,13B,1,Crime Against Person,Simple Assault,ASSAULT - 2ND DEGREE,WHEATON,13600 BLK  GEORGIA AVE,SILVER SPRING,MD,20906.0,MCPD,Grocery/Supermarket,K,4K1,348,13600.0,,GEORGIA,,AVE,39.07828,-77.0718,4D,"(39.0783, -77.0718)"
201337170,2303,210025957,07/06/2021 04:31:17 PM,2021-07-06 16:14:00,07/06/2021 04:33:00 PM,23C,1,Crime Against Property,Shoplifting,LARCENY - SHOPLIFTING,GERMANTOWN,20900 BLK  FREDERICK RD,GERMANTOWN,MD,20876.0,MCPD,Retail - Department/Discount Store,M,5M1,701,20900.0,,FREDERICK,,RD,39.19829,-77.2448,5D,"(39.1983, -77.2448)"
201419470,2699,230012958,03/17/2023 11:04:45 AM,2023-03-09 12:00:00,,26A,1,Crime Against Property,False Pretenses/Swindle/Confidence Game,FRAUD (DESCRIBE OFFENSE),WHEATON,17900 BLK  SKYMEADOW WAY,SANDY SPRING,MD,20860.0,MCPD,Other/Unknown,J,4J2,641,17900.0,,SKYMEADOW,,WAY,39.14939,-77.0252,4D,"(39.1494, -77.0252)"
201317139,2399,210002656,01/21/2021 06:54:59 PM,2021-01-20 15:30:00,01/20/2021 04:00:00 PM,23H,1,Crime Against Property,All other Larceny,LARCENY (DESCRIBE OFFENSE),BETHESDA,7300 BLK  WISCONSIN AVE,BETHESDA,MD,20814.0,MCPD,Street - Commercial,D,2D2,034,7300.0,,WISCONSIN,,AVE,38.98224,-77.0931,2D,"(38.9822, -77.0931)"
201420449,2605,230015781,04/02/2023 01:38:32 PM,2023-04-01 21:30:00,,26B,1,Crime Against Property,Credit Card/Automatic Teller Machine Fraud,FRAUD - ILLEGAL USE CREDIT CARDS,SILVER SPRING,8700 BLK  1ST AVE,SILVER SPRING,MD,20910.0,MCPD,Other/Unknown,G,3G1,095,8700.0,,1ST,,AVE,38.99738,-77.0317,3D,"(38.9974, -77.0317)"
201300354,2404,200034060,08/31/2020 04:35:45 PM,2020-05-22 08:22:00,07/21/2020 08:00:00 AM,240,1,Crime Against Property,Motor Vehicle Theft,AUTO THEFT - VEHICLE THEFT,SILVER SPRING,12100 BLK  TECH RD,SILVER SPRING,MD,20904.0,MCPD,Street - Commercial,I,3I1,146,12100.0,,TECH,,RD,39.05342,-76.9683,3D,"(39.0534, -76.9683)"
201338298,2303,210027444,07/15/2021 11:22:52 PM,2021-07-15 18:20:00,07/15/2021 08:00:00 PM,23C,1,Crime Against Property,Shoplifting,LARCENY - SHOPLIFTING,BETHESDA,4800 BLK  BOILING BROOK PKW,ROCKVILLE,MD,20852.0,MCPD,Convenience Store,D,2D4,523,4800.0,,BOILING BROOK,,PKW,39.04591,-77.0955,2D,"(39.0459, -77.0955)"
201277835,2202,200007633,02/14/2020 11:27:48 PM,2020-02-14 23:27:00,02/14/2020 10:30:00 PM,220,1,Crime Against Property,Burglary/Breaking and Entering,BURGLARY - FORCED ENTRY-RESIDENTIAL,BETHESDA,10800 BLK  BARN WOOD LA,POTOMAC,MD,20854.0,MCPD,Residence - Single Family,E,2E4,231,10800.0,,BARN WOOD,,LA,39.03458,-77.2207,2D,"(39.0346, -77.2207)"
201414876,2999,230009337,02/24/2023 03:33:28 PM,2023-02-24 15:33:00,02/24/2023 02:40:00 PM,290,1,Crime Against Property,Destruction/Damage/Vandalism of Property,DAMAGE PROPERTY (DESCRIBE OFFENSE),ROCKVILLE,10700 BLK  GAINSBOROUGH RD,POTOMAC,MD,20854.0,MCPD,School - Elementary/Secondary,B,1B1,221,10700.0,,GAINSBOROUGH,,RD,39.03052,-77.1727,1D,"(39.0305, -77.1727)"
201416665,1313,230011398,03/08/2023 01:33:07 PM,2023-03-08 13:33:00,03/08/2023 02:30:00 PM,13B,1,Crime Against Person,Simple Assault,ASSAULT - SIMPLE,MONTGOMERY VILLAGE,16500 BLK S FREDERICK AVE,GAITHERSBURG,MD,20877.0,MCPD,Retail - Other,P,6P3,437,16500.0,S,FREDERICK,,AVE,39.05909,-77.1162,6D,"(39.0591, -77.1162)"
201291360,2902,200023488,06/15/2020 03:46:41 PM,2020-06-13 23:00:00,06/14/2020 10:30:00 PM,290,1,Crime Against Property,Destruction/Damage/Vandalism of Property,DAMAGE PROPERTY - PRIVATE,ROCKVILLE,16600 BLK  BAEDERWOOD LA,DERWOOD,MD,20855.0,MCPD,Street - Residential,A,1A4,414,16600.0,,BAEDERWOOD,,LA,39.12813,-77.1544,1D,"(39.1281, -77.1544)"
201292671,1313,200025087,06/27/2020 08:21:44 PM,2020-06-27 20:21:00,,13B,1,Crime Against Person,Simple Assault,ASSAULT - SIMPLE,TAKOMA PARK,8000 BLK  FLOWER AVE,TAKOMA PARK,MD,20912.0,TPPD,Restaurant,T,8T2,803,8000.0,,FLOWER,,AVE,38.9888,-77.001,TPPD,"(38.9888, -77.001)"
201264612,2601,190054271,11/10/2019 11:19:37 PM,2019-10-21 12:00:00,11/11/2019 12:00:00 AM,26A,1,Crime Against Property,False Pretenses/Swindle/Confidence Game,FRAUD - CONFIDENCE GAME,BETHESDA,4500 BLK  SANGAMORE RD,BETHESDA,MD,20816.0,MCPD,Residence - Apartment/Condo,E,2E1,003,4500.0,,SANGAMORE,,RD,38.94865,-77.1181,2D,"(38.9487, -77.1181)"
201438587,1103,230048330,08/08/2023 06:40:19 AM,2023-08-08 05:00:00,,11A,1,Crime Against Person,Forcible Rape,RAPE - STRONG-ARM,MONTGOMERY VILLAGE,700 BLK  CLOPPER RD,GAITHERSBURG,MD,20878.0,GPD,Street - In vehicle,P,6P2,555,700.0,,CLOPPER,,RD,39.14368,-77.2237,6D,"(39.1437, -77.2237)"
201380205,1399,220025397,06/13/2022 02:03:15 PM,2022-06-13 14:03:00,,13B,1,Crime Against Person,Simple Assault,ASSAULT - 2ND DEGREE,WHEATON,12000 BLK  JUDSON RD,SILVER SPRING,MD,20902.0,MCPD,Residence - Single Family,L,4L1,329,12000.0,,JUDSON,,RD,39.05264,-77.0587,4D,"(39.0526, -77.0587)"
201339851,2304,210029419,07/29/2021 01:35:11 PM,2021-07-14 12:00:00,07/19/2021 12:00:00 PM,23G,1,Crime Against Property,Theft of Motor Vehicle Parts or Accessories,LARCENY - AUTO PARTS,MONTGOMERY VILLAGE,300 BLK E DIAMOND AVE,GAITHERSBURG,MD,20877.0,MCPD,Parking Lot - Residential,P,6P3,419,300.0,E,DIAMOND,,AVE,39.14219,-77.1933,6D,"(39.1422, -77.1933)"
201346047,2304,210037152,09/20/2021 03:54:22 PM,2021-09-15 18:00:00,09/20/2021 02:00:00 PM,23G,1,Crime Against Property,Theft of Motor Vehicle Parts or Accessories,LARCENY - AUTO PARTS,ROCKVILLE,12400 BLK  WASHINGTON AVE,ROCKVILLE,MD,20852.0,MCPD,Commercial - Office Building,A,1A2,302,12400.0,,WASHINGTON,,AVE,39.0591,-77.115,1D,"(39.0591, -77.115)"
201371109,2304,220014419,04/05/2022 08:10:09 AM,2022-04-03 17:00:00,04/05/2022 07:10:00 AM,23G,1,Crime Against Property,Theft of Motor Vehicle Parts or Accessories,LARCENY - AUTO PARTS,WHEATON,3900 BLK  BEL PRE RD,SILVER SPRING,MD,20906.0,MCPD,Parking Lot - Residential,K,4K1,534,3900.0,,BEL PRE,,RD,39.09379,-77.0762,4D,"(39.0938, -77.0762)"
201236838,2305,190019506,04/26/2019 03:43:46 AM,2019-04-26 03:41:00,04/26/2019 06:22:00 AM,23F,1,Crime Against Property,Theft From Motor Vehicle,LARCENY - FROM AUTO,WHEATON,3900 BLK  BEL PRE RD,SILVER SPRING,MD,20906.0,MCPD,Parking Lot - Residential,K,4K1,534,3900.0,,BEL PRE,,RD,39.09379,-77.0762,4D,"(39.0938, -77.0762)"
201316488,2902,210000964,01/08/2021 02:47:42 PM,2021-01-08 14:47:00,,290,1,Crime Against Property,Destruction/Damage/Vandalism of Property,DAMAGE PROPERTY - PRIVATE,SILVER SPRING,3600 BLK  ALPEN GREEN WAY,BURTONSVILLE,MD,20866.0,MCPD,Residence -Townhouse/Duplex,I,3I2,381,3600.0,,ALPEN GREEN,,WAY,39.09871,-76.9346,3D,"(39.0987, -76.9346)"
201402776,2303,220052825,11/30/2022 12:22:18 PM,2022-11-30 12:22:00,,23C,1,Crime Against Property,Shoplifting,LARCENY - SHOPLIFTING,WHEATON,11100 BLK  VEIRS MILL RD,SILVER SPRING,MD,20902.0,MCPD,Retail - Mall,L,4L2,321,11100.0,,VEIRS MILL,,RD,39.03758,-77.0519,4D,"(39.0376, -77.0519)"
201306572,2303,200041513,10/21/2020 10:12:25 AM,2020-10-20 23:37:00,10/20/2020 11:43:00 PM,23C,1,Crime Against Property,Shoplifting,LARCENY - SHOPLIFTING,SILVER SPRING,10100 BLK  NEW HAMPSHIRE AVE,SILVER SPRING,MD,20903.0,MCPD,Grocery/Supermarket,H,3H2,140,10100.0,,NEW HAMPSHIRE,,AVE,39.02039,-76.9766,3D,"(39.0204, -76.9766)"
201305522,2902,200040244,10/12/2020 11:25:19 PM,2020-10-12 22:55:00,,290,1,Crime Against Property,Destruction/Damage/Vandalism of Property,DAMAGE PROPERTY - PRIVATE,MONTGOMERY VILLAGE,,MONTGOMERY VILLAGE,MD,20886.0,MCPD,Street - In vehicle,R,6R1,766,,,CHRISTOPHER,,AVE,39.15952,-77.209,6D,"(39.1595, -77.209)"
201348108,3523,210039740,10/06/2021 02:07:09 AM,2021-10-06 02:07:00,,35A,1,Crime Against Society,Drug/Narcotic Violations,DRUGS - OPIUM OR DERIVATIVE (DESCRIBE OFFENSE),SILVER SPRING,8000 BLK  13TH ST,SILVER SPRING,MD,20910.0,MCPD,Hotel/Motel/Etc.,G,3G1,090,8000.0,,13TH,,ST,38.98692,-77.0296,3D,"(38.9869, -77.0296)"
201352411,2305,210045280,11/08/2021 08:14:32 PM,2021-11-07 17:00:00,11/08/2021 10:00:00 AM,23F,1,Crime Against Property,Theft From Motor Vehicle,LARCENY - FROM AUTO,BETHESDA,7800 BLK  ORACLE PL,POTOMAC,MD,20854.0,MCPD,Residence - Driveway,E,2E3,520,7800.0,,ORACLE,,PL,39.03226,-77.1584,2D,"(39.0323, -77.1584)"
201264674,4104,190054341,,2019-11-11 13:40:00,11/11/2019 01:50:00 PM,90G,1,Crime Against Society,Liquor Law Violations,LIQUOR - POSSESS,SILVER SPRING,8100 BLK  GEORGIA AVE,SILVER SPRING,MD,20910.0,MCPD,Parking Lot - County,G,3G1,094,8100.0,,GEORGIA,,AVE,38.99064,-77.0266,3D,"(38.9906, -77.0266)"
201239968,2305,190023482,05/18/2019 08:06:11 AM,2019-05-17 23:00:00,05/18/2019 08:00:00 AM,23F,1,Crime Against Property,Theft From Motor Vehicle,LARCENY - FROM AUTO,SILVER SPRING,700 BLK  THAYER AVE,SILVER SPRING,MD,20910.0,MCPD,Residence - Driveway,G,3G1,515,700.0,,THAYER,,AVE,38.99319,-77.0195,3D,"(38.9932, -77.0195)"
201378104,2404,220022856,05/28/2022 02:32:56 PM,2022-05-28 13:00:00,05/28/2022 02:15:00 PM,240,1,Crime Against Property,Motor Vehicle Theft,AUTO THEFT - VEHICLE THEFT,WHEATON,11100 BLK  VEIRS MILL RD,SILVER SPRING,MD,20902.0,MCPD,Parking Lot - Commercial,L,4L2,321,11100.0,,VEIRS MILL,,RD,39.03758,-77.0519,4D,"(39.0376, -77.0519)"
201255183,3562,190042152,09/03/2019 02:06:26 PM,2019-09-03 14:06:00,,35A,1,Crime Against Society,Drug/Narcotic Violations,DRUGS - MARIJUANA - POSSESS,GERMANTOWN,,GERMANTOWN,MD,20874.0,MCPD,Street - In vehicle,N,5N1,702,,,AIRCRAFT,,DR,39.18418,-77.2618,5D,"(39.1842, -77.2618)"
201340305,2404,210030031,08/02/2021 09:09:30 PM,2021-08-02 21:09:00,08/02/2021 09:09:00 PM,240,1,Crime Against Property,Motor Vehicle Theft,AUTO THEFT - VEHICLE THEFT,SILVER SPRING,600 BLK  NORTHAMPTON DR,SILVER SPRING,MD,20903.0,MCPD,Parking Lot - Residential,H,3H2,137,600.0,,NORTHAMPTON,,DR,39.00777,-76.9866,3D,"(39.0078, -76.9866)"
201372249,1313,220015830,04/14/2022 01:29:43 PM,2022-04-14 13:29:00,04/14/2022 02:00:00 PM,13B,3,Crime Against Person,Simple Assault,ASSAULT - SIMPLE,WHEATON,11100 BLK  VEIRS MILL RD,SILVER SPRING,MD,20902.0,MCPD,Restaurant,L,4L2,321,11100.0,,VEIRS MILL,,RD,39.03758,-77.0519,4D,"(39.0376, -77.0519)"
201403744,2303,220053988,12/07/2022 07:24:00 AM,2022-12-07 07:24:00,,23C,1,Crime Against Property,Shoplifting,LARCENY - SHOPLIFTING,TAKOMA PARK,6900 BLK  NEW HAMPSHIRE AVE,TAKOMA PARK,MD,20912.0,TPPD,Convenience Store,T,8T3,808,6900.0,,NEW HAMPSHIRE,,AVE,38.9756,-76.9939,TPPD,"(38.9756, -76.9939)"
201410156,1313,230003826,01/23/2023 11:51:50 PM,2023-01-23 23:51:00,,13B,1,Crime Against Person,Simple Assault,ASSAULT - SIMPLE,MONTGOMERY VILLAGE,16900 BLK  CRABBS BRANCH WAY,DERWOOD,MD,20855.0,MCPD,Residence - Other,P,6P3,551,16900.0,,CRABBS BRANCH,,WAY,39.1318,-77.1701,6D,"(39.1318, -77.1701)"
201434088,3504,230031937,07/04/2023 07:45:53 PM,2023-07-04 20:00:00,07/04/2023 08:30:00 PM,35A,1,Crime Against Society,Drug/Narcotic Violations,DRUGS - HALLUCINOGEN - POSSESS,WHEATON,14400 BLK  LAYHILL RD,SILVER SPRING,MD,20906.0,MCPD,Parking Lot - Commercial,K,4K1,530,14400.0,,LAYHILL,,RD,39.09214,-77.045,4D,"(39.0921, -77.045)"
201443798,2902,230054780,09/14/2023 08:31:10 AM,2023-09-14 08:00:00,09/14/2023 08:30:00 AM,290,1,Crime Against Property,Destruction/Damage/Vandalism of Property,DAMAGE PROPERTY - PRIVATE,ROCKVILLE,2300 BLK  LEWIS AVE,ROCKVILLE,,20851.0,RCPD,Retail - Other,A,1A2,298,2300.0,,LEWIS,,AVE,0.0,0.0,1D,"(0.0, 0.0)"
201424162,2901,230020273,04/28/2023 09:51:13 AM,2023-04-28 09:51:00,,290,1,Crime Against Property,Destruction/Damage/Vandalism of Property,DAMAGE PROPERTY - BUSINESS,MONTGOMERY VILLAGE,9800 BLK  WASHINGTONIAN BLV,GAITHERSBURG,MD,20878.0,GPD,Restaurant,P,6P1,549,9800.0,,WASHINGTONIAN,,BLV,39.11415,-77.197,6D,"(39.1142, -77.197)"
201276585,2304,200006005,02/05/2020 11:44:25 AM,2019-12-01 16:00:00,02/03/2020 03:00:00 PM,23G,1,Crime Against Property,Theft of Motor Vehicle Parts or Accessories,LARCENY - AUTO PARTS,SILVER SPRING,2000 BLK  TREETOP LA,SILVER SPRING,MD,20904.0,MCPD,Parking Lot - Residential,I,3I1,147,2000.0,,TREETOP,,LA,39.05984,-76.9711,3D,"(39.0598, -76.9711)"
201276890,2601,200006403,02/07/2020 08:32:48 PM,2020-02-07 17:00:00,,26A,1,Crime Against Property,False Pretenses/Swindle/Confidence Game,FRAUD - CONFIDENCE GAME,MONTGOMERY VILLAGE,9600 BLK  BRASSIE WAY,MONTGOMERY VILLAGE,MD,20886.0,MCPD,Residence -Townhouse/Duplex,R,6R2,544,9600.0,,BRASSIE,,WAY,39.17505,-77.2015,6D,"(39.175, -77.2015)"
201275355,5404,200004237,01/25/2020 11:38:03 PM,2020-01-25 23:38:00,,90D,1,Crime Against Society,Driving Under the Influence,DRIVING UNDER THE INFLUENCE LIQUOR,BETHESDA,,BETHESDA,MD,20814.0,MCPD,Street - In vehicle,D,2D3,072,,,ROCKVILLE,,PIK,39.07219,-77.1332,2D,"(39.0722, -77.1332)"
201314067,2305,200050611,12/24/2020 08:43:57 AM,2020-12-17 03:30:00,12/24/2020 06:30:00 AM,23F,1,Crime Against Property,Theft From Motor Vehicle,LARCENY - FROM AUTO,WHEATON,2900 BLK  HARRIS AVE,SILVER SPRING,MD,20902.0,MCPD,Residence - Driveway,L,4L1,328,2900.0,,HARRIS,,AVE,39.05118,-77.0593,4D,"(39.0512, -77.0593)"
201391283,2999,220038855,09/07/2022 12:44:46 PM,2022-09-06 14:20:00,,290,1,Crime Against Property,Destruction/Damage/Vandalism of Property,DAMAGE PROPERTY (DESCRIBE OFFENSE),SILVER SPRING,11200 BLK  LOCKWOOD DR,SILVER SPRING,,20901.0,MCPD,Residence - Apartment/Condo,I,3I1,518,11200.0,,LOCKWOOD,,DR,39.03877,-76.9925,3D,"(39.0388, -76.9925)"
201448911,2399,230061068,,2023-10-15 20:00:00,10/17/2023 07:00:00 AM,23H,1,Crime Against Property,All other Larceny,LARCENY (DESCRIBE OFFENSE),MONTGOMERY VILLAGE,200 BLK  PARAMOUNT PARK DR,GAITHERSBURG,MD,20879.0,MCPD,Construction Site,P,6P2,425,200.0,,PARAMOUNT PARK,,DR,39.15868,-77.2225,6D,"(39.1587, -77.2225)"
201423429,2404,230019377,04/23/2023 09:46:59 AM,2023-04-23 09:30:00,,240,1,Crime Against Property,Motor Vehicle Theft,AUTO THEFT - VEHICLE THEFT,BETHESDA,4700 BLK  CREEK SHORE DR,ROCKVILLE,MD,20852.0,MCPD,Street - In vehicle,D,2D4,309,4700.0,,CREEK SHORE,,DR,39.04221,-77.094,2D,"(39.0422, -77.094)"
201240006,2304,190023531,05/18/2019 02:47:40 PM,2019-05-17 14:00:00,05/18/2019 10:00:00 AM,23G,1,Crime Against Property,Theft of Motor Vehicle Parts or Accessories,LARCENY - AUTO PARTS,WHEATON,18000 BLK  LOGANBERRY CT,SANDY SPRING,MD,20860.0,MCPD,Parking Lot - Residential,J,4J2,641,18000.0,,LOGANBERRY,,CT,39.15103,-77.0247,4D,"(39.151, -77.0247)"
201371876,2610,220015409,04/11/2022 06:26:48 PM,2022-04-09 00:00:00,,26F,1,Crime Against Property,Identity Theft,FRAUD - IDENTITY THEFT,ROCKVILLE,8400 BLK  VICTORY LA,POTOMAC,MD,20854.0,MCPD,Other/Unknown,B,1B1,224,8400.0,,VICTORY,,LA,39.04514,-77.1717,1D,"(39.0451, -77.1717)"
201346939,2404,210038298,09/27/2021 05:51:33 PM,2021-09-27 17:51:00,09/27/2021 08:45:00 PM,240,1,Crime Against Property,Motor Vehicle Theft,AUTO THEFT - VEHICLE THEFT,SILVER SPRING,900 BLK  SILVER SPRING AVE,SILVER SPRING,MD,20910.0,MCPD,Street - In vehicle,G,3G1,093,900.0,,SILVER SPRING,,AVE,38.99169,-77.024,3D,"(38.9917, -77.024)"
201402900,2303,220052843,11/30/2022 01:56:55 PM,2022-11-30 13:20:00,11/30/2022 01:25:00 PM,23C,1,Crime Against Property,Shoplifting,LARCENY - SHOPLIFTING,WHEATON,13300 BLK  NEW HAMPSHIRE AVE,SILVER SPRING,MD,20904.0,MCPD,Convenience Store,J,4J1,677,13300.0,,NEW HAMPSHIRE,,AVE,39.07322,-77.0027,4D,"(39.0732, -77.0027)"
201362712,2605,220003931,01/29/2022 04:10:59 PM,2022-01-29 12:00:00,01/29/2022 12:07:00 PM,26B,1,Crime Against Property,Credit Card/Automatic Teller Machine Fraud,FRAUD - ILLEGAL USE CREDIT CARDS,BETHESDA,4900 BLK  ELM ST,BETHESDA,MD,20814.0,MCPD,Retail - Appliances/Electronics,D,2D2,033,4900.0,,ELM,,ST,38.98215,-77.096,2D,"(38.9821, -77.096)"
201339670,5707,210029086,07/27/2021 01:07:24 PM,2021-07-27 13:07:00,,90J,1,Crime Against Society,Trespass of Real Property,TRESPASSING,SILVER SPRING,10100 BLK  NEW HAMPSHIRE AVE,SILVER SPRING,MD,20903.0,MCPD,Grocery/Supermarket,H,3H2,140,10100.0,,NEW HAMPSHIRE,,AVE,39.02039,-76.9766,3D,"(39.0204, -76.9766)"
201336748,2205,210025484,07/02/2021 09:44:33 PM,2021-07-02 15:40:00,07/02/2021 03:46:00 PM,220,1,Crime Against Property,Burglary/Breaking and Entering,BURGLARY - NO FORCED ENTRY-NONRESIDENTIAL,WHEATON,1200 BLK  UNIVERSITY BLV W,SILVER SPRING,MD,20901.0,MCPD,Daycare Facility,L,4L2,163,1200.0,,UNIVERSITY,W,BLV,39.03638,-77.0293,4D,"(39.0364, -77.0293)"
201400264,5404,220049792,11/11/2022 02:41:30 AM,2022-11-11 02:41:00,11/11/2022 04:00:00 AM,90D,1,Crime Against Society,Driving Under the Influence,DRIVING UNDER THE INFLUENCE LIQUOR,ROCKVILLE,,ROCKVILLE,MD,20851.0,RCPD,Street - In vehicle,A,1A2,293,,,TWINBROOK,,PKW,39.07467,-77.1113,1D,"(39.0747, -77.1113)"
201445404,5404,230053119,09/04/2023 04:09:57 PM,2023-09-04 16:09:00,,90D,1,Crime Against Society,Driving Under the Influence,DRIVING UNDER THE INFLUENCE LIQUOR,WHEATON,,SILVER SPRING,MD,20902.0,MCPD,Street - In vehicle,J,4J1,368,,,GLENALLAN,,AVE,39.06256,-77.0485,4D,"(39.0626, -77.0485)"
201314913,2902,210000052,01/01/2021 10:42:28 AM,2020-12-31 23:45:00,,290,1,Crime Against Property,Destruction/Damage/Vandalism of Property,DAMAGE PROPERTY - PRIVATE,BETHESDA,6400 BLK  TILDEN LA,ROCKVILLE,MD,20852.0,MCPD,Residence - Single Family,E,2E3,200,6400.0,,TILDEN,,LA,39.04369,-77.1316,2D,"(39.0437, -77.1316)"
201318917,2305,210004638,02/05/2021 03:45:46 PM,2021-02-05 12:00:00,02/05/2021 03:30:00 PM,23F,1,Crime Against Property,Theft From Motor Vehicle,LARCENY - FROM AUTO,BETHESDA,,BETHESDA,MD,20814.0,MCPD,Street - In vehicle,D,2D2,030,,,EXETER,,RD,38.98347,-77.1031,2D,"(38.9835, -77.1031)"
201255153,2303,190042195,09/03/2019 05:26:51 PM,2019-09-03 17:26:00,,23C,1,Crime Against Property,Shoplifting,LARCENY - SHOPLIFTING,BETHESDA,10200 BLK  OLD GEORGETOWN RD,BETHESDA,MD,20814.0,MCPD,Retail - Salon/Spa,D,2D4,191,10200.0,,OLD GEORGETOWN,,RD,39.02308,-77.1239,2D,"(39.0231, -77.1239)"
201394558,2304,220042861,10/01/2022 06:38:55 PM,2022-10-01 18:38:00,,23G,1,Crime Against Property,Theft of Motor Vehicle Parts or Accessories,LARCENY - AUTO PARTS,TAKOMA PARK,800 BLK  HAYWARD AVE,TAKOMA PARK,MD,20912.0,TPPD,Residence - Driveway,T,8T3,808,800.0,,HAYWARD,,AVE,38.97728,-76.9968,TPPD,"(38.9773, -76.9968)"
201274296,1399,200003178,01/19/2020 10:32:58 PM,2020-01-19 22:29:00,,13B,1,Crime Against Person,Simple Assault,ASSAULT - 2ND DEGREE,SILVER SPRING,10000 BLK  NEW HAMPSHIRE AVE,SILVER SPRING,MD,20903.0,MCPD,Street - Residential,H,3H2,143,10000.0,,NEW HAMPSHIRE,,AVE,39.01939,-76.9766,3D,"(39.0194, -76.9766)"
201266141,2305,190056091,11/20/2019 05:06:03 PM,2019-11-19 20:00:00,11/20/2019 08:00:00 AM,23F,1,Crime Against Property,Theft From Motor Vehicle,LARCENY - FROM AUTO,ROCKVILLE,8500 BLK  BELLS RIDGE TER,POTOMAC,MD,20854.0,MCPD,Street - Residential,B,1B1,221,8500.0,,BELLS RIDGE,,TER,39.03287,-77.1709,1D,"(39.0329, -77.1709)"
201359059,1399,220000023,01/01/2022 04:55:15 AM,2022-01-01 04:55:00,,13B,1,Crime Against Person,Simple Assault,ASSAULT - 2ND DEGREE,GERMANTOWN,19700 BLK  TEAKWOOD CIR,GERMANTOWN,MD,20874.0,MCPD,Residence -Townhouse/Duplex,N,5N1,465,19700.0,,TEAKWOOD,,CIR,39.17939,-77.2825,5D,"(39.1794, -77.2825)"
201261078,2902,190049679,10/16/2019 05:45:51 PM,2019-10-16 17:45:00,,290,1,Crime Against Property,Destruction/Damage/Vandalism of Property,DAMAGE PROPERTY - PRIVATE,SILVER SPRING,2100 BLK  HARLEQUIN TER,SILVER SPRING,MD,20904.0,MCPD,Parking Lot - Residential,I,3I1,376,2100.0,,HARLEQUIN,,TER,39.06923,-76.9695,3D,"(39.0692, -76.9695)"
201385085,1305,220031341,07/21/2022 01:44:20 AM,2022-07-21 01:44:00,,13A,1,Crime Against Person,Aggravated Assault,ASSAULT - AGGRAVATED - NON-FAMILY-OTHER WEAPON,MONTGOMERY VILLAGE,18300 BLK  LOST KNIFE CIR,MONTGOMERY VILLAGE,MD,20886.0,MCPD,Residence - Yard,R,6R1,505,18300.0,,LOST KNIFE,,CIR,39.15801,-77.202,6D,"(39.158, -77.202)"
201288260,2605,200019770,05/17/2020 11:52:49 AM,2020-05-16 20:00:00,05/17/2020 10:00:00 AM,26B,1,Crime Against Property,Credit Card/Automatic Teller Machine Fraud,FRAUD - ILLEGAL USE CREDIT CARDS,WHEATON,12000 BLK  SAWMILL CT,SILVER SPRING,MD,20902.0,MCPD,Other/Unknown,L,4L1,674,12000.0,,SAWMILL,,CT,39.05305,-77.0472,4D,"(39.053, -77.0472)"
201307565,2305,200042719,10/29/2020 06:16:43 PM,2020-10-29 18:13:00,10/29/2020 06:50:00 PM,23F,1,Crime Against Property,Theft From Motor Vehicle,LARCENY - FROM AUTO,BETHESDA,6800 BLK  WISCONSIN AVE,CHEVY CHASE,MD,20815.0,MCPD,Street - In vehicle,D,2D2,014,6800.0,,WISCONSIN,,AVE,38.97782,-77.091,2D,"(38.9778, -77.091)"
201403135,5202,220053113,12/01/2022 08:16:00 PM,2022-12-01 20:16:00,12/02/2022 04:00:00 AM,520,1,Crime Against Society,Weapon Law Violations,WEAPON - CONCEALED,SILVER SPRING,,SILVER SPRING,MD,20993.0,MCPD,Street - In vehicle,H,3H2,142,,,NEW HAMPSHIRE,,AVE,38.97994,-76.9899,3D,"(38.9799, -76.9899)"
201282442,5404,200012515,03/13/2020 11:47:36 PM,2020-03-13 23:43:00,,90D,1,Crime Against Society,Driving Under the Influence,DRIVING UNDER THE INFLUENCE LIQUOR,SILVER SPRING,,SILVER SPRING,MD,20903.0,MCPD,Street - Residential,H,3H1,133,,,PINEY BRANCH,,RD,39.00069,-76.9894,3D,"(39.0007, -76.9894)"
201335446,5212,210023083,06/16/2021 03:10:24 PM,2021-06-16 15:41:00,,520,1,Crime Against Society,Weapon Law Violations,WEAPON - POSSESSION,MONTGOMERY VILLAGE,7600 BLK  AIRPARK RD,GAITHERSBURG,MD,20879.0,MCPD,Street - In vehicle,R,6R3,421,7600.0,,AIRPARK,,RD,39.16918,-77.1543,6D,"(39.1692, -77.1543)"
201225178,2607,190004488,01/28/2019 08:27:02 PM,2019-01-28 20:27:00,,26A,1,Crime Against Property,False Pretenses/Swindle/Confidence Game,FRAUD - FALSE STATEMENT,MONTGOMERY VILLAGE,400 BLK  GIRARD ST,GAITHERSBURG,MD,20877.0,MCFM,Residence - Apartment/Condo,P,6P3,419,400.0,,GIRARD,,ST,39.14648,-77.1849,6D,"(39.1465, -77.1849)"
201331891,2902,210019551,05/24/2021 06:50:22 AM,2021-05-23 17:00:00,05/24/2021 06:00:00 AM,290,1,Crime Against Property,Destruction/Damage/Vandalism of Property,DAMAGE PROPERTY - PRIVATE,SILVER SPRING,1900 BLK  CARTERS GROVE DR,SILVER SPRING,MD,20904.0,MCPD,Street - Residential,I,3I1,147,1900.0,,CARTERS GROVE,,DR,39.06119,-76.9722,3D,"(39.0612, -76.9722)"
201312703,2308,200049009,12/12/2020 02:59:57 PM,2020-12-11 14:00:00,,23D,1,Crime Against Property,Theft from Building,LARCENY - FROM BLDG,MONTGOMERY VILLAGE,15700 BLK  SHADY GROVE RD,GAITHERSBURG,MD,20877.0,MCPD,Retail - Hardware,P,6P3,756,15700.0,,SHADY GROVE,,RD,39.11327,-77.1865,6D,"(39.1133, -77.1865)"
201230947,2303,190012197,03/16/2019 03:28:42 PM,2019-03-16 15:23:00,,23C,1,Crime Against Property,Shoplifting,LARCENY - SHOPLIFTING,BETHESDA,10500 BLK  CONNECTICUT AVE,KENSINGTON,MD,20895.0,MCPD,Grocery/Supermarket,D,2D3,179,10500.0,,CONNECTICUT,,AVE,39.02748,-77.0766,2D,"(39.0275, -77.0766)"
201396892,2902,220045737,10/18/2022 04:38:38 PM,2022-10-16 15:00:00,10/18/2022 09:00:00 AM,290,1,Crime Against Property,Destruction/Damage/Vandalism of Property,DAMAGE PROPERTY - PRIVATE,GERMANTOWN,22100 BLK  WINDING WOODS WAY,CLARKSBURG,MD,20871.0,MCPD,Residence - Driveway,M,5M3,476,22100.0,,WINDING WOODS,,WAY,39.22506,-77.2552,5D,"(39.2251, -77.2552)"
201248945,2305,190034651,07/21/2019 10:31:55 AM,2019-07-21 04:17:00,07/21/2019 04:19:00 AM,23F,1,Crime Against Property,Theft From Motor Vehicle,LARCENY - FROM AUTO,ROCKVILLE,600 BLK  OAK KNOLL TER,ROCKVILLE,MD,20850.0,RCPD,Street - Residential,B,1B1,241,600.0,,OAK KNOLL,,TER,39.09685,-77.1868,1D,"(39.0969, -77.1868)"
201372684,2308,220016327,04/17/2022 09:55:15 PM,2021-12-31 22:00:00,01/01/2022 02:30:00 AM,23D,1,Crime Against Property,Theft from Building,LARCENY - FROM BLDG,SILVER SPRING,8200 BLK  GEORGIA AVE,SILVER SPRING,MD,20910.0,MCPD,Retail - Other,G,3G1,094,8200.0,,GEORGIA,,AVE,38.99163,-77.0266,3D,"(38.9916, -77.0266)"
201275096,2303,200004182,01/25/2020 03:59:57 PM,2020-01-25 15:25:00,01/25/2020 03:30:00 PM,23C,1,Crime Against Property,Shoplifting,LARCENY - SHOPLIFTING,GERMANTOWN,22700 BLK  CLARKSBURG RD,CLARKSBURG,MD,20871.0,MCPD,Retail - Clothing,N,5N3,466,22700.0,,CLARKSBURG,,RD,39.2291,-77.2898,5D,"(39.2291, -77.2898)"
201290657,2203,200022660,06/09/2020 12:23:49 PM,2020-05-31 04:50:00,,220,1,Crime Against Property,Burglary/Breaking and Entering,BURGLARY - FORCED ENTRY-NONRESIDENTIAL,BETHESDA,5500 BLK  WISCONSIN AVE,CHEVY CHASE,MD,20815.0,MCPD,Retail - Clothing,D,2D1,772,5500.0,,WISCONSIN,,AVE,38.96379,-77.0872,2D,"(38.9638, -77.0872)"
201371088,5404,220014397,04/05/2022 12:05:36 AM,2022-04-05 00:05:00,,90D,1,Crime Against Society,Driving Under the Influence,DRIVING UNDER THE INFLUENCE LIQUOR,WHEATON,4600 BLK  WINDING STONE CIR,OLNEY,MD,20832.0,MCPD,Street - In vehicle,J,4J2,412,4600.0,,WINDING STONE,,CIR,39.16478,-77.093,4D,"(39.1648, -77.093)"
201374240,2601,220018278,04/29/2022 06:51:37 PM,2022-04-28 16:00:00,04/29/2022 09:00:00 AM,26A,1,Crime Against Property,False Pretenses/Swindle/Confidence Game,FRAUD - CONFIDENCE GAME,WHEATON,2300 BLK  GLENMONT CIR,SILVER SPRING,MD,20902.0,MCPD,Residence - Apartment/Condo,L,4L1,366,2300.0,,GLENMONT,,CIR,39.05671,-77.0488,4D,"(39.0567, -77.0488)"
201336090,2308,210024679,06/27/2021 08:16:36 PM,2021-06-27 17:15:00,06/27/2021 05:45:00 PM,23D,1,Crime Against Property,Theft from Building,LARCENY - FROM BLDG,MONTGOMERY VILLAGE,300 BLK  COPLEY PL,GAITHERSBURG,MD,20878.0,GPD,Other/Unknown,P,6P1,441,300.0,,COPLEY,,PL,39.11511,-77.2066,6D,"(39.1151, -77.2066)"
201364175,2404,220006365,02/14/2022 04:10:43 AM,2022-02-14 03:27:00,02/14/2022 12:00:00 AM,240,1,Crime Against Property,Motor Vehicle Theft,AUTO THEFT - VEHICLE THEFT,WHEATON,17900 BLK  SHOTLEY BRIDGE PL,OLNEY,MD,20832.0,MCPD,Parking Lot - Residential,J,4J2,681,17900.0,,SHOTLEY BRIDGE,,PL,39.1501,-77.0509,4D,"(39.1501, -77.0509)"
201408939,2901,230002341,01/15/2023 05:49:41 AM,2023-01-15 05:49:00,01/15/2023 12:00:00 AM,290,1,Crime Against Property,Destruction/Damage/Vandalism of Property,DAMAGE PROPERTY - BUSINESS,ROCKVILLE,1200 BLK W MONTGOMERY AVE,ROCKVILLE,MD,20850.0,RCPD,Gas Station,B,1B1,238,1200.0,W,MONTGOMERY,,AVE,39.08838,-77.1772,1D,"(39.0884, -77.1772)"
201237653,5311,190020397,05/01/2019 10:55:01 AM,2019-05-01 06:26:00,,90C,1,Crime Against Society,Disorderly Conduct,PUBLIC PEACE - DISORDERLY CONDUCT,SILVER SPRING,11200 BLK  NEW HAMPSHIRE AVE,SILVER SPRING,MD,20904.0,MCPD,Street - Commercial,I,3I1,518,11200.0,,NEW HAMPSHIRE,,AVE,39.03978,-76.9906,3D,"(39.0398, -76.9906)"
201350011,2305,210042158,10/20/2021 03:03:27 PM,2021-10-16 12:00:00,10/20/2021 12:00:00 AM,23F,1,Crime Against Property,Theft From Motor Vehicle,LARCENY - FROM AUTO,GERMANTOWN,1  BLK  PICKERING CT,GERMANTOWN,MD,20874.0,MCPD,Parking Lot - Residential,N,5N1,702,1.0,,PICKERING,,CT,39.18853,-77.2717,5D,"(39.1885, -77.2717)"
201257745,1399,190045503,09/23/2019 03:03:12 AM,2019-09-23 03:03:00,,13B,1,Crime Against Person,Simple Assault,ASSAULT - 2ND DEGREE,BETHESDA,4500 BLK  AVONDALE ST,BETHESDA,MD,20814.0,MCPD,Residence - Apartment/Condo,D,2D2,047,4500.0,,AVONDALE,,ST,38.98623,-77.0922,2D,"(38.9862, -77.0922)"
201228956,2902,190009768,03/02/2019 12:12:13 AM,2019-03-02 00:12:00,,290,1,Crime Against Property,Destruction/Damage/Vandalism of Property,DAMAGE PROPERTY - PRIVATE,GERMANTOWN,18300 BLK  ALLSPICE DR,GERMANTOWN,MD,20874.0,MCPD,Residence -Townhouse/Duplex,N,5N2,594,18300.0,,ALLSPICE,,DR,39.15679,-77.2607,5D,"(39.1568, -77.2607)"
201371765,2303,220015137,04/09/2022 04:19:06 PM,2022-04-09 16:19:00,,23C,1,Crime Against Property,Shoplifting,LARCENY - SHOPLIFTING,WHEATON,11100 BLK  VEIRS MILL RD,SILVER SPRING,MD,20902.0,MCPD,Retail - Mall,L,4L2,321,11100.0,,VEIRS MILL,,RD,39.03758,-77.0519,4D,"(39.0376, -77.0519)"
201423345,1301,230019294,04/22/2023 06:18:10 PM,2023-04-22 18:18:00,,13A,1,Crime Against Person,Aggravated Assault,ASSAULT - AGGRAVATED - FAMILY-GUN,MONTGOMERY VILLAGE,200 BLK  BRISTOL DOWNS DR,GAITHERSBURG,MD,20877.0,GPD,Residence - Single Family,P,6P3,419,200.0,,BRISTOL DOWNS,,DR,39.1506,-77.1791,6D,"(39.1506, -77.1791)"
201299401,2304,200032952,08/23/2020 04:52:27 PM,2020-08-16 23:00:00,08/17/2020 11:00:00 AM,23G,1,Crime Against Property,Theft of Motor Vehicle Parts or Accessories,LARCENY - AUTO PARTS,BETHESDA,9900 BLK  OLD SPRING RD,KENSINGTON,MD,20895.0,MCPD,Street - Residential,D,2D3,697,9900.0,,OLD SPRING,,RD,39.01832,-77.071,2D,"(39.0183, -77.071)"
201272892,2501,200001454,01/09/2020 10:02:14 AM,2020-01-07 17:30:00,01/09/2020 07:00:00 AM,250,1,Crime Against Property,Counterfeiting/Forgery,FORGERY OF CHECKS,ROCKVILLE,14600 BLK  COUNTRY CREEK LA,GAITHERSBURG,MD,20878.0,MCPD,Other/Unknown,B,1B2,452,14600.0,,COUNTRY CREEK,,LA,39.09594,-77.2209,1D,"(39.0959, -77.2209)"
201312648,2303,200048844,12/11/2020 03:16:56 PM,2020-12-07 15:16:00,12/11/2020 12:00:00 AM,23C,1,Crime Against Property,Shoplifting,LARCENY - SHOPLIFTING,MONTGOMERY VILLAGE,1  BLK  GRAND CORNER AVE,GAITHERSBURG,MD,20878.0,GPD,Retail - Department/Discount Store,P,6P1,549,1.0,,GRAND CORNER,,AVE,39.11801,-77.2004,6D,"(39.118, -77.2004)"
201221608,1305,190000412,01/03/2019 12:32:24 PM,2019-01-03 12:32:00,,13A,1,Crime Against Person,Aggravated Assault,ASSAULT - AGGRAVATED - NON-FAMILY-OTHER WEAPON,MONTGOMERY VILLAGE,400 BLK N FREDERICK AVE,GAITHERSBURG,MD,20877.0,GPD,Convenience Store,R,6R1,548,400.0,N,FREDERICK,,AVE,39.1457,-77.2037,6D,"(39.1457, -77.2037)"
201293569,2103,200026099,07/05/2020 06:23:04 PM,2020-07-05 13:30:00,,210,1,Crime Against Property,Extortion/Blackmail,EXTORT - THREAT INJURE REPUTATION,BETHESDA,10200 BLK  GROSVENOR PL,ROCKVILLE,MD,20852.0,MCPD,Other/Unknown,D,2D4,190,10200.0,,GROSVENOR,,PL,39.02283,-77.1054,2D,"(39.0228, -77.1054)"
201304211,2601,200038656,10/01/2020 03:50:21 PM,2020-09-30 00:00:00,,26A,1,Crime Against Property,False Pretenses/Swindle/Confidence Game,FRAUD - CONFIDENCE GAME,SILVER SPRING,3300 BLK  TEAGARDEN CIR,SILVER SPRING,MD,20904.0,MCPD,Other/Unknown,I,3I2,380,3300.0,,TEAGARDEN,,CIR,39.08197,-76.9439,3D,"(39.082, -76.9439)"
201395708,2308,220044297,10/10/2022 03:44:56 PM,2022-10-10 15:00:00,,23D,1,Crime Against Property,Theft from Building,LARCENY - FROM BLDG,ROCKVILLE,300 BLK  MARTINS LA,ROCKVILLE,MD,20850.0,RCPD,Community Center,A,1A3,252,300.0,,MARTINS,,LA,39.09268,-77.1594,1D,"(39.0927, -77.1594)"
201431247,2305,230028861,06/15/2023 04:34:35 PM,2023-06-14 19:00:00,06/15/2023 03:00:00 PM,23F,1,Crime Against Property,Theft From Motor Vehicle,LARCENY - FROM AUTO,GERMANTOWN,18800 BLK  HARMONY WOODS LA,GERMANTOWN,MD,20874.0,MCPD,Street - Residential,N,5N2,594,18800.0,,HARMONY WOODS,,LA,39.16253,-77.2717,5D,"(39.1625, -77.2717)"
201385652,2605,220032069,07/25/2022 06:18:49 PM,2022-07-23 03:00:00,07/24/2022 07:00:00 PM,26B,1,Crime Against Property,Credit Card/Automatic Teller Machine Fraud,FRAUD - ILLEGAL USE CREDIT CARDS,WHEATON,12200 BLK  VEIRS MILL RD,SILVER SPRING,MD,20906.0,MCPD,Other/Unknown,K,4K2,307,12200.0,,VEIRS MILL,,RD,39.05614,-77.0826,4D,"(39.0561, -77.0826)"
201445066,2305,230056321,,2023-09-20 12:00:00,09/22/2023 02:00:00 PM,23F,1,Crime Against Property,Theft From Motor Vehicle,LARCENY - FROM AUTO,MONTGOMERY VILLAGE,1100 BLK  VERMEER AVE,GAITHERSBURG,MD,20878.0,MCPD,Residence - Driveway,P,6P1,441,1100.0,,VERMEER,,AVE,39.11196,-77.1973,6D,"(39.112, -77.1973)"
201391660,1399,220039306,09/10/2022 02:30:43 AM,2022-09-10 02:30:00,,13B,1,Crime Against Person,Simple Assault,ASSAULT - 2ND DEGREE,ROCKVILLE,2100 BLK  VEIRS MILL RD,ROCKVILLE,MD,20851.0,MCPD,Parking Lot - Commercial,A,1A2,521,2100.0,,VEIRS MILL,,RD,39.07529,-77.1163,1D,"(39.0753, -77.1163)"
201262392,3562,190050590,,2019-10-21 19:42:00,,35A,1,Crime Against Society,Drug/Narcotic Violations,DRUGS - MARIJUANA - POSSESS,SILVER SPRING,,SILVER SPRING,MD,20901.0,MCPD,Street - In vehicle,G,3G2,104,,,BREWSTER,,AVE,39.01105,-77.0137,3D,"(39.011, -77.0137)"
201337452,5404,210026309,07/08/2021 07:11:01 PM,2021-07-08 19:11:00,,90D,1,Crime Against Society,Driving Under the Influence,DRIVING UNDER THE INFLUENCE LIQUOR,MONTGOMERY VILLAGE,300 BLK N SUMMIT AVE,GAITHERSBURG,MD,20877.0,GPD,Parking Lot - Residential,P,6P3,419,300.0,N,SUMMIT,,AVE,39.14581,-77.1925,6D,"(39.1458, -77.1925)"
201432231,2605,230030118,06/23/2023 04:37:19 PM,2023-06-22 14:30:00,06/23/2023 05:00:00 PM,26B,1,Crime Against Property,Credit Card/Automatic Teller Machine Fraud,FRAUD - ILLEGAL USE CREDIT CARDS,SILVER SPRING,8600 BLK  CAMERON ST,SILVER SPRING,MD,20910.0,MCPD,Other/Unknown,G,3G1,108,8600.0,,CAMERON,,ST,38.99752,-77.0297,3D,"(38.9975, -77.0297)"
201432414,1399,230030304,06/24/2023 07:30:58 PM,2023-06-24 19:30:00,,13B,1,Crime Against Person,Simple Assault,ASSAULT - 2ND DEGREE,SILVER SPRING,11500 BLK  STEWART LA,SILVER SPRING,MD,20904.0,MCPD,Residence - Apartment/Condo,I,3I1,145,11500.0,,STEWART,,LA,39.04551,-76.9831,3D,"(39.0455, -76.9831)"
201308876,1103,200044316,,2020-11-06 13:03:00,11/08/2020 12:00:00 AM,11A,1,Crime Against Person,Forcible Rape,RAPE - STRONG-ARM,WHEATON,2400 BLK  SUN VALLEY CIR,SILVER SPRING,MD,20906.0,MCPD,Residence - Other,K,4K1,530,2400.0,,SUN VALLEY,,CIR,39.09228,-77.0492,4D,"(39.0923, -77.0492)"
201262862,2305,190051986,10/29/2019 08:10:24 AM,2019-10-28 18:00:00,10/29/2019 07:20:00 AM,23F,1,Crime Against Property,Theft From Motor Vehicle,LARCENY - FROM AUTO,SILVER SPRING,8000 BLK  EASTERN AVE,SILVER SPRING,MD,20910.0,MCPD,Parking Lot - Residential,G,3G1,669,8000.0,,EASTERN,,AVE,38.98805,-77.031,3D,"(38.9881, -77.031)"
201285449,2204,200016539,04/20/2020 11:06:06 AM,2019-11-15 12:00:00,04/18/2020 12:00:00 PM,220,1,Crime Against Property,Burglary/Breaking and Entering,BURGLARY - NO FORCED ENTRY-RESIDENTIAL,ROCKVILLE,11600 BLK  RIVER RD,POTOMAC,MD,20854.0,MCPD,Residence - Shed,B,1B2,511,11600.0,,RIVER,,RD,39.03495,-77.2402,1D,"(39.035, -77.2402)"
201325707,2308,210012046,03/31/2021 03:22:57 PM,2021-03-31 13:16:00,03/31/2021 02:50:00 PM,23D,1,Crime Against Property,Theft from Building,LARCENY - FROM BLDG,ROCKVILLE,800 BLK  ROCKVILLE PIK,ROCKVILLE,MD,20852.0,RCPD,Retail - Other,A,1A1,263,800.0,,ROCKVILLE,,PIK,39.07757,-77.14,1D,"(39.0776, -77.14)"
201333724,2202,210021730,06/08/2021 02:01:01 AM,2021-06-08 02:00:00,,220,1,Crime Against Property,Burglary/Breaking and Entering,BURGLARY - FORCED ENTRY-RESIDENTIAL,GERMANTOWN,18700 BLK  PIKEVIEW DR,GERMANTOWN,MD,20874.0,MCPD,Residence -Townhouse/Duplex,N,5N1,447,18700.0,,PIKEVIEW,,DR,39.16414,-77.2507,5D,"(39.1641, -77.2507)"
201253767,5404,190040613,08/25/2019 01:54:14 AM,2019-08-25 01:54:00,08/25/2019 03:26:00 AM,90D,1,Crime Against Society,Driving Under the Influence,DRIVING UNDER THE INFLUENCE LIQUOR,WHEATON,2000 BLK  SULLIVAN LA,SILVER SPRING,MD,20906.0,MCPD,Street - In vehicle,J,4J1,369,2000.0,,SULLIVAN,,LA,39.08482,-77.0446,4D,"(39.0848, -77.0446)"
201432039,2305,230029857,06/21/2023 08:54:05 PM,2023-06-21 18:50:00,06/21/2023 08:40:00 PM,23F,1,Crime Against Property,Theft From Motor Vehicle,LARCENY - FROM AUTO,BETHESDA,5900 BLK  EXECUTIVE BLV,ROCKVILLE,MD,20852.0,MCPD,Parking Lot - Commercial,D,2D4,188,5900.0,,EXECUTIVE,,BLV,39.0463,-77.1167,2D,"(39.0463, -77.1167)"
201299341,5404,200032889,08/23/2020 01:20:45 AM,2020-08-23 01:20:00,08/23/2020 02:45:00 AM,90D,1,Crime Against Society,Driving Under the Influence,DRIVING UNDER THE INFLUENCE LIQUOR,MONTGOMERY VILLAGE,,ROCKVILLE,MD,20850.0,RCPD,Street - In vehicle,P,6P1,721,,,SHADY GROVE,,RD,39.14114,-77.1518,6D,"(39.1411, -77.1518)"
201305914,5404,200040573,10/15/2020 01:25:18 AM,2020-10-15 01:28:00,,90D,1,Crime Against Society,Driving Under the Influence,DRIVING UNDER THE INFLUENCE LIQUOR,GERMANTOWN,22900 BLK  RIDGE RD,GERMANTOWN,MD,20876.0,MCPD,Street - In vehicle,M,5M1,625,22900.0,,RIDGE,,RD,39.23229,-77.2372,5D,"(39.2323, -77.2372)"
201309047,5299,200044485,11/10/2020 09:33:34 PM,2020-11-10 21:30:00,,520,1,Crime Against Society,Weapon Law Violations,WEAPON OFFENSE (DESCRIBE OFFENSE),GERMANTOWN,19700 BLK  CRYSTAL ROCK DR,GERMANTOWN,MD,20874.0,MCPD,Parking Lot - Residential,N,5N1,595,19700.0,,CRYSTAL ROCK,,DR,39.17902,-77.2616,5D,"(39.179, -77.2616)"
201434121,3522,230032412,07/07/2023 04:42:28 PM,2023-07-07 16:42:00,,35A,1,Crime Against Society,Drug/Narcotic Violations,DRUGS - OPIUM OR DERIVATIVE - POSSESS,WHEATON,11200 BLK  AMHERST AVE,SILVER SPRING,MD,20902.0,MCPD,Park,L,4L2,354,11200.0,,AMHERST,,AVE,39.03908,-77.0486,4D,"(39.0391, -77.0486)"
201227996,5404,190008440,02/21/2019 11:35:27 PM,2019-02-21 23:29:00,,90D,1,Crime Against Society,Driving Under the Influence,DRIVING UNDER THE INFLUENCE LIQUOR,MONTGOMERY VILLAGE,9800 BLK  WASHINGTONIAN BLV,GAITHERSBURG,MD,20878.0,MCPD,Street - In vehicle,P,6P1,549,9800.0,,WASHINGTONIAN,,BLV,39.11415,-77.197,6D,"(39.1142, -77.197)"
201257752,2305,190045508,09/23/2019 06:15:16 AM,2019-09-23 06:15:00,,23F,1,Crime Against Property,Theft From Motor Vehicle,LARCENY - FROM AUTO,SILVER SPRING,9600 BLK  COTTRELL TER,SILVER SPRING,MD,20903.0,MCPD,Street - Residential,H,3H2,136,9600.0,,COTTRELL,,TER,39.01246,-76.9796,3D,"(39.0125, -76.9796)"
201402561,1399,220052566,11/29/2022 03:12:42 AM,2022-11-29 04:05:00,,13B,1,Crime Against Person,Simple Assault,ASSAULT - 2ND DEGREE,GERMANTOWN,19800 BLK  OBSERVATION DR,GERMANTOWN,MD,20876.0,MCPD,Hospital/Emergency Care Center,M,5M1,468,19800.0,,OBSERVATION,,DR,39.18056,-77.2438,5D,"(39.1806, -77.2438)"
201425593,2501,230022018,05/08/2023 03:57:55 PM,2023-05-08 15:57:00,,250,1,Crime Against Property,Counterfeiting/Forgery,FORGERY OF CHECKS,BETHESDA,4600 BLK  ELM ST,CHEVY CHASE,MD,20815.0,MCPD,Bank - ATM,D,2D2,035,4600.0,,ELM,,ST,38.98242,-77.0921,2D,"(38.9824, -77.0921)"
201393389,2308,220041380,09/22/2022 07:18:26 PM,2022-09-22 17:55:00,09/22/2022 07:00:00 PM,23D,1,Crime Against Property,Theft from Building,LARCENY - FROM BLDG,SILVER SPRING,9800 BLK  HASTINGS DR,SILVER SPRING,MD,20901.0,MCPD,Recreation Center,G,3G2,120,9800.0,,HASTINGS,,DR,39.01434,-77.0157,3D,"(39.0143, -77.0157)"
201290624,2305,200022146,06/05/2020 11:00:14 AM,2020-05-31 16:00:00,06/02/2020 12:00:00 PM,23F,1,Crime Against Property,Theft From Motor Vehicle,LARCENY - FROM AUTO,BETHESDA,3700 BLK  THORNAPPLE ST,CHEVY CHASE,MD,20815.0,MCPD,Street - Residential,D,2D1,037,3700.0,,THORNAPPLE,,ST,38.98231,-77.0736,2D,"(38.9823, -77.0736)"
201342670,2999,210032937,08/23/2021 08:07:10 PM,2021-08-23 20:14:00,,290,1,Crime Against Property,Destruction/Damage/Vandalism of Property,DAMAGE PROPERTY (DESCRIBE OFFENSE),SILVER SPRING,1200 BLK E WEST HWY,SILVER SPRING,MD,20910.0,MCPD,Parking Lot - Commercial,G,3G1,089,1200.0,E,WEST,,HWY,39.12378,-77.2033,3D,"(39.1238, -77.2033)"
201386121,5707,220032466,07/28/2022 01:54:24 PM,2022-07-28 13:54:00,,90J,1,Crime Against Society,Trespass of Real Property,TRESPASSING,BETHESDA,11400 BLK  ROCKVILLE PIK,ROCKVILLE,MD,20852.0,MCPD,Retail - Other,D,2D4,189,11400.0,,ROCKVILLE,,PIK,39.04189,-77.1103,2D,"(39.0419, -77.1103)"
201368471,2304,220011286,03/16/2022 11:01:06 AM,2022-03-15 20:30:00,03/16/2022 05:50:00 AM,23G,1,Crime Against Property,Theft of Motor Vehicle Parts or Accessories,LARCENY - AUTO PARTS,SILVER SPRING,8400 BLK  MANCHESTER RD,SILVER SPRING,MD,20901.0,MCPD,Parking Lot - Residential,H,3H1,126,8400.0,,MANCHESTER,,RD,38.99687,-77.0051,3D,"(38.9969, -77.0051)"
201377564,2399,220022054,05/23/2022 10:09:13 PM,2022-05-23 22:09:00,,23H,1,Crime Against Property,All other Larceny,LARCENY (DESCRIBE OFFENSE),MONTGOMERY VILLAGE,18700 BLK N FREDERICK AVE,GAITHERSBURG,MD,20879.0,GPD,Restaurant,R,6R2,545,18700.0,N,FREDERICK,,AVE,39.1626,-77.2252,6D,"(39.1626, -77.2252)"
201413022,1305,230007191,02/12/2023 11:32:52 PM,2023-02-12 23:32:00,,13A,1,Crime Against Person,Aggravated Assault,ASSAULT - AGGRAVATED - NON-FAMILY-OTHER WEAPON,ROCKVILLE,400 BLK  MC ARTHUR DR,ROCKVILLE,MD,20850.0,RCPD,Residence - Single Family,A,1A3,286,400.0,,MC ARTHUR,,DR,39.0875,-77.1433,1D,"(39.0875, -77.1433)"
201424977,5404,230021250,05/03/2023 08:39:56 PM,2023-05-03 20:39:00,,90D,1,Crime Against Society,Driving Under the Influence,DRIVING UNDER THE INFLUENCE LIQUOR,BETHESDA,,BETHESDA,MD,20892.0,MCPD,Street - Commercial,E,2E2,073,,,WOODMONT,,AVE,38.97994,-77.0931,2D,"(38.9799, -77.0931)"
201280555,3532,200010869,03/05/2020 12:07:19 AM,2020-03-05 00:01:00,03/05/2020 12:10:00 AM,35A,1,Crime Against Society,Drug/Narcotic Violations,DRUGS - COCAINE - POSSESS,MONTGOMERY VILLAGE,,GAITHERSBURG,MD,20877.0,MCPD,Street - Commercial,P,6P3,759,,,SHADY GROVE,,RD,39.14114,-77.1518,6D,"(39.1411, -77.1518)"
201236711,2999,190019354,04/25/2019 11:07:19 AM,2019-04-22 10:00:00,04/24/2019 09:30:00 AM,290,1,Crime Against Property,Destruction/Damage/Vandalism of Property,DAMAGE PROPERTY (DESCRIBE OFFENSE),ROCKVILLE,5700 BLK  BOU AVE,ROCKVILLE,MD,20852.0,MCPD,Residence - Garage,A,1A2,735,5700.0,,BOU,,AVE,39.05597,-77.1136,1D,"(39.056, -77.1136)"
201364491,2305,220006729,02/16/2022 08:09:46 AM,2022-02-15 15:00:00,02/16/2022 08:00:00 AM,23F,1,Crime Against Property,Theft From Motor Vehicle,LARCENY - FROM AUTO,TAKOMA PARK,7200 BLK  CEDAR AVE,TAKOMA PARK,MD,20912.0,TPPD,Street - Residential,T,8T1,801,7200.0,,CEDAR,,AVE,38.97744,-77.0147,TPPD,"(38.9774, -77.0147)"
201432408,2303,230030303,06/24/2023 08:37:54 PM,2023-06-24 20:37:00,,23C,1,Crime Against Property,Shoplifting,LARCENY - SHOPLIFTING,MONTGOMERY VILLAGE,200 BLK N FREDERICK AVE,GAITHERSBURG,MD,20877.0,GPD,Retail - Hardware,P,6P2,428,200.0,N,FREDERICK,,AVE,39.09454,-77.1506,6D,"(39.0945, -77.1506)"
201301016,2305,200034906,09/06/2020 11:17:16 AM,2020-09-06 10:07:00,,23F,1,Crime Against Property,Theft From Motor Vehicle,LARCENY - FROM AUTO,BETHESDA,6100 BLK  CONNECTICUT AVE,CHEVY CHASE,MD,20815.0,MCPD,Parking Lot - Commercial,D,2D1,007,6100.0,,CONNECTICUT,,AVE,38.97288,-77.0771,2D,"(38.9729, -77.0771)"
201256456,3564,190043836,,2019-09-13 09:45:00,09/13/2019 10:15:00 AM,35A,1,Crime Against Society,Drug/Narcotic Violations,DRUGS - MARIJUANA (DESCRIBE OFFENSE),WHEATON,300 BLK  NORWOOD RD,SILVER SPRING,MD,20905.0,MCPD,School/College - DO NOT USE,J,4J1,372,300.0,,NORWOOD,,RD,39.11409,-77.0146,4D,"(39.1141, -77.0146)"
201381369,2304,220024340,06/07/2022 06:36:25 AM,2022-06-06 20:00:00,06/07/2022 05:30:00 AM,23G,1,Crime Against Property,Theft of Motor Vehicle Parts or Accessories,LARCENY - AUTO PARTS,WHEATON,11800 BLK  IDLEWOOD RD,SILVER SPRING,MD,20906.0,MCPD,Residence - Driveway,L,4L1,310,11800.0,,IDLEWOOD,,RD,39.0483,-77.0867,4D,"(39.0483, -77.0867)"
201231001,5404,190012288,03/17/2019 02:08:14 AM,2019-03-17 02:05:00,,90D,1,Crime Against Society,Driving Under the Influence,DRIVING UNDER THE INFLUENCE LIQUOR,SILVER SPRING,,BURTONSVILLE,MD,20866.0,MCPD,Street - In vehicle,I,3I2,384,,,COLUMBIA,,PIK,38.97665,-77.0065,3D,"(38.9766, -77.0065)"
201316306,2399,210001669,01/13/2021 10:23:31 PM,2021-01-13 07:00:00,01/13/2021 04:00:00 PM,23H,1,Crime Against Property,All other Larceny,LARCENY (DESCRIBE OFFENSE),WHEATON,500 BLK  EISNER ST,SILVER SPRING,MD,20901.0,MCPD,Other/Unknown,L,4L2,158,500.0,,EISNER,,ST,39.0303,-77.02,4D,"(39.0303, -77.02)"
201419707,1305,230014962,03/28/2023 10:50:35 AM,2023-03-28 10:50:00,,13A,3,Crime Against Person,Aggravated Assault,ASSAULT - AGGRAVATED - NON-FAMILY-OTHER WEAPON,MONTGOMERY VILLAGE,1200 BLK  MAIN ST,GAITHERSBURG,MD,20878.0,GPD,School - Elementary/Secondary,P,6P2,450,1200.0,,MAIN,,ST,39.11631,-77.2323,6D,"(39.1163, -77.2323)"
201271854,2999,200000080,01/01/2020 03:02:07 PM,2020-01-01 15:00:00,,290,1,Crime Against Property,Destruction/Damage/Vandalism of Property,DAMAGE PROPERTY (DESCRIBE OFFENSE),GERMANTOWN,19500 BLK  GUNNERS BRANCH RD,GERMANTOWN,MD,20876.0,MCPD,Residence - Apartment/Condo,M,5M1,469,19500.0,,GUNNERS BRANCH,,RD,39.17525,-77.2409,5D,"(39.1752, -77.2409)"
201269105,2305,190059405,12/09/2019 09:33:47 PM,2019-12-07 01:00:00,12/08/2019 09:00:00 AM,23F,1,Crime Against Property,Theft From Motor Vehicle,LARCENY - FROM AUTO,WHEATON,13800 BLK  BEACON HOLLOW LA,SILVER SPRING,MD,20906.0,MCPD,Residence - Driveway,K,4K1,348,13800.0,,BEACON HOLLOW,,LA,39.08142,-77.0615,4D,"(39.0814, -77.0615)"
201237773,2203,190020737,05/03/2019 12:47:20 AM,2019-05-03 00:44:00,,220,1,Crime Against Property,Burglary/Breaking and Entering,BURGLARY - FORCED ENTRY-NONRESIDENTIAL,MONTGOMERY VILLAGE,700 BLK  RUSSELL AVE,GAITHERSBURG,MD,20877.0,GPD,Retail - Mall,R,6R1,548,700.0,,RUSSELL,,AVE,39.15063,-77.2039,6D,"(39.1506, -77.2039)"
201242082,2404,190026129,06/01/2019 10:50:39 AM,2019-05-31 20:00:00,06/01/2019 12:05:00 PM,240,1,Crime Against Property,Motor Vehicle Theft,AUTO THEFT - VEHICLE THEFT,SILVER SPRING,10800 BLK  BLOSSOM LA,SILVER SPRING,MD,20903.0,MCPD,Street - Residential,H,3H2,144,10800.0,,BLOSSOM,,LA,39.0321,-76.9878,3D,"(39.0321, -76.9878)"
201341783,1399,210030626,08/07/2021 12:17:47 AM,2021-08-07 00:17:00,,13B,1,Crime Against Person,Simple Assault,ASSAULT - 2ND DEGREE,SILVER SPRING,1500 BLK  DECEMBER DR,SILVER SPRING,MD,20904.0,MCPD,Residence - Apartment/Condo,I,3I1,145,1500.0,,DECEMBER,,DR,39.04165,-76.9813,3D,"(39.0416, -76.9813)"
201237470,2304,190020317,04/30/2019 06:54:34 PM,2019-04-29 12:00:00,04/30/2019 11:00:00 AM,23G,1,Crime Against Property,Theft of Motor Vehicle Parts or Accessories,LARCENY - AUTO PARTS,ROCKVILLE,,POOLESVILLE,MD,20837.0,MCPD,Street - Residential,B,1B3,492,,,CHARITY HALL,,CIR,39.15977,-77.4041,1D,"(39.1598, -77.4041)"
201345882,2301,210036961,09/19/2021 11:39:35 AM,2021-09-19 10:30:00,09/19/2021 10:59:00 AM,23A,1,Crime Against Property,Pocket/picking,LARCENY - POCKET PICKING,BETHESDA,7100 BLK  ARLINGTON RD,BETHESDA,MD,20814.0,MCPD,Grocery/Supermarket,D,2D2,032,7100.0,,ARLINGTON,,RD,38.98085,-77.0984,2D,"(38.9808, -77.0984)"
201321551,2610,210007798,03/01/2021 07:40:52 PM,2021-03-01 00:00:00,,26F,1,Crime Against Property,Identity Theft,FRAUD - IDENTITY THEFT,WHEATON,18500 BLK  DENHIGH CIR,OLNEY,MD,20832.0,MCPD,Other/Unknown,J,4J2,412,18500.0,,DENHIGH,,CIR,39.15982,-77.0991,4D,"(39.1598, -77.0991)"
201231235,2303,190012639,03/19/2019 12:09:44 PM,2019-03-19 12:09:00,,23C,1,Crime Against Property,Shoplifting,LARCENY - SHOPLIFTING,WHEATON,11100 BLK  VEIRS MILL RD,SILVER SPRING,MD,20902.0,MCPD,Retail - Mall,L,4L2,321,11100.0,,VEIRS MILL,,RD,39.03758,-77.0519,4D,"(39.0376, -77.0519)"
201264492,1399,190054044,11/09/2019 02:33:02 PM,2019-11-09 14:33:00,11/09/2019 04:00:00 PM,13B,2,Crime Against Person,Simple Assault,ASSAULT - 2ND DEGREE,ROCKVILLE,2000 BLK  GAITHER RD,ROCKVILLE,MD,20850.0,RCPD,Parking Lot - Commercial,A,1A3,439,2000.0,,GAITHER,,RD,39.11584,-77.1796,1D,"(39.1158, -77.1796)"
201427523,1399,230024363,05/21/2023 03:22:07 PM,2023-05-21 15:21:00,,13B,1,Crime Against Person,Simple Assault,ASSAULT - 2ND DEGREE,MONTGOMERY VILLAGE,18300 BLK  LOST KNIFE CIR,MONTGOMERY VILLAGE,,20886.0,MCPD,Residence - Apartment/Condo,R,6R1,505,18300.0,,LOST KNIFE,,CIR,39.15801,-77.202,6D,"(39.158, -77.202)"
201405753,1399,220056410,12/20/2022 12:16:28 PM,2022-12-20 12:05:00,12/20/2022 12:16:00 PM,13B,1,Crime Against Person,Simple Assault,ASSAULT - 2ND DEGREE,WHEATON,1900 BLK  RANDOLPH RD,SILVER SPRING,MD,20902.0,MCPD,School - Elementary/Secondary,J,4J1,368,1900.0,,RANDOLPH,,RD,39.0652,-77.0371,4D,"(39.0652, -77.0371)"
201290603,2999,200022609,06/08/2020 11:22:04 PM,2020-06-08 23:17:00,,290,1,Crime Against Property,Destruction/Damage/Vandalism of Property,DAMAGE PROPERTY (DESCRIBE OFFENSE),GERMANTOWN,11700 BLK  SUMMER OAK DR,GERMANTOWN,MD,20874.0,MCPD,Street - Residential,N,5N1,447,11700.0,,SUMMER OAK,,DR,39.16489,-77.2439,5D,"(39.1649, -77.2439)"
201354148,2610,210047457,11/22/2021 02:45:26 PM,2021-11-22 14:48:00,,26F,1,Crime Against Property,Identity Theft,FRAUD - IDENTITY THEFT,GERMANTOWN,20000 BLK  AIRCRAFT DR,GERMANTOWN,MD,20874.0,MCPD,Other/Unknown,N,5N1,702,20000.0,,AIRCRAFT,,DR,39.18396,-77.2617,5D,"(39.184, -77.2617)"
201343033,2404,210033316,08/26/2021 12:56:56 PM,2021-08-25 17:00:00,08/26/2021 10:00:00 AM,240,1,Crime Against Property,Motor Vehicle Theft,AUTO THEFT - VEHICLE THEFT,WHEATON,1300 BLK  ELM GROVE CIR,SILVER SPRING,MD,20905.0,MCPD,Residence - Yard,J,4J1,374,1300.0,,ELM GROVE,,CIR,39.0941,-76.9859,4D,"(39.0941, -76.9859)"
201394243,2303,220042304,09/28/2022 12:53:10 PM,2022-09-28 12:53:00,,23C,1,Crime Against Property,Shoplifting,LARCENY - SHOPLIFTING,SILVER SPRING,2300 BLK  BROADBIRCH DR,SILVER SPRING,MD,20904.0,MCPD,Retail - Hardware,I,3I1,146,2300.0,,BROADBIRCH,,DR,39.05561,-76.9617,3D,"(39.0556, -76.9617)"
201238450,4199,190021560,05/07/2019 05:19:33 PM,2019-05-07 17:19:00,,90G,1,Crime Against Society,Liquor Law Violations,LIQUOR (DESCRIBE OFFENSE),TAKOMA PARK,8600 BLK  FLOWER AVE,TAKOMA PARK,MD,20912.0,MCPD,Street - Bus Stop,T,8T2,803,8600.0,,FLOWER,,AVE,38.99645,-77.0031,TPPD,"(38.9965, -77.0031)"
201272731,2501,200001073,01/07/2020 12:10:58 PM,2020-01-07 12:10:00,,250,1,Crime Against Property,Counterfeiting/Forgery,FORGERY OF CHECKS,WHEATON,14600 BLK  SILVERSTONE DR,SILVER SPRING,MD,20905.0,MCPD,Residence - Single Family,J,4J1,372,14600.0,,SILVERSTONE,,DR,39.09732,-77.0275,4D,"(39.0973, -77.0275)"
201409492,2305,230003005,01/19/2023 07:46:06 AM,2023-01-18 22:00:00,01/19/2023 05:05:00 AM,23F,1,Crime Against Property,Theft From Motor Vehicle,LARCENY - FROM AUTO,WHEATON,19400 BLK  OLNEY MILL RD,OLNEY,MD,20832.0,MCPD,Residence - Driveway,J,4J2,400,19400.0,,OLNEY MILL,,RD,39.17514,-77.0749,4D,"(39.1751, -77.0749)"
201245471,2303,190030326,06/25/2019 02:24:05 PM,2019-06-25 14:04:00,06/25/2019 02:21:00 PM,23C,1,Crime Against Property,Shoplifting,LARCENY - SHOPLIFTING,MONTGOMERY VILLAGE,600 BLK N FREDERICK AVE,GAITHERSBURG,MD,20877.0,GPD,Retail - Department/Discount Store,P,6P2,428,600.0,N,FREDERICK,,AVE,39.15009,-77.209,6D,"(39.1501, -77.209)"
201402641,2305,220052642,11/29/2022 12:01:50 PM,2022-11-29 12:01:00,,23F,1,Crime Against Property,Theft From Motor Vehicle,LARCENY - FROM AUTO,GERMANTOWN,19500 BLK  FREDERICK RD,GERMANTOWN,MD,20876.0,MCPD,Residence - Driveway,M,5M1,470,19500.0,,FREDERICK,,RD,39.17546,-77.2381,5D,"(39.1755, -77.2381)"
201305306,1202,200039978,10/10/2020 10:06:42 PM,2020-10-10 22:06:00,,120,1,Crime Against Property,Robbery,ROBBERY - BUSINESS-OTHER WEAPON,ROCKVILLE,15800 BLK  FREDERICK RD,DERWOOD,MD,20855.0,MCPD,Restaurant,A,1A4,280,15800.0,,FREDERICK,,RD,39.11454,-77.1644,1D,"(39.1145, -77.1644)"
201252218,2599,190038650,08/13/2019 02:47:08 PM,2019-08-13 14:47:00,,250,1,Crime Against Property,Counterfeiting/Forgery,COUNTERFEITING (DESCRIBE OFFENSE),WHEATON,11100 BLK  VEIRS MILL RD,SILVER SPRING,MD,20902.0,MCPD,Retail - Mall,L,4L2,321,11100.0,,VEIRS MILL,,RD,39.03758,-77.0519,4D,"(39.0376, -77.0519)"
201274512,3562,200003306,01/20/2020 11:45:53 PM,2020-01-20 23:45:00,01/21/2020 12:00:00 AM,35A,1,Crime Against Society,Drug/Narcotic Violations,DRUGS - MARIJUANA - POSSESS,BETHESDA,,CHEVY CHASE,MD,20815.0,MCPD,Street - In vehicle,D,2D1,037,,,GLENDALE,,RD,38.98974,-77.0751,2D,"(38.9897, -77.0751)"
201401388,2316,220051203,11/19/2022 01:39:00 PM,2022-11-19 12:45:00,11/19/2022 01:15:00 PM,23H,1,Crime Against Property,All other Larceny,LARCENY - POSTAL,ROCKVILLE,900 BLK  GRAND CHAMPION DR,ROCKVILLE,MD,20850.0,RCPD,Residence -Townhouse/Duplex,A,1A3,439,900.0,,GRAND CHAMPION,,DR,39.11551,-77.1708,1D,"(39.1155, -77.1708)"
201372405,2999,220015990,04/15/2022 12:56:35 PM,2022-04-14 17:30:00,04/15/2022 11:30:00 AM,290,1,Crime Against Property,Destruction/Damage/Vandalism of Property,DAMAGE PROPERTY (DESCRIBE OFFENSE),BETHESDA,6400 BLK  ROCK FOREST DR,BETHESDA,MD,20817.0,MCPD,Parking Garage - Residential,E,2E3,197,6400.0,,ROCK FOREST,,DR,39.0292,-77.1278,2D,"(39.0292, -77.1278)"
201411225,1114,220045742,,2022-10-18 00:00:00,10/18/2022 12:00:00 AM,11B,1,Crime Against Person,Forcible Sodomy,SEX ASSAULT - SODOMY-GIRL-STRONG-ARM,WHEATON,12600 BLK  HOLDRIDGE RD,SILVER SPRING,,20906.0,MCPD,Residence - Single Family,K,4K2,335,12600.0,,HOLDRIDGE,,RD,39.06254,-77.058,4D,"(39.0625, -77.058)"
201400042,5311,220049565,11/09/2022 05:44:12 PM,2022-11-09 17:43:00,,90C,1,Crime Against Society,Disorderly Conduct,PUBLIC PEACE - DISORDERLY CONDUCT,SILVER SPRING,11700 BLK  OLD COLUMBIA PIK,SILVER SPRING,MD,20904.0,MCPD,Residence - Apt Ofc/Storage,I,3I1,145,11700.0,,OLD COLUMBIA,,PIK,39.04846,-76.9806,3D,"(39.0485, -76.9806)"
201277055,3562,200006321,02/07/2020 01:20:38 PM,2020-02-07 12:00:00,02/07/2020 01:20:00 PM,35A,1,Crime Against Society,Drug/Narcotic Violations,DRUGS - MARIJUANA - POSSESS,SILVER SPRING,12200 BLK  NEW HAMPSHIRE AVE,SILVER SPRING,MD,20904.0,MCPD,School/College - DO NOT USE,I,3I1,519,12200.0,,NEW HAMPSHIRE,,AVE,39.05528,-76.9955,3D,"(39.0553, -76.9955)"
201387199,2399,220033898,08/07/2022 11:20:57 AM,2022-07-20 00:00:00,08/05/2022 12:00:00 AM,23H,1,Crime Against Property,All other Larceny,LARCENY (DESCRIBE OFFENSE),MONTGOMERY VILLAGE,10600 BLK  WAYRIDGE DR,MONTGOMERY VILLAGE,MD,20886.0,MCPD,Other/Unknown,R,6R2,424,10600.0,,WAYRIDGE,,DR,39.17388,-77.2186,6D,"(39.1739, -77.2186)"
201315761,5311,210001052,01/09/2021 06:11:48 AM,2021-01-09 06:10:00,,90C,1,Crime Against Society,Disorderly Conduct,PUBLIC PEACE - DISORDERLY CONDUCT,SILVER SPRING,7900 BLK  GEORGIA AVE,SILVER SPRING,MD,20910.0,MCPD,Retail - Other,G,3G1,090,7900.0,,GEORGIA,,AVE,38.98534,-77.0266,3D,"(38.9853, -77.0266)"
201234016,2305,190016012,04/06/2019 02:10:19 PM,2019-04-06 14:10:00,04/06/2019 02:00:00 PM,23F,1,Crime Against Property,Theft From Motor Vehicle,LARCENY - FROM AUTO,TAKOMA PARK,6500 BLK  NEW HAMPSHIRE AVE,TAKOMA PARK,MD,20912.0,TPPD,Restaurant,T,8T1,802,6500.0,,NEW HAMPSHIRE,,AVE,38.96876,-77.0002,TPPD,"(38.9688, -77.0002)"
201326414,3560,210012746,04/05/2021 10:31:37 PM,2021-04-06 22:23:00,,35A,1,Crime Against Society,Drug/Narcotic Violations,DRUGS - MARIJUANA - SELL,SILVER SPRING,,SILVER SPRING,MD,20910.0,MCPD,Street - In vehicle,G,3G2,175,,,FOREST GLEN,,RD,39.01596,-77.0365,3D,"(39.016, -77.0365)"
201232611,2902,190014103,03/27/2019 07:53:59 AM,2019-03-26 23:00:00,03/27/2019 07:53:00 AM,290,1,Crime Against Property,Destruction/Damage/Vandalism of Property,DAMAGE PROPERTY - PRIVATE,MONTGOMERY VILLAGE,1  BLK  DALAMAR ST,GAITHERSBURG,MD,20877.0,GPD,Parking Lot - Residential,P,6P2,428,1.0,,DALAMAR,,ST,39.14658,-77.2048,6D,"(39.1466, -77.2048)"
201340960,5404,210030770,08/08/2021 02:43:02 AM,2021-08-08 05:10:00,,90D,1,Crime Against Society,Driving Under the Influence,DRIVING UNDER THE INFLUENCE LIQUOR,MONTGOMERY VILLAGE,,GAITHERSBURG,MD,20879.0,GPD,Street - In vehicle,R,6R1,426,,N,FREDERICK,,AVE,39.05909,-77.1162,6D,"(39.0591, -77.1162)"
201271897,2605,190062890,12/31/2019 12:08:23 PM,2019-09-06 00:00:00,12/26/2019 05:30:00 PM,26B,1,Crime Against Property,Credit Card/Automatic Teller Machine Fraud,FRAUD - ILLEGAL USE CREDIT CARDS,WHEATON,3200 BLK  SANDBURG TER,OLNEY,MD,20832.0,MCPD,Other/Unknown,J,4J2,642,3200.0,,SANDBURG,,TER,39.13823,-77.0651,4D,"(39.1382, -77.0651)"
201419019,2610,230014055,03/23/2023 01:23:30 PM,2023-03-23 13:23:00,03/23/2023 01:30:00 PM,26F,1,Crime Against Property,Identity Theft,IDENTITY THEFT,GERMANTOWN,20000 BLK  AIRCRAFT DR,GERMANTOWN,MD,20874.0,MCPD,Cyberspace,N,5N1,702,20000.0,,AIRCRAFT,,DR,39.18396,-77.2617,5D,"(39.184, -77.2617)"
201273599,5311,200002315,01/14/2020 12:11:03 PM,2020-01-14 12:11:00,01/14/2020 02:00:00 PM,90C,1,Crime Against Society,Disorderly Conduct,PUBLIC PEACE - DISORDERLY CONDUCT,ROCKVILLE,1  BLK  MARYLAND AVE,ROCKVILLE,MD,20850.0,RCPD,Library,A,1A3,277,1.0,,MARYLAND,,AVE,39.14486,-77.2027,1D,"(39.1449, -77.2027)"
201386833,2499,220033436,08/04/2022 03:49:24 AM,2022-08-04 03:49:00,08/04/2022 03:49:00 AM,240,1,Crime Against Property,Motor Vehicle Theft,STOLEN VEHICLE (DESCRIBE OFFENSE),SILVER SPRING,,SILVER SPRING,MD,20903.0,MCPD,Street - In vehicle,H,3H2,141,,,NEW HAMPSHIRE,,AVE,38.97994,-76.9899,3D,"(38.9799, -76.9899)"
201401406,2404,220051239,11/19/2022 04:48:26 PM,2022-11-19 16:47:00,,240,1,Crime Against Property,Motor Vehicle Theft,AUTO THEFT - VEHICLE THEFT,ROCKVILLE,15500 BLK  FREDERICK RD,DERWOOD,MD,20855.0,MCPD,Auto Dealership,A,1A4,280,15500.0,,FREDERICK,,RD,39.11,-77.1604,1D,"(39.11, -77.1604)"
201440273,2303,230049230,08/13/2023 11:31:49 AM,2023-08-13 11:31:00,,23C,1,Crime Against Property,Shoplifting,LARCENY - SHOPLIFTING,GERMANTOWN,21000 BLK  FREDERICK RD,GERMANTOWN,MD,20876.0,MCPD,Retail - Hardware,M,5M1,701,21000.0,,FREDERICK,,RD,39.20103,-77.2454,5D,"(39.201, -77.2454)"
201421209,4104,230016662,04/07/2023 04:50:45 PM,2023-04-07 16:50:00,04/07/2023 05:09:00 PM,90G,1,Crime Against Society,Liquor Law Violations,LIQUOR - POSSESS,WHEATON,12200 BLK  VEIRS MILL RD,SILVER SPRING,MD,20906.0,MCPD,Parking Lot - Commercial,K,4K2,307,12200.0,,VEIRS MILL,,RD,39.05614,-77.0826,4D,"(39.0561, -77.0826)"
201274987,2399,200004060,01/24/2020 06:55:42 PM,2019-12-30 14:00:00,01/20/2020 03:00:00 PM,23H,1,Crime Against Property,All other Larceny,LARCENY (DESCRIBE OFFENSE),ROCKVILLE,900 BLK  WILLOWLEAF WAY,POTOMAC,MD,20854.0,MCPD,Other/Unknown,B,1B1,227,900.0,,WILLOWLEAF,,WAY,39.06717,-77.1635,1D,"(39.0672, -77.1635)"
201226998,1313,190007349,02/15/2019 08:45:57 AM,2019-02-14 10:24:00,,13B,1,Crime Against Person,Simple Assault,ASSAULT - SIMPLE,SILVER SPRING,1  BLK  UNIVERSITY BLV E,SILVER SPRING,MD,20901.0,MCPD,School/College - DO NOT USE,H,3H2,156,1.0,,UNIVERSITY,E,BLV,39.02037,-77.0127,3D,"(39.0204, -77.0127)"
201263574,9103,190052777,11/02/2019 10:23:40 AM,2019-09-30 12:00:00,,720,1,Crime Against Society,Animal Cruelty,ANIMAL CRUELTY,GERMANTOWN,13100 BLK  THACKERY PL,GERMANTOWN,MD,20874.0,MCPD,Residence -Townhouse/Duplex,N,5N1,702,13100.0,,THACKERY,,PL,39.18529,-77.2701,5D,"(39.1853, -77.2701)"
201318814,2203,210004582,02/05/2021 07:50:32 AM,2021-02-04 16:00:00,02/05/2021 07:48:00 AM,220,1,Crime Against Property,Burglary/Breaking and Entering,BURGLARY - FORCED ENTRY-NONRESIDENTIAL,ROCKVILLE,17000 BLK  OXLEY FARM RD,POOLESVILLE,MD,20837.0,MCPD,Residence - Single Family,B,1B3,499,17000.0,,OXLEY FARM,,RD,39.13562,-77.4165,1D,"(39.1356, -77.4165)"
201447211,1399,230058806,10/05/2023 05:35:56 PM,2023-10-05 17:35:00,,13B,1,Crime Against Person,Simple Assault,ASSAULT - 2ND DEGREE,MONTGOMERY VILLAGE,9900 BLK  MEDICAL CENTER DR,ROCKVILLE,MD,20850.0,MCPD,School - Elementary/Secondary,P,6P1,721,9900.0,,MEDICAL CENTER,,DR,39.09658,-77.1994,6D,"(39.0966, -77.1994)"
201430635,2305,230028171,06/12/2023 07:14:09 AM,2023-06-11 18:00:00,06/12/2023 06:35:00 AM,23F,1,Crime Against Property,Theft From Motor Vehicle,LARCENY - FROM AUTO,MONTGOMERY VILLAGE,17200 BLK  KING JAMES WAY,GAITHERSBURG,,20877.0,MCPD,Parking Lot - Residential,P,6P1,429,17200.0,,KING JAMES,,WAY,39.13854,-77.2065,6D,"(39.1385, -77.2065)"
201381183,2399,220026607,06/20/2022 06:30:02 PM,2022-06-20 18:30:00,,23H,1,Crime Against Property,All other Larceny,LARCENY (DESCRIBE OFFENSE),MONTGOMERY VILLAGE,200 BLK  KENTLANDS BLV,GAITHERSBURG,MD,20878.0,GPD,Retail - Other,P,6P2,450,200.0,,KENTLANDS,,BLV,39.12313,-77.2357,6D,"(39.1231, -77.2357)"
201395075,2308,220042878,10/01/2022 08:44:48 PM,2022-09-30 16:00:00,09/30/2022 04:30:00 PM,23D,1,Crime Against Property,Theft from Building,LARCENY - FROM BLDG,MONTGOMERY VILLAGE,800 BLK  RUSSELL AVE,GAITHERSBURG,MD,20879.0,MCPD,Retail - Department/Discount Store,R,6R1,426,800.0,,RUSSELL,,AVE,39.15473,-77.2097,6D,"(39.1547, -77.2097)"
201302530,2605,200036694,09/18/2020 11:43:23 PM,2020-09-16 12:00:00,,26B,1,Crime Against Property,Credit Card/Automatic Teller Machine Fraud,FRAUD - ILLEGAL USE CREDIT CARDS,BETHESDA,11000 BLK  WEST AVE,KENSINGTON,MD,20895.0,MCPD,Residence - Single Family,D,2D3,317,11000.0,,WEST,,AVE,39.03651,-77.0622,2D,"(39.0365, -77.0622)"
201445698,2404,230056239,09/22/2023 09:06:12 AM,2023-09-21 18:00:00,09/22/2023 08:10:00 AM,240,1,Crime Against Property,Motor Vehicle Theft,AUTO THEFT - VEHICLE THEFT,WHEATON,2100 BLK  RANDOLPH RD,SILVER SPRING,MD,20902.0,MCPD,Parking Lot - Residential,L,4L1,366,2100.0,,RANDOLPH,,RD,39.06049,-77.0449,4D,"(39.0605, -77.0449)"
201396246,2601,220044947,10/13/2022 08:13:27 PM,2022-10-13 17:30:00,10/13/2022 07:00:00 PM,26A,1,Crime Against Property,False Pretenses/Swindle/Confidence Game,FRAUD - CONFIDENCE GAME,BETHESDA,8000 BLK  INVERNESS RIDGE RD,POTOMAC,MD,20854.0,MCPD,Other/Unknown,E,2E4,220,8000.0,,INVERNESS RIDGE,,RD,39.03059,-77.1631,2D,"(39.0306, -77.1631)"
201326896,2305,210013260,04/09/2021 02:17:20 PM,2021-04-09 13:30:00,04/09/2021 02:16:00 PM,23F,1,Crime Against Property,Theft From Motor Vehicle,LARCENY - FROM AUTO,SILVER SPRING,800 BLK  WAYNE AVE,SILVER SPRING,MD,20910.0,MCPD,Parking Lot - Commercial,G,3G1,671,800.0,,WAYNE,,AVE,38.99717,-77.0218,3D,"(38.9972, -77.0218)"
201435407,2902,230033958,07/17/2023 08:22:04 AM,2023-07-16 23:00:00,07/17/2023 08:00:00 AM,290,1,Crime Against Property,Destruction/Damage/Vandalism of Property,DAMAGE PROPERTY - PRIVATE,TAKOMA PARK,7400 BLK  NEW HAMPSHIRE AVE,TAKOMA PARK,MD,20912.0,TPPD,Parking Lot - Rec Center,T,8T3,807,7400.0,,NEW HAMPSHIRE,,AVE,38.98337,-76.9883,TPPD,"(38.9834, -76.9883)"
201368869,5213,220011790,03/18/2022 10:50:51 PM,2022-03-18 22:40:00,03/18/2022 11:15:00 PM,520,1,Crime Against Society,Weapon Law Violations,WEAPON - FIRING,TAKOMA PARK,7600 BLK  MAPLE AVE,TAKOMA PARK,MD,20912.0,TPPD,Street - Residential,T,8T2,804,7600.0,,MAPLE,,AVE,38.98266,-77.0074,TPPD,"(38.9827, -77.0074)"
201290563,2305,200022564,06/08/2020 03:59:42 PM,2020-06-07 21:00:00,06/08/2020 03:55:00 PM,23F,1,Crime Against Property,Theft From Motor Vehicle,LARCENY - FROM AUTO,TAKOMA PARK,500 BLK  LINCOLN AVE,TAKOMA PARK,MD,20912.0,TPPD,Street - Residential,T,8T3,808,500.0,,LINCOLN,,AVE,38.97819,-76.9978,TPPD,"(38.9782, -76.9978)"
201272684,1399,200000710,01/05/2020 03:58:03 AM,2020-01-05 03:58:00,01/05/2020 03:58:00 AM,13B,1,Crime Against Person,Simple Assault,ASSAULT - 2ND DEGREE,SILVER SPRING,3300 BLK  PARKFORD MANOR TER,SILVER SPRING,MD,20904.0,MCPD,Residence -Townhouse/Duplex,I,3I2,380,3300.0,,PARKFORD MANOR,,TER,39.07901,-76.9399,3D,"(39.079, -76.9399)"
201359587,2610,220000718,01/06/2022 08:40:02 PM,2021-12-22 20:50:00,12/23/2021 04:00:00 AM,26F,1,Crime Against Property,Identity Theft,FRAUD - IDENTITY THEFT,SILVER SPRING,11300 BLK  BAROQUE RD,SILVER SPRING,MD,20901.0,MCPD,Cyberspace,H,3H2,152,11300.0,,BAROQUE,,RD,39.04238,-76.9971,3D,"(39.0424, -76.9971)"
201252992,2303,190039624,08/19/2019 02:52:15 PM,2019-08-19 11:40:00,,23C,1,Crime Against Property,Shoplifting,LARCENY - SHOPLIFTING,GERMANTOWN,22700 BLK  CLARKSBURG RD,CLARKSBURG,MD,20871.0,MCPD,Retail - Department/Discount Store,N,5N3,466,22700.0,,CLARKSBURG,,RD,39.2291,-77.2898,5D,"(39.2291, -77.2898)"
201387148,2902,220033826,08/06/2022 05:54:11 PM,2022-08-06 17:52:00,,290,1,Crime Against Property,Destruction/Damage/Vandalism of Property,DAMAGE PROPERTY - PRIVATE,SILVER SPRING,9200 BLK  NEW HAMPSHIRE AVE,SILVER SPRING,MD,20903.0,MCPD,Street - In vehicle,H,3H2,137,9200.0,,NEW HAMPSHIRE,,AVE,39.00636,-76.9804,3D,"(39.0064, -76.9804)"
201343994,2404,210034508,09/03/2021 07:23:34 AM,2021-09-02 19:00:00,09/03/2021 07:18:00 AM,240,1,Crime Against Property,Motor Vehicle Theft,AUTO THEFT - VEHICLE THEFT,MONTGOMERY VILLAGE,17600 BLK  SEQUOIA DR,GAITHERSBURG,MD,20877.0,RCPD,Street - Residential,P,6P3,551,17600.0,,SEQUOIA,,DR,39.14402,-77.1678,6D,"(39.144, -77.1678)"
201318004,5212,210003481,01/28/2021 04:06:52 AM,2021-01-28 04:06:00,,520,1,Crime Against Society,Weapon Law Violations,WEAPON - POSSESSION,BETHESDA,,BETHESDA,MD,20814.0,MCPD,Street - In vehicle,D,2D2,034,,,WISCONSIN,,AVE,38.9777,-77.0909,2D,"(38.9777, -77.0909)"
201382338,2699,220027844,06/28/2022 05:23:15 PM,2022-06-29 15:25:00,,26A,1,Crime Against Property,False Pretenses/Swindle/Confidence Game,FRAUD (DESCRIBE OFFENSE),WHEATON,4500 BLK  FALCON ST,ROCKVILLE,,20853.0,MCPD,Cyberspace,K,4K2,527,4500.0,,FALCON,,ST,39.06679,-77.0885,4D,"(39.0668, -77.0885)"
201301848,2305,200035901,09/13/2020 04:44:46 PM,2020-09-13 16:44:00,09/13/2020 05:00:00 PM,23F,1,Crime Against Property,Theft From Motor Vehicle,LARCENY - FROM AUTO,ROCKVILLE,14900 BLK  SHADY GROVE RD,ROCKVILLE,MD,20850.0,RCPD,Parking Lot - Other,B,1B1,241,14900.0,,SHADY GROVE,,RD,39.09939,-77.1924,1D,"(39.0994, -77.1924)"
201440336,2404,230050438,08/20/2023 09:37:55 PM,2023-08-20 21:37:00,,240,1,Crime Against Property,Motor Vehicle Theft,AUTO THEFT - VEHICLE THEFT,GERMANTOWN,20000 BLK  FREDERICK RD,GERMANTOWN,MD,20876.0,MCPD,Parking Lot - Residential,M,5M1,468,20000.0,,FREDERICK,,RD,39.18327,-77.2388,5D,"(39.1833, -77.2388)"
201326973,2303,210012914,04/07/2021 05:46:26 AM,2021-04-07 07:32:00,04/07/2021 12:00:00 AM,23C,1,Crime Against Property,Shoplifting,LARCENY - SHOPLIFTING,SILVER SPRING,900 BLK  THAYER AVE,SILVER SPRING,MD,20910.0,MCPD,Grocery/Supermarket,G,3G1,670,900.0,,THAYER,,AVE,38.99304,-77.024,3D,"(38.993, -77.024)"
201419690,2305,230011317,03/08/2023 07:32:51 AM,2023-03-07 16:00:00,03/08/2023 06:40:00 AM,23F,1,Crime Against Property,Theft From Motor Vehicle,LARCENY - FROM AUTO,GERMANTOWN,18400 BLK  CINNAMON DR,GERMANTOWN,MD,20874.0,MCPD,Other/Unknown,N,5N2,594,18400.0,,CINNAMON,,DR,39.15689,-77.2642,5D,"(39.1569, -77.2642)"
201274792,1103,190053050,,2019-10-12 23:00:00,,11A,1,Crime Against Person,Forcible Rape,RAPE - STRONG-ARM,WHEATON,2900 BLK  BEL PRE RD,SILVER SPRING,MD,20906.0,MCPD,Street - In vehicle,K,4K1,532,2900.0,,BEL PRE,,RD,39.09065,-77.0591,4D,"(39.0906, -77.0591)"
201345812,2299,210036770,09/18/2021 12:35:45 AM,2021-09-18 00:35:00,,220,1,Crime Against Property,Burglary/Breaking and Entering,BURGLARY (DESCRIBE OFFENSE),MONTGOMERY VILLAGE,200 BLK  PERRY PKW,GAITHERSBURG,MD,20877.0,GPD,Hotel/Motel/Etc.,P,6P2,428,200.0,,PERRY,,PKW,39.14046,-77.2095,6D,"(39.1405, -77.2095)"
201242571,2308,190026765,06/04/2019 08:56:51 PM,2019-06-04 20:56:00,,23D,1,Crime Against Property,Theft from Building,LARCENY - FROM BLDG,GERMANTOWN,12100 BLK  SNOWDEN FARM PKW,CLARKSBURG,MD,20871.0,MCPD,Convenience Store,M,5M3,476,12100.0,,SNOWDEN FARM,,PKW,39.22898,-77.2514,5D,"(39.229, -77.2514)"
201334278,5311,210022388,06/11/2021 09:22:27 PM,2021-06-11 21:22:00,,90C,1,Crime Against Society,Disorderly Conduct,PUBLIC PEACE - DISORDERLY CONDUCT,SILVER SPRING,8600 BLK  11TH AVE,SILVER SPRING,MD,20903.0,MCPD,Residence - Single Family,H,3H1,132,8600.0,,11TH,,AVE,38.99858,-76.9886,3D,"(38.9986, -76.9886)"
201388601,1202,220035556,08/17/2022 08:41:36 PM,2022-08-17 20:41:00,,120,1,Crime Against Property,Robbery,ROBBERY - BUSINESS-OTHER WEAPON,BETHESDA,7100 BLK  DEMOCRACY BLV,BETHESDA,MD,20817.0,MCPD,Retail - Mall,E,2E3,204,7100.0,,DEMOCRACY,,BLV,39.02207,-77.1473,2D,"(39.0221, -77.1473)"
201372624,2605,220016251,04/17/2022 07:10:20 AM,2022-04-16 22:00:00,04/17/2022 06:00:00 AM,26B,1,Crime Against Property,Credit Card/Automatic Teller Machine Fraud,FRAUD - ILLEGAL USE CREDIT CARDS,ROCKVILLE,500 BLK W MONTGOMERY AVE,ROCKVILLE,MD,20850.0,MCPD,Other/Unknown,A,1A3,249,500.0,W,MONTGOMERY,,AVE,39.08484,-77.1624,1D,"(39.0848, -77.1624)"
201229642,2902,190010703,03/07/2019 07:31:07 PM,2019-03-07 07:00:00,03/07/2019 07:10:00 PM,290,1,Crime Against Property,Destruction/Damage/Vandalism of Property,DAMAGE PROPERTY - PRIVATE,MONTGOMERY VILLAGE,16700 BLK  SIOUX LA,GAITHERSBURG,MD,20878.0,MCPD,Street - Residential,P,6P2,591,16700.0,,SIOUX,,LA,39.12968,-77.249,6D,"(39.1297, -77.249)"
201294214,2308,200026843,07/10/2020 06:32:09 PM,2020-07-07 12:30:00,07/10/2020 12:00:00 PM,23D,1,Crime Against Property,Theft from Building,LARCENY - FROM BLDG,SILVER SPRING,8800 BLK  COLESVILLE RD,SILVER SPRING,MD,20910.0,MCPD,Residence - Apartment/Condo,G,3G2,118,8800.0,,COLESVILLE,,RD,38.999,-77.0261,3D,"(38.999, -77.0261)"
201235007,2303,190017294,04/13/2019 04:50:38 PM,2019-04-13 16:59:00,,23C,1,Crime Against Property,Shoplifting,LARCENY - SHOPLIFTING,SILVER SPRING,8600 BLK  COLESVILLE RD,SILVER SPRING,MD,20910.0,MCPD,Retail - Mall,G,3G1,109,8600.0,,COLESVILLE,,RD,38.99602,-77.0281,3D,"(38.996, -77.0281)"
201426547,1399,230023150,05/14/2023 06:24:57 PM,2023-05-14 18:24:00,,13B,2,Crime Against Person,Simple Assault,ASSAULT - 2ND DEGREE,SILVER SPRING,12000 BLK  CHERRY HILL RD,SILVER SPRING,MD,20904.0,MCPD,Street - Bus Stop,I,3I1,146,12000.0,,CHERRY HILL,,RD,39.05259,-76.9531,3D,"(39.0526, -76.9531)"
201266705,1206,190056802,11/24/2019 04:42:53 PM,2019-11-23 15:00:00,,120,1,Crime Against Property,Robbery,ROBBERY - STREET-STRONG-ARM,MONTGOMERY VILLAGE,1  BLK  GRAND CORNER AVE,GAITHERSBURG,MD,20878.0,GPD,Street - Commercial,P,6P1,549,1.0,,GRAND CORNER,,AVE,39.11801,-77.2004,6D,"(39.118, -77.2004)"
201431403,5404,230028018,06/11/2023 02:27:27 AM,2023-06-11 02:27:00,,90D,1,Crime Against Society,Driving Under the Influence,DRIVING UNDER THE INFLUENCE LIQUOR,MONTGOMERY VILLAGE,,GAITHERSBURG,MD,20879.0,GPD,Street - In vehicle,R,6R3,420,,,WOODFIELD,,RD,39.28207,-77.2022,6D,"(39.2821, -77.2022)"
201383932,2205,220029561,07/10/2022 02:20:07 AM,2022-07-10 02:20:00,07/10/2022 12:00:00 AM,220,1,Crime Against Property,Burglary/Breaking and Entering,BURGLARY - NO FORCED ENTRY-NONRESIDENTIAL,BETHESDA,9600 BLK  OLD GEORGETOWN RD,BETHESDA,MD,20814.0,MCFM,Church/Synagogue/Temple,E,2E2,071,9600.0,,OLD GEORGETOWN,,RD,39.01307,-77.1173,2D,"(39.0131, -77.1173)"
201402530,1302,220052539,11/28/2022 07:14:35 PM,2022-11-28 19:14:00,11/28/2022 07:30:00 PM,13A,1,Crime Against Person,Aggravated Assault,ASSAULT - AGGRAVATED - FAMILY-OTHER WEAPON,ROCKVILLE,1600 BLK E JEFFERSON ST,ROCKVILLE,MD,20852.0,RCPD,Parking Lot - Residential,A,1A1,267,1600.0,E,JEFFERSON,,ST,39.06226,-77.129,1D,"(39.0623, -77.129)"
201261446,2308,190050193,10/19/2019 01:44:59 PM,2019-10-08 13:44:00,10/11/2019 12:00:00 AM,23D,1,Crime Against Property,Theft from Building,LARCENY - FROM BLDG,MONTGOMERY VILLAGE,18200 BLK  LOST KNIFE CIR,MONTGOMERY VILLAGE,MD,20886.0,MCPD,Residence - Apartment/Condo,R,6R1,505,18200.0,,LOST KNIFE,,CIR,39.15711,-77.2033,6D,"(39.1571, -77.2033)"
201385364,2305,220031558,07/22/2022 11:33:15 AM,2022-07-21 21:22:00,07/22/2022 11:00:00 AM,23F,1,Crime Against Property,Theft From Motor Vehicle,LARCENY - FROM AUTO,SILVER SPRING,400 BLK  SHERBROOK DR,SILVER SPRING,MD,20904.0,MCPD,Parking Lot - Residential,I,3I1,151,400.0,,SHERBROOK,,DR,39.05354,-77.0013,3D,"(39.0535, -77.0013)"
201300814,2305,200034628,09/04/2020 10:32:20 AM,2020-09-04 10:32:00,,23F,1,Crime Against Property,Theft From Motor Vehicle,LARCENY - FROM AUTO,ROCKVILLE,12100 BLK  HANSON FARM DR,GAITHERSBURG,MD,20878.0,MCPD,Construction Site,B,1B2,457,12100.0,,HANSON FARM,,DR,39.08556,-77.2491,1D,"(39.0856, -77.2491)"
201380734,3530,220026034,06/17/2022 02:11:20 AM,2022-06-17 02:11:00,,35A,1,Crime Against Society,Drug/Narcotic Violations,DRUGS - COCAINE - SELL,MONTGOMERY VILLAGE,1  BLK N SUMMIT DR,GAITHERSBURG,MD,20877.0,GPD,Residence - Apartment/Condo,P,6P3,419,1.0,N,SUMMIT,,DR,39.14581,-77.1925,6D,"(39.1458, -77.1925)"
201389991,1399,220037152,08/28/2022 01:56:07 AM,2022-08-28 01:20:00,08/28/2022 01:30:00 AM,13B,1,Crime Against Person,Simple Assault,ASSAULT - 2ND DEGREE,WHEATON,12000 BLK  CLARIDGE RD,SILVER SPRING,MD,20902.0,MCPD,Residence - Single Family,L,4L1,328,12000.0,,CLARIDGE,,RD,39.0516,-77.0661,4D,"(39.0516, -77.0661)"
201371298,2304,220014677,04/06/2022 04:30:28 PM,2022-04-05 22:00:00,04/06/2022 07:00:00 AM,23G,1,Crime Against Property,Theft of Motor Vehicle Parts or Accessories,LARCENY - AUTO PARTS,SILVER SPRING,1  BLK  SCARLET SAGE CT,BURTONSVILLE,MD,20866.0,MCPD,Street - Residential,I,3I2,381,1.0,,SCARLET SAGE,,CT,39.10374,-76.9241,3D,"(39.1037, -76.9241)"
201358233,5404,210052597,12/25/2021 04:45:50 PM,2021-12-25 17:00:00,12/25/2021 12:00:00 AM,90D,1,Crime Against Society,Driving Under the Influence,DRIVING UNDER THE INFLUENCE LIQUOR,MONTGOMERY VILLAGE,16500 BLK  SHADY GROVE RD,GAITHERSBURG,MD,20877.0,MCPD,Street - In vehicle,P,6P3,437,16500.0,,SHADY GROVE,,RD,39.12677,-77.1735,6D,"(39.1268, -77.1735)"
201238980,2610,190021299,05/06/2019 01:38:04 PM,2019-05-05 00:00:00,,26F,1,Crime Against Property,Identity Theft,FRAUD - IDENTITY THEFT,ROCKVILLE,1  BLK  BEALL AVE,ROCKVILLE,MD,20850.0,MCPD,Other/Unknown,A,1A3,254,1.0,,BEALL,,AVE,39.08752,-77.1501,1D,"(39.0875, -77.1501)"
201272321,2305,200000727,01/05/2020 11:12:40 AM,2020-01-05 06:00:00,01/05/2020 06:10:00 AM,23F,1,Crime Against Property,Theft From Motor Vehicle,LARCENY - FROM AUTO,WHEATON,15000 BLK  COLUMBINE WAY,ROCKVILLE,MD,20853.0,MCPD,Residence - Driveway,K,4K2,394,15000.0,,COLUMBINE,,WAY,39.1024,-77.0911,4D,"(39.1024, -77.0911)"
201301020,2305,200034916,09/06/2020 12:33:46 PM,2020-09-05 10:00:00,09/06/2020 11:30:00 AM,23F,1,Crime Against Property,Theft From Motor Vehicle,LARCENY - FROM AUTO,MONTGOMERY VILLAGE,1000 BLK  BAYRIDGE TER,GAITHERSBURG,MD,20878.0,MCPD,Parking Lot - Residential,P,6P2,449,1000.0,,BAYRIDGE,,TER,39.13018,-77.236,6D,"(39.1302, -77.236)"
201241919,2308,190025739,05/30/2019 10:24:02 AM,2019-05-08 09:00:00,05/12/2019 09:00:00 AM,23D,1,Crime Against Property,Theft from Building,LARCENY - FROM BLDG,BETHESDA,8300 BLK  BURDETTE RD,BETHESDA,MD,20817.0,MCPD,Residence - Nursing Home,E,2E2,060,8300.0,,BURDETTE,,RD,38.99092,-77.1521,2D,"(38.9909, -77.1521)"
201350102,2404,210042258,10/21/2021 05:09:45 AM,2021-10-21 05:09:00,,240,1,Crime Against Property,Motor Vehicle Theft,AUTO THEFT - VEHICLE THEFT,ROCKVILLE,14900 BLK  PLAINFIELD LA,GERMANTOWN,MD,20874.0,MCPD,Residence - Driveway,B,1B2,459,14900.0,,PLAINFIELD,,LA,39.08708,-77.3099,1D,"(39.0871, -77.3099)"
201438952,2404,230048771,08/10/2023 02:47:24 PM,2023-08-10 06:00:00,08/10/2023 01:00:00 PM,240,1,Crime Against Property,Motor Vehicle Theft,AUTO THEFT - VEHICLE THEFT,BETHESDA,7500 BLK  OLD GEORGETOWN RD,BETHESDA,MD,20814.0,MCPD,Street - Commercial,D,2D2,050,7500.0,,OLD GEORGETOWN,,RD,38.98466,-77.0942,2D,"(38.9847, -77.0942)"
201281571,5404,200012125,03/11/2020 11:23:02 PM,2020-03-11 23:34:00,,90D,1,Crime Against Society,Driving Under the Influence,DRIVING UNDER THE INFLUENCE LIQUOR,GERMANTOWN,15500 BLK  N270 X15 TO X16 HWY,GERMANTOWN,MD,20876.0,MCPD,Street - In vehicle,M,5M3,475,15500.0,,N270 X15 TO X16,,HWY,39.19106,-77.2591,5D,"(39.1911, -77.2591)"
201385997,2605,220032438,07/28/2022 11:44:23 AM,2022-07-25 14:00:00,07/26/2022 07:00:00 PM,26B,1,Crime Against Property,Credit Card/Automatic Teller Machine Fraud,FRAUD - ILLEGAL USE CREDIT CARDS,WHEATON,1900 BLK  ALBERTI DR,SILVER SPRING,MD,20902.0,MCPD,Other/Unknown,L,4L2,353,1900.0,,ALBERTI,,DR,39.03471,-77.0405,4D,"(39.0347, -77.0405)"
201357088,2404,210051108,12/16/2021 07:34:56 AM,2021-12-16 07:34:00,,240,1,Crime Against Property,Motor Vehicle Theft,AUTO THEFT - VEHICLE THEFT,MONTGOMERY VILLAGE,1  BLK  NAPA VALLEY RD,GAITHERSBURG,MD,20878.0,GPD,Parking Lot - Residential,P,6P2,554,1.0,,NAPA VALLEY,,RD,39.13459,-77.2275,6D,"(39.1346, -77.2275)"
201236795,5311,190019012,04/23/2019 02:05:43 PM,2019-04-23 13:55:00,,90C,1,Crime Against Society,Disorderly Conduct,PUBLIC PEACE - DISORDERLY CONDUCT,ROCKVILLE,6100 BLK  MONTROSE RD,ROCKVILLE,MD,20852.0,MCPD,Street - Commercial,A,1A1,270,6100.0,,MONTROSE,,RD,39.05276,-77.1229,1D,"(39.0528, -77.1229)"
201437915,2610,230046729,07/28/2023 09:18:08 PM,2023-07-28 18:30:00,07/28/2023 07:30:00 PM,26F,1,Crime Against Property,Identity Theft,IDENTITY THEFT,WHEATON,14300 BLK  GEORGIA AVE,SILVER SPRING,MD,20906.0,MCPD,Other/Unknown,K,4K1,534,14300.0,,GEORGIA,,AVE,39.09053,-77.0799,4D,"(39.0905, -77.0799)"
201410406,3550,230004038,01/25/2023 07:19:48 AM,2023-01-25 08:53:00,01/25/2023 12:00:00 AM,35B,1,Crime Against Society,Drug Equipment Violations,DRUGS - NARCOTIC EQUIP - POSSESS,WHEATON,2700 BLK  UNIVERSITY BLV,SILVER SPRING,MD,20902.0,MCPD,Street - In vehicle,L,4L2,321,2700.0,,UNIVERSITY,,BLV,39.04002,-77.0554,4D,"(39.04, -77.0554)"
201424316,2304,230020471,04/29/2023 01:02:15 PM,2023-04-20 21:00:00,04/29/2023 12:00:00 PM,23G,1,Crime Against Property,Theft of Motor Vehicle Parts or Accessories,LARCENY - AUTO PARTS,BETHESDA,1700 BLK E WEST HWY,SILVER SPRING,MD,20910.0,MCPD,Parking Lot - Residential,D,2D1,517,1700.0,E,WEST,,HWY,0.0,0.0,2D,"(0.0, 0.0)"
201278616,1305,200008627,02/21/2020 02:17:11 AM,2020-02-21 01:00:00,,13A,1,Crime Against Person,Aggravated Assault,ASSAULT - AGGRAVATED - NON-FAMILY-OTHER WEAPON,GERMANTOWN,,GERMANTOWN,MD,20874.0,MCPD,Park,N,5N1,447,,,WISTERIA,,DR,39.17752,-77.2711,5D,"(39.1775, -77.2711)"
201448210,2303,230060180,10/12/2023 08:57:58 PM,2023-10-12 20:57:00,,23C,1,Crime Against Property,Shoplifting,LARCENY - SHOPLIFTING,SILVER SPRING,,SILVER SPRING,MD,20910.0,MCPD,Retail - Department/Discount Store,G,3G1,671,,,FENTON,,ST,38.98471,-77.0227,3D,"(38.9847, -77.0227)"
201425677,2305,230022133,05/09/2023 07:30:51 AM,2023-05-08 17:00:00,05/09/2023 07:30:00 AM,23F,1,Crime Against Property,Theft From Motor Vehicle,LARCENY - FROM AUTO,BETHESDA,10300 BLK  STRATHMORE HALL ST,ROCKVILLE,MD,20852.0,MCPD,Parking Garage - Residential,D,2D4,185,10300.0,,STRATHMORE HALL,,ST,39.02587,-77.1013,2D,"(39.0259, -77.1013)"
201384811,2303,220030980,07/19/2022 07:36:48 AM,2022-05-23 16:20:00,05/23/2022 04:35:00 PM,23C,1,Crime Against Property,Shoplifting,LARCENY - SHOPLIFTING,ROCKVILLE,5700 BLK  BOU AVE,ROCKVILLE,MD,20852.0,MCPD,Retail - Department/Discount Store,A,1A2,735,5700.0,,BOU,,AVE,39.05597,-77.1136,1D,"(39.056, -77.1136)"
201440004,2304,230050041,08/18/2023 06:40:18 AM,2023-08-17 21:00:00,08/18/2023 06:30:00 AM,23G,1,Crime Against Property,Theft of Motor Vehicle Parts or Accessories,LARCENY - AUTO PARTS,GERMANTOWN,11900 BLK  SKYLARK RD,CLARKSBURG,MD,20871.0,MCPD,Residence - Driveway,M,5M3,476,11900.0,,SKYLARK,,RD,39.23441,-77.2454,5D,"(39.2344, -77.2454)"
201319887,2602,210005856,02/14/2021 07:35:41 PM,2021-02-14 19:35:00,,26A,1,Crime Against Property,False Pretenses/Swindle/Confidence Game,FRAUD - SWINDLE,WHEATON,15600 BLK  THOMPSON RD,SILVER SPRING,MD,20905.0,MCPD,Residence - Single Family,J,4J1,385,15600.0,,THOMPSON,,RD,39.11204,-76.9698,4D,"(39.112, -76.9698)"
201310290,2999,200046098,11/22/2020 12:45:41 AM,2020-11-22 00:45:00,,290,1,Crime Against Property,Destruction/Damage/Vandalism of Property,DAMAGE PROPERTY (DESCRIBE OFFENSE),SILVER SPRING,8000 BLK  13TH ST,SILVER SPRING,MD,20910.0,MCPD,Residence - Apartment/Condo,G,3G1,090,8000.0,,13TH,,ST,38.98692,-77.0296,3D,"(38.9869, -77.0296)"
201240214,2305,190023785,05/20/2019 05:03:44 AM,2019-05-20 03:30:00,05/20/2019 05:03:00 AM,23F,1,Crime Against Property,Theft From Motor Vehicle,LARCENY - FROM AUTO,SILVER SPRING,11200 BLK  OAK LEAF DR,SILVER SPRING,MD,20901.0,MCPD,Parking Garage - Residential,H,3H2,144,11200.0,,OAK LEAF,,DR,39.03844,-76.9949,3D,"(39.0384, -76.9949)"
201313226,2305,200049461,12/16/2020 06:51:26 AM,2020-12-16 06:45:00,12/16/2020 06:51:00 AM,23F,1,Crime Against Property,Theft From Motor Vehicle,LARCENY - FROM AUTO,WHEATON,3100 BLK  OLNEY SANDY SPRING RD,OLNEY,MD,20832.0,MCPD,Parking Lot - Commercial,J,4J2,642,3100.0,,OLNEY SANDY SPRING,,RD,39.15083,-77.0621,4D,"(39.1508, -77.0621)"
201265841,5404,190055532,11/17/2019 10:41:24 PM,2019-11-17 22:41:00,11/17/2019 12:00:00 AM,90D,1,Crime Against Society,Driving Under the Influence,DRIVING UNDER THE INFLUENCE LIQUOR,WHEATON,13300 BLK  ARCTIC AVE,ROCKVILLE,MD,20853.0,MCPD,Residence - Single Family,K,4K2,341,13300.0,,ARCTIC,,AVE,39.07381,-77.0993,4D,"(39.0738, -77.0993)"
201263912,2610,190053382,11/06/2019 12:26:51 AM,2019-10-23 12:00:00,10/28/2019 12:00:00 PM,26F,1,Crime Against Property,Identity Theft,FRAUD - IDENTITY THEFT,SILVER SPRING,13800 BLK  BAYWIND CT,SILVER SPRING,MD,20905.0,MCPD,Other/Unknown,I,3I2,379,13800.0,,BAYWIND,,CT,39.0829,-76.9591,3D,"(39.0829, -76.9591)"
201236170,5311,190018715,04/21/2019 07:52:24 PM,2019-04-21 19:52:00,,90C,1,Crime Against Society,Disorderly Conduct,PUBLIC PEACE - DISORDERLY CONDUCT,WHEATON,11400 BLK  VEIRS MILL RD,SILVER SPRING,MD,20902.0,MCPD,Residence - Single Family,L,4L2,325,11400.0,,VEIRS MILL,,RD,39.04258,-77.0603,4D,"(39.0426, -77.0603)"
201253598,2502,190040415,08/23/2019 05:44:53 PM,2019-08-23 17:44:00,,250,1,Crime Against Property,Counterfeiting/Forgery,FORGERY OF OTHER,BETHESDA,9300 BLK  RENSHAW DR,BETHESDA,MD,20817.0,MCPD,Residence - Single Family,E,2E2,067,9300.0,,RENSHAW,,DR,39.0085,-77.1402,2D,"(39.0085, -77.1402)"
201358056,1313,210052365,12/23/2021 03:24:51 PM,2021-12-23 15:24:00,,13B,1,Crime Against Person,Simple Assault,ASSAULT - SIMPLE,GERMANTOWN,22700 BLK  CLARKSBURG RD,CLARKSBURG,MD,20871.0,MCPD,Retail - Clothing,N,5N3,466,22700.0,,CLARKSBURG,,RD,39.2291,-77.2898,5D,"(39.2291, -77.2898)"
201378273,5707,220022940,05/29/2022 02:18:55 AM,2022-05-29 02:39:00,,90J,1,Crime Against Society,Trespass of Real Property,TRESPASSING,SILVER SPRING,1100 BLK  RIPLEY ST,SILVER SPRING,MD,20910.0,MCPD,Residence - Apartment/Condo,G,3G1,094,1100.0,,RIPLEY,,ST,38.99279,-77.0294,3D,"(38.9928, -77.0294)"
201270086,3550,190060079,,2019-12-13 10:47:00,12/13/2019 10:47:00 AM,35B,1,Crime Against Society,Drug Equipment Violations,DRUGS - NARCOTIC EQUIP - POSSESS,SILVER SPRING,7900 BLK  GEORGIA AVE,SILVER SPRING,MD,20910.0,MCPD,Parking Lot - Commercial,G,3G1,090,7900.0,,GEORGIA,,AVE,38.98534,-77.0266,3D,"(38.9853, -77.0266)"
201419005,1399,230014173,03/23/2023 11:42:36 PM,2023-03-23 23:42:00,03/23/2023 01:26:00 AM,13B,1,Crime Against Person,Simple Assault,ASSAULT - 2ND DEGREE,ROCKVILLE,1300 BLK  1ST ST,ROCKVILLE,MD,20850.0,RCPD,Residence - Apartment/Condo,A,1A2,287,1300.0,,1ST,,ST,39.09541,-77.1354,1D,"(39.0954, -77.1354)"
201413315,1399,230007557,02/14/2023 05:02:44 PM,2023-01-14 00:00:00,,13B,1,Crime Against Person,Simple Assault,ASSAULT - 2ND DEGREE,MONTGOMERY VILLAGE,1  BLK S FREDERICK AVE,GAITHERSBURG,MD,20877.0,MCPD,Residence - Apartment/Condo,P,6P1,430,1.0,S,FREDERICK,,AVE,39.09416,-77.1533,6D,"(39.0942, -77.1533)"
201291758,1399,200023873,06/18/2020 01:44:20 PM,2020-06-18 13:15:00,06/18/2020 01:44:00 PM,13B,1,Crime Against Person,Simple Assault,ASSAULT - 2ND DEGREE,SILVER SPRING,7900 BLK  GEORGIA AVE,SILVER SPRING,MD,20910.0,MCPD,Retail - Other,G,3G1,090,7900.0,,GEORGIA,,AVE,38.98534,-77.0266,3D,"(38.9853, -77.0266)"
201304226,2605,200038668,10/01/2020 05:16:11 PM,2020-10-01 17:08:00,,26B,1,Crime Against Property,Credit Card/Automatic Teller Machine Fraud,FRAUD - ILLEGAL USE CREDIT CARDS,ROCKVILLE,200 BLK  CONGRESSIONAL LA,ROCKVILLE,MD,20852.0,MCPD,Other/Unknown,A,1A1,267,200.0,,CONGRESSIONAL,,LA,39.06226,-77.129,1D,"(39.0623, -77.129)"
201371508,1117,220014636,,2022-04-02 10:30:00,,11D,1,Crime Against Person,Forcible Fondling,SEX ABUSE - FONDLING,MONTGOMERY VILLAGE,9800 BLK  LAKE SHORE DR,MONTGOMERY VILLAGE,MD,20886.0,MCPD,Residence - Single Family,R,6R1,505,9800.0,,LAKE SHORE,,DR,39.16143,-77.1995,6D,"(39.1614, -77.1995)"
201288341,5213,200019988,05/19/2020 05:44:30 AM,2020-05-19 03:26:00,,520,1,Crime Against Society,Weapon Law Violations,WEAPON - FIRING,ROCKVILLE,13200 BLK  TWINBROOK PKW,ROCKVILLE,MD,20851.0,MCPD,Parking Lot - Residential,A,1A2,301,13200.0,,TWINBROOK,,PKW,39.07171,-77.1134,1D,"(39.0717, -77.1134)"
201366816,2605,220009262,03/03/2022 07:23:23 PM,2022-03-01 00:01:00,03/03/2022 02:30:00 PM,26B,1,Crime Against Property,Credit Card/Automatic Teller Machine Fraud,FRAUD - ILLEGAL USE CREDIT CARDS,ROCKVILLE,200 BLK  SPRING AVE,ROCKVILLE,MD,20850.0,MCPD,Retail - Drug Store/Pharmacy,A,1A3,283,200.0,,SPRING,,AVE,39.09317,-77.1501,1D,"(39.0932, -77.1501)"
201450953,2605,230063595,,2023-09-07 14:44:00,,26B,1,Crime Against Property,Credit Card/Automatic Teller Machine Fraud,FRAUD - ILLEGAL USE CREDIT CARDS,BETHESDA,4800 BLK  RUGBY AVE,BETHESDA,MD,20814.0,MCPD,Government Building,D,2D2,049,4800.0,,RUGBY,,AVE,0.0,0.0,2D,"(0.0, 0.0)"
201445809,2404,230057228,09/28/2023 07:40:49 AM,2023-09-28 07:40:00,,240,1,Crime Against Property,Motor Vehicle Theft,AUTO THEFT - VEHICLE THEFT,MONTGOMERY VILLAGE,400 BLK  CHRISTOPHER AVE,GAITHERSBURG,MD,20879.0,MCPD,Parking Lot - Residential,R,6R1,426,400.0,,CHRISTOPHER,,AVE,39.15887,-77.2117,6D,"(39.1589, -77.2117)"
201358536,2305,210052950,12/28/2021 04:09:21 PM,2021-12-25 22:45:00,12/26/2021 09:30:00 AM,23F,1,Crime Against Property,Theft From Motor Vehicle,LARCENY - FROM AUTO,GERMANTOWN,19900 BLK  DUNSTABLE CIR,GERMANTOWN,MD,20876.0,MCPD,Residence - Driveway,M,5M1,470,19900.0,,DUNSTABLE,,CIR,39.18287,-77.2309,5D,"(39.1829, -77.2309)"
201263484,4104,190052720,,2019-11-01 22:42:00,,90G,1,Crime Against Society,Liquor Law Violations,LIQUOR - POSSESS,SILVER SPRING,,SILVER SPRING,MD,20910.0,MCPD,Street - Commercial,G,3G1,094,,,GEORGIA,,AVE,39.11237,-77.0755,3D,"(39.1124, -77.0755)"
201378007,1313,220022728,05/27/2022 05:58:46 PM,2022-05-23 08:00:00,05/23/2022 03:00:00 PM,13B,1,Crime Against Person,Simple Assault,ASSAULT - SIMPLE,ROCKVILLE,2100 BLK  WOOTTON PKW,ROCKVILLE,MD,20850.0,MCPD,School - Elementary/Secondary,B,1B1,238,2100.0,,WOOTTON,,PKW,39.07499,-77.1822,1D,"(39.075, -77.1822)"
201329160,2305,210015471,04/26/2021 04:32:38 AM,2021-04-26 04:32:00,,23F,1,Crime Against Property,Theft From Motor Vehicle,LARCENY - FROM AUTO,GERMANTOWN,,GERMANTOWN,MD,20874.0,MCPD,Street - In vehicle,N,5N2,594,,,GROTTO,,LA,39.16891,-77.2683,5D,"(39.1689, -77.2683)"
201228339,2399,190008993,02/25/2019 03:44:38 PM,2019-02-25 00:00:00,02/25/2019 11:30:00 AM,23H,1,Crime Against Property,All other Larceny,LARCENY (DESCRIBE OFFENSE),BETHESDA,11900 BLK  GRAND PARK AVE,ROCKVILLE,MD,20852.0,MCPD,Parking Lot - Commercial,D,2D4,188,11900.0,,GRAND PARK,,AVE,39.05089,-77.1174,2D,"(39.0509, -77.1174)"
201385163,3801,220031453,07/21/2022 03:59:17 PM,2022-07-21 15:59:00,,90F,1,Crime Against Society,"Family Offenses, NonViolent",FAMILY OFFENSE - NEGLECT FAMILY,BETHESDA,10200 BLK  WESTLAKE DR,BETHESDA,,20817.0,MCPD,Residence - Apartment/Condo,E,2E3,520,10200.0,,WESTLAKE,,DR,39.0226,-77.1501,2D,"(39.0226, -77.1501)"
201437556,2404,230047253,08/01/2023 09:34:41 AM,2023-07-31 22:00:00,08/01/2023 09:30:00 AM,240,1,Crime Against Property,Motor Vehicle Theft,AUTO THEFT - VEHICLE THEFT,MONTGOMERY VILLAGE,200 BLK  OLDE TOWNE AVE,GAITHERSBURG,MD,20877.0,MCPD,Parking Garage - Residential,P,6P3,431,200.0,,OLDE TOWNE,,AVE,39.14103,-77.1971,6D,"(39.141, -77.1971)"
201315777,5404,210000230,01/03/2021 02:28:39 AM,2021-01-02 02:21:00,,90D,1,Crime Against Society,Driving Under the Influence,DRIVING UNDER THE INFLUENCE LIQUOR,SILVER SPRING,,SILVER SPRING,MD,20910.0,MCPD,Street - In vehicle,G,3G1,108,,,GEORGIA,,AVE,39.11237,-77.0755,3D,"(39.1124, -77.0755)"
201270985,3562,190062062,12/25/2019 04:12:56 PM,2019-12-25 16:13:00,,35A,1,Crime Against Society,Drug/Narcotic Violations,DRUGS - MARIJUANA - POSSESS,MONTGOMERY VILLAGE,15700 BLK  SHADY GROVE RD,GAITHERSBURG,MD,20877.0,MCPD,Street - In vehicle,P,6P3,757,15700.0,,SHADY GROVE,,RD,39.11327,-77.1865,6D,"(39.1133, -77.1865)"
201233614,2902,190015558,04/03/2019 10:45:50 PM,2019-04-03 22:30:00,,290,1,Crime Against Property,Destruction/Damage/Vandalism of Property,DAMAGE PROPERTY - PRIVATE,GERMANTOWN,14400 BLK W OLD BALTIMORE RD,BOYDS,MD,20841.0,MCPD,Residence - Driveway,N,5N3,597,14400.0,W,OLD BALTIMORE,,RD,39.2139,-77.2982,5D,"(39.2139, -77.2982)"
201335997,2610,210024550,06/26/2021 05:39:58 PM,2021-06-23 15:00:00,,26F,1,Crime Against Property,Identity Theft,FRAUD - IDENTITY THEFT,WHEATON,15400 BLK  THOMPSON RD,SILVER SPRING,MD,20905.0,MCPD,Other/Unknown,J,4J1,385,15400.0,,THOMPSON,,RD,39.10995,-76.9648,4D,"(39.1099, -76.9648)"
201332513,2404,210020280,05/28/2021 08:12:40 PM,2021-05-28 20:00:00,05/28/2021 08:12:00 PM,240,1,Crime Against Property,Motor Vehicle Theft,AUTO THEFT - VEHICLE THEFT,SILVER SPRING,8200 BLK  GEORGIA AVE,SILVER SPRING,MD,20910.0,MCPD,Street - Commercial,G,3G1,093,8200.0,,GEORGIA,,AVE,38.99163,-77.0266,3D,"(38.9916, -77.0266)"
201339313,2404,210028737,07/24/2021 10:12:30 PM,2021-07-24 22:12:00,,240,1,Crime Against Property,Motor Vehicle Theft,AUTO THEFT - VEHICLE THEFT,SILVER SPRING,7900 BLK  GEORGIA AVE,SILVER SPRING,MD,20910.0,MCPD,Retail - Other,G,3G1,090,7900.0,,GEORGIA,,AVE,38.98534,-77.0266,3D,"(38.9853, -77.0266)"
201434845,2399,230033262,07/12/2023 04:27:30 PM,2023-03-04 10:00:00,07/04/2023 10:00:00 AM,23H,1,Crime Against Property,All other Larceny,LARCENY (DESCRIBE OFFENSE),WHEATON,11600 BLK  GAIL PL,SILVER SPRING,MD,20902.0,MCPD,Residence - Single Family,L,4L1,313,11600.0,,GAIL,,PL,39.04566,-77.0704,4D,"(39.0457, -77.0704)"
201299949,2999,200033566,08/27/2020 07:52:03 PM,2020-08-23 08:00:00,08/27/2020 12:00:00 PM,290,1,Crime Against Property,Destruction/Damage/Vandalism of Property,DAMAGE PROPERTY (DESCRIBE OFFENSE),MONTGOMERY VILLAGE,1300 BLK  CARLSBAD DR,GAITHERSBURG,MD,20879.0,GPD,Parking Lot - Residential,R,6R1,426,1300.0,,CARLSBAD,,DR,39.16282,-77.2109,6D,"(39.1628, -77.2109)"
201236746,2303,190019271,04/24/2019 08:38:51 PM,2019-04-24 20:30:00,,23C,1,Crime Against Property,Shoplifting,LARCENY - SHOPLIFTING,ROCKVILLE,,ROCKVILLE,MD,20850.0,MCPD,Retail - Drug Store/Pharmacy,A,1A3,276,,,MONROE,,ST,39.07776,-77.1516,1D,"(39.0778, -77.1516)"
201288306,2308,200019950,05/18/2020 05:36:26 PM,2020-05-15 15:07:00,05/15/2020 04:30:00 PM,23D,1,Crime Against Property,Theft from Building,LARCENY - FROM BLDG,MONTGOMERY VILLAGE,18400 BLK  LOST KNIFE CIR,MONTGOMERY VILLAGE,MD,20886.0,MCPD,Residence - Other,R,6R1,505,18400.0,,LOST KNIFE,,CIR,39.15859,-77.1985,6D,"(39.1586, -77.1985)"
201303010,2601,200037274,09/22/2020 07:44:02 PM,2020-09-21 18:00:00,,26A,1,Crime Against Property,False Pretenses/Swindle/Confidence Game,FRAUD - CONFIDENCE GAME,GERMANTOWN,20900 BLK  FATHER HURLEY BLV,GERMANTOWN,MD,20874.0,MCPD,Other/Unknown,N,5N1,465,20900.0,,FATHER HURLEY,,BLV,39.18923,-77.2734,5D,"(39.1892, -77.2734)"
201400651,3802,220036546,08/24/2022 11:20:43 AM,2022-11-14 13:32:00,,90F,1,Crime Against Society,"Family Offenses, NonViolent",FAMILY OFFENSE - CRUELTY TOWARD CHILD,BETHESDA,9200 BLK  WILMETT CT,BETHESDA,MD,20817.0,MCPD,Daycare Facility,E,2E2,068,9200.0,,WILMETT,,CT,39.00857,-77.131,2D,"(39.0086, -77.131)"
201304103,2203,200038513,09/30/2020 05:42:27 PM,2020-09-27 06:46:00,09/28/2020 05:13:00 AM,220,1,Crime Against Property,Burglary/Breaking and Entering,BURGLARY - FORCED ENTRY-NONRESIDENTIAL,BETHESDA,4600 BLK N PARK AVE,CHEVY CHASE,MD,20815.0,MCPD,Commercial - Office Building,E,2E1,516,4600.0,N,PARK,,AVE,38.96349,-77.0909,2D,"(38.9635, -77.0909)"
201361494,2501,220002831,01/22/2022 02:35:51 PM,2021-12-16 08:00:00,01/19/2022 12:00:00 AM,250,1,Crime Against Property,Counterfeiting/Forgery,FORGERY OF CHECKS,BETHESDA,9200 BLK E PARKHILL DR,BETHESDA,MD,20814.0,MCPD,Street - Residential,D,2D3,072,9200.0,E,PARKHILL,,DR,39.00555,-77.0915,2D,"(39.0055, -77.0915)"
201338525,2305,210027747,07/18/2021 12:40:20 PM,2021-07-18 00:00:00,07/18/2021 06:00:00 AM,23F,1,Crime Against Property,Theft From Motor Vehicle,LARCENY - FROM AUTO,SILVER SPRING,14800 BLK  CROSS VALLEY RD,BURTONSVILLE,MD,20866.0,MCPD,Parking Lot - Residential,I,3I2,381,14800.0,,CROSS VALLEY,,RD,39.09924,-76.9305,3D,"(39.0992, -76.9305)"
201370006,2304,220013149,03/27/2022 06:19:18 PM,2022-02-28 00:00:00,03/26/2022 10:00:00 AM,23G,1,Crime Against Property,Theft of Motor Vehicle Parts or Accessories,LARCENY - AUTO PARTS,ROCKVILLE,700 BLK  FALLSGROVE DR,ROCKVILLE,MD,20850.0,MCPD,Parking Lot - Residential,B,1B1,241,700.0,,FALLSGROVE,,DR,39.09884,-77.1897,1D,"(39.0988, -77.1897)"
201357099,1199,210051126,12/16/2021 08:51:38 AM,2021-11-15 08:00:00,11/18/2021 02:30:00 PM,11D,1,Crime Against Person,Forcible Fondling,SEX ASSAULT - FONDLING,WHEATON,300 BLK  NORWOOD RD,SILVER SPRING,MD,20905.0,MCPD,School - Elementary/Secondary,J,4J1,372,300.0,,NORWOOD,,RD,39.11409,-77.0146,4D,"(39.1141, -77.0146)"
201298234,2305,200031571,08/13/2020 06:05:26 PM,2020-08-13 18:05:00,,23F,1,Crime Against Property,Theft From Motor Vehicle,LARCENY - FROM AUTO,TAKOMA PARK,7600 BLK  NEW HAMPSHIRE AVE,TAKOMA PARK,MD,20912.0,TPPD,Parking Lot - Commercial,T,8T3,807,7600.0,,NEW HAMPSHIRE,,AVE,38.9859,-76.9881,TPPD,"(38.9859, -76.9881)"
201446936,2305,230056465,,2023-09-15 21:00:00,09/18/2023 10:00:00 PM,23F,1,Crime Against Property,Theft From Motor Vehicle,LARCENY - FROM AUTO,MONTGOMERY VILLAGE,9100 BLK  EMORY WOODS TER,GAITHERSBURG,MD,20877.0,GPD,Residence - Single Family,P,6P3,419,9100.0,,EMORY WOODS,,TER,39.15871,-77.1868,6D,"(39.1587, -77.1868)"
201303631,2305,200037992,09/27/2020 11:51:14 AM,2020-09-26 12:02:00,09/27/2020 10:00:00 AM,23F,1,Crime Against Property,Theft From Motor Vehicle,LARCENY - FROM AUTO,WHEATON,3700 BLK  ELBY ST,SILVER SPRING,MD,20906.0,MCPD,Residence - Driveway,K,4K2,333,3700.0,,ELBY,,ST,39.05855,-77.0739,4D,"(39.0585, -77.0739)"
201402253,2902,220052219,11/26/2022 06:10:19 PM,2022-11-24 23:00:00,11/26/2022 03:00:00 PM,290,1,Crime Against Property,Destruction/Damage/Vandalism of Property,DAMAGE PROPERTY - PRIVATE,WHEATON,11200 BLK  GEORGIA AVE,SILVER SPRING,MD,20902.0,MCPD,Parking Garage - Residential,L,4L2,354,11200.0,,GEORGIA,,AVE,39.03867,-77.0508,4D,"(39.0387, -77.0508)"
201335004,2404,210023323,06/18/2021 09:51:53 AM,2021-06-17 20:00:00,06/18/2021 09:00:00 AM,240,1,Crime Against Property,Motor Vehicle Theft,AUTO THEFT - VEHICLE THEFT,BETHESDA,,ROCKVILLE,MD,20852.0,MCPD,Street - Residential,D,2D4,187,,,CITADEL,,AVE,39.04502,-77.1091,2D,"(39.045, -77.1091)"
201229697,2305,190010753,03/08/2019 06:44:21 AM,2019-03-08 06:44:00,,23F,1,Crime Against Property,Theft From Motor Vehicle,LARCENY - FROM AUTO,SILVER SPRING,11300 BLK  LOCKWOOD DR,SILVER SPRING,MD,20904.0,MCPD,Parking Lot - Residential,I,3I1,145,11300.0,,LOCKWOOD,,DR,39.03978,-76.9906,3D,"(39.0398, -76.9906)"
201388465,2308,220034698,,2022-08-12 12:55:00,,23D,1,Crime Against Property,Theft from Building,LARCENY - FROM BLDG,GERMANTOWN,9800 BLK  MAIN ST,DAMASCUS,,20872.0,MCPD,Convenience Store,M,5M2,612,9800.0,,MAIN,,ST,39.28768,-77.2017,5D,"(39.2877, -77.2017)"
201234057,5404,190014961,03/31/2019 11:35:05 PM,2019-03-31 23:35:00,,90D,1,Crime Against Society,Driving Under the Influence,DRIVING UNDER THE INFLUENCE LIQUOR,ROCKVILLE,,ROCKVILLE,MD,20851.0,MCPD,Street - In vehicle,A,1A3,285,,,GRANDIN,,AVE,39.07906,-77.128,1D,"(39.0791, -77.128)"
201342976,1103,210033259,08/26/2021 01:35:21 AM,2021-08-26 01:35:00,,11A,1,Crime Against Person,Forcible Rape,RAPE - STRONG-ARM,BETHESDA,4400 BLK E WEST HWY,BETHESDA,MD,20814.0,MCPD,Residence - Apartment/Condo,D,2D2,034,4400.0,E,WEST,,HWY,0.0,0.0,2D,"(0.0, 0.0)"
201305393,1212,200040084,10/11/2020 09:57:49 PM,2020-10-11 21:54:00,,120,1,Crime Against Property,Robbery,ROBBERY - CARJACKING - ARMED,SILVER SPRING,30500 BLK  IL495 X31 TO X30 HWY,SILVER SPRING,MD,20901.0,MCPD,Street - Other,G,3G2,653,30500.0,,IL495 X31 TO X30,,HWY,39.01672,-77.0239,3D,"(39.0167, -77.0239)"
201285341,5311,200016425,04/19/2020 05:23:28 AM,2020-04-19 05:23:00,,90C,1,Crime Against Society,Disorderly Conduct,PUBLIC PEACE - DISORDERLY CONDUCT,GERMANTOWN,14600 BLK  BUBBLING SPRING RD,BOYDS,MD,20841.0,MCPD,Residence - Single Family,N,5N2,464,14600.0,,BUBBLING SPRING,,RD,39.15852,-77.3116,5D,"(39.1585, -77.3116)"
201371669,2902,220015131,04/09/2022 04:02:22 PM,2022-04-09 16:02:00,,290,1,Crime Against Property,Destruction/Damage/Vandalism of Property,DAMAGE PROPERTY - PRIVATE,MONTGOMERY VILLAGE,1  BLK  SHADY SPRING PL,GAITHERSBURG,MD,20877.0,MCPD,Parking Lot - Residential,R,6R3,542,1.0,,SHADY SPRING,,PL,39.14396,-77.1604,6D,"(39.144, -77.1604)"
201358587,5404,210051518,12/18/2021 01:59:01 AM,2021-12-18 01:59:00,12/18/2021 01:59:00 AM,90D,1,Crime Against Society,Driving Under the Influence,DRIVING UNDER THE INFLUENCE LIQUOR,ROCKVILLE,,ROCKVILLE,MD,20851.0,MCPD,Street - In vehicle,A,1A2,297,,,THORNDEN,,RD,39.07109,-77.1255,1D,"(39.0711, -77.1255)"
201420007,2305,230015286,03/30/2023 07:50:31 AM,2023-03-29 22:00:00,03/30/2023 07:35:00 AM,23F,1,Crime Against Property,Theft From Motor Vehicle,LARCENY - FROM AUTO,SILVER SPRING,1  BLK E WAYNE AVE,SILVER SPRING,MD,20901.0,MCPD,Parking Lot - Residential,H,3H1,126,1.0,E,WAYNE,,AVE,38.99963,-77.0106,3D,"(38.9996, -77.0106)"
201381209,2204,220026652,06/21/2022 04:11:37 AM,2022-06-21 04:11:00,,220,1,Crime Against Property,Burglary/Breaking and Entering,BURGLARY - NO FORCED ENTRY-RESIDENTIAL,GERMANTOWN,19500 BLK  FREDERICK RD,GERMANTOWN,MD,20876.0,MCPD,Residence - Mobile Home,M,5M1,470,19500.0,,FREDERICK,,RD,39.17546,-77.2381,5D,"(39.1755, -77.2381)"
201360713,2999,220002133,01/18/2022 09:44:18 AM,2022-01-18 09:37:00,,290,1,Crime Against Property,Destruction/Damage/Vandalism of Property,DAMAGE PROPERTY (DESCRIBE OFFENSE),WHEATON,3200 BLK  SPARTAN RD,OLNEY,MD,20832.0,MCPD,Residence - Apartment/Condo,J,4J2,642,3200.0,,SPARTAN,,RD,39.15083,-77.0621,4D,"(39.1508, -77.0621)"
201255824,1313,190043076,09/08/2019 08:39:28 PM,2019-09-08 20:39:00,,13B,1,Crime Against Person,Simple Assault,ASSAULT - SIMPLE,BETHESDA,900 BLK  ROSE AVE,ROCKVILLE,MD,20852.0,MCPD,Residence - Apartment/Condo,D,2D4,188,900.0,,ROSE,,AVE,39.05109,-77.1162,2D,"(39.0511, -77.1162)"
201339550,2601,210028554,07/23/2021 12:59:36 PM,2021-07-23 10:40:00,,26A,1,Crime Against Property,False Pretenses/Swindle/Confidence Game,FRAUD - CONFIDENCE GAME,ROCKVILLE,1700 BLK  ROCKVILLE PIK,ROCKVILLE,MD,20852.0,MCPD,Other/Unknown,A,1A1,272,1700.0,,ROCKVILLE,,PIK,39.06184,-77.124,1D,"(39.0618, -77.124)"
201425098,1399,230021370,05/04/2023 02:17:48 PM,2023-05-04 14:17:00,,13B,1,Crime Against Person,Simple Assault,ASSAULT - 2ND DEGREE,WHEATON,14100 BLK  WEEPING WILLOW DR,SILVER SPRING,MD,20906.0,MCPD,Residence - Apartment/Condo,K,4K1,348,14100.0,,WEEPING WILLOW,,DR,39.08771,-77.0675,4D,"(39.0877, -77.0675)"
201359386,2610,210046821,11/18/2021 12:51:09 PM,2021-11-13 14:00:00,,26F,1,Crime Against Property,Identity Theft,FRAUD - IDENTITY THEFT,GERMANTOWN,14700 BLK  BUBBLING SPRING RD,BOYDS,MD,20841.0,MCPD,Other/Unknown,N,5N2,464,14700.0,,BUBBLING SPRING,,RD,39.15964,-77.3105,5D,"(39.1596, -77.3105)"
201327351,2308,210014052,04/15/2021 11:12:04 AM,2021-04-13 03:25:00,04/13/2021 03:30:00 AM,23D,1,Crime Against Property,Theft from Building,LARCENY - FROM BLDG,ROCKVILLE,11300 BLK  SEVEN LOCKS RD,POTOMAC,MD,20854.0,MCPD,Gas Station,B,1B1,203,11300.0,,SEVEN LOCKS,,RD,39.0407,-77.159,1D,"(39.0407, -77.159)"
201277548,2610,200007136,02/12/2020 02:47:54 PM,2020-01-30 00:00:00,,26F,1,Crime Against Property,Identity Theft,FRAUD - IDENTITY THEFT,SILVER SPRING,14000 BLK  CASTLE BLV,SILVER SPRING,MD,20904.0,MCPD,Residence - Apartment/Condo,I,3I2,380,14000.0,,CASTLE,,BLV,39.08459,-76.9405,3D,"(39.0846, -76.9405)"
201392036,2399,220039764,09/13/2022 10:57:36 AM,2022-09-06 11:00:00,09/12/2022 06:00:00 PM,23H,1,Crime Against Property,All other Larceny,LARCENY (DESCRIBE OFFENSE),SILVER SPRING,1200 BLK  FIDLER LA,SILVER SPRING,MD,20910.0,MCPD,Residence - Apartment/Condo,G,3G1,095,1200.0,,FIDLER,,LA,38.9961,-77.0298,3D,"(38.9961, -77.0298)"
201403278,2303,220053448,12/03/2022 06:53:31 PM,2022-12-03 17:50:00,12/03/2022 06:20:00 PM,23C,1,Crime Against Property,Shoplifting,LARCENY - SHOPLIFTING,BETHESDA,5500 BLK  RANDOLPH RD,ROCKVILLE,MD,20852.0,MCPD,Grocery/Supermarket,D,2D4,187,5500.0,,RANDOLPH,,RD,39.05336,-77.1101,2D,"(39.0534, -77.1101)"
201395522,1399,220044012,10/08/2022 03:02:43 PM,2022-10-08 15:02:00,,13B,1,Crime Against Person,Simple Assault,ASSAULT - 2ND DEGREE,SILVER SPRING,1400 BLK  HAMPSHIRE WEST CT,SILVER SPRING,MD,20903.0,MCPD,Residence - Apartment/Condo,H,3H2,137,1400.0,,HAMPSHIRE WEST,,CT,39.00881,-76.9841,3D,"(39.0088, -76.9841)"
201364674,2305,220004474,02/02/2022 08:45:54 AM,2022-02-01 21:30:00,02/02/2022 08:20:00 AM,23F,1,Crime Against Property,Theft From Motor Vehicle,LARCENY - FROM AUTO,WHEATON,17400 BLK  GALLAGHER WAY,OLNEY,MD,20832.0,MCPD,Parking Lot - Residential,J,4J2,539,17400.0,,GALLAGHER,,WAY,39.14352,-77.0901,4D,"(39.1435, -77.0901)"
201438725,3502,230048475,08/08/2023 08:32:27 PM,2023-08-08 20:32:00,,35A,1,Crime Against Society,Drug/Narcotic Violations,DRUGS - HALLUCINOGEN - DISTRIB,SILVER SPRING,,SILVER SPRING,MD,20904.0,MCPD,Bank - ATM,I,3I2,380,,,BRIGGS CHANEY,,RD,39.07202,-76.9383,3D,"(39.072, -76.9383)"
201337706,2605,210026162,07/07/2021 10:27:54 PM,2021-07-07 19:30:00,07/07/2021 10:30:00 PM,26B,1,Crime Against Property,Credit Card/Automatic Teller Machine Fraud,FRAUD - ILLEGAL USE CREDIT CARDS,SILVER SPRING,2100 BLK  INDUSTRIAL PKW,SILVER SPRING,MD,20904.0,MCPD,Other/Unknown,I,3I1,146,2100.0,,INDUSTRIAL,,PKW,39.05583,-76.9709,3D,"(39.0558, -76.9709)"
201260412,2699,190048815,,2019-10-11 10:52:00,,26A,1,Crime Against Property,False Pretenses/Swindle/Confidence Game,FRAUD (DESCRIBE OFFENSE),SILVER SPRING,8300 BLK  COLESVILLE RD,SILVER SPRING,MD,20910.0,MCPD,Bank - ATM,G,3G1,089,8300.0,,COLESVILLE,,RD,38.9924,-77.036,3D,"(38.9924, -77.036)"
201282082,3601,200011971,03/11/2020 11:09:05 AM,2020-03-09 13:45:00,,11D,1,Crime Against Person,Forcible Fondling,SEX OFFENSE - AGAINST CHILD-FONDLING,GERMANTOWN,25900 BLK  RIDGE RD,DAMASCUS,MD,20872.0,MCPD,School/College - DO NOT USE,M,5M2,615,25900.0,,RIDGE,,RD,39.28396,-77.2106,5D,"(39.284, -77.2106)"
201433348,2404,230031513,07/01/2023 10:18:20 PM,2023-06-30 17:00:00,07/01/2023 08:00:00 PM,240,1,Crime Against Property,Motor Vehicle Theft,AUTO THEFT - VEHICLE THEFT,SILVER SPRING,8500 BLK  GLENVIEW AVE,TAKOMA PARK,MD,20912.0,MCPD,Parking Lot - Residential,H,3H1,129,8500.0,,GLENVIEW,,AVE,38.99547,-76.9993,3D,"(38.9955, -76.9993)"
201408114,2304,230001309,01/09/2023 11:38:47 AM,2023-01-08 17:00:00,01/09/2023 09:00:00 AM,23G,1,Crime Against Property,Theft of Motor Vehicle Parts or Accessories,LARCENY - AUTO PARTS,BETHESDA,5200 BLK  TUCKERMAN LA,ROCKVILLE,MD,20852.0,MCPD,Parking Lot - Residential,D,2D4,185,5200.0,,TUCKERMAN,,LA,39.02428,-77.1027,2D,"(39.0243, -77.1027)"
201242183,2699,190026160,06/01/2019 02:10:35 PM,2019-02-08 00:00:00,06/01/2019 12:00:00 AM,26A,1,Crime Against Property,False Pretenses/Swindle/Confidence Game,FRAUD (DESCRIBE OFFENSE),WHEATON,2300 BLK  RANDOLPH RD,SILVER SPRING,MD,20902.0,MCPD,Other/Unknown,L,4L1,366,2300.0,,RANDOLPH,,RD,39.05861,-77.0485,4D,"(39.0586, -77.0485)"
201236269,2399,190018832,04/22/2019 02:36:03 PM,2019-04-19 21:00:00,04/20/2019 11:59:00 PM,23H,1,Crime Against Property,All other Larceny,LARCENY (DESCRIBE OFFENSE),ROCKVILLE,15100 BLK  FREDERICK RD,ROCKVILLE,MD,20850.0,MCPD,Other/Unknown,A,1A3,279,15100.0,,FREDERICK,,RD,39.10343,-77.1559,1D,"(39.1034, -77.1559)"
201331596,2308,210019164,05/21/2021 09:28:07 AM,2021-05-19 13:45:00,05/21/2021 09:28:00 AM,23D,1,Crime Against Property,Theft from Building,LARCENY - FROM BLDG,TAKOMA PARK,7700 BLK  MAPLE AVE,TAKOMA PARK,MD,20912.0,TPPD,Residence - Apartment/Condo,T,8T2,804,7700.0,,MAPLE,,AVE,38.98397,-77.0052,TPPD,"(38.984, -77.0052)"
201361072,2308,220001893,01/15/2022 08:03:03 PM,2022-01-15 19:09:00,01/15/2022 07:20:00 PM,23D,1,Crime Against Property,Theft from Building,LARCENY - FROM BLDG,MONTGOMERY VILLAGE,15300 BLK  DIAMOND COVE TER,ROCKVILLE,MD,20850.0,MCPD,Residence - Other,P,6P1,751,15300.0,,DIAMOND COVE,,TER,39.10982,-77.2066,6D,"(39.1098, -77.2066)"
201245450,2309,190030208,06/24/2019 06:37:17 PM,2019-06-24 18:37:00,06/24/2019 08:30:00 PM,23H,1,Crime Against Property,All other Larceny,LARCENY - FROM YARDS,WHEATON,12600 BLK  BARBARA RD,SILVER SPRING,MD,20906.0,MCPD,Residence - Yard,K,4K2,525,12600.0,,BARBARA,,RD,39.06218,-77.0811,4D,"(39.0622, -77.0811)"
201358321,2303,210052679,12/26/2021 03:39:31 PM,2021-12-26 15:39:00,,23C,1,Crime Against Property,Shoplifting,LARCENY - SHOPLIFTING,ROCKVILLE,700 BLK  HUNGERFORD DR,ROCKVILLE,MD,20850.0,MCPD,Grocery/Supermarket,A,1A3,251,700.0,,HUNGERFORD,,DR,39.09308,-77.1534,1D,"(39.0931, -77.1534)"
201397322,1399,220046285,10/21/2022 07:36:15 PM,2022-10-21 19:36:00,,13B,1,Crime Against Person,Simple Assault,ASSAULT - 2ND DEGREE,GERMANTOWN,19400 BLK  WALTER JOHNSON RD,GERMANTOWN,MD,20874.0,MCPD,Gas Station,N,5N1,702,19400.0,,WALTER JOHNSON,,RD,39.17398,-77.2712,5D,"(39.174, -77.2712)"
201312980,1399,200049364,12/15/2020 11:20:22 AM,2020-12-15 11:20:00,,13B,1,Crime Against Person,Simple Assault,ASSAULT - 2ND DEGREE,MONTGOMERY VILLAGE,7900 BLK  MUNCASTER MILL RD,GAITHERSBURG,MD,20877.0,MCPD,Gas Station,R,6R3,417,7900.0,,MUNCASTER MILL,,RD,39.15772,-77.1589,6D,"(39.1577, -77.1589)"
201222332,2609,190001275,01/08/2019 03:37:26 PM,2019-01-08 10:00:00,01/08/2019 01:30:00 PM,26A,1,Crime Against Property,False Pretenses/Swindle/Confidence Game,FRAUD AND ABUSE - COMPUTER,WHEATON,1100 BLK  UNIVERSITY BLV W,SILVER SPRING,MD,20902.0,MCPD,Other/Unknown,L,4L1,360,1100.0,,UNIVERSITY,W,BLV,39.03585,-77.0268,4D,"(39.0359, -77.0268)"
201403831,4104,220054101,12/07/2022 04:15:55 PM,2022-12-07 16:15:00,,90G,1,Crime Against Society,Liquor Law Violations,LIQUOR - POSSESS,WHEATON,13600 BLK  GEORGIA AVE,SILVER SPRING,MD,20906.0,MCPD,Retail - Other,K,4K1,348,13600.0,,GEORGIA,,AVE,39.07828,-77.0718,4D,"(39.0783, -77.0718)"
201233569,5404,190014507,03/29/2019 02:11:48 AM,2019-03-29 20:21:00,,90D,1,Crime Against Society,Driving Under the Influence,DRIVING UNDER THE INFLUENCE LIQUOR,SILVER SPRING,,SILVER SPRING,MD,20901.0,MCPD,Street - In vehicle,H,3H2,152,,,COLUMBIA,,PIK,38.97665,-77.0065,3D,"(38.9766, -77.0065)"
201280561,1399,200010976,03/05/2020 04:58:42 PM,2020-03-05 16:58:00,03/05/2020 05:15:00 PM,13B,1,Crime Against Person,Simple Assault,ASSAULT - 2ND DEGREE,ROCKVILLE,100 BLK  TALBOTT ST,ROCKVILLE,MD,20852.0,RCPD,Residence - Apartment/Condo,A,1A1,265,100.0,,TALBOTT,,ST,39.07103,-77.1321,1D,"(39.071, -77.1321)"
201258275,2299,190046170,09/26/2019 12:11:30 PM,2019-09-26 12:11:00,,220,1,Crime Against Property,Burglary/Breaking and Entering,BURGLARY (DESCRIBE OFFENSE),BETHESDA,4800 BLK  BATTERY LA,BETHESDA,MD,20814.0,MCPD,Residence - Apt Ofc/Storage,E,2E2,054,4800.0,,BATTERY,,LA,38.99275,-77.096,2D,"(38.9928, -77.096)"
201302735,1214,200036917,09/20/2020 05:36:05 PM,2020-09-20 17:36:00,09/20/2020 12:00:00 AM,120,1,Crime Against Property,Robbery,ROBBERY - KNIFE,WHEATON,13400 BLK  LYDIA ST,SILVER SPRING,MD,20906.0,MCPD,School/College - DO NOT USE,K,4K2,337,13400.0,,LYDIA,,ST,39.07593,-77.0772,4D,"(39.0759, -77.0772)"
201315226,1114,200044645,11/12/2020 11:23:49 AM,2021-01-04 19:36:00,,11B,1,Crime Against Person,Forcible Sodomy,SEX ASSAULT - SODOMY-GIRL-STRONG-ARM,GERMANTOWN,21500 BLK  SUN GARDEN CT,GERMANTOWN,MD,20876.0,MCPD,Residence - Single Family,M,5M3,474,21500.0,,SUN GARDEN,,CT,39.20735,-77.2577,5D,"(39.2073, -77.2577)"
201230544,2202,190011709,03/13/2019 09:05:30 PM,2019-03-13 20:51:00,,220,1,Crime Against Property,Burglary/Breaking and Entering,BURGLARY - FORCED ENTRY-RESIDENTIAL,SILVER SPRING,9600 BLK  MT PISGAH RD,SILVER SPRING,MD,20903.0,MCPD,Residence - Single Family,H,3H2,138,9600.0,,MT PISGAH,,RD,39.01213,-76.9773,3D,"(39.0121, -76.9773)"
201394913,5311,220043311,10/04/2022 04:43:01 PM,2022-10-04 16:45:00,,90C,1,Crime Against Society,Disorderly Conduct,PUBLIC PEACE - DISORDERLY CONDUCT,WHEATON,2300 BLK  REEDIE DR,SILVER SPRING,MD,20902.0,MCPD,Street - Commercial,L,4L2,352,2300.0,,REEDIE,,DR,39.03908,-77.0486,4D,"(39.0391, -77.0486)"
201357531,2303,210051569,12/18/2021 02:08:43 PM,2021-12-18 14:08:00,,23C,1,Crime Against Property,Shoplifting,LARCENY - SHOPLIFTING,SILVER SPRING,900 BLK  THAYER AVE,SILVER SPRING,MD,20910.0,MCPD,Grocery/Supermarket,G,3G1,670,900.0,,THAYER,,AVE,38.99304,-77.024,3D,"(38.993, -77.024)"
201253658,3512,190040374,08/23/2019 01:53:17 PM,2019-08-23 13:53:00,08/23/2019 04:30:00 PM,35A,1,Crime Against Society,Drug/Narcotic Violations,DRUGS - HEROIN - POSSESS,ROCKVILLE,12600 BLK  TWINBROOK PKW,ROCKVILLE,MD,20852.0,RCPD,Street - Commercial,A,1A2,301,12600.0,,TWINBROOK,,PKW,39.06276,-77.1164,1D,"(39.0628, -77.1164)"
201254368,3532,190041004,08/27/2019 10:28:46 AM,2019-08-27 10:27:00,08/27/2019 01:46:00 PM,35A,1,Crime Against Society,Drug/Narcotic Violations,DRUGS - COCAINE - POSSESS,SILVER SPRING,8100 BLK  FENTON ST,SILVER SPRING,MD,20910.0,MCPD,Convenience Store,G,3G1,111,8100.0,,FENTON,,ST,38.99021,-77.0239,3D,"(38.9902, -77.0239)"
201359315,2305,220000430,01/04/2022 04:45:47 PM,2022-01-02 17:00:00,01/04/2022 04:00:00 PM,23F,1,Crime Against Property,Theft From Motor Vehicle,LARCENY - FROM AUTO,SILVER SPRING,1500 BLK E WEST HWY,SILVER SPRING,MD,20910.0,MCPD,Parking Lot - Residential,G,3G1,667,1500.0,E,WEST,,HWY,0.0,0.0,3D,"(0.0, 0.0)"
201410746,2601,230004510,01/27/2023 05:56:00 PM,2023-01-10 17:56:00,,26A,1,Crime Against Property,False Pretenses/Swindle/Confidence Game,FRAUD - CONFIDENCE GAME,GERMANTOWN,12000 BLK  BIRDSEYE TER,GERMANTOWN,,20874.0,MCPD,Residence -Townhouse/Duplex,N,5N1,447,12000.0,,BIRDSEYE,,TER,39.16359,-77.2492,5D,"(39.1636, -77.2492)"
201309010,2303,200044504,11/11/2020 06:43:19 AM,2020-11-11 06:42:00,,23C,1,Crime Against Property,Shoplifting,LARCENY - SHOPLIFTING,ROCKVILLE,1800 BLK  ROCKVILLE PIK,ROCKVILLE,MD,20852.0,RCPD,Grocery/Supermarket,A,1A1,272,1800.0,,ROCKVILLE,,PIK,39.06028,-77.1226,1D,"(39.0603, -77.1226)"
201276794,1399,200006251,02/06/2020 10:24:22 PM,2020-02-06 22:24:00,,13B,1,Crime Against Person,Simple Assault,ASSAULT - 2ND DEGREE,SILVER SPRING,,SILVER SPRING,MD,20901.0,MCPD,Street - In vehicle,H,3H1,133,,,PINEY BRANCH,,RD,39.00069,-76.9894,3D,"(39.0007, -76.9894)"
201408083,3601,230001280,01/09/2023 09:07:22 AM,2022-11-01 09:00:00,11/30/2022 09:00:00 PM,11D,1,Crime Against Person,Forcible Fondling,SEX OFFENSE - AGAINST CHILD-FONDLING,MONTGOMERY VILLAGE,18700 BLK  BARN SWALLOW TER,GAITHERSBURG,MD,20879.0,MCPD,Residence - Single Family,R,6R1,503,18700.0,,BARN SWALLOW,,TER,39.16493,-77.1865,6D,"(39.1649, -77.1865)"
201293457,2605,200025964,07/04/2020 01:13:15 PM,2020-07-02 12:00:00,07/03/2020 10:00:00 PM,26B,1,Crime Against Property,Credit Card/Automatic Teller Machine Fraud,FRAUD - ILLEGAL USE CREDIT CARDS,WHEATON,3900 BLK  ASPEN HILL RD,SILVER SPRING,MD,20906.0,MCPD,Other/Unknown,K,4K2,526,3900.0,,ASPEN HILL,,RD,39.08038,-77.0772,4D,"(39.0804, -77.0772)"
201275360,2204,200004375,01/27/2020 03:35:50 AM,2020-01-17 16:00:00,01/27/2020 03:35:00 AM,220,1,Crime Against Property,Burglary/Breaking and Entering,BURGLARY - NO FORCED ENTRY-RESIDENTIAL,ROCKVILLE,15800 BLK  BUENA VISTA DR,DERWOOD,MD,20855.0,MCPD,Residence - Single Family,A,1A4,281,15800.0,,BUENA VISTA,,DR,39.11641,-77.1516,1D,"(39.1164, -77.1516)"
201250179,3504,190034882,07/22/2019 09:23:46 PM,2019-07-22 21:24:00,,35A,1,Crime Against Society,Drug/Narcotic Violations,DRUGS - HALLUCINOGEN - POSSESS,MONTGOMERY VILLAGE,,GAITHERSBURG,MD,20879.0,GPD,Street - Residential,R,6R2,545,,,TRAVIS,,AVE,39.16249,-77.2172,6D,"(39.1625, -77.2172)"
201366324,1399,220008752,02/28/2022 11:58:20 PM,2022-02-28 23:58:00,,13B,1,Crime Against Person,Simple Assault,ASSAULT - 2ND DEGREE,ROCKVILLE,1  BLK  INDIAN HILLS CT,DERWOOD,MD,20855.0,MCPD,Residence -Townhouse/Duplex,A,1A4,281,1.0,,INDIAN HILLS,,CT,39.11688,-77.1549,1D,"(39.1169, -77.1549)"
201445052,2699,230056290,09/22/2023 12:39:17 PM,2023-09-22 12:39:00,,26A,1,Crime Against Property,False Pretenses/Swindle/Confidence Game,FRAUD (DESCRIBE OFFENSE),BETHESDA,4800 BLK  CREEK SHORE DR,ROCKVILLE,MD,20852.0,MCPD,Residence - Single Family,D,2D4,309,4800.0,,CREEK SHORE,,DR,39.04267,-77.0954,2D,"(39.0427, -77.0954)"
201337544,2303,210026450,07/09/2021 07:30:45 PM,2021-07-09 19:31:00,,23C,1,Crime Against Property,Shoplifting,LARCENY - SHOPLIFTING,WHEATON,11100 BLK  VEIRS MILL RD,SILVER SPRING,MD,20902.0,MCPD,Retail - Department/Discount Store,L,4L2,321,11100.0,,VEIRS MILL,,RD,39.03758,-77.0519,4D,"(39.0376, -77.0519)"
201258287,2610,190046205,09/26/2019 04:22:40 PM,2019-09-23 20:00:00,,26F,1,Crime Against Property,Identity Theft,FRAUD - IDENTITY THEFT,MONTGOMERY VILLAGE,400 BLK  CHRISTOPHER AVE,GAITHERSBURG,MD,20879.0,MCPD,Other/Unknown,R,6R1,426,400.0,,CHRISTOPHER,,AVE,39.1589,-77.2118,6D,"(39.1589, -77.2118)"
201364796,2404,220007038,02/17/2022 06:33:09 PM,2022-02-17 12:00:00,02/17/2022 01:15:00 PM,240,1,Crime Against Property,Motor Vehicle Theft,AUTO THEFT - VEHICLE THEFT,BETHESDA,7100 BLK  DEMOCRACY BLV,BETHESDA,MD,20817.0,MCPD,Retail - Mall,E,2E3,204,7100.0,,DEMOCRACY,,BLV,39.02207,-77.1473,2D,"(39.0221, -77.1473)"
201408408,2404,230001663,01/11/2023 08:32:30 AM,2023-01-10 20:30:00,01/11/2023 07:30:00 AM,240,1,Crime Against Property,Motor Vehicle Theft,AUTO THEFT - VEHICLE THEFT,BETHESDA,9300 BLK  KINGSLEY AVE,BETHESDA,MD,20814.0,MCPD,Street - Residential,E,2E2,071,9300.0,,KINGSLEY,,AVE,39.00767,-77.1046,2D,"(39.0077, -77.1046)"
201331239,2699,210018759,05/18/2021 01:28:13 PM,2021-02-01 14:40:00,,26A,1,Crime Against Property,False Pretenses/Swindle/Confidence Game,FRAUD (DESCRIBE OFFENSE),WHEATON,2100 BLK  GREENERY LA,SILVER SPRING,MD,20906.0,MCPD,Other/Unknown,J,4J1,368,2100.0,,GREENERY,,LA,39.06027,-77.0456,4D,"(39.0603, -77.0456)"
201437398,2404,230047093,07/31/2023 10:45:42 AM,2023-07-28 18:00:00,07/31/2023 09:30:00 AM,240,1,Crime Against Property,Motor Vehicle Theft,AUTO THEFT - VEHICLE THEFT,MONTGOMERY VILLAGE,200 BLK  FAIRBANKS DR,GAITHERSBURG,MD,20877.0,MCPD,Parking Garage - Residential,P,6P3,433,200.0,,FAIRBANKS,,DR,39.13227,-77.1915,6D,"(39.1323, -77.1915)"
201419770,2308,230014899,03/28/2023 04:56:40 AM,2023-03-28 04:56:00,,23D,1,Crime Against Property,Theft from Building,LARCENY - FROM BLDG,SILVER SPRING,1700 BLK  MT PISGAH LA,SILVER SPRING,MD,20903.0,MCPD,Residence - Apartment/Condo,H,3H2,138,1700.0,,MT PISGAH,,LA,39.01506,-76.9761,3D,"(39.0151, -76.9761)"
201395466,2304,220043791,10/07/2022 07:51:09 AM,2022-10-06 22:00:00,10/07/2022 07:00:00 AM,23G,1,Crime Against Property,Theft of Motor Vehicle Parts or Accessories,LARCENY - AUTO PARTS,SILVER SPRING,1500 BLK  HEATHER HOLLOW CIR,SILVER SPRING,MD,20904.0,MCPD,Parking Lot - Residential,I,3I1,145,1500.0,,HEATHER HOLLOW,,CIR,39.04129,-76.9827,3D,"(39.0413, -76.9827)"
201259877,1399,190048163,10/07/2019 04:24:06 PM,2019-10-07 16:24:00,,13B,1,Crime Against Person,Simple Assault,ASSAULT - 2ND DEGREE,BETHESDA,6200 BLK  MONTROSE RD,ROCKVILLE,MD,20852.0,MCPD,Parking Lot - Commercial,E,2E3,200,6200.0,,MONTROSE,,RD,39.05268,-77.1261,2D,"(39.0527, -77.1261)"
201424121,2902,230020228,04/27/2023 11:23:40 PM,2023-04-27 23:23:00,,290,1,Crime Against Property,Destruction/Damage/Vandalism of Property,DAMAGE PROPERTY - PRIVATE,SILVER SPRING,800 BLK  NORTHAMPTON DR,SILVER SPRING,MD,20903.0,MCPD,Street - In vehicle,H,3H2,137,800.0,,NORTHAMPTON,,DR,39.00782,-76.9843,3D,"(39.0078, -76.9843)"
201228563,3562,190009308,02/27/2019 11:37:07 AM,2019-02-27 00:00:00,,35A,1,Crime Against Society,Drug/Narcotic Violations,DRUGS - MARIJUANA - POSSESS,SILVER SPRING,1900 BLK E RANDOLPH RD,SILVER SPRING,,20904.0,MCPD,School/College - DO NOT USE,I,3I1,147,1900.0,E,RANDOLPH,,RD,39.0652,-77.0371,3D,"(39.0652, -77.0371)"
201419915,2303,230011577,03/09/2023 12:45:01 PM,2023-03-09 12:45:00,,23C,1,Crime Against Property,Shoplifting,LARCENY - SHOPLIFTING,SILVER SPRING,900 BLK  THAYER AVE,SILVER SPRING,MD,20910.0,MCPD,Grocery/Supermarket,G,3G1,670,900.0,,THAYER,,AVE,38.99304,-77.024,3D,"(38.993, -77.024)"
201430160,2303,230027594,06/08/2023 03:41:46 PM,2023-06-08 15:41:00,,23C,1,Crime Against Property,Shoplifting,LARCENY - SHOPLIFTING,TAKOMA PARK,6900 BLK  NEW HAMPSHIRE AVE,TAKOMA PARK,MD,20912.0,TPPD,Convenience Store,T,8T3,808,6900.0,,NEW HAMPSHIRE,,AVE,38.9756,-76.9939,TPPD,"(38.9756, -76.9939)"
201247397,3560,190032664,07/09/2019 10:04:07 PM,2019-07-09 22:05:00,,35A,1,Crime Against Society,Drug/Narcotic Violations,DRUGS - MARIJUANA - SELL,BETHESDA,,SILVER SPRING,MD,20910.0,MCPD,Street - In vehicle,D,2D1,086,,,SUNDALE,,DR,38.99842,-77.0462,2D,"(38.9984, -77.0462)"
201261084,1399,190049713,10/16/2019 08:36:49 PM,2019-10-16 20:36:00,,13B,1,Crime Against Person,Simple Assault,ASSAULT - 2ND DEGREE,WHEATON,2900 BLK  FENIMORE CT,SILVER SPRING,MD,20902.0,MCPD,Residence - Single Family,L,4L2,325,2900.0,,FENIMORE,,CT,39.04454,-77.0591,4D,"(39.0445, -77.0591)"
201265819,2303,190055669,11/18/2019 03:26:54 PM,2019-11-18 14:45:00,11/18/2019 03:30:00 PM,23C,1,Crime Against Property,Shoplifting,LARCENY - SHOPLIFTING,SILVER SPRING,12000 BLK  CHERRY HILL RD,SILVER SPRING,MD,20904.0,MCPD,Retail - Department/Discount Store,I,3I1,146,12000.0,,CHERRY HILL,,RD,39.05259,-76.9531,3D,"(39.0526, -76.9531)"
201355657,2404,210049344,,2021-12-05 02:30:00,12/05/2021 07:40:00 AM,240,1,Crime Against Property,Motor Vehicle Theft,AUTO THEFT - VEHICLE THEFT,BETHESDA,3700 BLK  LELAND ST,CHEVY CHASE,MD,20815.0,MCPD,Street - Residential,D,2D1,037,3700.0,,LELAND,,ST,38.98677,-77.0731,2D,"(38.9868, -77.0731)"
201388960,2303,220035996,08/20/2022 04:35:29 PM,2022-08-20 15:50:00,08/20/2022 04:15:00 PM,23C,1,Crime Against Property,Shoplifting,LARCENY - SHOPLIFTING,BETHESDA,7100 BLK  DEMOCRACY BLV,BETHESDA,MD,20817.0,MCPD,Retail - Mall,E,2E3,204,7100.0,,DEMOCRACY,,BLV,39.02207,-77.1473,2D,"(39.0221, -77.1473)"
201448769,2902,230060905,10/16/2023 04:47:12 PM,2023-10-15 15:00:00,10/16/2023 05:00:00 PM,290,1,Crime Against Property,Destruction/Damage/Vandalism of Property,DAMAGE PROPERTY - PRIVATE,SILVER SPRING,13800 BLK  CASTLE BLV,SILVER SPRING,MD,20904.0,MCPD,Parking Lot - Residential,I,3I2,380,13800.0,,CASTLE,,BLV,0.0,0.0,3D,"(0.0, 0.0)"
201329091,2399,210016116,04/30/2021 01:19:51 PM,2021-04-30 13:15:00,04/30/2021 12:00:00 AM,23H,1,Crime Against Property,All other Larceny,LARCENY (DESCRIBE OFFENSE),WHEATON,13800 BLK  GEORGIA AVE,SILVER SPRING,MD,20906.0,MCPD,Retail - Beauty/Barber Shop,K,4K2,526,13800.0,,GEORGIA,,AVE,39.08074,-77.0752,4D,"(39.0807, -77.0752)"
201400783,2605,220050451,11/15/2022 11:27:18 AM,2022-11-13 00:00:00,11/15/2022 09:00:00 AM,26B,1,Crime Against Property,Credit Card/Automatic Teller Machine Fraud,FRAUD - ILLEGAL USE CREDIT CARDS,SILVER SPRING,8000 BLK  13TH ST,SILVER SPRING,MD,20910.0,MCPD,Other/Unknown,G,3G1,090,8000.0,,13TH,,ST,38.98692,-77.0296,3D,"(38.9869, -77.0296)"
201420870,2303,230016183,04/04/2023 11:21:13 PM,2023-04-04 23:10:00,04/05/2023 01:30:00 AM,23C,1,Crime Against Property,Shoplifting,LARCENY - SHOPLIFTING,WHEATON,3800 BLK  INTERNATIONAL DR,SILVER SPRING,MD,20906.0,MCPD,Grocery/Supermarket,K,4K1,346,3800.0,,INTERNATIONAL,,DR,39.10371,-77.0758,4D,"(39.1037, -77.0758)"
201415519,2303,230010168,03/01/2023 01:02:38 PM,2023-03-01 10:56:00,,23C,1,Crime Against Property,Shoplifting,LARCENY - SHOPLIFTING,SILVER SPRING,8700 BLK  COLESVILLE RD,SILVER SPRING,MD,20910.0,MCPD,Liquor Store - County,G,3G1,671,8700.0,,COLESVILLE,,RD,38.99765,-77.027,3D,"(38.9977, -77.027)"
201280124,3560,200009976,02/28/2020 07:01:09 PM,2020-02-28 21:30:00,02/28/2020 10:00:00 PM,35A,1,Crime Against Society,Drug/Narcotic Violations,DRUGS - MARIJUANA - SELL,SILVER SPRING,8000 BLK  13TH ST,SILVER SPRING,MD,20910.0,MCPD,Hotel/Motel/Etc.,G,3G1,090,8000.0,,13TH,,ST,38.98692,-77.0296,3D,"(38.9869, -77.0296)"
201254473,2303,190041424,08/29/2019 06:22:11 PM,2019-08-29 18:00:00,08/29/2019 06:15:00 PM,23C,1,Crime Against Property,Shoplifting,LARCENY - SHOPLIFTING,MONTGOMERY VILLAGE,700 BLK  RUSSELL AVE,GAITHERSBURG,MD,20877.0,GPD,Retail - Department/Discount Store,R,6R1,548,700.0,,RUSSELL,,AVE,39.15063,-77.2039,6D,"(39.1506, -77.2039)"
201265091,2305,190054860,11/14/2019 10:15:04 AM,2019-11-14 10:15:00,,23F,1,Crime Against Property,Theft From Motor Vehicle,LARCENY - FROM AUTO,WHEATON,13400 BLK  ORIENTAL ST,ROCKVILLE,MD,20853.0,MCPD,Residence - Driveway,K,4K2,341,13400.0,,ORIENTAL,,ST,39.0746,-77.0943,4D,"(39.0746, -77.0943)"
201444947,2308,230056188,09/21/2023 08:05:59 PM,2023-09-21 18:00:00,09/21/2023 07:15:00 PM,23D,1,Crime Against Property,Theft from Building,LARCENY - FROM BLDG,BETHESDA,10200 BLK  OLD GEORGETOWN RD,BETHESDA,MD,20814.0,MCPD,Restaurant,D,2D4,191,10200.0,,OLD GEORGETOWN,,RD,39.02306,-77.1241,2D,"(39.0231, -77.1241)"
201278002,2605,200007836,02/16/2020 04:19:03 PM,2020-02-16 16:19:00,,26B,1,Crime Against Property,Credit Card/Automatic Teller Machine Fraud,FRAUD - ILLEGAL USE CREDIT CARDS,ROCKVILLE,300 BLK  ELMCROFT BLV,ROCKVILLE,MD,20850.0,RCPD,Other/Unknown,A,1A3,242,300.0,,ELMCROFT,,BLV,39.11067,-77.1626,1D,"(39.1107, -77.1626)"
201440816,1399,230050994,08/24/2023 03:05:12 AM,2023-08-24 03:05:00,08/24/2023 03:05:00 AM,13B,1,Crime Against Person,Simple Assault,ASSAULT - 2ND DEGREE,ROCKVILLE,1  BLK  DENFIELD CT,ROCKVILLE,MD,20851.0,RCPD,Residence -Townhouse/Duplex,A,1A2,299,1.0,,DENFIELD,,CT,39.07217,-77.1172,1D,"(39.0722, -77.1172)"
201333192,5707,210021064,06/03/2021 01:56:31 PM,2021-06-03 13:56:00,,90J,1,Crime Against Society,Trespass of Real Property,TRESPASSING,MONTGOMERY VILLAGE,8900 BLK N WESTLAND DR,GAITHERSBURG,MD,20877.0,MCPD,Convenience Store,P,6P3,437,8900.0,N,WESTLAND,,DR,39.13015,-77.1816,6D,"(39.1302, -77.1816)"
201450826,2304,230063448,10/30/2023 04:54:29 PM,2023-10-29 18:00:00,10/30/2023 10:00:00 AM,23G,1,Crime Against Property,Theft of Motor Vehicle Parts or Accessories,LARCENY - AUTO PARTS,WHEATON,3000 BLK  BEL PRE RD,SILVER SPRING,MD,20906.0,MCPD,Parking Lot - Residential,K,4K1,348,3000.0,,BEL PRE,,RD,39.09092,-77.0611,4D,"(39.0909, -77.0611)"
201430222,1399,230027622,06/08/2023 05:51:57 PM,2023-06-08 17:51:00,,13B,1,Crime Against Person,Simple Assault,ASSAULT - 2ND DEGREE,SILVER SPRING,14700 BLK  CEDAR TREE DR,BURTONSVILLE,MD,20866.0,MCPD,Street - Residential,I,3I2,381,14700.0,,CEDAR TREE,,DR,39.09636,-76.9219,3D,"(39.0964, -76.9219)"
201349636,2204,210041727,10/17/2021 10:13:16 PM,2021-10-17 17:35:00,,220,1,Crime Against Property,Burglary/Breaking and Entering,BURGLARY - NO FORCED ENTRY-RESIDENTIAL,GERMANTOWN,18900 BLK  QUIET OAK LA,GERMANTOWN,MD,20874.0,MCPD,Residence -Townhouse/Duplex,N,5N2,594,18900.0,,QUIET OAK,,LA,39.16399,-77.272,5D,"(39.164, -77.272)"
201365865,2007,220007148,02/18/2022 01:01:17 PM,2022-02-18 13:01:00,,200,1,Crime Against Property,Arson,ARSON - BURNING OF - (IDENTIFY OBJECT),WHEATON,12100 BLK  VEIRS MILL RD,SILVER SPRING,MD,20906.0,MCPD,Restaurant,L,4L1,332,12100.0,,VEIRS MILL,,RD,39.05364,-77.0783,4D,"(39.0536, -77.0783)"
201374907,2404,220019064,05/05/2022 09:01:23 AM,2022-05-04 22:00:00,05/05/2022 07:30:00 AM,240,1,Crime Against Property,Motor Vehicle Theft,AUTO THEFT - VEHICLE THEFT,BETHESDA,5100 BLK  WHITE FLINT DR,KENSINGTON,MD,20895.0,MCPD,Residence - Driveway,D,2D4,694,5100.0,,WHITE FLINT,,DR,39.04015,-77.1027,2D,"(39.0401, -77.1027)"
201364761,4199,220007028,02/17/2022 05:41:05 PM,2022-02-17 18:00:00,,90G,1,Crime Against Society,Liquor Law Violations,LIQUOR (DESCRIBE OFFENSE),SILVER SPRING,600 BLK  UNIVERSITY BLV E,SILVER SPRING,MD,20901.0,MCPD,Parking Lot - Commercial,H,3H1,128,600.0,,UNIVERSITY,E,BLV,39.00254,-76.9957,3D,"(39.0025, -76.9957)"
201414634,2404,230009107,02/23/2023 02:03:32 PM,2023-02-23 02:45:00,,240,1,Crime Against Property,Motor Vehicle Theft,AUTO THEFT - VEHICLE THEFT,MONTGOMERY VILLAGE,900 BLK N FREDERICK AVE,GAITHERSBURG,MD,20879.0,GPD,Auto Dealership,R,6R1,426,900.0,N,FREDERICK,,AVE,39.15763,-77.2179,6D,"(39.1576, -77.2179)"
201376828,2305,220021344,05/19/2022 02:07:59 PM,2022-05-19 13:10:00,,23F,1,Crime Against Property,Theft From Motor Vehicle,LARCENY - FROM AUTO,SILVER SPRING,12000 BLK  NEW HAMPSHIRE AVE,SILVER SPRING,MD,20904.0,MCPD,Street - Other,I,3I1,148,12000.0,,NEW HAMPSHIRE,,AVE,39.05206,-76.9937,3D,"(39.0521, -76.9937)"
201381923,2902,220027502,06/26/2022 01:33:21 PM,2022-06-25 12:00:00,06/26/2022 09:35:00 AM,290,1,Crime Against Property,Destruction/Damage/Vandalism of Property,DAMAGE PROPERTY - PRIVATE,ROCKVILLE,13200 BLK  DARNESTOWN RD,GAITHERSBURG,MD,20878.0,MCPD,Residence - Driveway,B,1B2,592,13200.0,,DARNESTOWN,,RD,39.11239,-77.2739,1D,"(39.1124, -77.2739)"
201272241,2302,200000634,01/04/2020 03:57:31 PM,2020-01-04 15:57:00,,23B,1,Crime Against Property,Purse-snatching,LARCENY - PURSE SNATCHING - NO FORCE,GERMANTOWN,19700 BLK  GERMANTOWN RD,GERMANTOWN,MD,20874.0,MCPD,Gas Station,N,5N1,702,19700.0,,GERMANTOWN,,RD,39.17881,-77.2673,5D,"(39.1788, -77.2673)"
201228094,3562,190008632,02/22/2019 11:38:37 PM,2019-02-22 23:41:00,,35A,1,Crime Against Society,Drug/Narcotic Violations,DRUGS - MARIJUANA - POSSESS,WHEATON,,SILVER SPRING,MD,20902.0,MCPD,Street - Commercial,K,4K2,335,,,RANDOLPH,,RD,39.07542,-77.0039,4D,"(39.0754, -77.0039)"
201284948,2305,200016045,04/15/2020 07:13:15 AM,2020-04-12 21:00:00,04/14/2020 05:00:00 AM,23F,1,Crime Against Property,Theft From Motor Vehicle,LARCENY - FROM AUTO,WHEATON,12700 BLK  ROBINDALE DR,ROCKVILLE,MD,20853.0,MCPD,Residence - Driveway,K,4K2,339,12700.0,,ROBINDALE,,DR,39.06309,-77.0947,4D,"(39.0631, -77.0947)"
201399296,2303,220048653,11/04/2022 04:48:38 PM,2022-11-03 15:17:00,,23C,1,Crime Against Property,Shoplifting,LARCENY - SHOPLIFTING,BETHESDA,7100 BLK  DEMOCRACY BLV,BETHESDA,MD,20817.0,MCPD,Retail - Mall,E,2E3,204,7100.0,,DEMOCRACY,,BLV,39.02207,-77.1473,2D,"(39.0221, -77.1473)"
201287004,5311,200018182,05/04/2020 01:48:35 PM,2020-05-04 13:32:00,05/04/2020 01:34:00 PM,90C,1,Crime Against Society,Disorderly Conduct,PUBLIC PEACE - DISORDERLY CONDUCT,SILVER SPRING,8700 BLK  RAMSEY AVE,SILVER SPRING,MD,20910.0,MCPD,Restaurant,G,3G1,095,8700.0,,RAMSEY,,AVE,38.9961,-77.0298,3D,"(38.9961, -77.0298)"
201423968,2308,230020047,04/26/2023 08:23:52 PM,2023-04-25 09:00:00,04/25/2023 09:15:00 AM,23D,1,Crime Against Property,Theft from Building,LARCENY - FROM BLDG,GERMANTOWN,25900 BLK  RIDGE RD,DAMASCUS,MD,20872.0,MCPD,School - Elementary/Secondary,M,5M2,615,25900.0,,RIDGE,,RD,39.28396,-77.2106,5D,"(39.284, -77.2106)"
201307688,5707,200042862,10/30/2020 06:26:52 PM,2020-10-30 18:26:00,,90J,1,Crime Against Society,Trespass of Real Property,TRESPASSING,ROCKVILLE,12000 BLK  ROCKVILLE PIK,ROCKVILLE,MD,20852.0,MCPD,Restaurant,A,1A2,735,12000.0,,ROCKVILLE,,PIK,39.05313,-77.1167,1D,"(39.0531, -77.1167)"
201284723,1399,200015768,04/12/2020 11:44:07 AM,2020-04-12 11:44:00,,13B,1,Crime Against Person,Simple Assault,ASSAULT - 2ND DEGREE,GERMANTOWN,1  BLK  OBSERVATION CT,GERMANTOWN,MD,20876.0,MCPD,Residence - Apartment/Condo,M,5M1,468,1.0,,OBSERVATION,,CT,39.19222,-77.2475,5D,"(39.1922, -77.2475)"
201334138,2308,210022206,06/10/2021 07:53:01 PM,2021-06-10 10:30:00,06/10/2021 06:30:00 PM,23D,1,Crime Against Property,Theft from Building,LARCENY - FROM BLDG,ROCKVILLE,1500 BLK  ROCKVILLE PIK,ROCKVILLE,MD,20852.0,RCPD,Retail - Other,A,1A1,266,1500.0,,ROCKVILLE,,PIK,39.0651,-77.1266,1D,"(39.0651, -77.1266)"
201347399,2902,210038681,09/29/2021 07:09:39 PM,2021-09-29 00:30:00,09/29/2021 06:00:00 AM,290,1,Crime Against Property,Destruction/Damage/Vandalism of Property,DAMAGE PROPERTY - PRIVATE,WHEATON,12200 BLK  VEIRS MILL RD,SILVER SPRING,MD,20906.0,MCPD,Parking Lot - Commercial,K,4K2,307,12200.0,,VEIRS MILL,,RD,39.05614,-77.0826,4D,"(39.0561, -77.0826)"
201351449,1305,210043965,10/31/2021 03:09:40 PM,2021-10-31 15:08:00,,13A,1,Crime Against Person,Aggravated Assault,ASSAULT - AGGRAVATED - NON-FAMILY-OTHER WEAPON,WHEATON,12100 BLK  VEIRS MILL RD,SILVER SPRING,MD,20906.0,MCPD,Parking Garage - Commercial,L,4L1,332,12100.0,,VEIRS MILL,,RD,39.05364,-77.0783,4D,"(39.0536, -77.0783)"
201302399,3572,200035956,09/14/2020 12:48:33 AM,2020-09-14 00:48:00,,35A,1,Crime Against Society,Drug/Narcotic Violations,DRUGS - AMPHETAMINE - POSSESS,MONTGOMERY VILLAGE,,GAITHERSBURG,MD,20877.0,GPD,Street - In vehicle,R,6R1,548,,,ODEND HAL,,AVE,39.15164,-77.2009,6D,"(39.1516, -77.2009)"
201306944,2201,200041844,10/23/2020 12:59:41 PM,2020-10-01 12:59:00,10/23/2020 12:56:00 PM,220,1,Crime Against Property,Burglary/Breaking and Entering,BURGLARY - SAFE-VAULT,WHEATON,18400 BLK  SHADY VIEW LA,BROOKEVILLE,MD,20833.0,MCPD,Residence - Single Family,J,4J2,540,18400.0,,SHADY VIEW,,LA,39.15918,-77.0666,4D,"(39.1592, -77.0666)"
201316288,2601,210001639,01/13/2021 04:50:36 PM,2021-01-12 19:00:00,01/12/2021 08:15:00 PM,26A,1,Crime Against Property,False Pretenses/Swindle/Confidence Game,FRAUD - CONFIDENCE GAME,MONTGOMERY VILLAGE,200 BLK  PROFESSIONAL DR,GAITHERSBURG,MD,20879.0,MCPD,Other/Unknown,P,6P2,425,200.0,,PROFESSIONAL,,DR,39.16278,-77.2277,6D,"(39.1628, -77.2277)"
201322245,2610,210007951,03/03/2021 12:45:56 AM,2021-02-28 07:59:00,03/02/2021 05:25:00 PM,26F,1,Crime Against Property,Identity Theft,FRAUD - IDENTITY THEFT,ROCKVILLE,1000 BLK  ROCKVILLE PIK,ROCKVILLE,MD,20852.0,MCPD,Residence - Apartment/Condo,A,1A1,265,1000.0,,ROCKVILLE,,PIK,39.07356,-77.1345,1D,"(39.0736, -77.1345)"
201431887,2308,230029216,06/17/2023 07:54:15 PM,2023-06-17 15:00:00,06/17/2023 03:40:00 PM,23D,1,Crime Against Property,Theft from Building,LARCENY - FROM BLDG,BETHESDA,9100 BLK  ROCKVILLE PIK,BETHESDA,MD,20814.0,MCPD,School - College/University,D,2D3,072,9100.0,,ROCKVILLE,,PIK,39.00459,-77.0974,2D,"(39.0046, -77.0974)"
201234564,2304,190016713,04/10/2019 03:41:47 PM,2019-02-10 19:00:00,02/17/2019 11:59:00 PM,23G,1,Crime Against Property,Theft of Motor Vehicle Parts or Accessories,LARCENY - AUTO PARTS,MONTGOMERY VILLAGE,,GAITHERSBURG,MD,20879.0,MCPD,Street - Commercial,R,6R2,545,,N,FREDERICK,,AVE,39.05909,-77.1162,6D,"(39.0591, -77.1162)"
201272168,2204,200000521,01/03/2020 09:30:37 PM,2020-01-02 18:00:00,01/02/2020 08:00:00 PM,220,1,Crime Against Property,Burglary/Breaking and Entering,BURGLARY - NO FORCED ENTRY-RESIDENTIAL,SILVER SPRING,9300 BLK  PINEY BRANCH RD,SILVER SPRING,MD,20903.0,MCPD,Residence - Apartment/Condo,H,3H1,133,9300.0,,PINEY BRANCH,,RD,39.00126,-76.9871,3D,"(39.0013, -76.9871)"
201432977,2299,230030848,06/28/2023 04:36:00 AM,2023-06-28 04:36:00,,220,1,Crime Against Property,Burglary/Breaking and Entering,BURGLARY (DESCRIBE OFFENSE),MONTGOMERY VILLAGE,400 BLK  MAIN ST,GAITHERSBURG,MD,20878.0,GPD,Retail - Other,P,6P2,450,400.0,,MAIN,,ST,39.12102,-77.237,6D,"(39.121, -77.237)"
201287871,2605,200019403,05/14/2020 10:32:00 AM,2020-05-01 10:32:00,,26B,1,Crime Against Property,Credit Card/Automatic Teller Machine Fraud,FRAUD - ILLEGAL USE CREDIT CARDS,SILVER SPRING,12500 BLK  PROSPERITY DR,SILVER SPRING,MD,20904.0,MCPD,Bank - ATM,I,3I1,146,12500.0,,PROSPERITY,,DR,39.06059,-76.9633,3D,"(39.0606, -76.9633)"
201241584,2999,190025494,05/29/2019 07:26:31 AM,2019-05-28 23:00:00,05/29/2019 07:26:00 AM,290,1,Crime Against Property,Destruction/Damage/Vandalism of Property,DAMAGE PROPERTY (DESCRIBE OFFENSE),WHEATON,15000 BLK  WESTBURY RD,ROCKVILLE,MD,20853.0,MCPD,Residence - Single Family,K,4K2,394,15000.0,,WESTBURY,,RD,39.10195,-77.0957,4D,"(39.102, -77.0957)"
201398147,2303,220047145,10/27/2022 11:18:36 AM,2022-10-27 11:18:00,,23C,1,Crime Against Property,Shoplifting,LARCENY - SHOPLIFTING,MONTGOMERY VILLAGE,15700 BLK  SHADY GROVE RD,GAITHERSBURG,MD,20877.0,GPD,Retail - Hardware,P,6P3,756,15700.0,,SHADY GROVE,,RD,39.11327,-77.1865,6D,"(39.1133, -77.1865)"
201439809,2399,230049817,08/16/2023 06:59:16 PM,2023-08-09 12:00:00,,23H,1,Crime Against Property,All other Larceny,LARCENY (DESCRIBE OFFENSE),WHEATON,1  BLK  WILCOX CT,SILVER SPRING,MD,20906.0,MCPD,Residence - Single Family,J,4J1,368,1.0,,WILCOX,,CT,39.06707,-77.0356,4D,"(39.0671, -77.0356)"
201262437,1399,190051432,10/26/2019 12:44:09 AM,2019-10-26 00:44:00,,13B,2,Crime Against Person,Simple Assault,ASSAULT - 2ND DEGREE,BETHESDA,7400 BLK  WESTLAKE TER,BETHESDA,MD,20817.0,MCPD,Parking Lot - Residential,E,2E3,520,7400.0,,WESTLAKE,,TER,39.02705,-77.1505,2D,"(39.0271, -77.1505)"
201225926,3614,190005913,02/06/2019 01:32:43 PM,2019-02-06 13:32:00,,90C,1,Crime Against Society,Disorderly Conduct,INDECENT EXPOSURE TO MINOR,WHEATON,2800 BLK  ABBEY MANOR CIR,BROOKEVILLE,MD,20833.0,MCPD,Street - Residential,J,4J2,682,2800.0,,ABBEY MANOR,,CIR,39.16611,-77.0571,4D,"(39.1661, -77.0571)"
201244346,1399,190028928,06/17/2019 02:21:12 PM,2019-06-17 14:21:00,,13B,1,Crime Against Person,Simple Assault,ASSAULT - 2ND DEGREE,GERMANTOWN,12100 BLK  FLAG HARBOR DR,GERMANTOWN,MD,20874.0,MCPD,Residence -Townhouse/Duplex,N,5N1,447,12100.0,,FLAG HARBOR,,DR,39.16454,-77.2529,5D,"(39.1645, -77.2529)"
201278649,2303,200008656,02/21/2020 09:36:58 AM,2020-02-21 10:15:00,02/21/2020 10:15:00 AM,23C,1,Crime Against Property,Shoplifting,LARCENY - SHOPLIFTING,ROCKVILLE,400 BLK  HUNGERFORD DR,ROCKVILLE,MD,20850.0,RCPD,Retail - Drug Store/Pharmacy,A,1A3,277,400.0,,HUNGERFORD,,DR,39.08822,-77.1507,1D,"(39.0882, -77.1507)"
201243001,2399,190027319,06/07/2019 09:22:21 PM,2019-06-03 13:59:00,06/03/2019 02:50:00 PM,23H,1,Crime Against Property,All other Larceny,LARCENY (DESCRIBE OFFENSE),MONTGOMERY VILLAGE,9700 BLK  DOCENA DR,MONTGOMERY VILLAGE,MD,20886.0,MCPD,Residence - Other,R,6R1,505,9700.0,,DOCENA,,DR,39.1598,-77.1993,6D,"(39.1598, -77.1993)"
201255583,2308,190042775,09/06/2019 05:19:40 PM,2019-08-30 17:19:00,09/05/2019 12:00:00 AM,23D,1,Crime Against Property,Theft from Building,LARCENY - FROM BLDG,BETHESDA,4500 BLK  SLEAFORD RD,BETHESDA,MD,20814.0,MCPD,Residence - Single Family,D,2D2,046,4500.0,,SLEAFORD,,RD,38.98825,-77.0881,2D,"(38.9883, -77.0881)"
201297170,2305,200030301,08/04/2020 07:23:15 PM,2020-08-04 19:23:00,,23F,1,Crime Against Property,Theft From Motor Vehicle,LARCENY - FROM AUTO,SILVER SPRING,9300 BLK  COLESVILLE RD,SILVER SPRING,MD,20901.0,MCPD,Street - In vehicle,G,3G2,104,9300.0,,COLESVILLE,,RD,39.00766,-77.0201,3D,"(39.0077, -77.0201)"
201450066,1399,230062440,10/25/2023 08:45:49 AM,2023-10-25 08:45:00,,13B,1,Crime Against Person,Simple Assault,ASSAULT - 2ND DEGREE,SILVER SPRING,2000 BLK  HARLEQUIN TER,SILVER SPRING,MD,20904.0,MCPD,Residence -Townhouse/Duplex,I,3I1,376,2000.0,,HARLEQUIN,,TER,39.06799,-76.9691,3D,"(39.068, -76.9691)"
201446523,2902,230058163,10/02/2023 07:00:45 PM,2023-10-02 19:00:00,,290,1,Crime Against Property,Destruction/Damage/Vandalism of Property,DAMAGE PROPERTY - PRIVATE,ROCKVILLE,16100 BLK  CRABBS BRANCH WAY,DERWOOD,MD,20855.0,MCPD,Residence - Apartment/Condo,A,1A4,281,16100.0,,CRABBS BRANCH,,WAY,39.11927,-77.1569,1D,"(39.1193, -77.1569)"
201274466,1399,200003320,01/21/2020 06:21:18 AM,2020-01-21 05:57:00,01/21/2020 05:57:00 AM,13B,1,Crime Against Person,Simple Assault,ASSAULT - 2ND DEGREE,BETHESDA,8400 BLK  CHEVY CHASE LAKE TER,CHEVY CHASE,MD,20815.0,MCPD,Residence - Apartment/Condo,D,2D1,038,8400.0,,CHEVY CHASE LAKE,,TER,38.99419,-77.0752,2D,"(38.9942, -77.0752)"
201331519,5404,210018491,05/16/2021 10:39:38 PM,2021-05-16 22:39:00,05/16/2021 10:50:00 PM,90D,1,Crime Against Society,Driving Under the Influence,DRIVING UNDER THE INFLUENCE LIQUOR,MONTGOMERY VILLAGE,2500 BLK  E370 270-SG HWY,GAITHERSBURG,MD,20877.0,GPD,Street - In vehicle,P,6P3,786,2500.0,,E370 270-SG,,HWY,39.12037,-77.1839,6D,"(39.1204, -77.1839)"
201300316,3572,200034000,08/31/2020 10:18:15 AM,2020-08-31 10:18:00,,35A,1,Crime Against Society,Drug/Narcotic Violations,DRUGS - AMPHETAMINE - POSSESS,GERMANTOWN,,GERMANTOWN,MD,20876.0,MCPD,Street - Residential,M,5M1,469,,,ST JOHNSBURY,,LA,39.17247,-77.2376,5D,"(39.1725, -77.2376)"
201402788,2399,220052844,11/30/2022 02:08:32 PM,2022-10-30 00:00:00,11/04/2022 12:00:00 AM,23H,1,Crime Against Property,All other Larceny,LARCENY (DESCRIBE OFFENSE),BETHESDA,7100 BLK  WOODMONT AVE,CHEVY CHASE,MD,20815.0,MCPD,Other/Unknown,D,2D2,031,7100.0,,WOODMONT,,AVE,38.97995,-77.093,2D,"(38.98, -77.093)"
201376040,2305,220020387,05/13/2022 01:54:32 PM,2022-05-13 09:00:00,05/13/2022 01:45:00 PM,23F,1,Crime Against Property,Theft From Motor Vehicle,LARCENY - FROM AUTO,SILVER SPRING,8700 BLK  CAMERON ST,SILVER SPRING,MD,20910.0,MCPD,Parking Garage - County,G,3G1,108,8700.0,,CAMERON,,ST,38.9984,-77.0287,3D,"(38.9984, -77.0287)"
201236617,3562,190019240,04/24/2019 05:11:03 PM,2019-04-24 17:11:00,,35A,1,Crime Against Society,Drug/Narcotic Violations,DRUGS - MARIJUANA - POSSESS,MONTGOMERY VILLAGE,,MONTGOMERY VILLAGE,MD,20886.0,MCPD,Street - In vehicle,R,6R2,504,,,ROTHBURY,,DR,39.18556,-77.1924,6D,"(39.1856, -77.1924)"
201247444,2303,190032777,07/10/2019 04:12:54 PM,2019-07-10 16:12:00,,23C,1,Crime Against Property,Shoplifting,LARCENY - SHOPLIFTING,SILVER SPRING,12000 BLK  CHERRY HILL RD,SILVER SPRING,MD,20904.0,MCPD,Retail - Appliances/Electronics,I,3I1,146,12000.0,,CHERRY HILL,,RD,39.05259,-76.9531,3D,"(39.0526, -76.9531)"
201328048,2999,210014881,04/21/2021 05:31:05 PM,2021-04-16 00:00:00,04/20/2021 02:30:00 PM,290,1,Crime Against Property,Destruction/Damage/Vandalism of Property,DAMAGE PROPERTY (DESCRIBE OFFENSE),GERMANTOWN,13500 BLK  PENN SHOP RD,MOUNT AIRY,MD,21771.0,MCPD,Parking Lot - Other,M,5M2,611,13500.0,,PENN SHOP,,RD,39.3426,-77.1912,5D,"(39.3426, -77.1912)"
201291218,2305,200022410,06/07/2020 02:04:35 PM,2020-06-06 23:30:00,06/07/2020 12:00:00 PM,23F,1,Crime Against Property,Theft From Motor Vehicle,LARCENY - FROM AUTO,GERMANTOWN,21200 BLK  SPARROW CT,GERMANTOWN,MD,20876.0,MCPD,Residence - Driveway,M,5M3,474,21200.0,,SPARROW,,CT,39.20575,-77.251,5D,"(39.2058, -77.251)"
201339174,2305,210028542,07/23/2021 11:41:40 AM,2021-07-23 07:30:00,07/23/2021 09:00:00 AM,23F,1,Crime Against Property,Theft From Motor Vehicle,LARCENY - FROM AUTO,ROCKVILLE,1100 BLK  BROADWOOD DR,ROCKVILLE,MD,20851.0,MCPD,Street - Residential,A,1A2,298,1100.0,,BROADWOOD,,DR,39.07275,-77.1317,1D,"(39.0727, -77.1317)"
201423916,2999,230018572,04/18/2023 05:29:27 PM,2023-04-18 17:29:00,,290,1,Crime Against Property,Destruction/Damage/Vandalism of Property,DAMAGE PROPERTY (DESCRIBE OFFENSE),SILVER SPRING,8100 BLK  CARROLL AVE,TAKOMA PARK,MD,20912.0,TPPD,Street - Residential,H,3H1,130,8100.0,,CARROLL,,AVE,38.98985,-76.9935,3D,"(38.9898, -76.9935)"
201378361,2305,220023163,05/30/2022 09:41:03 PM,2022-05-30 01:00:00,05/30/2022 05:00:00 PM,23F,1,Crime Against Property,Theft From Motor Vehicle,LARCENY - FROM AUTO,SILVER SPRING,8200 BLK  GEORGIA AVE,SILVER SPRING,MD,20910.0,MCPD,Parking Garage - Residential,G,3G1,094,8200.0,,GEORGIA,,AVE,38.99163,-77.0266,3D,"(38.9916, -77.0266)"
201271276,5404,190060018,12/13/2019 12:13:52 AM,2019-12-13 00:13:00,,90D,1,Crime Against Society,Driving Under the Influence,DRIVING UNDER THE INFLUENCE LIQUOR,WHEATON,2700 BLK  PARKER AVE,SILVER SPRING,MD,20902.0,MCPD,Street - Residential,L,4L1,326,2700.0,,PARKER,,AVE,39.04904,-77.0559,4D,"(39.049, -77.0559)"
201232380,2404,190014073,,2019-03-26 23:00:00,,240,1,Crime Against Property,Motor Vehicle Theft,AUTO THEFT - VEHICLE THEFT,MONTGOMERY VILLAGE,10800 BLK  GAME PRESERVE RD,GAITHERSBURG,MD,20879.0,MCPD,Street - Residential,R,6R2,424,10800.0,,GAME PRESERVE,,RD,39.17031,-77.2225,6D,"(39.1703, -77.2225)"
201236939,5311,190019467,04/25/2019 10:37:32 PM,2019-04-25 22:37:00,,90C,1,Crime Against Society,Disorderly Conduct,PUBLIC PEACE - DISORDERLY CONDUCT,SILVER SPRING,8200 BLK  GEORGIA AVE,SILVER SPRING,MD,20910.0,MCPD,Street - Alley,G,3G1,094,8200.0,,GEORGIA,,AVE,38.99163,-77.0266,3D,"(38.9916, -77.0266)"
201346049,2308,210037199,09/20/2021 08:03:16 PM,2021-09-18 14:00:00,09/18/2021 02:03:00 PM,23D,1,Crime Against Property,Theft from Building,LARCENY - FROM BLDG,WHEATON,12200 BLK  VEIRS MILL RD,SILVER SPRING,MD,20906.0,MCPD,Grocery/Supermarket,K,4K2,525,12200.0,,VEIRS MILL,,RD,39.05614,-77.0826,4D,"(39.0561, -77.0826)"
201319221,2399,210005035,02/08/2021 03:51:50 PM,2021-02-01 16:06:00,02/01/2021 09:44:00 PM,23H,1,Crime Against Property,All other Larceny,LARCENY (DESCRIBE OFFENSE),SILVER SPRING,1600 BLK  TREETOP VIEW TER,SILVER SPRING,MD,20904.0,MCPD,Residence - Yard,I,3I1,145,1600.0,,TREETOP VIEW,,TER,39.04847,-76.9823,3D,"(39.0485, -76.9823)"
201403140,2902,220053280,12/02/2022 05:02:25 PM,2022-12-02 15:40:00,,290,1,Crime Against Property,Destruction/Damage/Vandalism of Property,DAMAGE PROPERTY - PRIVATE,GERMANTOWN,11400 BLK  BEEHIVE CT,GERMANTOWN,MD,20876.0,MCPD,Street - In vehicle,M,5M1,471,11400.0,,BEEHIVE,,CT,39.19182,-77.2378,5D,"(39.1918, -77.2378)"
201356020,1399,210049790,12/08/2021 01:35:27 AM,2021-12-06 00:00:00,12/08/2021 01:35:00 AM,13B,1,Crime Against Person,Simple Assault,ASSAULT - 2ND DEGREE,GERMANTOWN,19600 BLK  CRYSTAL ROCK DR,GERMANTOWN,MD,20874.0,MCPD,Residence - Apartment/Condo,N,5N1,595,19600.0,,CRYSTAL ROCK,,DR,39.17853,-77.263,5D,"(39.1785, -77.263)"
201276570,4104,200005883,02/04/2020 09:33:37 PM,2020-02-04 21:33:00,,90G,1,Crime Against Society,Liquor Law Violations,LIQUOR - POSSESS,GERMANTOWN,12600 BLK  WISTERIA DR,GERMANTOWN,MD,20874.0,MCPD,Restaurant,N,5N1,447,12600.0,,WISTERIA,,DR,39.16948,-77.2612,5D,"(39.1695, -77.2612)"
201267663,2203,190058079,12/02/2019 04:39:39 PM,2019-11-30 12:00:00,12/02/2019 09:30:00 AM,220,1,Crime Against Property,Burglary/Breaking and Entering,BURGLARY - FORCED ENTRY-NONRESIDENTIAL,BETHESDA,4900 BLK  NICHOLSON CT,KENSINGTON,MD,20895.0,MCPD,Rental Storage Facility,D,2D4,186,4900.0,,NICHOLSON,,CT,39.045,-77.1027,2D,"(39.045, -77.1027)"
201347512,2610,210036374,09/15/2021 01:42:33 PM,2021-09-03 14:00:00,,26F,1,Crime Against Property,Identity Theft,FRAUD - IDENTITY THEFT,SILVER SPRING,9000 BLK  SLIGO CREEK PKW,SILVER SPRING,MD,20901.0,MCPD,Other/Unknown,G,3G2,123,9000.0,,SLIGO CREEK,,PKW,38.97973,-76.9952,3D,"(38.9797, -76.9952)"
201295086,2303,200027874,07/18/2020 08:50:53 AM,2020-07-18 08:50:00,07/18/2020 09:15:00 AM,23C,1,Crime Against Property,Shoplifting,LARCENY - SHOPLIFTING,ROCKVILLE,1500 BLK  ROCKVILLE PIK,ROCKVILLE,MD,20852.0,RCPD,Retail - Drug Store/Pharmacy,A,1A1,273,1500.0,,ROCKVILLE,,PIK,39.0651,-77.1266,1D,"(39.0651, -77.1266)"
201228336,1399,190008946,02/25/2019 10:44:20 AM,2019-02-25 10:44:00,,13B,2,Crime Against Person,Simple Assault,ASSAULT - 2ND DEGREE,SILVER SPRING,11100 BLK  NEW HAMPSHIRE AVE,SILVER SPRING,MD,20901.0,MCPD,Restaurant,I,3I1,518,11100.0,,NEW HAMPSHIRE,,AVE,39.03777,-76.9897,3D,"(39.0378, -76.9897)"
201284623,2610,200015657,04/10/2020 08:42:53 PM,2020-03-03 15:00:00,,26F,1,Crime Against Property,Identity Theft,FRAUD - IDENTITY THEFT,SILVER SPRING,9500 BLK  BILTMORE DR,SILVER SPRING,MD,20901.0,MCPD,Other/Unknown,G,3G2,122,9500.0,,BILTMORE,,DR,39.01128,-77.0043,3D,"(39.0113, -77.0043)"
201229261,2308,190010203,03/05/2019 07:33:30 AM,2019-03-01 16:00:00,03/04/2019 04:00:00 PM,23D,1,Crime Against Property,Theft from Building,LARCENY - FROM BLDG,BETHESDA,11600 BLK  DANVILLE DR,ROCKVILLE,MD,20852.0,MCPD,Residence - Single Family,E,2E3,200,11600.0,,DANVILLE,,DR,39.04544,-77.1297,2D,"(39.0454, -77.1297)"
